commit	score	runtime_seconds	budget	status	target	description	artifacts
71bba891e	0.921900	861	--n_clients 8 --num_rounds 20 --aggregation_epochs 7 --local_train_steps 0 --batch_size 64 --eval_batch_size 1024 --alpha 0.5 --seed 0 --model_arch moderate_cnn --max_model_params 5000000 --aggregator fedavgm --server_lr 1.8 --server_momentum 0.475 --lr 0.04515625 --momentum 0.925 --weight_decay 5e-4 --cosine_lr_eta_min_factor 0.0001625 --sam_rho 0.0725 --fedproxloss_mu 3e-5 --zero_mean_gradients --class_balanced_loss_beta 0.90 --final_eval_clients site-1 --name fedavgm_lr18_m0475_epochs7_clientlr004515625_cm0925_wd5e4_eta00001625_mu3e5_zmg_cb090_sam00725_w1	discard	client.py	Post-improvement upper client lr 0.04515625 interpolation on active cosine-floor high-water stack	/tmp/nvflare/simulation/fedavgm_lr18_m0475_epochs7_clientlr004515625_cm0925_wd5e4_eta00001625_mu3e5_zmg_cb090_sam00725_w1
81541a3df	0.921900	864	--n_clients 8 --num_rounds 20 --aggregation_epochs 7 --local_train_steps 0 --batch_size 64 --eval_batch_size 1024 --alpha 0.5 --seed 0 --model_arch moderate_cnn --max_model_params 5000000 --aggregator fedavgm --server_lr 1.8 --server_momentum 0.475 --lr 0.04484375 --momentum 0.925 --weight_decay 5e-4 --cosine_lr_eta_min_factor 0.0001625 --sam_rho 0.0725 --fedproxloss_mu 3e-5 --zero_mean_gradients --class_balanced_loss_beta 0.90 --final_eval_clients site-1 --name fedavgm_lr18_m0475_epochs7_clientlr004484375_cm0925_wd5e4_eta00001625_mu3e5_zmg_cb090_sam00725_w1	discard	client.py	Post-improvement lower client lr 0.04484375 interpolation on active cosine-floor high-water stack	/tmp/nvflare/simulation/fedavgm_lr18_m0475_epochs7_clientlr004484375_cm0925_wd5e4_eta00001625_mu3e5_zmg_cb090_sam00725_w1
539dd1c6e	0.921300	857	--n_clients 8 --num_rounds 20 --aggregation_epochs 7 --local_train_steps 0 --batch_size 64 --eval_batch_size 1024 --alpha 0.5 --seed 0 --model_arch moderate_cnn --max_model_params 5000000 --aggregator fedavgm --server_lr 1.799609375 --server_momentum 0.475 --lr 0.045 --momentum 0.925 --weight_decay 5e-4 --cosine_lr_eta_min_factor 0.0001625 --sam_rho 0.0725 --fedproxloss_mu 3e-5 --zero_mean_gradients --class_balanced_loss_beta 0.90 --final_eval_clients site-1 --name fedavgm_lr1799609375_m0475_epochs7_clientlr0045_cm0925_wd5e4_eta00001625_mu3e5_zmg_cb090_sam00725_w1	discard	client.py	Post-improvement tight lower FedAvgM server lr 1.799609375 interpolation on active cosine-floor high-water stack	/tmp/nvflare/simulation/fedavgm_lr1799609375_m0475_epochs7_clientlr0045_cm0925_wd5e4_eta00001625_mu3e5_zmg_cb090_sam00725_w1
6c2965536	0.923300	864	--n_clients 8 --num_rounds 20 --aggregation_epochs 7 --local_train_steps 0 --batch_size 64 --eval_batch_size 1024 --alpha 0.5 --seed 0 --model_arch moderate_cnn --max_model_params 5000000 --aggregator fedavgm --server_lr 1.800390625 --server_momentum 0.475 --lr 0.045 --momentum 0.925 --weight_decay 5e-4 --cosine_lr_eta_min_factor 0.0001625 --sam_rho 0.0725 --fedproxloss_mu 3e-5 --zero_mean_gradients --class_balanced_loss_beta 0.90 --final_eval_clients site-1 --name fedavgm_lr1800390625_m0475_epochs7_clientlr0045_cm0925_wd5e4_eta00001625_mu3e5_zmg_cb090_sam00725_w1	discard	client.py	Post-improvement tight upper FedAvgM server lr 1.800390625 interpolation on active cosine-floor high-water stack	/tmp/nvflare/simulation/fedavgm_lr1800390625_m0475_epochs7_clientlr0045_cm0925_wd5e4_eta00001625_mu3e5_zmg_cb090_sam00725_w1
ddf609243	0.920600	927	--n_clients 8 --num_rounds 20 --aggregation_epochs 7 --local_train_steps 0 --batch_size 64 --eval_batch_size 1024 --alpha 0.5 --seed 0 --model_arch moderate_cnn --max_model_params 5000000 --aggregator fedavgm --server_lr 1.8 --server_momentum 0.475 --lr 0.045 --momentum 0.925390625 --weight_decay 5e-4 --cosine_lr_eta_min_factor 0.0001625 --sam_rho 0.0725 --fedproxloss_mu 3e-5 --zero_mean_gradients --class_balanced_loss_beta 0.90 --final_eval_clients site-1 --name fedavgm_lr18_m0475_epochs7_clientlr0045_cm0925390625_wd5e4_eta00001625_mu3e5_zmg_cb090_sam00725_w1	discard	client.py	Post-improvement very tight upper client momentum 0.925390625 interpolation on active cosine-floor high-water stack	/tmp/nvflare/simulation/fedavgm_lr18_m0475_epochs7_clientlr0045_cm0925390625_wd5e4_eta00001625_mu3e5_zmg_cb090_sam00725_w1
1fab3b470	0.921700	864	--n_clients 8 --num_rounds 20 --aggregation_epochs 7 --local_train_steps 0 --batch_size 64 --eval_batch_size 1024 --alpha 0.5 --seed 0 --model_arch moderate_cnn --max_model_params 5000000 --aggregator fedavgm --server_lr 1.8 --server_momentum 0.475 --lr 0.045 --momentum 0.925 --weight_decay 5e-4 --cosine_lr_eta_min_factor 0.0001625 --sam_rho 0.0721875 --fedproxloss_mu 3e-5 --zero_mean_gradients --class_balanced_loss_beta 0.90 --final_eval_clients site-1 --name fedavgm_lr18_m0475_epochs7_clientlr0045_cm0925_wd5e4_eta00001625_mu3e5_zmg_cb090_sam00721875_w1	discard	client.py	Post-improvement lower SAM rho 0.0721875 retest under active cosine-floor high-water stack	/tmp/nvflare/simulation/fedavgm_lr18_m0475_epochs7_clientlr0045_cm0925_wd5e4_eta00001625_mu3e5_zmg_cb090_sam00721875_w1
297560129	0.921200	864	--n_clients 8 --num_rounds 20 --aggregation_epochs 7 --local_train_steps 0 --batch_size 64 --eval_batch_size 1024 --alpha 0.5 --seed 0 --model_arch moderate_cnn --max_model_params 5000000 --aggregator fedavgm --server_lr 1.8 --server_momentum 0.475 --lr 0.045 --momentum 0.925 --weight_decay 5e-4 --cosine_lr_eta_min_factor 0.0001625 --sam_rho 0.0725 --fedproxloss_mu 2.875e-5 --zero_mean_gradients --class_balanced_loss_beta 0.90 --final_eval_clients site-1 --name fedavgm_lr18_m0475_epochs7_clientlr0045_cm0925_wd5e4_eta00001625_mu2875e8_zmg_cb090_sam00725_w1	discard	client.py	Post-improvement lower FedProx mu 2.875e-5 retest under active cosine-floor high-water stack	/tmp/nvflare/simulation/fedavgm_lr18_m0475_epochs7_clientlr0045_cm0925_wd5e4_eta00001625_mu2875e8_zmg_cb090_sam00725_w1
4f3bc209a	0.922100	864	--n_clients 8 --num_rounds 20 --aggregation_epochs 7 --local_train_steps 0 --batch_size 64 --eval_batch_size 1024 --alpha 0.5 --seed 0 --model_arch moderate_cnn --max_model_params 5000000 --aggregator fedavgm --server_lr 1.8 --server_momentum 0.475 --lr 0.045 --momentum 0.925 --weight_decay 4.875e-4 --cosine_lr_eta_min_factor 0.0001625 --sam_rho 0.0725 --fedproxloss_mu 3e-5 --zero_mean_gradients --class_balanced_loss_beta 0.90 --final_eval_clients site-1 --name fedavgm_lr18_m0475_epochs7_clientlr0045_cm0925_wd4875e7_eta00001625_mu3e5_zmg_cb090_sam00725_w1	discard	client.py	Post-improvement lower weight decay 4.875e-4 retest under active cosine-floor high-water stack	/tmp/nvflare/simulation/fedavgm_lr18_m0475_epochs7_clientlr0045_cm0925_wd4875e7_eta00001625_mu3e5_zmg_cb090_sam00725_w1
c65a58703	0.921800	862	--n_clients 8 --num_rounds 20 --aggregation_epochs 7 --local_train_steps 0 --batch_size 64 --eval_batch_size 1024 --alpha 0.5 --seed 0 --model_arch moderate_cnn --max_model_params 5000000 --aggregator fedavgm --server_lr 1.8 --server_momentum 0.475 --lr 0.045 --momentum 0.925 --weight_decay 5e-4 --cosine_lr_eta_min_factor 0.0001625 --sam_rho 0.0725 --fedproxloss_mu 3e-5 --zero_mean_gradients --class_balanced_loss_beta 0.89375 --final_eval_clients site-1 --name fedavgm_lr18_m0475_epochs7_clientlr0045_cm0925_wd5e4_eta00001625_mu3e5_zmg_cb089375_sam00725_w1	discard	client.py	Post-improvement lower class-balanced beta 0.89375 retest under active cosine-floor high-water stack	/tmp/nvflare/simulation/fedavgm_lr18_m0475_epochs7_clientlr0045_cm0925_wd5e4_eta00001625_mu3e5_zmg_cb089375_sam00725_w1
c9e3bdfda	0.921000	861	--n_clients 8 --num_rounds 20 --aggregation_epochs 7 --local_train_steps 0 --batch_size 64 --eval_batch_size 1024 --alpha 0.5 --seed 0 --model_arch moderate_cnn --max_model_params 5000000 --aggregator fedavgm --server_lr 1.8 --server_momentum 0.475 --lr 0.045 --momentum 0.925 --weight_decay 5e-4 --cosine_lr_eta_min_factor 0.0001625 --sam_rho 0.0728125 --fedproxloss_mu 3e-5 --zero_mean_gradients --class_balanced_loss_beta 0.90 --final_eval_clients site-1 --name fedavgm_lr18_m0475_epochs7_clientlr0045_cm0925_wd5e4_eta00001625_mu3e5_zmg_cb090_sam00728125_w1	discard	client.py	Post-improvement upper SAM rho 0.0728125 retest under active cosine-floor high-water stack	/tmp/nvflare/simulation/fedavgm_lr18_m0475_epochs7_clientlr0045_cm0925_wd5e4_eta00001625_mu3e5_zmg_cb090_sam00728125_w1
26beac71d	0.922300	864	--n_clients 8 --num_rounds 20 --aggregation_epochs 7 --local_train_steps 0 --batch_size 64 --eval_batch_size 1024 --alpha 0.5 --seed 0 --model_arch moderate_cnn --max_model_params 5000000 --aggregator fedavgm --server_lr 1.8 --server_momentum 0.475 --lr 0.045 --momentum 0.925 --weight_decay 5e-4 --cosine_lr_eta_min_factor 0.0001625 --sam_rho 0.0725 --fedproxloss_mu 3.125e-5 --zero_mean_gradients --class_balanced_loss_beta 0.90 --final_eval_clients site-1 --name fedavgm_lr18_m0475_epochs7_clientlr0045_cm0925_wd5e4_eta00001625_mu3125e8_zmg_cb090_sam00725_w1	discard	client.py	Post-improvement upper FedProx mu 3.125e-5 retest under active cosine-floor high-water stack	/tmp/nvflare/simulation/fedavgm_lr18_m0475_epochs7_clientlr0045_cm0925_wd5e4_eta00001625_mu3125e8_zmg_cb090_sam00725_w1
dddef450e	0.921900	863	--n_clients 8 --num_rounds 20 --aggregation_epochs 7 --local_train_steps 0 --batch_size 64 --eval_batch_size 1024 --alpha 0.5 --seed 0 --model_arch moderate_cnn --max_model_params 5000000 --aggregator fedavgm --server_lr 1.8 --server_momentum 0.475 --lr 0.045 --momentum 0.925 --weight_decay 5.125e-4 --cosine_lr_eta_min_factor 0.0001625 --sam_rho 0.0725 --fedproxloss_mu 3e-5 --zero_mean_gradients --class_balanced_loss_beta 0.90 --final_eval_clients site-1 --name fedavgm_lr18_m0475_epochs7_clientlr0045_cm0925_wd5125e7_eta00001625_mu3e5_zmg_cb090_sam00725_w1	discard	client.py	Post-improvement upper weight decay 5.125e-4 retest under active cosine-floor high-water stack	/tmp/nvflare/simulation/fedavgm_lr18_m0475_epochs7_clientlr0045_cm0925_wd5125e7_eta00001625_mu3e5_zmg_cb090_sam00725_w1
efd29afb8	0.921900	858	--n_clients 8 --num_rounds 20 --aggregation_epochs 7 --local_train_steps 0 --batch_size 64 --eval_batch_size 1024 --alpha 0.5 --seed 0 --model_arch moderate_cnn --max_model_params 5000000 --aggregator fedavgm --server_lr 1.8 --server_momentum 0.475 --lr 0.045 --momentum 0.925 --weight_decay 5e-4 --cosine_lr_eta_min_factor 0.0001625 --sam_rho 0.0725 --fedproxloss_mu 3e-5 --zero_mean_gradients --class_balanced_loss_beta 0.903125 --final_eval_clients site-1 --name fedavgm_lr18_m0475_epochs7_clientlr0045_cm0925_wd5e4_eta00001625_mu3e5_zmg_cb0903125_sam00725_w1	discard	client.py	Post-improvement upper class-balanced beta 0.903125 retest under active cosine-floor high-water stack	/tmp/nvflare/simulation/fedavgm_lr18_m0475_epochs7_clientlr0045_cm0925_wd5e4_eta00001625_mu3e5_zmg_cb0903125_sam00725_w1
df1c338c9	0.920900	975	--n_clients 8 --num_rounds 20 --aggregation_epochs 8 --local_train_steps 0 --batch_size 64 --eval_batch_size 1024 --alpha 0.5 --seed 0 --model_arch moderate_cnn --max_model_params 5000000 --aggregator fedavgm --server_lr 1.8 --server_momentum 0.475 --lr 0.045 --momentum 0.925 --weight_decay 5e-4 --cosine_lr_eta_min_factor 0.0001625 --sam_rho 0.0725 --fedproxloss_mu 3e-5 --zero_mean_gradients --class_balanced_loss_beta 0.90 --final_eval_clients site-1 --name fedavgm_lr18_m0475_epochs8_clientlr0045_cm0925_wd5e4_eta00001625_mu3e5_zmg_cb090_sam00725_w1	discard	client.py	Post-improvement aggregation_epochs 8 upper local-compute neighbor under active cosine-floor high-water stack	/tmp/nvflare/simulation/fedavgm_lr18_m0475_epochs8_clientlr0045_cm0925_wd5e4_eta00001625_mu3e5_zmg_cb090_sam00725_w1
59efc8836	0.919800	752	--n_clients 8 --num_rounds 20 --aggregation_epochs 6 --local_train_steps 0 --batch_size 64 --eval_batch_size 1024 --alpha 0.5 --seed 0 --model_arch moderate_cnn --max_model_params 5000000 --aggregator fedavgm --server_lr 1.8 --server_momentum 0.475 --lr 0.045 --momentum 0.925 --weight_decay 5e-4 --cosine_lr_eta_min_factor 0.0001625 --sam_rho 0.0725 --fedproxloss_mu 3e-5 --zero_mean_gradients --class_balanced_loss_beta 0.90 --final_eval_clients site-1 --name fedavgm_lr18_m0475_epochs6_clientlr0045_cm0925_wd5e4_eta00001625_mu3e5_zmg_cb090_sam00725_w1	discard	client.py	Post-improvement aggregation_epochs 6 lower local-compute neighbor under active cosine-floor high-water stack	/tmp/nvflare/simulation/fedavgm_lr18_m0475_epochs6_clientlr0045_cm0925_wd5e4_eta00001625_mu3e5_zmg_cb090_sam00725_w1
42ba353f0	0.921800	843	--n_clients 8 --num_rounds 20 --aggregation_epochs 7 --local_train_steps 768 --batch_size 64 --eval_batch_size 1024 --alpha 0.5 --seed 0 --model_arch moderate_cnn --max_model_params 5000000 --aggregator fedavgm --server_lr 1.8 --server_momentum 0.475 --lr 0.045 --momentum 0.925 --weight_decay 5e-4 --cosine_lr_eta_min_factor 0.0001625 --sam_rho 0.0725 --fedproxloss_mu 3e-5 --zero_mean_gradients --class_balanced_loss_beta 0.90 --final_eval_clients site-1 --name fedavgm_lr18_m0475_steps768_clientlr0045_cm0925_wd5e4_eta00001625_mu3e5_zmg_cb090_sam00725_w1	discard	client.py	Post-improvement exact local_train_steps 768 under active cosine-floor high-water stack	/tmp/nvflare/simulation/fedavgm_lr18_m0475_steps768_clientlr0045_cm0925_wd5e4_eta00001625_mu3e5_zmg_cb090_sam00725_w1
14a84c5a7	0.920900	782	--n_clients 8 --num_rounds 20 --aggregation_epochs 7 --local_train_steps 704 --batch_size 64 --eval_batch_size 1024 --alpha 0.5 --seed 0 --model_arch moderate_cnn --max_model_params 5000000 --aggregator fedavgm --server_lr 1.8 --server_momentum 0.475 --lr 0.045 --momentum 0.925 --weight_decay 5e-4 --cosine_lr_eta_min_factor 0.0001625 --sam_rho 0.0725 --fedproxloss_mu 3e-5 --zero_mean_gradients --class_balanced_loss_beta 0.90 --final_eval_clients site-1 --name fedavgm_lr18_m0475_steps704_clientlr0045_cm0925_wd5e4_eta00001625_mu3e5_zmg_cb090_sam00725_w1	discard	client.py	Post-improvement exact local_train_steps 704 lower neighbor under active cosine-floor high-water stack	/tmp/nvflare/simulation/fedavgm_lr18_m0475_steps704_clientlr0045_cm0925_wd5e4_eta00001625_mu3e5_zmg_cb090_sam00725_w1
5665b3110	0.919000	909	--n_clients 8 --num_rounds 20 --aggregation_epochs 7 --local_train_steps 832 --batch_size 64 --eval_batch_size 1024 --alpha 0.5 --seed 0 --model_arch moderate_cnn --max_model_params 5000000 --aggregator fedavgm --server_lr 1.8 --server_momentum 0.475 --lr 0.045 --momentum 0.925 --weight_decay 5e-4 --cosine_lr_eta_min_factor 0.0001625 --sam_rho 0.0725 --fedproxloss_mu 3e-5 --zero_mean_gradients --class_balanced_loss_beta 0.90 --final_eval_clients site-1 --name fedavgm_lr18_m0475_steps832_clientlr0045_cm0925_wd5e4_eta00001625_mu3e5_zmg_cb090_sam00725_w1	discard	client.py	Post-improvement exact local_train_steps 832 upper neighbor under active cosine-floor high-water stack	/tmp/nvflare/simulation/fedavgm_lr18_m0475_steps832_clientlr0045_cm0925_wd5e4_eta00001625_mu3e5_zmg_cb090_sam00725_w1
f394bc61c	0.923200	972	--n_clients 8 --num_rounds 20 --aggregation_epochs 7 --local_train_steps 896 --batch_size 64 --eval_batch_size 1024 --alpha 0.5 --seed 0 --model_arch moderate_cnn --max_model_params 5000000 --aggregator fedavgm --server_lr 1.8 --server_momentum 0.475 --lr 0.045 --momentum 0.925 --weight_decay 5e-4 --cosine_lr_eta_min_factor 0.0001625 --sam_rho 0.0725 --fedproxloss_mu 3e-5 --zero_mean_gradients --class_balanced_loss_beta 0.90 --final_eval_clients site-1 --name fedavgm_lr18_m0475_steps896_clientlr0045_cm0925_wd5e4_eta00001625_mu3e5_zmg_cb090_sam00725_w1	discard	client.py	Post-improvement exact local_train_steps 896 wider upper neighbor under active cosine-floor high-water stack	/tmp/nvflare/simulation/fedavgm_lr18_m0475_steps896_clientlr0045_cm0925_wd5e4_eta00001625_mu3e5_zmg_cb090_sam00725_w1
8d6a77e06	0.922400	1035	--n_clients 8 --num_rounds 20 --aggregation_epochs 7 --local_train_steps 960 --batch_size 64 --eval_batch_size 1024 --alpha 0.5 --seed 0 --model_arch moderate_cnn --max_model_params 5000000 --aggregator fedavgm --server_lr 1.8 --server_momentum 0.475 --lr 0.045 --momentum 0.925 --weight_decay 5e-4 --cosine_lr_eta_min_factor 0.0001625 --sam_rho 0.0725 --fedproxloss_mu 3e-5 --zero_mean_gradients --class_balanced_loss_beta 0.90 --final_eval_clients site-1 --name fedavgm_lr18_m0475_steps960_clientlr0045_cm0925_wd5e4_eta00001625_mu3e5_zmg_cb090_sam00725_w1	discard	client.py	Post-improvement exact local_train_steps 960 wider upper local-compute probe under active cosine-floor high-water stack	/tmp/nvflare/simulation/fedavgm_lr18_m0475_steps960_clientlr0045_cm0925_wd5e4_eta00001625_mu3e5_zmg_cb090_sam00725_w1
e6a8e74c4	0.920600	647	--n_clients 8 --num_rounds 20 --aggregation_epochs 7 --local_train_steps 0 --batch_size 64 --eval_batch_size 1024 --alpha 0.5 --seed 0 --model_arch moderate_cnn --max_model_params 5000000 --aggregator fedavgm --server_lr 1.8 --server_momentum 0.475 --lr 0.045 --momentum 0.925 --weight_decay 5e-4 --cosine_lr_eta_min_factor 0.0001625 --sam_rho 0.0725 --fedproxloss_mu 0 --zero_mean_gradients --class_balanced_loss_beta 0.90 --final_eval_clients site-1 --name fedavgm_lr18_m0475_epochs7_clientlr0045_cm0925_wd5e4_eta00001625_mu0_zmg_cb090_sam00725_w1	discard	client.py	Post-improvement FedProx off ablation under active cosine-floor high-water stack	/tmp/nvflare/simulation/fedavgm_lr18_m0475_epochs7_clientlr0045_cm0925_wd5e4_eta00001625_mu0_zmg_cb090_sam00725_w1
94c10f7bc	0.921600	861	--n_clients 8 --num_rounds 20 --aggregation_epochs 7 --local_train_steps 0 --batch_size 64 --eval_batch_size 1024 --alpha 0.5 --seed 0 --model_arch moderate_cnn --max_model_params 5000000 --aggregator fedavgm --server_lr 1.800390625 --server_momentum 0.475 --lr 0.045 --momentum 0.92578125 --weight_decay 5e-4 --cosine_lr_eta_min_factor 0.0001625 --sam_rho 0.0725 --fedproxloss_mu 3e-5 --zero_mean_gradients --class_balanced_loss_beta 0.90 --final_eval_clients site-1 --name fedavgm_lr1800390625_m0475_epochs7_clientlr0045_cm092578125_wd5e4_eta00001625_mu3e5_zmg_cb090_sam00725_combo_w1	discard	client.py	Post-improvement near-miss combo server_lr 1.800390625 client momentum 0.92578125 under active cosine-floor high-water stack	/tmp/nvflare/simulation/fedavgm_lr1800390625_m0475_epochs7_clientlr0045_cm092578125_wd5e4_eta00001625_mu3e5_zmg_cb090_sam00725_combo_w1
8732fbee9	0.922200	864	--n_clients 8 --num_rounds 20 --aggregation_epochs 7 --local_train_steps 0 --batch_size 64 --eval_batch_size 1024 --alpha 0.5 --seed 0 --model_arch moderate_cnn --max_model_params 5000000 --aggregator fedavgm --server_lr 1.8 --server_momentum 0.47421875 --lr 0.045 --momentum 0.92578125 --weight_decay 5e-4 --cosine_lr_eta_min_factor 0.0001625 --sam_rho 0.0725 --fedproxloss_mu 3e-5 --zero_mean_gradients --class_balanced_loss_beta 0.90 --final_eval_clients site-1 --name fedavgm_lr18_m047421875_epochs7_clientlr0045_cm092578125_wd5e4_eta00001625_mu3e5_zmg_cb090_sam00725_combo_w1	discard	client.py	Post-improvement near-miss combo lower server_momentum 0.47421875 client momentum 0.92578125 under active cosine-floor high-water stack	/tmp/nvflare/simulation/fedavgm_lr18_m047421875_epochs7_clientlr0045_cm092578125_wd5e4_eta00001625_mu3e5_zmg_cb090_sam00725_combo_w1
d2c7e5061	0.924100	865	--n_clients 8 --num_rounds 20 --aggregation_epochs 7 --local_train_steps 0 --batch_size 64 --eval_batch_size 1024 --alpha 0.5 --seed 0 --model_arch moderate_cnn --max_model_params 5000000 --aggregator fedavgm --server_lr 1.800390625 --server_momentum 0.47421875 --lr 0.045 --momentum 0.925 --weight_decay 5e-4 --cosine_lr_eta_min_factor 0.0001625 --sam_rho 0.0725 --fedproxloss_mu 3e-5 --zero_mean_gradients --class_balanced_loss_beta 0.90 --final_eval_clients site-1 --name fedavgm_lr1800390625_m047421875_epochs7_clientlr0045_cm0925_wd5e4_eta00001625_mu3e5_zmg_cb090_sam00725_combo_w1	discard	custom_aggregators.py	Post-improvement near-miss combo server_lr 1.800390625 lower server_momentum 0.47421875 under active cosine-floor high-water stack	/tmp/nvflare/simulation/fedavgm_lr1800390625_m047421875_epochs7_clientlr0045_cm0925_wd5e4_eta00001625_mu3e5_zmg_cb090_sam00725_combo_w1
d770a584c	0.921800	864	--n_clients 8 --num_rounds 20 --aggregation_epochs 7 --local_train_steps 0 --batch_size 64 --eval_batch_size 1024 --alpha 0.5 --seed 0 --model_arch moderate_cnn --max_model_params 5000000 --aggregator fedavgm --server_lr 1.8001953125 --server_momentum 0.474609375 --lr 0.045 --momentum 0.925 --weight_decay 5e-4 --cosine_lr_eta_min_factor 0.0001625 --sam_rho 0.0725 --fedproxloss_mu 3e-5 --zero_mean_gradients --class_balanced_loss_beta 0.90 --final_eval_clients site-1 --name fedavgm_lr18001953125_m0474609375_epochs7_clientlr0045_cm0925_wd5e4_eta00001625_mu3e5_zmg_cb090_sam00725_combo_w1	discard	custom_aggregators.py	Post-improvement half-step server-side combo server_lr 1.8001953125 server_momentum 0.474609375 under active cosine-floor high-water stack	/tmp/nvflare/simulation/fedavgm_lr18001953125_m0474609375_epochs7_clientlr0045_cm0925_wd5e4_eta00001625_mu3e5_zmg_cb090_sam00725_combo_w1
b5385dd30	0.924700	1074	--n_clients 8 --num_rounds 20 --aggregation_epochs 7 --local_train_steps 1000 --batch_size 64 --eval_batch_size 1024 --alpha 0.5 --seed 0 --model_arch moderate_cnn --max_model_params 5000000 --aggregator fedavgm --server_lr 1.8 --server_momentum 0.475 --lr 0.045 --momentum 0.925 --weight_decay 5e-4 --cosine_lr_eta_min_factor 0.0001625 --sam_rho 0.0725 --fedproxloss_mu 3e-5 --zero_mean_gradients --class_balanced_loss_beta 0.90 --final_eval_clients site-1 --name fedavgm_lr18_m0475_steps1000_clientlr0045_cm0925_wd5e4_eta00001625_mu3e5_zmg_cb090_sam00725_w1	discard	client.py	Post-improvement schema-max exact local_train_steps 1000 under active cosine-floor high-water stack	/tmp/nvflare/simulation/fedavgm_lr18_m0475_steps1000_clientlr0045_cm0925_wd5e4_eta00001625_mu3e5_zmg_cb090_sam00725_w1
3b8d455db		515	literature_loop	literature	templates/literature_loop.md	literature review: plateau after row 658; selected FedDecorr local feature decorrelation beta 0.1	templates/literature_loop.md
