commit	score	runtime_seconds	budget	status	target	description	artifacts
fcc530d23	0.913600	765	--n_clients 8 --num_rounds 20 --aggregation_epochs 7 --local_train_steps 0 --batch_size 64 --eval_batch_size 1024 --alpha 0.5 --seed 0 --model_arch moderate_cnn --max_model_params 5000000 --aggregator fedavgm --server_lr 1.8 --server_momentum 0.475 --lr 0.045 --momentum 0.925 --weight_decay 5e-4 --cosine_lr_eta_min_factor 0.00015 --fedproxloss_mu 3e-5 --zero_mean_gradients --final_eval_clients site-1 --class_balanced_loss_beta 0.95 --name fedavgm_lr18_m0475_epochs7_clientlr0045_cm0925_wd5e4_eta000015_mu3e5_zmg_cb095_w2	discard	client.py	Class-balanced effective-number beta 0.95 stability bracket on FedZMG high-floor stack [src: Cui19 CBLoss CVPR; Wang21 RatioLoss AAAI]	/tmp/nvflare/simulation/fedavgm_lr18_m0475_epochs7_clientlr0045_cm0925_wd5e4_eta000015_mu3e5_zmg_cb095_w2
fcc530d23	0.918600	765	--n_clients 8 --num_rounds 20 --aggregation_epochs 7 --local_train_steps 0 --batch_size 64 --eval_batch_size 1024 --alpha 0.5 --seed 0 --model_arch moderate_cnn --max_model_params 5000000 --aggregator fedavgm --server_lr 1.8 --server_momentum 0.475 --lr 0.045 --momentum 0.925 --weight_decay 5e-4 --cosine_lr_eta_min_factor 0.00015 --fedproxloss_mu 3e-5 --zero_mean_gradients --final_eval_clients site-1 --class_balanced_loss_beta 0.90 --name fedavgm_lr18_m0475_epochs7_clientlr0045_cm0925_wd5e4_eta000015_mu3e5_zmg_cb090_w2	keep	client.py	Class-balanced effective-number beta 0.90 stability bracket on FedZMG high-floor stack [src: Cui19 CBLoss CVPR; Wang21 RatioLoss AAAI]	/tmp/nvflare/simulation/fedavgm_lr18_m0475_epochs7_clientlr0045_cm0925_wd5e4_eta000015_mu3e5_zmg_cb090_w2
c1c75754f	0.914800	765	--n_clients 8 --num_rounds 20 --aggregation_epochs 7 --local_train_steps 0 --batch_size 64 --eval_batch_size 1024 --alpha 0.5 --seed 0 --model_arch moderate_cnn --max_model_params 5000000 --aggregator fedavgm --server_lr 1.8 --server_momentum 0.475 --lr 0.045 --momentum 0.925 --weight_decay 5e-4 --cosine_lr_eta_min_factor 0.00015 --fedproxloss_mu 3e-5 --zero_mean_gradients --final_eval_clients site-1 --class_balanced_loss_beta 0.925 --name fedavgm_lr18_m0475_epochs7_clientlr0045_cm0925_wd5e4_eta000015_mu3e5_zmg_cb0925_w2	discard	client.py	Class-balanced effective-number beta 0.925 bracket around kept 0.90 [src: Cui19 CBLoss CVPR; Wang21 RatioLoss AAAI]	/tmp/nvflare/simulation/fedavgm_lr18_m0475_epochs7_clientlr0045_cm0925_wd5e4_eta000015_mu3e5_zmg_cb0925_w2
c1c75754f	0.915300	768	--n_clients 8 --num_rounds 20 --aggregation_epochs 7 --local_train_steps 0 --batch_size 64 --eval_batch_size 1024 --alpha 0.5 --seed 0 --model_arch moderate_cnn --max_model_params 5000000 --aggregator fedavgm --server_lr 1.8 --server_momentum 0.475 --lr 0.045 --momentum 0.925 --weight_decay 5e-4 --cosine_lr_eta_min_factor 0.00015 --fedproxloss_mu 3e-5 --zero_mean_gradients --final_eval_clients site-1 --class_balanced_loss_beta 0.875 --name fedavgm_lr18_m0475_epochs7_clientlr0045_cm0925_wd5e4_eta000015_mu3e5_zmg_cb0875_w2	discard	client.py	Class-balanced effective-number beta 0.875 bracket around kept 0.90 [src: Cui19 CBLoss CVPR; Wang21 RatioLoss AAAI]	/tmp/nvflare/simulation/fedavgm_lr18_m0475_epochs7_clientlr0045_cm0925_wd5e4_eta000015_mu3e5_zmg_cb0875_w2
9dd4f18b8	0.911800	768	--n_clients 8 --num_rounds 20 --aggregation_epochs 7 --local_train_steps 0 --batch_size 64 --eval_batch_size 1024 --alpha 0.5 --seed 0 --model_arch moderate_cnn --max_model_params 5000000 --aggregator fedavgm --server_lr 1.8 --server_momentum 0.475 --momentum 0.925 --weight_decay 5e-4 --cosine_lr_eta_min_factor 0.00015 --fedproxloss_mu 3e-5 --zero_mean_gradients --class_balanced_loss_beta 0.90 --final_eval_clients site-1 --lr 0.04625 --name fedavgm_lr18_m0475_epochs7_clientlr004625_cm0925_wd5e4_eta000015_mu3e5_zmg_cb090_w2	discard	client.py	Client lr 0.04625 around class-balanced beta 0.90 FedZMG stack [src: Cui19 CBLoss CVPR; Wang21 RatioLoss AAAI]	/tmp/nvflare/simulation/fedavgm_lr18_m0475_epochs7_clientlr004625_cm0925_wd5e4_eta000015_mu3e5_zmg_cb090_w2
9dd4f18b8	0.916100	768	--n_clients 8 --num_rounds 20 --aggregation_epochs 7 --local_train_steps 0 --batch_size 64 --eval_batch_size 1024 --alpha 0.5 --seed 0 --model_arch moderate_cnn --max_model_params 5000000 --aggregator fedavgm --server_lr 1.8 --server_momentum 0.475 --momentum 0.925 --weight_decay 5e-4 --cosine_lr_eta_min_factor 0.00015 --fedproxloss_mu 3e-5 --zero_mean_gradients --class_balanced_loss_beta 0.90 --final_eval_clients site-1 --lr 0.04375 --name fedavgm_lr18_m0475_epochs7_clientlr004375_cm0925_wd5e4_eta000015_mu3e5_zmg_cb090_w2	discard	client.py	Client lr 0.04375 around class-balanced beta 0.90 FedZMG stack [src: Cui19 CBLoss CVPR; Wang21 RatioLoss AAAI]	/tmp/nvflare/simulation/fedavgm_lr18_m0475_epochs7_clientlr004375_cm0925_wd5e4_eta000015_mu3e5_zmg_cb090_w2
650af5f7b	0.913400	762	--n_clients 8 --num_rounds 20 --aggregation_epochs 7 --local_train_steps 0 --batch_size 64 --eval_batch_size 1024 --alpha 0.5 --seed 0 --model_arch moderate_cnn --max_model_params 5000000 --aggregator fedavgm --server_momentum 0.475 --lr 0.045 --momentum 0.925 --weight_decay 5e-4 --cosine_lr_eta_min_factor 0.00015 --fedproxloss_mu 3e-5 --zero_mean_gradients --class_balanced_loss_beta 0.90 --final_eval_clients site-1 --server_lr 1.85 --name fedavgm_lr185_m0475_epochs7_clientlr0045_cm0925_wd5e4_eta000015_mu3e5_zmg_cb090_w2	discard	custom_aggregators.py	Server lr 1.85 around class-balanced beta 0.90 FedZMG stack [src: Cui19 CBLoss CVPR; Wang21 RatioLoss AAAI]	/tmp/nvflare/simulation/fedavgm_lr185_m0475_epochs7_clientlr0045_cm0925_wd5e4_eta000015_mu3e5_zmg_cb090_w2
650af5f7b	0.910400	763	--n_clients 8 --num_rounds 20 --aggregation_epochs 7 --local_train_steps 0 --batch_size 64 --eval_batch_size 1024 --alpha 0.5 --seed 0 --model_arch moderate_cnn --max_model_params 5000000 --aggregator fedavgm --server_momentum 0.475 --lr 0.045 --momentum 0.925 --weight_decay 5e-4 --cosine_lr_eta_min_factor 0.00015 --fedproxloss_mu 3e-5 --zero_mean_gradients --class_balanced_loss_beta 0.90 --final_eval_clients site-1 --server_lr 1.75 --name fedavgm_lr175_m0475_epochs7_clientlr0045_cm0925_wd5e4_eta000015_mu3e5_zmg_cb090_w2	discard	custom_aggregators.py	Server lr 1.75 around class-balanced beta 0.90 FedZMG stack [src: Cui19 CBLoss CVPR; Wang21 RatioLoss AAAI]	/tmp/nvflare/simulation/fedavgm_lr175_m0475_epochs7_clientlr0045_cm0925_wd5e4_eta000015_mu3e5_zmg_cb090_w2
d3540cda4	0.914300	643	--n_clients 8 --num_rounds 20 --local_train_steps 0 --batch_size 64 --eval_batch_size 1024 --alpha 0.5 --seed 0 --model_arch moderate_cnn --max_model_params 5000000 --aggregator fedavgm --server_lr 1.8 --server_momentum 0.475 --lr 0.045 --momentum 0.925 --weight_decay 5e-4 --cosine_lr_eta_min_factor 0.00015 --fedproxloss_mu 3e-5 --zero_mean_gradients --class_balanced_loss_beta 0.90 --final_eval_clients site-1 --aggregation_epochs 6 --name fedavgm_lr18_m0475_epochs6_clientlr0045_cm0925_wd5e4_eta000015_mu3e5_zmg_cb090_w2	discard	client.py	Aggregation epochs 6 with class-balanced beta 0.90 FedZMG stack [src: Cui19 CBLoss CVPR; Wang21 RatioLoss AAAI]	/tmp/nvflare/simulation/fedavgm_lr18_m0475_epochs6_clientlr0045_cm0925_wd5e4_eta000015_mu3e5_zmg_cb090_w2
d3540cda4	0.910000	756	--n_clients 8 --num_rounds 20 --local_train_steps 0 --batch_size 64 --eval_batch_size 1024 --alpha 0.5 --seed 0 --model_arch moderate_cnn --max_model_params 5000000 --aggregator fedavgm --server_lr 1.8 --server_momentum 0.475 --lr 0.045 --momentum 0.925 --weight_decay 5e-4 --cosine_lr_eta_min_factor 0.00015 --fedproxloss_mu 3e-5 --zero_mean_gradients --class_balanced_loss_beta 0.90 --final_eval_clients site-1 --aggregation_epochs 8 --name fedavgm_lr18_m0475_epochs8_clientlr0045_cm0925_wd5e4_eta000015_mu3e5_zmg_cb090_w2	discard	client.py	Aggregation epochs 8 with class-balanced beta 0.90 FedZMG stack [src: Cui19 CBLoss CVPR; Wang21 RatioLoss AAAI]	/tmp/nvflare/simulation/fedavgm_lr18_m0475_epochs8_clientlr0045_cm0925_wd5e4_eta000015_mu3e5_zmg_cb090_w2
354ee878a	0.912700	762	--n_clients 8 --num_rounds 20 --aggregation_epochs 7 --local_train_steps 0 --batch_size 64 --eval_batch_size 1024 --alpha 0.5 --seed 0 --model_arch moderate_cnn --max_model_params 5000000 --aggregator fedavgm --server_lr 1.8 --server_momentum 0.475 --lr 0.045 --momentum 0.925 --weight_decay 5e-4 --fedproxloss_mu 3e-5 --zero_mean_gradients --class_balanced_loss_beta 0.90 --final_eval_clients site-1 --cosine_lr_eta_min_factor 0.000125 --name fedavgm_lr18_m0475_epochs7_clientlr0045_cm0925_wd5e4_eta0000125_mu3e5_zmg_cb090_w2	discard	client.py	Cosine eta_min_factor 0.000125 with class-balanced beta 0.90 FedZMG stack [src: Cui19 CBLoss CVPR; Wang21 RatioLoss AAAI]	/tmp/nvflare/simulation/fedavgm_lr18_m0475_epochs7_clientlr0045_cm0925_wd5e4_eta0000125_mu3e5_zmg_cb090_w2
354ee878a	0.913300	765	--n_clients 8 --num_rounds 20 --aggregation_epochs 7 --local_train_steps 0 --batch_size 64 --eval_batch_size 1024 --alpha 0.5 --seed 0 --model_arch moderate_cnn --max_model_params 5000000 --aggregator fedavgm --server_lr 1.8 --server_momentum 0.475 --lr 0.045 --momentum 0.925 --weight_decay 5e-4 --fedproxloss_mu 3e-5 --zero_mean_gradients --class_balanced_loss_beta 0.90 --final_eval_clients site-1 --cosine_lr_eta_min_factor 0.000175 --name fedavgm_lr18_m0475_epochs7_clientlr0045_cm0925_wd5e4_eta0000175_mu3e5_zmg_cb090_w2	discard	client.py	Cosine eta_min_factor 0.000175 with class-balanced beta 0.90 FedZMG stack [src: Cui19 CBLoss CVPR; Wang21 RatioLoss AAAI]	/tmp/nvflare/simulation/fedavgm_lr18_m0475_epochs7_clientlr0045_cm0925_wd5e4_eta0000175_mu3e5_zmg_cb090_w2
3718ad1d8	0.914100	764	--n_clients 8 --num_rounds 20 --aggregation_epochs 7 --local_train_steps 0 --batch_size 64 --eval_batch_size 1024 --alpha 0.5 --seed 0 --model_arch moderate_cnn --max_model_params 5000000 --aggregator fedavgm --server_lr 1.8 --server_momentum 0.475 --lr 0.045 --momentum 0.925 --weight_decay 5e-4 --cosine_lr_eta_min_factor 0.00015 --zero_mean_gradients --class_balanced_loss_beta 0.90 --final_eval_clients site-1 --fedproxloss_mu 3.5e-5 --name fedavgm_lr18_m0475_epochs7_clientlr0045_cm0925_wd5e4_eta000015_mu3p5e5_zmg_cb090_w2	discard	client.py	FedProx mu 3.5e-5 around class-balanced beta 0.90 FedZMG stack [src: Li20 FedProx arXiv:1812.06127; Cui19 CBLoss CVPR]	/tmp/nvflare/simulation/fedavgm_lr18_m0475_epochs7_clientlr0045_cm0925_wd5e4_eta000015_mu3p5e5_zmg_cb090_w2
3718ad1d8	0.913100	768	--n_clients 8 --num_rounds 20 --aggregation_epochs 7 --local_train_steps 0 --batch_size 64 --eval_batch_size 1024 --alpha 0.5 --seed 0 --model_arch moderate_cnn --max_model_params 5000000 --aggregator fedavgm --server_lr 1.8 --server_momentum 0.475 --lr 0.045 --momentum 0.925 --weight_decay 5e-4 --cosine_lr_eta_min_factor 0.00015 --zero_mean_gradients --class_balanced_loss_beta 0.90 --final_eval_clients site-1 --fedproxloss_mu 2.5e-5 --name fedavgm_lr18_m0475_epochs7_clientlr0045_cm0925_wd5e4_eta000015_mu2p5e5_zmg_cb090_w2	discard	client.py	FedProx mu 2.5e-5 around class-balanced beta 0.90 FedZMG stack [src: Li20 FedProx arXiv:1812.06127; Cui19 CBLoss CVPR]	/tmp/nvflare/simulation/fedavgm_lr18_m0475_epochs7_clientlr0045_cm0925_wd5e4_eta000015_mu2p5e5_zmg_cb090_w2
c83a0bbd2	0.914500	766	--n_clients 8 --num_rounds 20 --aggregation_epochs 7 --local_train_steps 0 --batch_size 64 --eval_batch_size 1024 --alpha 0.5 --seed 0 --model_arch moderate_cnn --max_model_params 5000000 --aggregator fedavgm --server_lr 1.8 --lr 0.045 --momentum 0.925 --weight_decay 5e-4 --cosine_lr_eta_min_factor 0.00015 --fedproxloss_mu 3e-5 --zero_mean_gradients --class_balanced_loss_beta 0.90 --final_eval_clients site-1 --server_momentum 0.45 --name fedavgm_lr18_m045_epochs7_clientlr0045_cm0925_wd5e4_eta000015_mu3e5_zmg_cb090_w2	discard	custom_aggregators.py	Server momentum 0.45 around class-balanced beta 0.90 FedZMG stack [src: Cui19 CBLoss CVPR; Wang21 RatioLoss AAAI]	/tmp/nvflare/simulation/fedavgm_lr18_m045_epochs7_clientlr0045_cm0925_wd5e4_eta000015_mu3e5_zmg_cb090_w2
c83a0bbd2	0.912200	769	--n_clients 8 --num_rounds 20 --aggregation_epochs 7 --local_train_steps 0 --batch_size 64 --eval_batch_size 1024 --alpha 0.5 --seed 0 --model_arch moderate_cnn --max_model_params 5000000 --aggregator fedavgm --server_lr 1.8 --lr 0.045 --momentum 0.925 --weight_decay 5e-4 --cosine_lr_eta_min_factor 0.00015 --fedproxloss_mu 3e-5 --zero_mean_gradients --class_balanced_loss_beta 0.90 --final_eval_clients site-1 --server_momentum 0.50 --name fedavgm_lr18_m050_epochs7_clientlr0045_cm0925_wd5e4_eta000015_mu3e5_zmg_cb090_w2	discard	custom_aggregators.py	Server momentum 0.50 around class-balanced beta 0.90 FedZMG stack [src: Cui19 CBLoss CVPR; Wang21 RatioLoss AAAI]	/tmp/nvflare/simulation/fedavgm_lr18_m050_epochs7_clientlr0045_cm0925_wd5e4_eta000015_mu3e5_zmg_cb090_w2
ead206bfb	0.914700	765	--n_clients 8 --num_rounds 20 --aggregation_epochs 7 --local_train_steps 0 --batch_size 64 --eval_batch_size 1024 --alpha 0.5 --seed 0 --model_arch moderate_cnn --max_model_params 5000000 --aggregator fedavgm --server_lr 1.8 --server_momentum 0.475 --lr 0.045 --weight_decay 5e-4 --cosine_lr_eta_min_factor 0.00015 --fedproxloss_mu 3e-5 --zero_mean_gradients --class_balanced_loss_beta 0.90 --final_eval_clients site-1 --momentum 0.9125 --name fedavgm_lr18_m0475_epochs7_clientlr0045_cm09125_wd5e4_eta000015_mu3e5_zmg_cb090_w2	discard	client.py	Client momentum 0.9125 around class-balanced beta 0.90 FedZMG stack [src: Cui19 CBLoss CVPR; Wang21 RatioLoss AAAI]	/tmp/nvflare/simulation/fedavgm_lr18_m0475_epochs7_clientlr0045_cm09125_wd5e4_eta000015_mu3e5_zmg_cb090_w2
ead206bfb	0.910700	765	--n_clients 8 --num_rounds 20 --aggregation_epochs 7 --local_train_steps 0 --batch_size 64 --eval_batch_size 1024 --alpha 0.5 --seed 0 --model_arch moderate_cnn --max_model_params 5000000 --aggregator fedavgm --server_lr 1.8 --server_momentum 0.475 --lr 0.045 --weight_decay 5e-4 --cosine_lr_eta_min_factor 0.00015 --fedproxloss_mu 3e-5 --zero_mean_gradients --class_balanced_loss_beta 0.90 --final_eval_clients site-1 --momentum 0.9375 --name fedavgm_lr18_m0475_epochs7_clientlr0045_cm09375_wd5e4_eta000015_mu3e5_zmg_cb090_w2	discard	client.py	Client momentum 0.9375 around class-balanced beta 0.90 FedZMG stack [src: Cui19 CBLoss CVPR; Wang21 RatioLoss AAAI]	/tmp/nvflare/simulation/fedavgm_lr18_m0475_epochs7_clientlr0045_cm09375_wd5e4_eta000015_mu3e5_zmg_cb090_w2
c65778b8b	0.908900	762	--n_clients 8 --num_rounds 20 --aggregation_epochs 7 --local_train_steps 0 --batch_size 64 --eval_batch_size 1024 --alpha 0.5 --seed 0 --model_arch moderate_cnn --max_model_params 5000000 --aggregator fedavgm --server_lr 1.8 --server_momentum 0.475 --lr 0.045 --momentum 0.925 --cosine_lr_eta_min_factor 0.00015 --fedproxloss_mu 3e-5 --zero_mean_gradients --class_balanced_loss_beta 0.90 --final_eval_clients site-1 --weight_decay 7.5e-4 --name fedavgm_lr18_m0475_epochs7_clientlr0045_cm0925_wd7p5e4_eta000015_mu3e5_zmg_cb090_w2	discard	client.py	Weight decay 7.5e-4 around class-balanced beta 0.90 FedZMG stack [src: Cui19 CBLoss CVPR; Wang21 RatioLoss AAAI]	/tmp/nvflare/simulation/fedavgm_lr18_m0475_epochs7_clientlr0045_cm0925_wd7p5e4_eta000015_mu3e5_zmg_cb090_w2
c65778b8b	0.910800	765	--n_clients 8 --num_rounds 20 --aggregation_epochs 7 --local_train_steps 0 --batch_size 64 --eval_batch_size 1024 --alpha 0.5 --seed 0 --model_arch moderate_cnn --max_model_params 5000000 --aggregator fedavgm --server_lr 1.8 --server_momentum 0.475 --lr 0.045 --momentum 0.925 --cosine_lr_eta_min_factor 0.00015 --fedproxloss_mu 3e-5 --zero_mean_gradients --class_balanced_loss_beta 0.90 --final_eval_clients site-1 --weight_decay 2.5e-4 --name fedavgm_lr18_m0475_epochs7_clientlr0045_cm0925_wd2p5e4_eta000015_mu3e5_zmg_cb090_w2	discard	client.py	Weight decay 2.5e-4 around class-balanced beta 0.90 FedZMG stack [src: Cui19 CBLoss CVPR; Wang21 RatioLoss AAAI]	/tmp/nvflare/simulation/fedavgm_lr18_m0475_epochs7_clientlr0045_cm0925_wd2p5e4_eta000015_mu3e5_zmg_cb090_w2
0a3ae92fa	0.909000	397	--n_clients 8 --num_rounds 20 --aggregation_epochs 7 --batch_size 64 --eval_batch_size 1024 --alpha 0.5 --seed 0 --model_arch moderate_cnn --max_model_params 5000000 --aggregator fedavgm --server_lr 1.8 --server_momentum 0.475 --lr 0.045 --momentum 0.925 --weight_decay 5e-4 --cosine_lr_eta_min_factor 0.00015 --fedproxloss_mu 3e-5 --zero_mean_gradients --class_balanced_loss_beta 0.90 --final_eval_clients site-1 --local_train_steps 640 --name fedavgm_lr18_m0475_steps640_clientlr0045_cm0925_wd5e4_eta000015_mu3e5_zmg_cb090_w2	discard	client.py	Exact local_train_steps 640 with class-balanced beta 0.90 FedZMG stack [src: Cui19 CBLoss CVPR; Wang21 RatioLoss AAAI]	/tmp/nvflare/simulation/fedavgm_lr18_m0475_steps640_clientlr0045_cm0925_wd5e4_eta000015_mu3e5_zmg_cb090_w2
0a3ae92fa	0.913000	471	--n_clients 8 --num_rounds 20 --aggregation_epochs 7 --local_train_steps 768 --batch_size 64 --eval_batch_size 1024 --alpha 0.5 --seed 0 --model_arch moderate_cnn --max_model_params 5000000 --aggregator fedavgm --server_lr 1.8 --server_momentum 0.475 --lr 0.045 --momentum 0.925 --weight_decay 5e-4 --cosine_lr_eta_min_factor 0.00015 --fedproxloss_mu 3e-5 --zero_mean_gradients --class_balanced_loss_beta 0.90 --final_eval_clients site-1 --name fedavgm_lr18_m0475_steps768_clientlr0045_cm0925_wd5e4_eta000015_mu3e5_zmg_cb090_w1	discard	client.py	Exact local_train_steps 768 with class-balanced beta 0.90 FedZMG stack retry after pycache race [src: Cui19 CBLoss CVPR; Wang21 RatioLoss AAAI]	/tmp/nvflare/simulation/fedavgm_lr18_m0475_steps768_clientlr0045_cm0925_wd5e4_eta000015_mu3e5_zmg_cb090_w1
d6fffc389	0.898100	778	--n_clients 8 --num_rounds 20 --aggregation_epochs 7 --local_train_steps 0 --batch_size 64 --eval_batch_size 1024 --alpha 0.5 --seed 0 --model_arch moderate_cnn --max_model_params 5000000 --lr 0.045 --momentum 0.925 --weight_decay 5e-4 --cosine_lr_eta_min_factor 0.00015 --fedproxloss_mu 3e-5 --zero_mean_gradients --class_balanced_loss_beta 0.90 --final_eval_clients site-1 --aggregator default --name default_epochs7_clientlr0045_cm0925_wd5e4_eta000015_mu3e5_zmg_cb090_w2	discard	custom_aggregators.py	Built-in FedAvg comparison with class-balanced beta 0.90 FedZMG stack [src: Cui19 CBLoss CVPR; Wang21 RatioLoss AAAI]	/tmp/nvflare/simulation/default_epochs7_clientlr0045_cm0925_wd5e4_eta000015_mu3e5_zmg_cb090_w2
d6fffc389	0.898000	778	--n_clients 8 --num_rounds 20 --aggregation_epochs 7 --local_train_steps 0 --batch_size 64 --eval_batch_size 1024 --alpha 0.5 --seed 0 --model_arch moderate_cnn --max_model_params 5000000 --lr 0.045 --momentum 0.925 --weight_decay 5e-4 --cosine_lr_eta_min_factor 0.00015 --fedproxloss_mu 3e-5 --zero_mean_gradients --class_balanced_loss_beta 0.90 --final_eval_clients site-1 --aggregator weighted --name weighted_epochs7_clientlr0045_cm0925_wd5e4_eta000015_mu3e5_zmg_cb090_w2	discard	custom_aggregators.py	Weighted FedAvg comparison with class-balanced beta 0.90 FedZMG stack [src: Cui19 CBLoss CVPR; Wang21 RatioLoss AAAI]	/tmp/nvflare/simulation/weighted_epochs7_clientlr0045_cm0925_wd5e4_eta000015_mu3e5_zmg_cb090_w2
4a44bda90	0.913000	775	--n_clients 8 --num_rounds 20 --aggregation_epochs 7 --local_train_steps 0 --batch_size 64 --eval_batch_size 1024 --alpha 0.5 --seed 0 --model_arch moderate_cnn --max_model_params 5000000 --aggregator fedavgm --server_lr 1.8 --server_momentum 0.475 --lr 0.045 --momentum 0.925 --weight_decay 5e-4 --cosine_lr_eta_min_factor 0.00015 --fedproxloss_mu 3e-5 --zero_mean_gradients --final_eval_clients site-1 --class_balanced_loss_beta 0.895 --name fedavgm_lr18_m0475_epochs7_clientlr0045_cm0925_wd5e4_eta000015_mu3e5_zmg_cb0895_w2	discard	client.py	Class-balanced effective-number beta 0.895 tight bracket around kept 0.90 [src: Cui19 CBLoss CVPR; Wang21 RatioLoss AAAI]	/tmp/nvflare/simulation/fedavgm_lr18_m0475_epochs7_clientlr0045_cm0925_wd5e4_eta000015_mu3e5_zmg_cb0895_w2
4a44bda90	0.911400	778	--n_clients 8 --num_rounds 20 --aggregation_epochs 7 --local_train_steps 0 --batch_size 64 --eval_batch_size 1024 --alpha 0.5 --seed 0 --model_arch moderate_cnn --max_model_params 5000000 --aggregator fedavgm --server_lr 1.8 --server_momentum 0.475 --lr 0.045 --momentum 0.925 --weight_decay 5e-4 --cosine_lr_eta_min_factor 0.00015 --fedproxloss_mu 3e-5 --zero_mean_gradients --final_eval_clients site-1 --class_balanced_loss_beta 0.905 --name fedavgm_lr18_m0475_epochs7_clientlr0045_cm0925_wd5e4_eta000015_mu3e5_zmg_cb0905_w2	discard	client.py	Class-balanced effective-number beta 0.905 tight bracket around kept 0.90 [src: Cui19 CBLoss CVPR; Wang21 RatioLoss AAAI]	/tmp/nvflare/simulation/fedavgm_lr18_m0475_epochs7_clientlr0045_cm0925_wd5e4_eta000015_mu3e5_zmg_cb0905_w2
676dd6aba	0.914900	592	--n_clients 8 --num_rounds 20 --aggregation_epochs 7 --local_train_steps 0 --batch_size 64 --eval_batch_size 1024 --alpha 0.5 --seed 0 --model_arch moderate_cnn --max_model_params 5000000 --aggregator fedavgm --server_lr 1.8 --server_momentum 0.475 --lr 0.045 --momentum 0.925 --weight_decay 5e-4 --cosine_lr_eta_min_factor 0.00015 --class_balanced_loss_beta 0.90 --final_eval_clients site-1 --zero_mean_gradients --name fedavgm_lr18_m0475_epochs7_clientlr0045_cm0925_wd5e4_eta000015_zmg_cb090_noprox_w2	discard	client.py	Ablate FedProx from class-balanced beta 0.90 FedZMG stack [src: Cui19 CBLoss CVPR; Wang21 RatioLoss AAAI]	/tmp/nvflare/simulation/fedavgm_lr18_m0475_epochs7_clientlr0045_cm0925_wd5e4_eta000015_zmg_cb090_noprox_w2
