commit	score	runtime_seconds	budget	status	target	description	artifacts
676dd6aba	0.901500	664	--n_clients 8 --num_rounds 20 --aggregation_epochs 7 --local_train_steps 0 --batch_size 64 --eval_batch_size 1024 --alpha 0.5 --seed 0 --model_arch moderate_cnn --max_model_params 5000000 --aggregator fedavgm --server_lr 1.8 --server_momentum 0.475 --lr 0.045 --momentum 0.925 --weight_decay 5e-4 --cosine_lr_eta_min_factor 0.00015 --class_balanced_loss_beta 0.90 --final_eval_clients site-1 --fedproxloss_mu 3e-5 --name fedavgm_lr18_m0475_epochs7_clientlr0045_cm0925_wd5e4_eta000015_mu3e5_cb090_nozmg_w2	discard	client.py	Ablate zero-mean gradients from class-balanced beta 0.90 FedProx stack [src: Cui19 CBLoss CVPR; Wang21 RatioLoss AAAI]	/tmp/nvflare/simulation/fedavgm_lr18_m0475_epochs7_clientlr0045_cm0925_wd5e4_eta000015_mu3e5_cb090_nozmg_w2
76596b239	0.907700	463	--n_clients 8 --num_rounds 20 --local_train_steps 0 --batch_size 64 --eval_batch_size 1024 --alpha 0.5 --seed 0 --model_arch moderate_cnn --max_model_params 5000000 --aggregator fedavgm --server_lr 1.8 --server_momentum 0.475 --lr 0.045 --momentum 0.925 --weight_decay 5e-4 --cosine_lr_eta_min_factor 0.00015 --fedproxloss_mu 3e-5 --zero_mean_gradients --class_balanced_loss_beta 0.90 --final_eval_clients site-1 --aggregation_epochs 4 --name fedavgm_lr18_m0475_epochs4_clientlr0045_cm0925_wd5e4_eta000015_mu3e5_zmg_cb090_w2	discard	client.py	Aggregation epochs 4 with class-balanced beta 0.90 FedZMG stack [src: Cui19 CBLoss CVPR; Wang21 RatioLoss AAAI]	/tmp/nvflare/simulation/fedavgm_lr18_m0475_epochs4_clientlr0045_cm0925_wd5e4_eta000015_mu3e5_zmg_cb090_w2
76596b239	0.910400	513	--n_clients 8 --num_rounds 20 --local_train_steps 0 --batch_size 64 --eval_batch_size 1024 --alpha 0.5 --seed 0 --model_arch moderate_cnn --max_model_params 5000000 --aggregator fedavgm --server_lr 1.8 --server_momentum 0.475 --lr 0.045 --momentum 0.925 --weight_decay 5e-4 --cosine_lr_eta_min_factor 0.00015 --fedproxloss_mu 3e-5 --zero_mean_gradients --class_balanced_loss_beta 0.90 --final_eval_clients site-1 --aggregation_epochs 5 --name fedavgm_lr18_m0475_epochs5_clientlr0045_cm0925_wd5e4_eta000015_mu3e5_zmg_cb090_w2	discard	client.py	Aggregation epochs 5 with class-balanced beta 0.90 FedZMG stack [src: Cui19 CBLoss CVPR; Wang21 RatioLoss AAAI]	/tmp/nvflare/simulation/fedavgm_lr18_m0475_epochs5_clientlr0045_cm0925_wd5e4_eta000015_mu3e5_zmg_cb090_w2
cbce032bd	0.884800	795	--n_clients 8 --num_rounds 20 --aggregation_epochs 7 --local_train_steps 0 --batch_size 64 --eval_batch_size 1024 --alpha 0.5 --seed 0 --model_arch moderate_cnn --max_model_params 5000000 --lr 0.045 --momentum 0.925 --weight_decay 5e-4 --cosine_lr_eta_min_factor 0.00015 --fedproxloss_mu 3e-5 --zero_mean_gradients --class_balanced_loss_beta 0.90 --final_eval_clients site-1 --aggregator median --name median_epochs7_clientlr0045_cm0925_wd5e4_eta000015_mu3e5_zmg_cb090_w2	discard	custom_aggregators.py	Median aggregation audit with class-balanced beta 0.90 FedZMG client stack [src: Cui19 CBLoss CVPR; Wang21 RatioLoss AAAI]	/tmp/nvflare/simulation/median_epochs7_clientlr0045_cm0925_wd5e4_eta000015_mu3e5_zmg_cb090_w2
cbce032bd	0.906600	799	--n_clients 8 --num_rounds 20 --aggregation_epochs 7 --local_train_steps 0 --batch_size 64 --eval_batch_size 1024 --alpha 0.5 --seed 0 --model_arch moderate_cnn --max_model_params 5000000 --lr 0.045 --momentum 0.925 --weight_decay 5e-4 --cosine_lr_eta_min_factor 0.00015 --fedproxloss_mu 3e-5 --zero_mean_gradients --class_balanced_loss_beta 0.90 --final_eval_clients site-1 --aggregator scaffold --name scaffold_epochs7_clientlr0045_cm0925_wd5e4_eta000015_mu3e5_zmg_cb090_w2	discard	custom_aggregators.py	SCAFFOLD metadata mode with class-balanced beta 0.90 FedZMG client stack [src: Karimireddy20 SCAFFOLD arXiv:1910.06378; Cui19 CBLoss CVPR]	/tmp/nvflare/simulation/scaffold_epochs7_clientlr0045_cm0925_wd5e4_eta000015_mu3e5_zmg_cb090_w2
e540992a7	0.000000	1200	--n_clients 8 --num_rounds 20 --aggregation_epochs 7 --local_train_steps 0 --batch_size 64 --eval_batch_size 1024 --alpha 0.5 --seed 0 --model_arch moderate_cnn --max_model_params 5000000 --aggregator fedavgm --server_lr 1.8 --server_momentum 0.475 --lr 0.045 --momentum 0.925 --weight_decay 5e-4 --fedproxloss_mu 3e-5 --zero_mean_gradients --class_balanced_loss_beta 0.90 --final_eval_clients site-1 --cosine_lr_eta_min_factor 0.0005 --name fedavgm_lr18_m0475_epochs7_clientlr0045_cm0925_wd5e4_eta00005_mu3e5_zmg_cb090_w2	crash	client.py	Cosine eta_min_factor 0.0005 broader scheduler floor with class-balanced beta 0.90 FedZMG stack [src: Cui19 CBLoss CVPR; Wang21 RatioLoss AAAI]	run_logs/fedavgm_lr18_m0475_epochs7_clientlr0045_cm0925_wd5e4_eta00005_mu3e5_zmg_cb090_w2.log
e540992a7	0.000000	1200	--n_clients 8 --num_rounds 20 --aggregation_epochs 7 --local_train_steps 0 --batch_size 64 --eval_batch_size 1024 --alpha 0.5 --seed 0 --model_arch moderate_cnn --max_model_params 5000000 --aggregator fedavgm --server_lr 1.8 --server_momentum 0.475 --lr 0.045 --momentum 0.925 --weight_decay 5e-4 --fedproxloss_mu 3e-5 --zero_mean_gradients --class_balanced_loss_beta 0.90 --final_eval_clients site-1 --cosine_lr_eta_min_factor 0.001 --name fedavgm_lr18_m0475_epochs7_clientlr0045_cm0925_wd5e4_eta0001_mu3e5_zmg_cb090_w2	crash	client.py	Cosine eta_min_factor 0.001 broader scheduler floor with class-balanced beta 0.90 FedZMG stack [src: Cui19 CBLoss CVPR; Wang21 RatioLoss AAAI]	run_logs/fedavgm_lr18_m0475_epochs7_clientlr0045_cm0925_wd5e4_eta0001_mu3e5_zmg_cb090_w2.log
e7cc95a2a	0.913300	513	--n_clients 8 --num_rounds 20 --aggregation_epochs 7 --local_train_steps 0 --batch_size 64 --eval_batch_size 1024 --alpha 0.5 --seed 0 --model_arch moderate_cnn --max_model_params 5000000 --aggregator fedavgm --server_lr 1.8 --server_momentum 0.475 --lr 0.045 --momentum 0.925 --weight_decay 5e-4 --fedproxloss_mu 3e-5 --zero_mean_gradients --class_balanced_loss_beta 0.90 --final_eval_clients site-1 --cosine_lr_eta_min_factor 0.0005 --name fedavgm_lr18_m0475_epochs7_clientlr0045_cm0925_wd5e4_eta00005_mu3e5_zmg_cb090_w1	discard	client.py	Cosine eta_min_factor 0.0005 width-1 retry after NVFlare communication crash [src: Cui19 CBLoss CVPR; Wang21 RatioLoss AAAI]	/tmp/nvflare/simulation/fedavgm_lr18_m0475_epochs7_clientlr0045_cm0925_wd5e4_eta00005_mu3e5_zmg_cb090_w1
e7cc95a2a	0.915800	541	--n_clients 8 --num_rounds 20 --aggregation_epochs 7 --local_train_steps 0 --batch_size 64 --eval_batch_size 1024 --alpha 0.5 --seed 0 --model_arch moderate_cnn --max_model_params 5000000 --aggregator fedavgm --server_lr 1.8 --server_momentum 0.475 --lr 0.045 --momentum 0.925 --weight_decay 5e-4 --fedproxloss_mu 3e-5 --zero_mean_gradients --class_balanced_loss_beta 0.90 --final_eval_clients site-1 --cosine_lr_eta_min_factor 0.001 --name fedavgm_lr18_m0475_epochs7_clientlr0045_cm0925_wd5e4_eta0001_mu3e5_zmg_cb090_w1	discard	client.py	Cosine eta_min_factor 0.001 width-1 retry after NVFlare communication crash [src: Cui19 CBLoss CVPR; Wang21 RatioLoss AAAI]	/tmp/nvflare/simulation/fedavgm_lr18_m0475_epochs7_clientlr0045_cm0925_wd5e4_eta0001_mu3e5_zmg_cb090_w1
861b7c909		285	literature_loop	literature	templates/literature_loop.md	literature review: plateau after class-balanced beta 0.90; selected LDAM margin-loss variants	templates/literature_loop.md
f209ade19	0.911700	560	--n_clients 8 --num_rounds 20 --aggregation_epochs 7 --local_train_steps 0 --batch_size 64 --eval_batch_size 1024 --alpha 0.5 --seed 0 --model_arch moderate_cnn --max_model_params 5000000 --aggregator fedavgm --server_lr 1.8 --server_momentum 0.475 --lr 0.045 --momentum 0.925 --weight_decay 5e-4 --cosine_lr_eta_min_factor 0.00015 --fedproxloss_mu 3e-5 --zero_mean_gradients --class_balanced_loss_beta 0.90 --final_eval_clients site-1 --ldam_max_margin 0.25 --name fedavgm_lr18_m0475_epochs7_clientlr0045_cm0925_wd5e4_eta000015_mu3e5_zmg_cb090_ldam025_w1	discard	client.py	LDAM max_margin 0.25 with class-balanced beta 0.90 FedZMG stack [src: Cao19 LDAM NeurIPS; Cui19 CBLoss CVPR]	/tmp/nvflare/simulation/fedavgm_lr18_m0475_epochs7_clientlr0045_cm0925_wd5e4_eta000015_mu3e5_zmg_cb090_ldam025_w1
f209ade19	0.911300	553	--n_clients 8 --num_rounds 20 --aggregation_epochs 7 --local_train_steps 0 --batch_size 64 --eval_batch_size 1024 --alpha 0.5 --seed 0 --model_arch moderate_cnn --max_model_params 5000000 --aggregator fedavgm --server_lr 1.8 --server_momentum 0.475 --lr 0.045 --momentum 0.925 --weight_decay 5e-4 --cosine_lr_eta_min_factor 0.00015 --fedproxloss_mu 3e-5 --zero_mean_gradients --class_balanced_loss_beta 0.90 --final_eval_clients site-1 --ldam_max_margin 0.50 --name fedavgm_lr18_m0475_epochs7_clientlr0045_cm0925_wd5e4_eta000015_mu3e5_zmg_cb090_ldam050_w1	discard	client.py	LDAM max_margin 0.50 with class-balanced beta 0.90 FedZMG stack [src: Cao19 LDAM NeurIPS; Cui19 CBLoss CVPR]	/tmp/nvflare/simulation/fedavgm_lr18_m0475_epochs7_clientlr0045_cm0925_wd5e4_eta000015_mu3e5_zmg_cb090_ldam050_w1
ac5199f59	0.910100	565	--n_clients 8 --num_rounds 20 --aggregation_epochs 7 --batch_size 64 --eval_batch_size 1024 --alpha 0.5 --seed 0 --model_arch moderate_cnn --max_model_params 5000000 --aggregator fedavgm --server_lr 1.8 --server_momentum 0.475 --lr 0.045 --momentum 0.925 --weight_decay 5e-4 --cosine_lr_eta_min_factor 0.00015 --fedproxloss_mu 3e-5 --zero_mean_gradients --class_balanced_loss_beta 0.90 --final_eval_clients site-1 --local_train_steps 896 --name fedavgm_lr18_m0475_steps896_clientlr0045_cm0925_wd5e4_eta000015_mu3e5_zmg_cb090_w1	discard	client.py	Exact local_train_steps 896 with class-balanced beta 0.90 FedZMG stack [src: Cui19 CBLoss CVPR; Wang21 RatioLoss AAAI]	/tmp/nvflare/simulation/fedavgm_lr18_m0475_steps896_clientlr0045_cm0925_wd5e4_eta000015_mu3e5_zmg_cb090_w1
ac5199f59	0.914700	585	--n_clients 8 --num_rounds 20 --aggregation_epochs 7 --batch_size 64 --eval_batch_size 1024 --alpha 0.5 --seed 0 --model_arch moderate_cnn --max_model_params 5000000 --aggregator fedavgm --server_lr 1.8 --server_momentum 0.475 --lr 0.045 --momentum 0.925 --weight_decay 5e-4 --cosine_lr_eta_min_factor 0.00015 --fedproxloss_mu 3e-5 --zero_mean_gradients --class_balanced_loss_beta 0.90 --final_eval_clients site-1 --local_train_steps 1000 --name fedavgm_lr18_m0475_steps1000_clientlr0045_cm0925_wd5e4_eta000015_mu3e5_zmg_cb090_w1	discard	client.py	Exact local_train_steps 1000 with class-balanced beta 0.90 FedZMG stack [src: Cui19 CBLoss CVPR; Wang21 RatioLoss AAAI]	/tmp/nvflare/simulation/fedavgm_lr18_m0475_steps1000_clientlr0045_cm0925_wd5e4_eta000015_mu3e5_zmg_cb090_w1
d0654df6a	0.914400	485	--n_clients 8 --num_rounds 20 --aggregation_epochs 7 --local_train_steps 0 --batch_size 64 --eval_batch_size 1024 --alpha 0.5 --seed 0 --model_arch moderate_cnn --max_model_params 5000000 --aggregator fedavgm --server_momentum 0.475 --lr 0.045 --momentum 0.925 --weight_decay 5e-4 --cosine_lr_eta_min_factor 0.00015 --fedproxloss_mu 3e-5 --zero_mean_gradients --class_balanced_loss_beta 0.90 --final_eval_clients site-1 --server_lr 1.6 --name fedavgm_lr16_m0475_epochs7_clientlr0045_cm0925_wd5e4_eta000015_mu3e5_zmg_cb090_w1	discard	custom_aggregators.py	Server lr 1.6 broad lower under class-balanced beta 0.90 FedZMG stack [src: Cui19 CBLoss CVPR; Wang21 RatioLoss AAAI]	/tmp/nvflare/simulation/fedavgm_lr16_m0475_epochs7_clientlr0045_cm0925_wd5e4_eta000015_mu3e5_zmg_cb090_w1
d0654df6a	0.914100	488	--n_clients 8 --num_rounds 20 --aggregation_epochs 7 --local_train_steps 0 --batch_size 64 --eval_batch_size 1024 --alpha 0.5 --seed 0 --model_arch moderate_cnn --max_model_params 5000000 --aggregator fedavgm --server_momentum 0.475 --lr 0.045 --momentum 0.925 --weight_decay 5e-4 --cosine_lr_eta_min_factor 0.00015 --fedproxloss_mu 3e-5 --zero_mean_gradients --class_balanced_loss_beta 0.90 --final_eval_clients site-1 --server_lr 2.0 --name fedavgm_lr20_m0475_epochs7_clientlr0045_cm0925_wd5e4_eta000015_mu3e5_zmg_cb090_w1	discard	custom_aggregators.py	Server lr 2.0 broad upper under class-balanced beta 0.90 FedZMG stack [src: Cui19 CBLoss CVPR; Wang21 RatioLoss AAAI]	/tmp/nvflare/simulation/fedavgm_lr20_m0475_epochs7_clientlr0045_cm0925_wd5e4_eta000015_mu3e5_zmg_cb090_w1
7aaa82a18	0.915100	487	--n_clients 8 --num_rounds 20 --aggregation_epochs 7 --local_train_steps 0 --batch_size 64 --eval_batch_size 1024 --alpha 0.5 --seed 0 --model_arch moderate_cnn --max_model_params 5000000 --aggregator fedavgm --server_lr 1.8 --lr 0.045 --momentum 0.925 --weight_decay 5e-4 --cosine_lr_eta_min_factor 0.00015 --fedproxloss_mu 3e-5 --zero_mean_gradients --class_balanced_loss_beta 0.90 --final_eval_clients site-1 --server_momentum 0.40 --name fedavgm_lr18_m040_epochs7_clientlr0045_cm0925_wd5e4_eta000015_mu3e5_zmg_cb090_w1	discard	custom_aggregators.py	Server momentum 0.40 broad lower under class-balanced beta 0.90 FedZMG stack [src: Cui19 CBLoss CVPR; Wang21 RatioLoss AAAI]	/tmp/nvflare/simulation/fedavgm_lr18_m040_epochs7_clientlr0045_cm0925_wd5e4_eta000015_mu3e5_zmg_cb090_w1
7aaa82a18	0.911900	490	--n_clients 8 --num_rounds 20 --aggregation_epochs 7 --local_train_steps 0 --batch_size 64 --eval_batch_size 1024 --alpha 0.5 --seed 0 --model_arch moderate_cnn --max_model_params 5000000 --aggregator fedavgm --server_lr 1.8 --lr 0.045 --momentum 0.925 --weight_decay 5e-4 --cosine_lr_eta_min_factor 0.00015 --fedproxloss_mu 3e-5 --zero_mean_gradients --class_balanced_loss_beta 0.90 --final_eval_clients site-1 --server_momentum 0.55 --name fedavgm_lr18_m055_epochs7_clientlr0045_cm0925_wd5e4_eta000015_mu3e5_zmg_cb090_w1	discard	custom_aggregators.py	Server momentum 0.55 broad upper under class-balanced beta 0.90 FedZMG stack [src: Cui19 CBLoss CVPR; Wang21 RatioLoss AAAI]	/tmp/nvflare/simulation/fedavgm_lr18_m055_epochs7_clientlr0045_cm0925_wd5e4_eta000015_mu3e5_zmg_cb090_w1
3d586c57c	0.909300	487	--n_clients 8 --num_rounds 20 --aggregation_epochs 7 --local_train_steps 0 --batch_size 64 --eval_batch_size 1024 --alpha 0.5 --seed 0 --model_arch moderate_cnn --max_model_params 5000000 --aggregator fedavgm --server_lr 1.8 --server_momentum 0.475 --lr 0.045 --weight_decay 5e-4 --cosine_lr_eta_min_factor 0.00015 --fedproxloss_mu 3e-5 --zero_mean_gradients --class_balanced_loss_beta 0.90 --final_eval_clients site-1 --momentum 0.875 --name fedavgm_lr18_m0475_epochs7_clientlr0045_cm0875_wd5e4_eta000015_mu3e5_zmg_cb090_w1	discard	client.py	Client momentum 0.875 broad lower under class-balanced beta 0.90 FedZMG stack [src: Cui19 CBLoss CVPR; Wang21 RatioLoss AAAI]	/tmp/nvflare/simulation/fedavgm_lr18_m0475_epochs7_clientlr0045_cm0875_wd5e4_eta000015_mu3e5_zmg_cb090_w1
3d586c57c	0.909100	490	--n_clients 8 --num_rounds 20 --aggregation_epochs 7 --local_train_steps 0 --batch_size 64 --eval_batch_size 1024 --alpha 0.5 --seed 0 --model_arch moderate_cnn --max_model_params 5000000 --aggregator fedavgm --server_lr 1.8 --server_momentum 0.475 --lr 0.045 --weight_decay 5e-4 --cosine_lr_eta_min_factor 0.00015 --fedproxloss_mu 3e-5 --zero_mean_gradients --class_balanced_loss_beta 0.90 --final_eval_clients site-1 --momentum 0.95 --name fedavgm_lr18_m0475_epochs7_clientlr0045_cm095_wd5e4_eta000015_mu3e5_zmg_cb090_w1	discard	client.py	Client momentum 0.95 broad upper under class-balanced beta 0.90 FedZMG stack [src: Cui19 CBLoss CVPR; Wang21 RatioLoss AAAI]	/tmp/nvflare/simulation/fedavgm_lr18_m0475_epochs7_clientlr0045_cm095_wd5e4_eta000015_mu3e5_zmg_cb090_w1
f290d41ba	0.867900	481	--n_clients 8 --num_rounds 20 --aggregation_epochs 7 --local_train_steps 0 --batch_size 64 --eval_batch_size 1024 --alpha 0.5 --seed 0 --model_arch moderate_cnn --max_model_params 5000000 --aggregator fedavgm --server_lr 1.8 --server_momentum 0.475 --lr 0.045 --momentum 0.925 --cosine_lr_eta_min_factor 0.00015 --fedproxloss_mu 3e-5 --zero_mean_gradients --class_balanced_loss_beta 0.90 --final_eval_clients site-1 --weight_decay 0.0 --name fedavgm_lr18_m0475_epochs7_clientlr0045_cm0925_wd0_eta000015_mu3e5_zmg_cb090_w1	discard	client.py	Weight decay 0.0 broad lower under class-balanced beta 0.90 FedZMG stack [src: Cui19 CBLoss CVPR; Wang21 RatioLoss AAAI]	/tmp/nvflare/simulation/fedavgm_lr18_m0475_epochs7_clientlr0045_cm0925_wd0_eta000015_mu3e5_zmg_cb090_w1
f290d41ba	0.905100	490	--n_clients 8 --num_rounds 20 --aggregation_epochs 7 --local_train_steps 0 --batch_size 64 --eval_batch_size 1024 --alpha 0.5 --seed 0 --model_arch moderate_cnn --max_model_params 5000000 --aggregator fedavgm --server_lr 1.8 --server_momentum 0.475 --lr 0.045 --momentum 0.925 --cosine_lr_eta_min_factor 0.00015 --fedproxloss_mu 3e-5 --zero_mean_gradients --class_balanced_loss_beta 0.90 --final_eval_clients site-1 --weight_decay 1e-3 --name fedavgm_lr18_m0475_epochs7_clientlr0045_cm0925_wd1e3_eta000015_mu3e5_zmg_cb090_w1	discard	client.py	Weight decay 1e-3 broad upper under class-balanced beta 0.90 FedZMG stack [src: Cui19 CBLoss CVPR; Wang21 RatioLoss AAAI]	/tmp/nvflare/simulation/fedavgm_lr18_m0475_epochs7_clientlr0045_cm0925_wd1e3_eta000015_mu3e5_zmg_cb090_w1
a6e2e5b53	0.912700	478	--n_clients 8 --num_rounds 20 --aggregation_epochs 7 --local_train_steps 0 --batch_size 64 --eval_batch_size 1024 --alpha 0.5 --seed 0 --model_arch moderate_cnn --max_model_params 5000000 --aggregator fedavgm --server_lr 1.8 --server_momentum 0.475 --momentum 0.925 --weight_decay 5e-4 --cosine_lr_eta_min_factor 0.00015 --fedproxloss_mu 3e-5 --zero_mean_gradients --class_balanced_loss_beta 0.90 --final_eval_clients site-1 --lr 0.04 --name fedavgm_lr18_m0475_epochs7_clientlr004_cm0925_wd5e4_eta000015_mu3e5_zmg_cb090_w1	discard	client.py	Client lr 0.04 broad lower under class-balanced beta 0.90 FedZMG stack [src: Cui19 CBLoss CVPR; Wang21 RatioLoss AAAI]	/tmp/nvflare/simulation/fedavgm_lr18_m0475_epochs7_clientlr004_cm0925_wd5e4_eta000015_mu3e5_zmg_cb090_w1
a6e2e5b53	0.914400	481	--n_clients 8 --num_rounds 20 --aggregation_epochs 7 --local_train_steps 0 --batch_size 64 --eval_batch_size 1024 --alpha 0.5 --seed 0 --model_arch moderate_cnn --max_model_params 5000000 --aggregator fedavgm --server_lr 1.8 --server_momentum 0.475 --momentum 0.925 --weight_decay 5e-4 --cosine_lr_eta_min_factor 0.00015 --fedproxloss_mu 3e-5 --zero_mean_gradients --class_balanced_loss_beta 0.90 --final_eval_clients site-1 --lr 0.05 --name fedavgm_lr18_m0475_epochs7_clientlr005_cm0925_wd5e4_eta000015_mu3e5_zmg_cb090_w1	discard	client.py	Client lr 0.05 broad upper under class-balanced beta 0.90 FedZMG stack [src: Cui19 CBLoss CVPR; Wang21 RatioLoss AAAI]	/tmp/nvflare/simulation/fedavgm_lr18_m0475_epochs7_clientlr005_cm0925_wd5e4_eta000015_mu3e5_zmg_cb090_w1
6a264ba79	0.911200	490	--n_clients 8 --num_rounds 20 --aggregation_epochs 7 --local_train_steps 0 --batch_size 64 --eval_batch_size 1024 --alpha 0.5 --seed 0 --model_arch moderate_cnn --max_model_params 5000000 --aggregator fedavgm --server_lr 1.8 --server_momentum 0.475 --lr 0.045 --momentum 0.925 --weight_decay 5e-4 --cosine_lr_eta_min_factor 0.00015 --zero_mean_gradients --class_balanced_loss_beta 0.90 --final_eval_clients site-1 --fedproxloss_mu 1e-5 --name fedavgm_lr18_m0475_epochs7_clientlr0045_cm0925_wd5e4_eta000015_mu1e5_zmg_cb090_w1	discard	client.py	FedProx mu 1e-5 broad lower under class-balanced beta 0.90 FedZMG stack [src: Li20 FedProx; Cui19 CBLoss CVPR; Wang21 RatioLoss AAAI]	/tmp/nvflare/simulation/fedavgm_lr18_m0475_epochs7_clientlr0045_cm0925_wd5e4_eta000015_mu1e5_zmg_cb090_w1
6a264ba79	0.913700	485	--n_clients 8 --num_rounds 20 --aggregation_epochs 7 --local_train_steps 0 --batch_size 64 --eval_batch_size 1024 --alpha 0.5 --seed 0 --model_arch moderate_cnn --max_model_params 5000000 --aggregator fedavgm --server_lr 1.8 --server_momentum 0.475 --lr 0.045 --momentum 0.925 --weight_decay 5e-4 --cosine_lr_eta_min_factor 0.00015 --zero_mean_gradients --class_balanced_loss_beta 0.90 --final_eval_clients site-1 --fedproxloss_mu 1e-4 --name fedavgm_lr18_m0475_epochs7_clientlr0045_cm0925_wd5e4_eta000015_mu1e4_zmg_cb090_w1	discard	client.py	FedProx mu 1e-4 broad upper under class-balanced beta 0.90 FedZMG stack [src: Li20 FedProx; Cui19 CBLoss CVPR; Wang21 RatioLoss AAAI]	/tmp/nvflare/simulation/fedavgm_lr18_m0475_epochs7_clientlr0045_cm0925_wd5e4_eta000015_mu1e4_zmg_cb090_w1
75b4e4c05	0.914000	487	--n_clients 8 --num_rounds 20 --aggregation_epochs 7 --local_train_steps 0 --batch_size 64 --eval_batch_size 1024 --alpha 0.5 --seed 0 --model_arch moderate_cnn --max_model_params 5000000 --aggregator fedavgm --server_lr 1.8 --server_momentum 0.475 --lr 0.045 --momentum 0.925 --weight_decay 5e-4 --fedproxloss_mu 3e-5 --zero_mean_gradients --class_balanced_loss_beta 0.90 --final_eval_clients site-1 --cosine_lr_eta_min_factor 0.00005 --name fedavgm_lr18_m0475_epochs7_clientlr0045_cm0925_wd5e4_eta000005_mu3e5_zmg_cb090_w1	discard	client.py	Cosine eta_min_factor 0.00005 lower floor under class-balanced beta 0.90 FedZMG stack [src: Cui19 CBLoss CVPR; Wang21 RatioLoss AAAI]	/tmp/nvflare/simulation/fedavgm_lr18_m0475_epochs7_clientlr0045_cm0925_wd5e4_eta000005_mu3e5_zmg_cb090_w1
75b4e4c05	0.913400	486	--n_clients 8 --num_rounds 20 --aggregation_epochs 7 --local_train_steps 0 --batch_size 64 --eval_batch_size 1024 --alpha 0.5 --seed 0 --model_arch moderate_cnn --max_model_params 5000000 --aggregator fedavgm --server_lr 1.8 --server_momentum 0.475 --lr 0.045 --momentum 0.925 --weight_decay 5e-4 --fedproxloss_mu 3e-5 --zero_mean_gradients --class_balanced_loss_beta 0.90 --final_eval_clients site-1 --cosine_lr_eta_min_factor 0.00025 --name fedavgm_lr18_m0475_epochs7_clientlr0045_cm0925_wd5e4_eta000025_mu3e5_zmg_cb090_w1	discard	client.py	Cosine eta_min_factor 0.00025 intermediate floor under class-balanced beta 0.90 FedZMG stack [src: Cui19 CBLoss CVPR; Wang21 RatioLoss AAAI]	/tmp/nvflare/simulation/fedavgm_lr18_m0475_epochs7_clientlr0045_cm0925_wd5e4_eta000025_mu3e5_zmg_cb090_w1
