commit	score	runtime_seconds	budget	status	target	description	artifacts
06e6bb766	0.918500	861	--n_clients 8 --num_rounds 20 --aggregation_epochs 7 --local_train_steps 0 --batch_size 64 --eval_batch_size 1024 --alpha 0.5 --seed 0 --model_arch moderate_cnn --max_model_params 5000000 --aggregator fedavgm --server_lr 1.8 --server_momentum 0.46875 --lr 0.045 --momentum 0.925 --weight_decay 5e-4 --cosine_lr_eta_min_factor 0.0001 --sam_rho 0.05 --fedproxloss_mu 3e-5 --zero_mean_gradients --class_balanced_loss_beta 0.90 --final_eval_clients site-1 --name fedavgm_lr18_m046875_epochs7_clientlr0045_cm0925_wd5e4_eta00001_mu3e5_zmg_cb090_sam005_combo_w1	discard	custom_aggregators.py	Lower server momentum with lower cosine tail near-miss pairing under kept FedSAM stack [src: Reddi21 FedOpt; Qu22 FedSAM ICML]	/tmp/nvflare/simulation/fedavgm_lr18_m046875_epochs7_clientlr0045_cm0925_wd5e4_eta00001_mu3e5_zmg_cb090_sam005_combo_w1
49630ee06	0.922400	864	--n_clients 8 --num_rounds 20 --aggregation_epochs 7 --local_train_steps 0 --batch_size 64 --eval_batch_size 1024 --alpha 0.5 --seed 0 --model_arch moderate_cnn --max_model_params 5000000 --aggregator fedavgm --server_lr 1.8 --server_momentum 0.46875 --lr 0.045 --momentum 0.925 --weight_decay 5e-4 --cosine_lr_eta_min_factor 0.00015 --sam_rho 0.05 --fedproxloss_mu 1e-5 --zero_mean_gradients --class_balanced_loss_beta 0.90 --final_eval_clients site-1 --name fedavgm_lr18_m046875_epochs7_clientlr0045_cm0925_wd5e4_eta000015_mu1e5_zmg_cb090_sam005_combo_w1	discard	custom_aggregators.py	Lower server momentum with lower FedProx mu near-miss pairing under kept FedSAM stack [src: Reddi21 FedOpt; Li20 FedProx]	/tmp/nvflare/simulation/fedavgm_lr18_m046875_epochs7_clientlr0045_cm0925_wd5e4_eta000015_mu1e5_zmg_cb090_sam005_combo_w1
db2b47fb1	0.920900	861	--n_clients 8 --num_rounds 20 --aggregation_epochs 7 --local_train_steps 0 --batch_size 64 --eval_batch_size 1024 --alpha 0.5 --seed 0 --model_arch moderate_cnn --max_model_params 5000000 --aggregator fedavgm --server_lr 1.8 --server_momentum 0.475 --lr 0.045 --momentum 0.925 --weight_decay 5e-4 --cosine_lr_eta_min_factor 0.00015 --sam_rho 0.075 --fedproxloss_mu 1e-5 --zero_mean_gradients --class_balanced_loss_beta 0.90 --final_eval_clients site-1 --name fedavgm_lr18_m0475_epochs7_clientlr0045_cm0925_wd5e4_eta000015_mu1e5_zmg_cb090_sam0075_combo_w1	discard	client.py	Higher SAM radius with lower FedProx mu near-miss pairing under kept FedAvgM stack [src: Qu22 FedSAM ICML; Li20 FedProx]	/tmp/nvflare/simulation/fedavgm_lr18_m0475_epochs7_clientlr0045_cm0925_wd5e4_eta000015_mu1e5_zmg_cb090_sam0075_combo_w1
39cb8c43f	0.920200	858	--n_clients 8 --num_rounds 20 --aggregation_epochs 7 --local_train_steps 0 --batch_size 64 --eval_batch_size 1024 --alpha 0.5 --seed 0 --model_arch moderate_cnn --max_model_params 5000000 --aggregator fedavgm --server_lr 1.8 --server_momentum 0.475 --lr 0.05 --momentum 0.925 --weight_decay 5e-4 --cosine_lr_eta_min_factor 0.00015 --sam_rho 0.05 --fedproxloss_mu 1e-5 --zero_mean_gradients --class_balanced_loss_beta 0.90 --final_eval_clients site-1 --name fedavgm_lr18_m0475_epochs7_clientlr005_cm0925_wd5e4_eta000015_mu1e5_zmg_cb090_sam005_combo_w1	discard	client.py	Stronger client learning rate with lower FedProx mu near-miss pairing under kept FedSAM stack [src: Li20 FedProx; Qu22 FedSAM ICML]	/tmp/nvflare/simulation/fedavgm_lr18_m0475_epochs7_clientlr005_cm0925_wd5e4_eta000015_mu1e5_zmg_cb090_sam005_combo_w1
f654ba3c9	0.919500	860	--n_clients 8 --num_rounds 20 --aggregation_epochs 7 --local_train_steps 0 --batch_size 64 --eval_batch_size 1024 --alpha 0.5 --seed 0 --model_arch moderate_cnn --max_model_params 5000000 --aggregator fedavgm --server_lr 1.8 --server_momentum 0.46875 --lr 0.045 --momentum 0.925 --weight_decay 5e-4 --cosine_lr_eta_min_factor 0.00015 --sam_rho 0.05 --fedproxloss_mu 3e-5 --zero_mean_gradients --class_balanced_loss_beta 0.875 --final_eval_clients site-1 --name fedavgm_lr18_m046875_epochs7_clientlr0045_cm0925_wd5e4_eta000015_mu3e5_zmg_cb0875_sam005_combo_w1	discard	custom_aggregators.py	Lower server momentum with class-balanced beta 0.875 near-miss pairing under kept FedSAM stack [src: Reddi21 FedOpt; Cui19 CBLoss]	/tmp/nvflare/simulation/fedavgm_lr18_m046875_epochs7_clientlr0045_cm0925_wd5e4_eta000015_mu3e5_zmg_cb0875_sam005_combo_w1
1aa15c759	0.922400	861	--n_clients 8 --num_rounds 20 --aggregation_epochs 7 --local_train_steps 0 --batch_size 64 --eval_batch_size 1024 --alpha 0.5 --seed 0 --model_arch moderate_cnn --max_model_params 5000000 --aggregator fedavgm --server_lr 1.8 --server_momentum 0.46875 --lr 0.045 --momentum 0.925 --weight_decay 5e-4 --cosine_lr_eta_min_factor 0.00015 --sam_rho 0.05 --fedproxloss_mu 2.5e-5 --zero_mean_gradients --class_balanced_loss_beta 0.90 --final_eval_clients site-1 --name fedavgm_lr18_m046875_epochs7_clientlr0045_cm0925_wd5e4_eta000015_mu25e6_zmg_cb090_sam005_combo_w1	discard	custom_aggregators.py	Lower server momentum with slightly lower FedProx mu near-miss pairing under kept FedSAM stack [src: Reddi21 FedOpt; Li20 FedProx]	/tmp/nvflare/simulation/fedavgm_lr18_m046875_epochs7_clientlr0045_cm0925_wd5e4_eta000015_mu25e6_zmg_cb090_sam005_combo_w1
ea734b807		609	literature_loop	literature	templates/literature_loop.md	literature review: FedSAM/FedAvgM plateau; selected FedNTD masked global distillation	templates/literature_loop.md
22abfb128	0.920300	966	--n_clients 8 --num_rounds 20 --aggregation_epochs 7 --local_train_steps 0 --batch_size 64 --eval_batch_size 1024 --alpha 0.5 --seed 0 --model_arch moderate_cnn --max_model_params 5000000 --aggregator fedavgm --server_lr 1.8 --server_momentum 0.475 --lr 0.045 --momentum 0.925 --weight_decay 5e-4 --cosine_lr_eta_min_factor 0.00015 --sam_rho 0.05 --fedproxloss_mu 3e-5 --zero_mean_gradients --class_balanced_loss_beta 0.90 --fedntd_beta 0.05 --fedntd_temperature 2.0 --final_eval_clients site-1 --name fedavgm_lr18_m0475_epochs7_clientlr0045_cm0925_wd5e4_eta000015_mu3e5_zmg_cb090_sam005_fedntd005_t2_w1	discard	client.py	FedNTD masked global distillation beta 0.05 T2 under kept FedSAM stack [src: Lee22 FedNTD; Song24 FedDistill; Yan23 FedCSD]	/tmp/nvflare/simulation/fedavgm_lr18_m0475_epochs7_clientlr0045_cm0925_wd5e4_eta000015_mu3e5_zmg_cb090_sam005_fedntd005_t2_w1
4289b940d	0.920000	966	--n_clients 8 --num_rounds 20 --aggregation_epochs 7 --local_train_steps 0 --batch_size 64 --eval_batch_size 1024 --alpha 0.5 --seed 0 --model_arch moderate_cnn --max_model_params 5000000 --aggregator fedavgm --server_lr 1.8 --server_momentum 0.475 --lr 0.045 --momentum 0.925 --weight_decay 5e-4 --cosine_lr_eta_min_factor 0.00015 --sam_rho 0.05 --fedproxloss_mu 3e-5 --zero_mean_gradients --class_balanced_loss_beta 0.90 --fedntd_beta 0.02 --fedntd_temperature 2.0 --final_eval_clients site-1 --name fedavgm_lr18_m0475_epochs7_clientlr0045_cm0925_wd5e4_eta000015_mu3e5_zmg_cb090_sam005_fedntd002_t2_w1	discard	client.py	FedNTD masked global distillation beta 0.02 T2 under kept FedSAM stack after beta 0.05 over-regularized [src: Lee22 FedNTD]	/tmp/nvflare/simulation/fedavgm_lr18_m0475_epochs7_clientlr0045_cm0925_wd5e4_eta000015_mu3e5_zmg_cb090_sam005_fedntd002_t2_w1
9ad92a11b	0.000000	1200	--n_clients 8 --num_rounds 20 --aggregation_epochs 7 --local_train_steps 0 --batch_size 64 --eval_batch_size 1024 --alpha 0.5 --seed 0 --model_arch moderate_cnn --max_model_params 5000000 --aggregator fedavgm --server_lr 1.8 --server_momentum 0.475 --lr 0.045 --momentum 0.925 --weight_decay 5e-4 --cosine_lr_eta_min_factor 0.00015 --sam_rho 0.05 --fedproxloss_mu 3e-5 --zero_mean_gradients --class_balanced_loss_beta 0.90 --feddyn_alpha 0.01 --final_eval_clients site-1 --name fedavgm_lr18_m0475_epochs7_clientlr0045_cm0925_wd5e4_eta000015_mu3e5_zmg_cb090_sam005_feddyn001_w1	crash	client.py	FedDyn-lite client dynamic regularizer alpha 0.01 under kept FedSAM stack after FedNTD misses [src: Acar21 FedDyn]	/tmp/nvflare/fedavgm_lr18_m0475_epochs7_clientlr0045_cm0925_wd5e4_eta000015_mu3e5_zmg_cb090_sam005_feddyn001_w1.log
620db86e6	0.857200	862	--n_clients 8 --num_rounds 20 --aggregation_epochs 7 --local_train_steps 0 --batch_size 64 --eval_batch_size 1024 --alpha 0.5 --seed 0 --model_arch moderate_cnn --max_model_params 5000000 --aggregator fedyogi --server_lr 0.2 --fedopt_beta1 0.9 --fedopt_beta2 0.99 --fedopt_tau 0.1 --lr 0.045 --momentum 0.925 --weight_decay 5e-4 --cosine_lr_eta_min_factor 0.00015 --sam_rho 0.05 --fedproxloss_mu 3e-5 --zero_mean_gradients --class_balanced_loss_beta 0.90 --final_eval_clients site-1 --name fedyogi_lr02_tau01_epochs7_clientlr0045_cm0925_wd5e4_eta000015_mu3e5_zmg_cb090_sam005_w1	discard	custom_aggregators.py	Conservative FedYogi server optimizer under kept FedSAM stack after client forgetting controls missed [src: Reddi21 FedOpt]	/tmp/nvflare/simulation/fedyogi_lr02_tau01_epochs7_clientlr0045_cm0925_wd5e4_eta000015_mu3e5_zmg_cb090_sam005_w1
00ba5ccbf	0.922200	864	--n_clients 8 --num_rounds 20 --aggregation_epochs 7 --local_train_steps 0 --batch_size 64 --eval_batch_size 1024 --alpha 0.5 --seed 0 --model_arch moderate_cnn --max_model_params 5000000 --aggregator fedavgm --server_lr 1.8 --server_momentum 0.475 --lr 0.045 --momentum 0.925 --weight_decay 5e-4 --cosine_lr_eta_min_factor 0.00015 --sam_rho 0.075 --fedproxloss_mu 3e-5 --zero_mean_gradients --class_balanced_loss_beta 0.86875 --final_eval_clients site-1 --name fedavgm_lr18_m0475_epochs7_clientlr0045_cm0925_wd5e4_eta000015_mu3e5_zmg_cb086875_sam0075_combo_w1	discard	client.py	Near-miss pair class-balanced beta 0.86875 with SAM rho 0.075 under kept FedAvgM stack [src: Cui19 CBLoss; Qu22 FedSAM]	/tmp/nvflare/simulation/fedavgm_lr18_m0475_epochs7_clientlr0045_cm0925_wd5e4_eta000015_mu3e5_zmg_cb086875_sam0075_combo_w1
ec54f60f3	0.921900	864	--n_clients 8 --num_rounds 20 --aggregation_epochs 7 --local_train_steps 0 --batch_size 64 --eval_batch_size 1024 --alpha 0.5 --seed 0 --model_arch moderate_cnn --max_model_params 5000000 --aggregator fedavgm --server_lr 1.8 --server_momentum 0.475 --lr 0.045 --momentum 0.925 --weight_decay 5e-4 --cosine_lr_eta_min_factor 0.00015 --sam_rho 0.0775 --fedproxloss_mu 3e-5 --zero_mean_gradients --class_balanced_loss_beta 0.90 --final_eval_clients site-1 --name fedavgm_lr18_m0475_epochs7_clientlr0045_cm0925_wd5e4_eta000015_mu3e5_zmg_cb090_sam00775_w1	discard	client.py	SAM radius 0.0775 tight upper-shoulder interpolation under kept FedSAM stack [src: Qu22 FedSAM]	/tmp/nvflare/simulation/fedavgm_lr18_m0475_epochs7_clientlr0045_cm0925_wd5e4_eta000015_mu3e5_zmg_cb090_sam00775_w1
03c12bb64	0.919400	864	--n_clients 8 --num_rounds 20 --aggregation_epochs 7 --local_train_steps 0 --batch_size 64 --eval_batch_size 1024 --alpha 0.5 --seed 0 --model_arch moderate_cnn --max_model_params 5000000 --aggregator fedavgm --server_lr 1.8 --server_momentum 0.475 --lr 0.045 --momentum 0.925 --weight_decay 5e-4 --cosine_lr_eta_min_factor 0.00015 --sam_rho 0.05 --fedproxloss_mu 3e-5 --zero_mean_gradients --class_balanced_loss_beta 0.868359375 --final_eval_clients site-1 --name fedavgm_lr18_m0475_epochs7_clientlr0045_cm0925_wd5e4_eta000015_mu3e5_zmg_cb0868359_sam005_w1	discard	client.py	Class-balanced beta 0.868359375 tight interpolation under kept FedSAM/FedAvgM stack [src: Cui19 CBLoss]	/tmp/nvflare/simulation/fedavgm_lr18_m0475_epochs7_clientlr0045_cm0925_wd5e4_eta000015_mu3e5_zmg_cb0868359_sam005_w1
3f520e786	0.919400	868	--n_clients 8 --num_rounds 20 --aggregation_epochs 7 --local_train_steps 0 --batch_size 64 --eval_batch_size 1024 --alpha 0.5 --seed 0 --model_arch moderate_cnn --max_model_params 5000000 --aggregator fedavgm --server_lr 1.8 --server_momentum 0.475 --lr 0.045 --momentum 0.92421875 --weight_decay 5e-4 --cosine_lr_eta_min_factor 0.00015 --sam_rho 0.05 --fedproxloss_mu 3e-5 --zero_mean_gradients --class_balanced_loss_beta 0.90 --final_eval_clients site-1 --name fedavgm_lr18_m0475_epochs7_clientlr0045_cm092421875_wd5e4_eta000015_mu3e5_zmg_cb090_sam005_w1	discard	client.py	Client momentum 0.92421875 tight interpolation under kept FedSAM/FedAvgM stack	/tmp/nvflare/simulation/fedavgm_lr18_m0475_epochs7_clientlr0045_cm092421875_wd5e4_eta000015_mu3e5_zmg_cb090_sam005_w1
eebd347a4	0.922400	858	--n_clients 8 --num_rounds 20 --aggregation_epochs 7 --local_train_steps 0 --batch_size 64 --eval_batch_size 1024 --alpha 0.5 --seed 0 --model_arch moderate_cnn --max_model_params 5000000 --aggregator fedavgm --server_lr 1.8 --server_momentum 0.4765625 --lr 0.045 --momentum 0.925 --weight_decay 5e-4 --cosine_lr_eta_min_factor 0.00015 --sam_rho 0.05 --fedproxloss_mu 3e-5 --zero_mean_gradients --class_balanced_loss_beta 0.90 --final_eval_clients site-1 --name fedavgm_lr18_m04765625_epochs7_clientlr0045_cm0925_wd5e4_eta000015_mu3e5_zmg_cb090_sam005_w1	discard	custom_aggregators.py	Server momentum 0.4765625 tight upper interpolation under kept FedSAM/FedAvgM stack [src: Reddi21 FedOpt]	/tmp/nvflare/simulation/fedavgm_lr18_m04765625_epochs7_clientlr0045_cm0925_wd5e4_eta000015_mu3e5_zmg_cb090_sam005_w1
9dc4b3ffe	0.922100	865	--n_clients 8 --num_rounds 20 --aggregation_epochs 7 --local_train_steps 0 --batch_size 64 --eval_batch_size 1024 --alpha 0.5 --seed 0 --model_arch moderate_cnn --max_model_params 5000000 --aggregator fedavgm --server_lr 1.796875 --server_momentum 0.475 --lr 0.045 --momentum 0.925 --weight_decay 5e-4 --cosine_lr_eta_min_factor 0.00015 --sam_rho 0.05 --fedproxloss_mu 3e-5 --zero_mean_gradients --class_balanced_loss_beta 0.90 --final_eval_clients site-1 --name fedavgm_lr1796875_m0475_epochs7_clientlr0045_cm0925_wd5e4_eta000015_mu3e5_zmg_cb090_sam005_w1	discard	custom_aggregators.py	Server learning rate 1.796875 tight lower interpolation under kept FedSAM/FedAvgM stack [src: Reddi21 FedOpt]	/tmp/nvflare/simulation/fedavgm_lr1796875_m0475_epochs7_clientlr0045_cm0925_wd5e4_eta000015_mu3e5_zmg_cb090_sam005_w1
b1f4a352d	0.923000	861	--n_clients 8 --num_rounds 20 --aggregation_epochs 7 --local_train_steps 0 --batch_size 64 --eval_batch_size 1024 --alpha 0.5 --seed 0 --model_arch moderate_cnn --max_model_params 5000000 --aggregator fedavgm --server_lr 1.8 --server_momentum 0.475 --lr 0.045 --momentum 0.925 --weight_decay 5e-4 --cosine_lr_eta_min_factor 0.00015 --sam_rho 0.05 --fedproxloss_mu 3e-5 --zero_mean_gradients --class_balanced_loss_beta 0.89375 --final_eval_clients site-1 --name fedavgm_lr18_m0475_epochs7_clientlr0045_cm0925_wd5e4_eta000015_mu3e5_zmg_cb089375_sam005_w1	discard	client.py	Class-balanced beta 0.89375 tight upper interpolation under kept FedSAM/FedAvgM stack [src: Cui19 CBLoss]	/tmp/nvflare/simulation/fedavgm_lr18_m0475_epochs7_clientlr0045_cm0925_wd5e4_eta000015_mu3e5_zmg_cb089375_sam005_w1
e24a1586e	0.921600	861	--n_clients 8 --num_rounds 20 --aggregation_epochs 7 --local_train_steps 0 --batch_size 64 --eval_batch_size 1024 --alpha 0.5 --seed 0 --model_arch moderate_cnn --max_model_params 5000000 --aggregator fedavgm --server_lr 1.8 --server_momentum 0.4734375 --lr 0.045 --momentum 0.925 --weight_decay 5e-4 --cosine_lr_eta_min_factor 0.00015 --sam_rho 0.05 --fedproxloss_mu 3e-5 --zero_mean_gradients --class_balanced_loss_beta 0.90 --final_eval_clients site-1 --name fedavgm_lr18_m04734375_epochs7_clientlr0045_cm0925_wd5e4_eta000015_mu3e5_zmg_cb090_sam005_w1	discard	custom_aggregators.py	Server momentum 0.4734375 tight lower interpolation under kept FedSAM/FedAvgM stack [src: Reddi21 FedOpt]	/tmp/nvflare/simulation/fedavgm_lr18_m04734375_epochs7_clientlr0045_cm0925_wd5e4_eta000015_mu3e5_zmg_cb090_sam005_w1
c3ccd2cdb	0.920800	860	--n_clients 8 --num_rounds 20 --aggregation_epochs 7 --local_train_steps 0 --batch_size 64 --eval_batch_size 1024 --alpha 0.5 --seed 0 --model_arch moderate_cnn --max_model_params 5000000 --aggregator fedavgm --server_lr 1.8015625 --server_momentum 0.475 --lr 0.045 --momentum 0.925 --weight_decay 5e-4 --cosine_lr_eta_min_factor 0.00015 --sam_rho 0.05 --fedproxloss_mu 3e-5 --zero_mean_gradients --class_balanced_loss_beta 0.90 --final_eval_clients site-1 --name fedavgm_lr18015625_m0475_epochs7_clientlr0045_cm0925_wd5e4_eta000015_mu3e5_zmg_cb090_sam005_w1	discard	custom_aggregators.py	Server learning rate 1.8015625 tight upper interpolation under kept FedSAM/FedAvgM stack [src: Reddi21 FedOpt]	/tmp/nvflare/simulation/fedavgm_lr18015625_m0475_epochs7_clientlr0045_cm0925_wd5e4_eta000015_mu3e5_zmg_cb090_sam005_w1
d33b9efe5	0.925200	867	--n_clients 8 --num_rounds 20 --aggregation_epochs 7 --local_train_steps 0 --batch_size 64 --eval_batch_size 1024 --alpha 0.5 --seed 0 --model_arch moderate_cnn --max_model_params 5000000 --aggregator fedavgm --server_lr 1.8 --server_momentum 0.475 --lr 0.045 --momentum 0.925 --weight_decay 5e-4 --cosine_lr_eta_min_factor 0.00015 --sam_rho 0.0725 --fedproxloss_mu 3e-5 --zero_mean_gradients --class_balanced_loss_beta 0.90 --final_eval_clients site-1 --name fedavgm_lr18_m0475_epochs7_clientlr0045_cm0925_wd5e4_eta000015_mu3e5_zmg_cb090_sam00725_w1	keep	client.py	SAM radius 0.0725 tight upper-shoulder interpolation under kept FedSAM/FedAvgM stack [src: Qu22 FedSAM]	/tmp/nvflare/simulation/fedavgm_lr18_m0475_epochs7_clientlr0045_cm0925_wd5e4_eta000015_mu3e5_zmg_cb090_sam00725_w1
0033c19ec	0.921400	861	--n_clients 8 --num_rounds 20 --aggregation_epochs 7 --local_train_steps 0 --batch_size 64 --eval_batch_size 1024 --alpha 0.5 --seed 0 --model_arch moderate_cnn --max_model_params 5000000 --aggregator fedavgm --server_lr 1.8 --server_momentum 0.475 --lr 0.045 --momentum 0.925 --weight_decay 5e-4 --cosine_lr_eta_min_factor 0.00015 --sam_rho 0.07375 --fedproxloss_mu 3e-5 --zero_mean_gradients --class_balanced_loss_beta 0.90 --final_eval_clients site-1 --name fedavgm_lr18_m0475_epochs7_clientlr0045_cm0925_wd5e4_eta000015_mu3e5_zmg_cb090_sam007375_w1	discard	client.py	SAM radius 0.07375 upper neighbor around new kept 0.0725 FedSAM/FedAvgM stack [src: Qu22 FedSAM]	/tmp/nvflare/simulation/fedavgm_lr18_m0475_epochs7_clientlr0045_cm0925_wd5e4_eta000015_mu3e5_zmg_cb090_sam007375_w1
f7a6a1dca	0.920300	864	--n_clients 8 --num_rounds 20 --aggregation_epochs 7 --local_train_steps 0 --batch_size 64 --eval_batch_size 1024 --alpha 0.5 --seed 0 --model_arch moderate_cnn --max_model_params 5000000 --aggregator fedavgm --server_lr 1.8 --server_momentum 0.475 --lr 0.045 --momentum 0.925 --weight_decay 5e-4 --cosine_lr_eta_min_factor 0.00015 --sam_rho 0.07125 --fedproxloss_mu 3e-5 --zero_mean_gradients --class_balanced_loss_beta 0.90 --final_eval_clients site-1 --name fedavgm_lr18_m0475_epochs7_clientlr0045_cm0925_wd5e4_eta000015_mu3e5_zmg_cb090_sam007125_w1	discard	client.py	SAM radius 0.07125 lower neighbor around new kept 0.0725 FedSAM/FedAvgM stack [src: Qu22 FedSAM]	/tmp/nvflare/simulation/fedavgm_lr18_m0475_epochs7_clientlr0045_cm0925_wd5e4_eta000015_mu3e5_zmg_cb090_sam007125_w1
2910ca130	0.921700	864	--n_clients 8 --num_rounds 20 --aggregation_epochs 7 --local_train_steps 0 --batch_size 64 --eval_batch_size 1024 --alpha 0.5 --seed 0 --model_arch moderate_cnn --max_model_params 5000000 --aggregator fedavgm --server_lr 1.8 --server_momentum 0.475 --lr 0.045 --momentum 0.925 --weight_decay 5e-4 --cosine_lr_eta_min_factor 0.00015 --sam_rho 0.0725 --fedproxloss_mu 3e-5 --zero_mean_gradients --class_balanced_loss_beta 0.89375 --final_eval_clients site-1 --name fedavgm_lr18_m0475_epochs7_clientlr0045_cm0925_wd5e4_eta000015_mu3e5_zmg_cb089375_sam00725_w1	discard	client.py	Class-balanced beta 0.89375 lower neighbor under new kept SAM 0.0725 FedSAM/FedAvgM stack [src: Cui19 class-balanced loss]	/tmp/nvflare/simulation/fedavgm_lr18_m0475_epochs7_clientlr0045_cm0925_wd5e4_eta000015_mu3e5_zmg_cb089375_sam00725_w1
423d692d8	0.921500	865	--n_clients 8 --num_rounds 20 --aggregation_epochs 7 --local_train_steps 0 --batch_size 64 --eval_batch_size 1024 --alpha 0.5 --seed 0 --model_arch moderate_cnn --max_model_params 5000000 --aggregator fedavgm --server_lr 1.8 --server_momentum 0.475 --lr 0.045 --momentum 0.925 --weight_decay 5e-4 --cosine_lr_eta_min_factor 0.00015 --sam_rho 0.0725 --fedproxloss_mu 3e-5 --zero_mean_gradients --class_balanced_loss_beta 0.903125 --final_eval_clients site-1 --name fedavgm_lr18_m0475_epochs7_clientlr0045_cm0925_wd5e4_eta000015_mu3e5_zmg_cb0903125_sam00725_w1	discard	client.py	Class-balanced beta 0.903125 upper neighbor under new kept SAM 0.0725 FedSAM/FedAvgM stack [src: Cui19 class-balanced loss]	/tmp/nvflare/simulation/fedavgm_lr18_m0475_epochs7_clientlr0045_cm0925_wd5e4_eta000015_mu3e5_zmg_cb0903125_sam00725_w1
4a4506035	0.920200	864	--n_clients 8 --num_rounds 20 --aggregation_epochs 7 --local_train_steps 0 --batch_size 64 --eval_batch_size 1024 --alpha 0.5 --seed 0 --model_arch moderate_cnn --max_model_params 5000000 --aggregator fedavgm --server_lr 1.8 --server_momentum 0.475 --lr 0.045 --momentum 0.925 --weight_decay 5e-4 --cosine_lr_eta_min_factor 0.00015 --sam_rho 0.0725 --fedproxloss_mu 3.25e-5 --zero_mean_gradients --class_balanced_loss_beta 0.90 --final_eval_clients site-1 --name fedavgm_lr18_m0475_epochs7_clientlr0045_cm0925_wd5e4_eta000015_mu0000325_zmg_cb090_sam00725_w1	discard	client.py	FedProx mu 3.25e-5 upper neighbor under new kept SAM 0.0725 FedSAM/FedAvgM stack [src: Li20 FedProx]	/tmp/nvflare/simulation/fedavgm_lr18_m0475_epochs7_clientlr0045_cm0925_wd5e4_eta000015_mu0000325_zmg_cb090_sam00725_w1
