commit	score	runtime_seconds	budget	status	target	description	artifacts
d5c8d8810	0.920500	861	--n_clients 8 --num_rounds 20 --aggregation_epochs 7 --local_train_steps 0 --batch_size 64 --eval_batch_size 1024 --alpha 0.5 --seed 0 --model_arch moderate_cnn --max_model_params 5000000 --aggregator fedavgm --server_lr 1.8 --server_momentum 0.475 --lr 0.045 --momentum 0.925 --weight_decay 5e-4 --cosine_lr_eta_min_factor 0.00015 --sam_rho 0.0725 --fedproxloss_mu 2.75e-5 --zero_mean_gradients --class_balanced_loss_beta 0.90 --final_eval_clients site-1 --name fedavgm_lr18_m0475_epochs7_clientlr0045_cm0925_wd5e4_eta000015_mu0000275_zmg_cb090_sam00725_w1	discard	client.py	FedProx mu 2.75e-5 lower neighbor under new kept SAM 0.0725 FedSAM/FedAvgM stack [src: Li20 FedProx]	/tmp/nvflare/simulation/fedavgm_lr18_m0475_epochs7_clientlr0045_cm0925_wd5e4_eta000015_mu0000275_zmg_cb090_sam00725_w1
ae45ca9e8	0.918400	862	--n_clients 8 --num_rounds 20 --aggregation_epochs 7 --local_train_steps 0 --batch_size 64 --eval_batch_size 1024 --alpha 0.5 --seed 0 --model_arch moderate_cnn --max_model_params 5000000 --aggregator fedavgm --server_lr 1.8 --server_momentum 0.4765625 --lr 0.045 --momentum 0.925 --weight_decay 5e-4 --cosine_lr_eta_min_factor 0.00015 --sam_rho 0.0725 --fedproxloss_mu 3e-5 --zero_mean_gradients --class_balanced_loss_beta 0.90 --final_eval_clients site-1 --name fedavgm_lr18_m04765625_epochs7_clientlr0045_cm0925_wd5e4_eta000015_mu3e5_zmg_cb090_sam00725_w1	discard	custom_aggregators.py	Server momentum 0.4765625 upper neighbor under new kept SAM 0.0725 FedSAM/FedAvgM stack [src: Reddi21 FedOpt]	/tmp/nvflare/simulation/fedavgm_lr18_m04765625_epochs7_clientlr0045_cm0925_wd5e4_eta000015_mu3e5_zmg_cb090_sam00725_w1
0670b4378	0.919500	861	--n_clients 8 --num_rounds 20 --aggregation_epochs 7 --local_train_steps 0 --batch_size 64 --eval_batch_size 1024 --alpha 0.5 --seed 0 --model_arch moderate_cnn --max_model_params 5000000 --aggregator fedavgm --server_lr 1.8 --server_momentum 0.4734375 --lr 0.045 --momentum 0.925 --weight_decay 5e-4 --cosine_lr_eta_min_factor 0.00015 --sam_rho 0.0725 --fedproxloss_mu 3e-5 --zero_mean_gradients --class_balanced_loss_beta 0.90 --final_eval_clients site-1 --name fedavgm_lr18_m04734375_epochs7_clientlr0045_cm0925_wd5e4_eta000015_mu3e5_zmg_cb090_sam00725_w1	discard	custom_aggregators.py	Server momentum 0.4734375 lower neighbor under new kept SAM 0.0725 FedSAM/FedAvgM stack [src: Reddi21 FedOpt]	/tmp/nvflare/simulation/fedavgm_lr18_m04734375_epochs7_clientlr0045_cm0925_wd5e4_eta000015_mu3e5_zmg_cb090_sam00725_w1
0b95354d5	0.922000	867	--n_clients 8 --num_rounds 20 --aggregation_epochs 7 --local_train_steps 0 --batch_size 64 --eval_batch_size 1024 --alpha 0.5 --seed 0 --model_arch moderate_cnn --max_model_params 5000000 --aggregator fedavgm --server_lr 1.796875 --server_momentum 0.475 --lr 0.045 --momentum 0.925 --weight_decay 5e-4 --cosine_lr_eta_min_factor 0.00015 --sam_rho 0.0725 --fedproxloss_mu 3e-5 --zero_mean_gradients --class_balanced_loss_beta 0.90 --final_eval_clients site-1 --name fedavgm_lr1796875_m0475_epochs7_clientlr0045_cm0925_wd5e4_eta000015_mu3e5_zmg_cb090_sam00725_w1	discard	custom_aggregators.py	Server learning rate 1.796875 lower neighbor under new kept SAM 0.0725 FedSAM/FedAvgM stack [src: Reddi21 FedOpt]	/tmp/nvflare/simulation/fedavgm_lr1796875_m0475_epochs7_clientlr0045_cm0925_wd5e4_eta000015_mu3e5_zmg_cb090_sam00725_w1
a9d42f047	0.920600	864	--n_clients 8 --num_rounds 20 --aggregation_epochs 7 --local_train_steps 0 --batch_size 64 --eval_batch_size 1024 --alpha 0.5 --seed 0 --model_arch moderate_cnn --max_model_params 5000000 --aggregator fedavgm --server_lr 1.8015625 --server_momentum 0.475 --lr 0.045 --momentum 0.925 --weight_decay 5e-4 --cosine_lr_eta_min_factor 0.00015 --sam_rho 0.0725 --fedproxloss_mu 3e-5 --zero_mean_gradients --class_balanced_loss_beta 0.90 --final_eval_clients site-1 --name fedavgm_lr18015625_m0475_epochs7_clientlr0045_cm0925_wd5e4_eta000015_mu3e5_zmg_cb090_sam00725_w1	discard	custom_aggregators.py	Server learning rate 1.8015625 upper neighbor under new kept SAM 0.0725 FedSAM/FedAvgM stack [src: Reddi21 FedOpt]	/tmp/nvflare/simulation/fedavgm_lr18015625_m0475_epochs7_clientlr0045_cm0925_wd5e4_eta000015_mu3e5_zmg_cb090_sam00725_w1
28ec50ae0	0.918700	855	--n_clients 8 --num_rounds 20 --aggregation_epochs 7 --local_train_steps 0 --batch_size 64 --eval_batch_size 1024 --alpha 0.5 --seed 0 --model_arch moderate_cnn --max_model_params 5000000 --aggregator fedavgm --server_lr 1.8 --server_momentum 0.475 --lr 0.044375 --momentum 0.925 --weight_decay 5e-4 --cosine_lr_eta_min_factor 0.00015 --sam_rho 0.0725 --fedproxloss_mu 3e-5 --zero_mean_gradients --class_balanced_loss_beta 0.90 --final_eval_clients site-1 --name fedavgm_lr18_m0475_epochs7_clientlr0044375_cm0925_wd5e4_eta000015_mu3e5_zmg_cb090_sam00725_w1	discard	client.py	Client lr 0.044375 lower neighbor under new kept SAM 0.0725 FedSAM/FedAvgM stack [src: Qu22 FedSAM]	/tmp/nvflare/simulation/fedavgm_lr18_m0475_epochs7_clientlr0044375_cm0925_wd5e4_eta000015_mu3e5_zmg_cb090_sam00725_w1
55aac5b2c	0.920300	864	--n_clients 8 --num_rounds 20 --aggregation_epochs 7 --local_train_steps 0 --batch_size 64 --eval_batch_size 1024 --alpha 0.5 --seed 0 --model_arch moderate_cnn --max_model_params 5000000 --aggregator fedavgm --server_lr 1.8 --server_momentum 0.475 --lr 0.045625 --momentum 0.925 --weight_decay 5e-4 --cosine_lr_eta_min_factor 0.00015 --sam_rho 0.0725 --fedproxloss_mu 3e-5 --zero_mean_gradients --class_balanced_loss_beta 0.90 --final_eval_clients site-1 --name fedavgm_lr18_m0475_epochs7_clientlr0045625_cm0925_wd5e4_eta000015_mu3e5_zmg_cb090_sam00725_w1	discard	client.py	Client lr 0.045625 upper neighbor under new kept SAM 0.0725 FedSAM/FedAvgM stack [src: Qu22 FedSAM]	/tmp/nvflare/simulation/fedavgm_lr18_m0475_epochs7_clientlr0045625_cm0925_wd5e4_eta000015_mu3e5_zmg_cb090_sam00725_w1
b6b5454e6	0.921200	867	--n_clients 8 --num_rounds 20 --aggregation_epochs 7 --local_train_steps 0 --batch_size 64 --eval_batch_size 1024 --alpha 0.5 --seed 0 --model_arch moderate_cnn --max_model_params 5000000 --aggregator fedavgm --server_lr 1.8 --server_momentum 0.475 --lr 0.045 --momentum 0.9234375 --weight_decay 5e-4 --cosine_lr_eta_min_factor 0.00015 --sam_rho 0.0725 --fedproxloss_mu 3e-5 --zero_mean_gradients --class_balanced_loss_beta 0.90 --final_eval_clients site-1 --name fedavgm_lr18_m0475_epochs7_clientlr0045_cm09234375_wd5e4_eta000015_mu3e5_zmg_cb090_sam00725_w1	discard	client.py	Client momentum 0.9234375 lower retune under new kept SAM 0.0725 FedSAM/FedAvgM stack	/tmp/nvflare/simulation/fedavgm_lr18_m0475_epochs7_clientlr0045_cm09234375_wd5e4_eta000015_mu3e5_zmg_cb090_sam00725_w1
eeb8e3322	0.920700	858	--n_clients 8 --num_rounds 20 --aggregation_epochs 7 --local_train_steps 0 --batch_size 64 --eval_batch_size 1024 --alpha 0.5 --seed 0 --model_arch moderate_cnn --max_model_params 5000000 --aggregator fedavgm --server_lr 1.8 --server_momentum 0.475 --lr 0.045 --momentum 0.9265625 --weight_decay 5e-4 --cosine_lr_eta_min_factor 0.00015 --sam_rho 0.0725 --fedproxloss_mu 3e-5 --zero_mean_gradients --class_balanced_loss_beta 0.90 --final_eval_clients site-1 --name fedavgm_lr18_m0475_epochs7_clientlr0045_cm09265625_wd5e4_eta000015_mu3e5_zmg_cb090_sam00725_w1	discard	client.py	Client momentum 0.9265625 upper retune under new kept SAM 0.0725 FedSAM/FedAvgM stack	/tmp/nvflare/simulation/fedavgm_lr18_m0475_epochs7_clientlr0045_cm09265625_wd5e4_eta000015_mu3e5_zmg_cb090_sam00725_w1
129504a3e	0.922500	860	--n_clients 8 --num_rounds 20 --aggregation_epochs 7 --local_train_steps 0 --batch_size 64 --eval_batch_size 1024 --alpha 0.5 --seed 0 --model_arch moderate_cnn --max_model_params 5000000 --aggregator fedavgm --server_lr 1.8 --server_momentum 0.475 --lr 0.045 --momentum 0.925 --weight_decay 5e-4 --cosine_lr_eta_min_factor 0.0001 --sam_rho 0.0725 --fedproxloss_mu 3e-5 --zero_mean_gradients --class_balanced_loss_beta 0.90 --final_eval_clients site-1 --name fedavgm_lr18_m0475_epochs7_clientlr0045_cm0925_wd5e4_eta00001_mu3e5_zmg_cb090_sam00725_w1	discard	client.py	Cosine eta_min_factor 0.0001 lower neighbor under new kept SAM 0.0725 FedSAM/FedAvgM stack	/tmp/nvflare/simulation/fedavgm_lr18_m0475_epochs7_clientlr0045_cm0925_wd5e4_eta00001_mu3e5_zmg_cb090_sam00725_w1
ea193a4ab	0.920000	858	--n_clients 8 --num_rounds 20 --aggregation_epochs 7 --local_train_steps 0 --batch_size 64 --eval_batch_size 1024 --alpha 0.5 --seed 0 --model_arch moderate_cnn --max_model_params 5000000 --aggregator fedavgm --server_lr 1.8 --server_momentum 0.475 --lr 0.045 --momentum 0.925 --weight_decay 5e-4 --cosine_lr_eta_min_factor 0.0002 --sam_rho 0.0725 --fedproxloss_mu 3e-5 --zero_mean_gradients --class_balanced_loss_beta 0.90 --final_eval_clients site-1 --name fedavgm_lr18_m0475_epochs7_clientlr0045_cm0925_wd5e4_eta00002_mu3e5_zmg_cb090_sam00725_w1	discard	client.py	Cosine eta_min_factor 0.0002 upper neighbor under new kept SAM 0.0725 FedSAM/FedAvgM stack	/tmp/nvflare/simulation/fedavgm_lr18_m0475_epochs7_clientlr0045_cm0925_wd5e4_eta00002_mu3e5_zmg_cb090_sam00725_w1
9f7e224ea	0.922300	864	--n_clients 8 --num_rounds 20 --aggregation_epochs 7 --local_train_steps 0 --batch_size 64 --eval_batch_size 1024 --alpha 0.5 --seed 0 --model_arch moderate_cnn --max_model_params 5000000 --aggregator fedavgm --server_lr 1.8 --server_momentum 0.475 --lr 0.045 --momentum 0.925 --weight_decay 4.75e-4 --cosine_lr_eta_min_factor 0.00015 --sam_rho 0.0725 --fedproxloss_mu 3e-5 --zero_mean_gradients --class_balanced_loss_beta 0.90 --final_eval_clients site-1 --name fedavgm_lr18_m0475_epochs7_clientlr0045_cm0925_wd475e6_eta000015_mu3e5_zmg_cb090_sam00725_w1	discard	client.py	Weight decay 4.75e-4 lower neighbor under new kept SAM 0.0725 FedSAM/FedAvgM stack	/tmp/nvflare/simulation/fedavgm_lr18_m0475_epochs7_clientlr0045_cm0925_wd475e6_eta000015_mu3e5_zmg_cb090_sam00725_w1
f37a14408	0.921000	865	--n_clients 8 --num_rounds 20 --aggregation_epochs 7 --local_train_steps 0 --batch_size 64 --eval_batch_size 1024 --alpha 0.5 --seed 0 --model_arch moderate_cnn --max_model_params 5000000 --aggregator fedavgm --server_lr 1.8 --server_momentum 0.475 --lr 0.045 --momentum 0.925 --weight_decay 5.25e-4 --cosine_lr_eta_min_factor 0.00015 --sam_rho 0.0725 --fedproxloss_mu 3e-5 --zero_mean_gradients --class_balanced_loss_beta 0.90 --final_eval_clients site-1 --name fedavgm_lr18_m0475_epochs7_clientlr0045_cm0925_wd525e6_eta000015_mu3e5_zmg_cb090_sam00725_w1	discard	client.py	Weight decay 5.25e-4 upper neighbor under new kept SAM 0.0725 FedSAM/FedAvgM stack	/tmp/nvflare/simulation/fedavgm_lr18_m0475_epochs7_clientlr0045_cm0925_wd525e6_eta000015_mu3e5_zmg_cb090_sam00725_w1
b6ed0a3e4	0.919700	746	--n_clients 8 --num_rounds 20 --aggregation_epochs 6 --local_train_steps 0 --batch_size 64 --eval_batch_size 1024 --alpha 0.5 --seed 0 --model_arch moderate_cnn --max_model_params 5000000 --aggregator fedavgm --server_lr 1.8 --server_momentum 0.475 --lr 0.045 --momentum 0.925 --weight_decay 5e-4 --cosine_lr_eta_min_factor 0.00015 --sam_rho 0.0725 --fedproxloss_mu 3e-5 --zero_mean_gradients --class_balanced_loss_beta 0.90 --final_eval_clients site-1 --name fedavgm_lr18_m0475_epochs6_clientlr0045_cm0925_wd5e4_eta000015_mu3e5_zmg_cb090_sam00725_w1	discard	client.py	Aggregation epochs 6 lower compute neighbor under new kept SAM 0.0725 FedSAM/FedAvgM stack	/tmp/nvflare/simulation/fedavgm_lr18_m0475_epochs6_clientlr0045_cm0925_wd5e4_eta000015_mu3e5_zmg_cb090_sam00725_w1
765d9f47d	0.922000	966	--n_clients 8 --num_rounds 20 --aggregation_epochs 8 --local_train_steps 0 --batch_size 64 --eval_batch_size 1024 --alpha 0.5 --seed 0 --model_arch moderate_cnn --max_model_params 5000000 --aggregator fedavgm --server_lr 1.8 --server_momentum 0.475 --lr 0.045 --momentum 0.925 --weight_decay 5e-4 --cosine_lr_eta_min_factor 0.00015 --sam_rho 0.0725 --fedproxloss_mu 3e-5 --zero_mean_gradients --class_balanced_loss_beta 0.90 --final_eval_clients site-1 --name fedavgm_lr18_m0475_epochs8_clientlr0045_cm0925_wd5e4_eta000015_mu3e5_zmg_cb090_sam00725_w1	discard	client.py	Aggregation epochs 8 upper compute neighbor under new kept SAM 0.0725 FedSAM/FedAvgM stack	/tmp/nvflare/simulation/fedavgm_lr18_m0475_epochs8_clientlr0045_cm0925_wd5e4_eta000015_mu3e5_zmg_cb090_sam00725_w1
3deacea14	0.920000	780	--n_clients 8 --num_rounds 20 --aggregation_epochs 7 --local_train_steps 704 --batch_size 64 --eval_batch_size 1024 --alpha 0.5 --seed 0 --model_arch moderate_cnn --max_model_params 5000000 --aggregator fedavgm --server_lr 1.8 --server_momentum 0.475 --lr 0.045 --momentum 0.925 --weight_decay 5e-4 --cosine_lr_eta_min_factor 0.00015 --sam_rho 0.0725 --fedproxloss_mu 3e-5 --zero_mean_gradients --class_balanced_loss_beta 0.90 --final_eval_clients site-1 --name fedavgm_lr18_m0475_steps704_clientlr0045_cm0925_wd5e4_eta000015_mu3e5_zmg_cb090_sam00725_w1	discard	client.py	Exact local_train_steps 704 local-compute representation under new kept SAM 0.0725 FedSAM/FedAvgM stack	/tmp/nvflare/simulation/fedavgm_lr18_m0475_steps704_clientlr0045_cm0925_wd5e4_eta000015_mu3e5_zmg_cb090_sam00725_w1
11b682594	0.921800	851	--n_clients 8 --num_rounds 20 --aggregation_epochs 7 --local_train_steps 768 --batch_size 64 --eval_batch_size 1024 --alpha 0.5 --seed 0 --model_arch moderate_cnn --max_model_params 5000000 --aggregator fedavgm --server_lr 1.8 --server_momentum 0.475 --lr 0.045 --momentum 0.925 --weight_decay 5e-4 --cosine_lr_eta_min_factor 0.00015 --sam_rho 0.0725 --fedproxloss_mu 3e-5 --zero_mean_gradients --class_balanced_loss_beta 0.90 --final_eval_clients site-1 --name fedavgm_lr18_m0475_steps768_clientlr0045_cm0925_wd5e4_eta000015_mu3e5_zmg_cb090_sam00725_w1	discard	client.py	Exact local_train_steps 768 upper local-compute check under new kept SAM 0.0725 FedSAM/FedAvgM stack	/tmp/nvflare/simulation/fedavgm_lr18_m0475_steps768_clientlr0045_cm0925_wd5e4_eta000015_mu3e5_zmg_cb090_sam00725_w1
9fe9a9b6e	0.919500	906	--n_clients 8 --num_rounds 20 --aggregation_epochs 7 --local_train_steps 832 --batch_size 64 --eval_batch_size 1024 --alpha 0.5 --seed 0 --model_arch moderate_cnn --max_model_params 5000000 --aggregator fedavgm --server_lr 1.8 --server_momentum 0.475 --lr 0.045 --momentum 0.925 --weight_decay 5e-4 --cosine_lr_eta_min_factor 0.00015 --sam_rho 0.0725 --fedproxloss_mu 3e-5 --zero_mean_gradients --class_balanced_loss_beta 0.90 --final_eval_clients site-1 --name fedavgm_lr18_m0475_steps832_clientlr0045_cm0925_wd5e4_eta000015_mu3e5_zmg_cb090_sam00725_w1	discard	client.py	Exact local_train_steps 832 upper continuation under new kept SAM 0.0725 FedSAM/FedAvgM stack	/tmp/nvflare/simulation/fedavgm_lr18_m0475_steps832_clientlr0045_cm0925_wd5e4_eta000015_mu3e5_zmg_cb090_sam00725_w1
4503d1984	0.921400	864	--n_clients 8 --num_rounds 20 --aggregation_epochs 7 --local_train_steps 0 --batch_size 64 --eval_batch_size 1024 --alpha 0.5 --seed 0 --model_arch moderate_cnn --max_model_params 5000000 --aggregator fedavgm --server_lr 1.8 --server_momentum 0.475 --lr 0.045 --momentum 0.925 --weight_decay 4.75e-4 --cosine_lr_eta_min_factor 0.0001 --sam_rho 0.0725 --fedproxloss_mu 3e-5 --zero_mean_gradients --class_balanced_loss_beta 0.90 --final_eval_clients site-1 --name fedavgm_lr18_m0475_epochs7_clientlr0045_cm0925_wd475e6_eta00001_mu3e5_zmg_cb090_sam00725_w1	discard	client.py	Combined lower cosine floor 0.0001 and lower weight decay 4.75e-4 under new kept SAM 0.0725 FedSAM/FedAvgM stack	/tmp/nvflare/simulation/fedavgm_lr18_m0475_epochs7_clientlr0045_cm0925_wd475e6_eta00001_mu3e5_zmg_cb090_sam00725_w1
0a00a2f65	0.919000	864	--n_clients 8 --num_rounds 20 --aggregation_epochs 7 --local_train_steps 0 --batch_size 64 --eval_batch_size 1024 --alpha 0.5 --seed 0 --model_arch moderate_cnn --max_model_params 5000000 --aggregator fedavgm --server_lr 1.796875 --server_momentum 0.475 --lr 0.045 --momentum 0.925 --weight_decay 5e-4 --cosine_lr_eta_min_factor 0.0001 --sam_rho 0.0725 --fedproxloss_mu 3e-5 --zero_mean_gradients --class_balanced_loss_beta 0.90 --final_eval_clients site-1 --name fedavgm_lr1796875_m0475_epochs7_clientlr0045_cm0925_wd5e4_eta00001_mu3e5_zmg_cb090_sam00725_w1	discard	client.py	Combined lower cosine floor 0.0001 and lower server lr 1.796875 under new kept SAM 0.0725 FedSAM/FedAvgM stack	/tmp/nvflare/simulation/fedavgm_lr1796875_m0475_epochs7_clientlr0045_cm0925_wd5e4_eta00001_mu3e5_zmg_cb090_sam00725_w1
ea888c442	0.922800	861	--n_clients 8 --num_rounds 20 --aggregation_epochs 7 --local_train_steps 0 --batch_size 64 --eval_batch_size 1024 --alpha 0.5 --seed 0 --model_arch moderate_cnn --max_model_params 5000000 --aggregator fedavgm --server_lr 1.796875 --server_momentum 0.475 --lr 0.045 --momentum 0.925 --weight_decay 4.75e-4 --cosine_lr_eta_min_factor 0.00015 --sam_rho 0.0725 --fedproxloss_mu 3e-5 --zero_mean_gradients --class_balanced_loss_beta 0.90 --final_eval_clients site-1 --name fedavgm_lr1796875_m0475_epochs7_clientlr0045_cm0925_wd475e6_eta000015_mu3e5_zmg_cb090_sam00725_w1	discard	client.py	Combined lower weight decay 4.75e-4 and lower server lr 1.796875 under new kept SAM 0.0725 FedSAM/FedAvgM stack	/tmp/nvflare/simulation/fedavgm_lr1796875_m0475_epochs7_clientlr0045_cm0925_wd475e6_eta000015_mu3e5_zmg_cb090_sam00725_w1
a631f2e2c	0.919700	978	--n_clients 8 --num_rounds 20 --aggregation_epochs 8 --local_train_steps 0 --batch_size 64 --eval_batch_size 1024 --alpha 0.5 --seed 0 --model_arch moderate_cnn --max_model_params 5000000 --aggregator fedavgm --server_lr 1.796875 --server_momentum 0.475 --lr 0.045 --momentum 0.925 --weight_decay 4.75e-4 --cosine_lr_eta_min_factor 0.00015 --sam_rho 0.0725 --fedproxloss_mu 3e-5 --zero_mean_gradients --class_balanced_loss_beta 0.90 --final_eval_clients site-1 --name fedavgm_lr1796875_m0475_epochs8_clientlr0045_cm0925_wd475e6_eta000015_mu3e5_zmg_cb090_sam00725_w1	discard	client.py	Aggregation epochs 8 follow-up on lower server lr 1.796875 and lower weight decay 4.75e-4 near-miss FedSAM/FedAvgM stack	/tmp/nvflare/simulation/fedavgm_lr1796875_m0475_epochs8_clientlr0045_cm0925_wd475e6_eta000015_mu3e5_zmg_cb090_sam00725_w1
a6de7dada	0.921600	866	--n_clients 8 --num_rounds 20 --aggregation_epochs 7 --local_train_steps 0 --batch_size 64 --eval_batch_size 1024 --alpha 0.5 --seed 0 --model_arch moderate_cnn --max_model_params 5000000 --aggregator fedavgm --server_lr 1.796875 --server_momentum 0.475 --lr 0.045 --momentum 0.925 --weight_decay 4.75e-4 --cosine_lr_eta_min_factor 0.00015 --sam_rho 0.0725 --fedproxloss_mu 3e-5 --zero_mean_gradients --class_balanced_loss_beta 0.89375 --final_eval_clients site-1 --name fedavgm_lr1796875_m0475_epochs7_clientlr0045_cm0925_wd475e6_eta000015_mu3e5_zmg_cb089375_sam00725_w1	discard	client.py	Lower class-balanced beta 0.89375 on lower server lr 1.796875 and lower weight decay 4.75e-4 near-miss FedSAM/FedAvgM stack	/tmp/nvflare/simulation/fedavgm_lr1796875_m0475_epochs7_clientlr0045_cm0925_wd475e6_eta000015_mu3e5_zmg_cb089375_sam00725_w1
5d1a6b8ed	0.920000	865	--n_clients 8 --num_rounds 20 --aggregation_epochs 7 --local_train_steps 0 --batch_size 64 --eval_batch_size 1024 --alpha 0.5 --seed 0 --model_arch moderate_cnn --max_model_params 5000000 --aggregator fedavgm --server_lr 1.796875 --server_momentum 0.475 --lr 0.045 --momentum 0.925 --weight_decay 4.75e-4 --cosine_lr_eta_min_factor 0.0002 --sam_rho 0.0725 --fedproxloss_mu 3e-5 --zero_mean_gradients --class_balanced_loss_beta 0.90 --final_eval_clients site-1 --name fedavgm_lr1796875_m0475_epochs7_clientlr0045_cm0925_wd475e6_eta00002_mu3e5_zmg_cb090_sam00725_w1	discard	client.py	Upper cosine floor 0.0002 on lower server lr 1.796875 and lower weight decay 4.75e-4 near-miss FedSAM/FedAvgM stack	/tmp/nvflare/simulation/fedavgm_lr1796875_m0475_epochs7_clientlr0045_cm0925_wd475e6_eta00002_mu3e5_zmg_cb090_sam00725_w1
f0d875dec	0.918600	864	--n_clients 8 --num_rounds 20 --aggregation_epochs 7 --local_train_steps 0 --batch_size 64 --eval_batch_size 1024 --alpha 0.5 --seed 0 --model_arch moderate_cnn --max_model_params 5000000 --aggregator fedavgm --server_lr 1.796875 --server_momentum 0.475 --lr 0.045 --momentum 0.925 --weight_decay 4.75e-4 --cosine_lr_eta_min_factor 0.00015 --sam_rho 0.07375 --fedproxloss_mu 3e-5 --zero_mean_gradients --class_balanced_loss_beta 0.90 --final_eval_clients site-1 --name fedavgm_lr1796875_m0475_epochs7_clientlr0045_cm0925_wd475e6_eta000015_mu3e5_zmg_cb090_sam007375_w1	discard	client.py	Upper SAM rho 0.07375 on lower server lr 1.796875 and lower weight decay 4.75e-4 near-miss FedSAM/FedAvgM stack	/tmp/nvflare/simulation/fedavgm_lr1796875_m0475_epochs7_clientlr0045_cm0925_wd475e6_eta000015_mu3e5_zmg_cb090_sam007375_w1
2092772ce	0.920900	867	--n_clients 8 --num_rounds 20 --aggregation_epochs 7 --local_train_steps 0 --batch_size 64 --eval_batch_size 1024 --alpha 0.5 --seed 0 --model_arch moderate_cnn --max_model_params 5000000 --aggregator fedavgm --server_lr 1.796875 --server_momentum 0.475 --lr 0.045 --momentum 0.925 --weight_decay 4.75e-4 --cosine_lr_eta_min_factor 0.00015 --sam_rho 0.07125 --fedproxloss_mu 3e-5 --zero_mean_gradients --class_balanced_loss_beta 0.90 --final_eval_clients site-1 --name fedavgm_lr1796875_m0475_epochs7_clientlr0045_cm0925_wd475e6_eta000015_mu3e5_zmg_cb090_sam007125_w1	discard	client.py	Lower SAM rho 0.07125 on lower server lr 1.796875 and lower weight decay 4.75e-4 near-miss FedSAM/FedAvgM stack	/tmp/nvflare/simulation/fedavgm_lr1796875_m0475_epochs7_clientlr0045_cm0925_wd475e6_eta000015_mu3e5_zmg_cb090_sam007125_w1
