commit	score	runtime_seconds	budget	status	target	description	artifacts
c32491551	0.915400	510	--n_clients 8 --num_rounds 20 --aggregation_epochs 7 --local_train_steps 0 --batch_size 64 --eval_batch_size 1024 --alpha 0.5 --seed 0 --model_arch moderate_cnn --max_model_params 5000000 --aggregator fedavgm --server_lr 1.8 --server_momentum 0.475 --lr 0.045 --momentum 0.925 --weight_decay 5e-4 --cosine_lr_eta_min_factor 0.00015 --sam_rho 0.05 --sam_global_trajectory --fedproxloss_mu 3e-5 --zero_mean_gradients --class_balanced_loss_beta 0.90 --final_eval_clients site-1 --name fedavgm_lr18_m0475_epochs7_clientlr0045_cm0925_wd5e4_eta000015_mu3e5_zmg_cb090_sam005_lesam_w1	discard	client.py	FedLESAM trajectory perturbation replacing local SAM direction [src: Fan24 FedLESAM ICML]	/tmp/nvflare/simulation/fedavgm_lr18_m0475_epochs7_clientlr0045_cm0925_wd5e4_eta000015_mu3e5_zmg_cb090_sam005_lesam_w1
7a0ec5740	0.920000	846	--n_clients 8 --num_rounds 20 --aggregation_epochs 7 --local_train_steps 0 --batch_size 64 --eval_batch_size 1024 --alpha 0.5 --seed 0 --model_arch moderate_cnn --max_model_params 5000000 --aggregator fedavgm --server_lr 1.8 --server_momentum 0.475 --lr 0.045 --momentum 0.925 --weight_decay 5e-4 --cosine_lr_eta_min_factor 0.00015 --sam_rho 0.10 --sam_rho_schedule late_cosine --fedproxloss_mu 3e-5 --zero_mean_gradients --class_balanced_loss_beta 0.90 --final_eval_clients site-1 --name fedavgm_lr18_m0475_epochs7_clientlr0045_cm0925_wd5e4_eta000015_mu3e5_zmg_cb090_sam010_latecos_w1	discard	client.py	Late-cosine SAM rho schedule max 0.10 under kept FedAvgM stack [src: Li25 FedWMSAM]	/tmp/nvflare/simulation/fedavgm_lr18_m0475_epochs7_clientlr0045_cm0925_wd5e4_eta000015_mu3e5_zmg_cb090_sam010_latecos_w1
923d49444	0.915500	906	--n_clients 8 --num_rounds 20 --aggregation_epochs 7 --local_train_steps 0 --batch_size 64 --eval_batch_size 1024 --alpha 0.5 --seed 0 --model_arch moderate_cnn --max_model_params 5000000 --aggregator fedavgm --server_lr 1.8 --server_momentum 0.475 --lr 0.045 --momentum 0.925 --weight_decay 5e-4 --cosine_lr_eta_min_factor 0.00015 --sam_rho 0.10 --sam_adaptive_scale --sam_adaptive_eta 0.01 --fedproxloss_mu 3e-5 --zero_mean_gradients --class_balanced_loss_beta 0.90 --final_eval_clients site-1 --name fedavgm_lr18_m0475_epochs7_clientlr0045_cm0925_wd5e4_eta000015_mu3e5_zmg_cb090_sam010_asam001_w1	discard	client.py	ASAM adaptive perturbation scaling rho 0.10 under kept FedAvgM stack [src: Kwon21 ASAM ICML]	/tmp/nvflare/simulation/fedavgm_lr18_m0475_epochs7_clientlr0045_cm0925_wd5e4_eta000015_mu3e5_zmg_cb090_sam010_asam001_w1
e6d751574	0.901700	858	--n_clients 8 --num_rounds 20 --aggregation_epochs 7 --local_train_steps 0 --batch_size 64 --eval_batch_size 1024 --alpha 0.5 --seed 0 --model_arch moderate_cnn --max_model_params 5000000 --aggregator weighted --server_lr 1.0 --server_momentum 0.0 --lr 0.045 --momentum 0.925 --weight_decay 5e-4 --cosine_lr_eta_min_factor 0.00015 --sam_rho 0.05 --fedproxloss_mu 3e-5 --zero_mean_gradients --class_balanced_loss_beta 0.90 --final_eval_clients site-1 --name weighted_epochs7_clientlr0045_cm0925_wd5e4_eta000015_mu3e5_zmg_cb090_sam005_w1	discard	custom_aggregators.py	Weighted aggregation under kept FedSAM rho 0.05 client stack [src: Qu22 FedSAM ICML]	/tmp/nvflare/simulation/weighted_epochs7_clientlr0045_cm0925_wd5e4_eta000015_mu3e5_zmg_cb090_sam005_w1
08c60ad34	0.917500	861	--n_clients 8 --num_rounds 20 --aggregation_epochs 7 --local_train_steps 0 --batch_size 64 --eval_batch_size 1024 --alpha 0.5 --seed 0 --model_arch moderate_cnn --max_model_params 5000000 --aggregator fedavgm --server_lr 1.8 --server_momentum 0.475 --lr 0.05 --momentum 0.925 --weight_decay 5e-4 --cosine_lr_eta_min_factor 0.00015 --sam_rho 0.05 --fedproxloss_mu 3e-5 --zero_mean_gradients --class_balanced_loss_beta 0.86875 --final_eval_clients site-1 --name fedavgm_lr18_m0475_epochs7_clientlr005_cm0925_wd5e4_eta000015_mu3e5_zmg_cb086875_sam005_combo_w1	discard	client.py	Near-miss combination client lr 0.05 with class-balanced beta 0.86875 under kept FedSAM stack [src: Cui19 CBLoss; Qu22 FedSAM ICML]	/tmp/nvflare/simulation/fedavgm_lr18_m0475_epochs7_clientlr005_cm0925_wd5e4_eta000015_mu3e5_zmg_cb086875_sam005_combo_w1
23a8ea44f	0.920800	864	--n_clients 8 --num_rounds 20 --aggregation_epochs 7 --local_train_steps 0 --batch_size 64 --eval_batch_size 1024 --alpha 0.5 --seed 0 --model_arch moderate_cnn --max_model_params 5000000 --aggregator fedavgm --server_lr 1.8 --server_momentum 0.475 --lr 0.045 --momentum 0.925 --weight_decay 5e-4 --cosine_lr_eta_min_factor 0.00015 --sam_rho 0.05 --fedproxloss_mu 3e-5 --zero_mean_gradients --class_balanced_loss_beta 0.86953125 --final_eval_clients site-1 --name fedavgm_lr18_m0475_epochs7_clientlr0045_cm0925_wd5e4_eta000015_mu3e5_zmg_cb086953125_sam005_w1	discard	client.py	Class-balanced beta 0.86953125 tight interpolation under kept FedSAM/FedAvgM stack [src: Cui19 CBLoss; Qu22 FedSAM ICML]	/tmp/nvflare/simulation/fedavgm_lr18_m0475_epochs7_clientlr0045_cm0925_wd5e4_eta000015_mu3e5_zmg_cb086953125_sam005_w1
108fab14d	0.919800	864	--n_clients 8 --num_rounds 20 --aggregation_epochs 7 --local_train_steps 0 --batch_size 64 --eval_batch_size 1024 --alpha 0.5 --seed 0 --model_arch moderate_cnn --max_model_params 5000000 --aggregator fedavgm --server_lr 1.8 --server_momentum 0.475 --lr 0.049375 --momentum 0.925 --weight_decay 5e-4 --cosine_lr_eta_min_factor 0.00015 --sam_rho 0.05 --fedproxloss_mu 3e-5 --zero_mean_gradients --class_balanced_loss_beta 0.90 --final_eval_clients site-1 --name fedavgm_lr18_m0475_epochs7_clientlr0049375_cm0925_wd5e4_eta000015_mu3e5_zmg_cb090_sam005_w1	discard	client.py	Client lr 0.049375 tight upper interpolation under kept FedSAM/FedAvgM stack [src: Qu22 FedSAM ICML]	/tmp/nvflare/simulation/fedavgm_lr18_m0475_epochs7_clientlr0049375_cm0925_wd5e4_eta000015_mu3e5_zmg_cb090_sam005_w1
9ab166aff	0.922400	861	--n_clients 8 --num_rounds 20 --aggregation_epochs 7 --local_train_steps 0 --batch_size 64 --eval_batch_size 1024 --alpha 0.5 --seed 0 --model_arch moderate_cnn --max_model_params 5000000 --aggregator fedavgm --server_lr 1.8 --server_momentum 0.46875 --lr 0.045 --momentum 0.925 --weight_decay 5e-4 --cosine_lr_eta_min_factor 0.00015 --sam_rho 0.05 --fedproxloss_mu 3e-5 --zero_mean_gradients --class_balanced_loss_beta 0.90 --final_eval_clients site-1 --name fedavgm_lr18_m046875_epochs7_clientlr0045_cm0925_wd5e4_eta000015_mu3e5_zmg_cb090_sam005_w1	discard	custom_aggregators.py	Server momentum 0.46875 tight lower interpolation under kept FedSAM/FedAvgM stack [src: Reddi21 FedOpt]	/tmp/nvflare/simulation/fedavgm_lr18_m046875_epochs7_clientlr0045_cm0925_wd5e4_eta000015_mu3e5_zmg_cb090_sam005_w1
fbb6ac744	0.920000	861	--n_clients 8 --num_rounds 20 --aggregation_epochs 7 --local_train_steps 0 --batch_size 64 --eval_batch_size 1024 --alpha 0.5 --seed 0 --model_arch moderate_cnn --max_model_params 5000000 --aggregator fedavgm --server_lr 1.8 --server_momentum 0.471875 --lr 0.045 --momentum 0.925 --weight_decay 5e-4 --cosine_lr_eta_min_factor 0.00015 --sam_rho 0.05 --fedproxloss_mu 3e-5 --zero_mean_gradients --class_balanced_loss_beta 0.90 --final_eval_clients site-1 --name fedavgm_lr18_m0471875_epochs7_clientlr0045_cm0925_wd5e4_eta000015_mu3e5_zmg_cb090_sam005_w1	discard	custom_aggregators.py	Server momentum 0.471875 tight lower interpolation under kept FedSAM/FedAvgM stack [src: Reddi21 FedOpt]	/tmp/nvflare/simulation/fedavgm_lr18_m0471875_epochs7_clientlr0045_cm0925_wd5e4_eta000015_mu3e5_zmg_cb090_sam005_w1
e2d6a1d20	0.921700	861	--n_clients 8 --num_rounds 20 --aggregation_epochs 7 --local_train_steps 0 --batch_size 64 --eval_batch_size 1024 --alpha 0.5 --seed 0 --model_arch moderate_cnn --max_model_params 5000000 --aggregator fedavgm --server_lr 1.8 --server_momentum 0.478125 --lr 0.045 --momentum 0.925 --weight_decay 5e-4 --cosine_lr_eta_min_factor 0.00015 --sam_rho 0.05 --fedproxloss_mu 3e-5 --zero_mean_gradients --class_balanced_loss_beta 0.90 --final_eval_clients site-1 --name fedavgm_lr18_m0478125_epochs7_clientlr0045_cm0925_wd5e4_eta000015_mu3e5_zmg_cb090_sam005_w1	discard	custom_aggregators.py	Server momentum 0.478125 tight upper interpolation under kept FedSAM/FedAvgM stack [src: Reddi21 FedOpt]	/tmp/nvflare/simulation/fedavgm_lr18_m0478125_epochs7_clientlr0045_cm0925_wd5e4_eta000015_mu3e5_zmg_cb090_sam005_w1
b72124632	0.920700	867	--n_clients 8 --num_rounds 20 --aggregation_epochs 7 --local_train_steps 0 --batch_size 64 --eval_batch_size 1024 --alpha 0.5 --seed 0 --model_arch moderate_cnn --max_model_params 5000000 --aggregator fedavgm --server_lr 1.8 --server_momentum 0.46875 --lr 0.045 --momentum 0.925 --weight_decay 5e-4 --cosine_lr_eta_min_factor 0.00015 --sam_rho 0.05 --fedproxloss_mu 3e-5 --zero_mean_gradients --class_balanced_loss_beta 0.86875 --final_eval_clients site-1 --name fedavgm_lr18_m046875_epochs7_clientlr0045_cm0925_wd5e4_eta000015_mu3e5_zmg_cb086875_sam005_combo_w1	discard	custom_aggregators.py	Server momentum 0.46875 on lower-beta near-miss FedSAM stack [src: Reddi21 FedOpt; Cui19 CBLoss]	/tmp/nvflare/simulation/fedavgm_lr18_m046875_epochs7_clientlr0045_cm0925_wd5e4_eta000015_mu3e5_zmg_cb086875_sam005_combo_w1
5bcbd9c46	0.921000	867	--n_clients 8 --num_rounds 20 --aggregation_epochs 7 --local_train_steps 0 --batch_size 64 --eval_batch_size 1024 --alpha 0.5 --seed 0 --model_arch moderate_cnn --max_model_params 5000000 --aggregator fedavgm --server_lr 1.8 --server_momentum 0.475 --lr 0.045 --momentum 0.925 --weight_decay 5e-4 --cosine_lr_eta_min_factor 0.00015 --sam_rho 0.045 --fedproxloss_mu 3e-5 --zero_mean_gradients --class_balanced_loss_beta 0.90 --final_eval_clients site-1 --name fedavgm_lr18_m0475_epochs7_clientlr0045_cm0925_wd5e4_eta000015_mu3e5_zmg_cb090_sam0045_w1	discard	client.py	SAM radius 0.045 tight lower bracket under kept FedAvgM/class-balanced stack [src: Qu22 FedSAM ICML]	/tmp/nvflare/simulation/fedavgm_lr18_m0475_epochs7_clientlr0045_cm0925_wd5e4_eta000015_mu3e5_zmg_cb090_sam0045_w1
b3e93033e	0.916300	865	--n_clients 8 --num_rounds 20 --aggregation_epochs 7 --local_train_steps 0 --batch_size 64 --eval_batch_size 1024 --alpha 0.5 --seed 0 --model_arch moderate_cnn --max_model_params 5000000 --aggregator fedavgm --server_lr 1.8 --server_momentum 0.475 --lr 0.045 --momentum 0.925 --weight_decay 5e-4 --cosine_lr_eta_min_factor 0.00015 --sam_rho 0.05 --fedproxloss_mu 3e-5 --zero_mean_gradients --class_balanced_loss_beta 0.88125 --final_eval_clients site-1 --name fedavgm_lr18_m0475_epochs7_clientlr0045_cm0925_wd5e4_eta000015_mu3e5_zmg_cb088125_sam005_w1	discard	client.py	Class-balanced beta 0.88125 interpolation under kept FedSAM/FedAvgM stack [src: Cui19 CBLoss]	/tmp/nvflare/simulation/fedavgm_lr18_m0475_epochs7_clientlr0045_cm0925_wd5e4_eta000015_mu3e5_zmg_cb088125_sam005_w1
27cafe588	0.920000	864	--n_clients 8 --num_rounds 20 --aggregation_epochs 7 --local_train_steps 0 --batch_size 64 --eval_batch_size 1024 --alpha 0.5 --seed 0 --model_arch moderate_cnn --max_model_params 5000000 --aggregator fedavgm --server_lr 1.8 --server_momentum 0.475 --lr 0.045 --momentum 0.925 --weight_decay 4.875e-4 --cosine_lr_eta_min_factor 0.00015 --sam_rho 0.05 --fedproxloss_mu 3e-5 --zero_mean_gradients --class_balanced_loss_beta 0.90 --final_eval_clients site-1 --name fedavgm_lr18_m0475_epochs7_clientlr0045_cm0925_wd4875e7_eta000015_mu3e5_zmg_cb090_sam005_w1	discard	client.py	Weight decay 4.875e-4 tight lower interpolation under kept FedSAM/FedAvgM stack	/tmp/nvflare/simulation/fedavgm_lr18_m0475_epochs7_clientlr0045_cm0925_wd4875e7_eta000015_mu3e5_zmg_cb090_sam005_w1
bde75e63c	0.919400	859	--n_clients 8 --num_rounds 20 --aggregation_epochs 7 --local_train_steps 0 --batch_size 64 --eval_batch_size 1024 --alpha 0.5 --seed 0 --model_arch moderate_cnn --max_model_params 5000000 --aggregator fedavgm --server_lr 1.8 --server_momentum 0.475 --lr 0.045 --momentum 0.925 --weight_decay 5.0625e-4 --cosine_lr_eta_min_factor 0.00015 --sam_rho 0.05 --fedproxloss_mu 3e-5 --zero_mean_gradients --class_balanced_loss_beta 0.90 --final_eval_clients site-1 --name fedavgm_lr18_m0475_epochs7_clientlr0045_cm0925_wd50625e7_eta000015_mu3e5_zmg_cb090_sam005_w1	discard	client.py	Weight decay 5.0625e-4 tight upper interpolation under kept FedSAM/FedAvgM stack	/tmp/nvflare/simulation/fedavgm_lr18_m0475_epochs7_clientlr0045_cm0925_wd50625e7_eta000015_mu3e5_zmg_cb090_sam005_w1
be6cc9b91	0.922300	863	--n_clients 8 --num_rounds 20 --aggregation_epochs 7 --local_train_steps 0 --batch_size 64 --eval_batch_size 1024 --alpha 0.5 --seed 0 --model_arch moderate_cnn --max_model_params 5000000 --aggregator fedavgm --server_lr 1.8 --server_momentum 0.475 --lr 0.045 --momentum 0.9234375 --weight_decay 5e-4 --cosine_lr_eta_min_factor 0.00015 --sam_rho 0.05 --fedproxloss_mu 3e-5 --zero_mean_gradients --class_balanced_loss_beta 0.90 --final_eval_clients site-1 --name fedavgm_lr18_m0475_epochs7_clientlr0045_cm09234375_wd5e4_eta000015_mu3e5_zmg_cb090_sam005_w1	discard	client.py	Client momentum 0.9234375 tight lower interpolation under kept FedSAM/FedAvgM stack	/tmp/nvflare/simulation/fedavgm_lr18_m0475_epochs7_clientlr0045_cm09234375_wd5e4_eta000015_mu3e5_zmg_cb090_sam005_w1
948cc2eb3	0.918700	861	--n_clients 8 --num_rounds 20 --aggregation_epochs 7 --local_train_steps 0 --batch_size 64 --eval_batch_size 1024 --alpha 0.5 --seed 0 --model_arch moderate_cnn --max_model_params 5000000 --aggregator fedavgm --server_lr 1.8 --server_momentum 0.475 --lr 0.045 --momentum 0.9265625 --weight_decay 5e-4 --cosine_lr_eta_min_factor 0.00015 --sam_rho 0.05 --fedproxloss_mu 3e-5 --zero_mean_gradients --class_balanced_loss_beta 0.90 --final_eval_clients site-1 --name fedavgm_lr18_m0475_epochs7_clientlr0045_cm09265625_wd5e4_eta000015_mu3e5_zmg_cb090_sam005_w1	discard	client.py	Client momentum 0.9265625 tight upper interpolation under kept FedSAM/FedAvgM stack	/tmp/nvflare/simulation/fedavgm_lr18_m0475_epochs7_clientlr0045_cm09265625_wd5e4_eta000015_mu3e5_zmg_cb090_sam005_w1
b7b36692b	0.921100	864	--n_clients 8 --num_rounds 20 --aggregation_epochs 7 --local_train_steps 0 --batch_size 64 --eval_batch_size 1024 --alpha 0.5 --seed 0 --model_arch moderate_cnn --max_model_params 5000000 --aggregator fedavgm --server_lr 1.8 --server_momentum 0.475 --lr 0.045 --momentum 0.925 --weight_decay 5e-4 --cosine_lr_eta_min_factor 0.00015 --sam_rho 0.05 --fedproxloss_mu 2.75e-5 --zero_mean_gradients --class_balanced_loss_beta 0.90 --final_eval_clients site-1 --name fedavgm_lr18_m0475_epochs7_clientlr0045_cm0925_wd5e4_eta000015_mu2p75e5_zmg_cb090_sam005_w1	discard	client.py	FedProx mu 2.75e-5 tight lower interpolation under kept FedSAM/FedAvgM stack	/tmp/nvflare/simulation/fedavgm_lr18_m0475_epochs7_clientlr0045_cm0925_wd5e4_eta000015_mu2p75e5_zmg_cb090_sam005_w1
a666c5087	0.919200	858	--n_clients 8 --num_rounds 20 --aggregation_epochs 7 --local_train_steps 0 --batch_size 64 --eval_batch_size 1024 --alpha 0.5 --seed 0 --model_arch moderate_cnn --max_model_params 5000000 --aggregator fedavgm --server_lr 1.7875 --server_momentum 0.475 --lr 0.045 --momentum 0.925 --weight_decay 5e-4 --cosine_lr_eta_min_factor 0.00015 --sam_rho 0.05 --fedproxloss_mu 3e-5 --zero_mean_gradients --class_balanced_loss_beta 0.90 --final_eval_clients site-1 --name fedavgm_lr17875_m0475_epochs7_clientlr0045_cm0925_wd5e4_eta000015_mu3e5_zmg_cb090_sam005_w1	discard	client.py	Server learning rate 1.7875 tight lower interpolation under kept FedSAM/FedAvgM stack	/tmp/nvflare/simulation/fedavgm_lr17875_m0475_epochs7_clientlr0045_cm0925_wd5e4_eta000015_mu3e5_zmg_cb090_sam005_w1
16c0345de	0.917200	858	--n_clients 8 --num_rounds 20 --aggregation_epochs 7 --local_train_steps 0 --batch_size 64 --eval_batch_size 1024 --alpha 0.5 --seed 0 --model_arch moderate_cnn --max_model_params 5000000 --aggregator fedavgm --server_lr 1.80625 --server_momentum 0.475 --lr 0.045 --momentum 0.925 --weight_decay 5e-4 --cosine_lr_eta_min_factor 0.00015 --sam_rho 0.05 --fedproxloss_mu 3e-5 --zero_mean_gradients --class_balanced_loss_beta 0.90 --final_eval_clients site-1 --name fedavgm_lr180625_m0475_epochs7_clientlr0045_cm0925_wd5e4_eta000015_mu3e5_zmg_cb090_sam005_w1	discard	client.py	Server learning rate 1.80625 tight upper interpolation under kept FedSAM/FedAvgM stack	/tmp/nvflare/simulation/fedavgm_lr180625_m0475_epochs7_clientlr0045_cm0925_wd5e4_eta000015_mu3e5_zmg_cb090_sam005_w1
3ee3c31b5	0.917900	1003	--n_clients 8 --num_rounds 20 --aggregation_epochs 7 --local_train_steps 928 --batch_size 64 --eval_batch_size 1024 --alpha 0.5 --seed 0 --model_arch moderate_cnn --max_model_params 5000000 --aggregator fedavgm --server_lr 1.8 --server_momentum 0.475 --lr 0.045 --momentum 0.925 --weight_decay 5e-4 --cosine_lr_eta_min_factor 0.00015 --sam_rho 0.05 --fedproxloss_mu 3e-5 --zero_mean_gradients --class_balanced_loss_beta 0.90 --final_eval_clients site-1 --name fedavgm_lr18_m0475_steps928_clientlr0045_cm0925_wd5e4_eta000015_mu3e5_zmg_cb090_sam005_w1	discard	client.py	Exact local_train_steps 928 under kept FedSAM/FedAvgM stack	/tmp/nvflare/simulation/fedavgm_lr18_m0475_steps928_clientlr0045_cm0925_wd5e4_eta000015_mu3e5_zmg_cb090_sam005_w1
f7a095bff	0.914100	510	--n_clients 8 --num_rounds 20 --aggregation_epochs 7 --local_train_steps 0 --batch_size 128 --eval_batch_size 1024 --alpha 0.5 --seed 0 --model_arch moderate_cnn --max_model_params 5000000 --aggregator fedavgm --server_lr 1.8 --server_momentum 0.475 --lr 0.045 --momentum 0.925 --weight_decay 5e-4 --cosine_lr_eta_min_factor 0.00015 --sam_rho 0.05 --fedproxloss_mu 3e-5 --zero_mean_gradients --class_balanced_loss_beta 0.90 --final_eval_clients site-1 --name fedavgm_lr18_m0475_epochs7_bs128_clientlr0045_cm0925_wd5e4_eta000015_mu3e5_zmg_cb090_sam005_w1	discard	client.py	Batch size 128 under kept FedSAM/FedAvgM stack	/tmp/nvflare/simulation/fedavgm_lr18_m0475_epochs7_bs128_clientlr0045_cm0925_wd5e4_eta000015_mu3e5_zmg_cb090_sam005_w1
06b2788ba	0.916900	858	--n_clients 8 --num_rounds 20 --aggregation_epochs 7 --local_train_steps 0 --batch_size 64 --eval_batch_size 1024 --alpha 0.5 --seed 0 --model_arch moderate_cnn --max_model_params 5000000 --aggregator fedavgm --server_lr 1.8 --server_momentum 0.46875 --lr 0.045 --momentum 0.9234375 --weight_decay 5e-4 --cosine_lr_eta_min_factor 0.00015 --sam_rho 0.05 --fedproxloss_mu 3e-5 --zero_mean_gradients --class_balanced_loss_beta 0.90 --final_eval_clients site-1 --name fedavgm_lr18_m046875_epochs7_clientlr0045_cm09234375_wd5e4_eta000015_mu3e5_zmg_cb090_sam005_combo_w1	discard	custom_aggregators.py	Lower server/client momentum near-miss pairing under kept FedSAM stack	/tmp/nvflare/simulation/fedavgm_lr18_m046875_epochs7_clientlr0045_cm09234375_wd5e4_eta000015_mu3e5_zmg_cb090_sam005_combo_w1
ac145b02f	0.922500	867	--n_clients 8 --num_rounds 20 --aggregation_epochs 7 --local_train_steps 0 --batch_size 64 --eval_batch_size 1024 --alpha 0.5 --seed 0 --model_arch moderate_cnn --max_model_params 5000000 --aggregator fedavgm --server_lr 1.8 --server_momentum 0.46875 --lr 0.045 --momentum 0.925 --weight_decay 5e-4 --cosine_lr_eta_min_factor 0.00015 --sam_rho 0.075 --fedproxloss_mu 3e-5 --zero_mean_gradients --class_balanced_loss_beta 0.90 --final_eval_clients site-1 --name fedavgm_lr18_m046875_epochs7_clientlr0045_cm0925_wd5e4_eta000015_mu3e5_zmg_cb090_sam0075_combo_w1	discard	custom_aggregators.py	Lower server momentum with higher SAM radius near-miss pairing under kept FedSAM stack [src: Reddi21 FedOpt; Qu22 FedSAM ICML]	/tmp/nvflare/simulation/fedavgm_lr18_m046875_epochs7_clientlr0045_cm0925_wd5e4_eta000015_mu3e5_zmg_cb090_sam0075_combo_w1
da9093b9e	0.918900	864	--n_clients 8 --num_rounds 20 --aggregation_epochs 7 --local_train_steps 0 --batch_size 64 --eval_batch_size 1024 --alpha 0.5 --seed 0 --model_arch moderate_cnn --max_model_params 5000000 --aggregator fedavgm --server_lr 1.8 --server_momentum 0.475 --lr 0.045 --momentum 0.9234375 --weight_decay 5e-4 --cosine_lr_eta_min_factor 0.00015 --sam_rho 0.075 --fedproxloss_mu 3e-5 --zero_mean_gradients --class_balanced_loss_beta 0.90 --final_eval_clients site-1 --name fedavgm_lr18_m0475_epochs7_clientlr0045_cm09234375_wd5e4_eta000015_mu3e5_zmg_cb090_sam0075_combo_w1	discard	client.py	Lower client momentum with higher SAM radius near-miss pairing under kept FedSAM stack [src: Qu22 FedSAM ICML]	/tmp/nvflare/simulation/fedavgm_lr18_m0475_epochs7_clientlr0045_cm09234375_wd5e4_eta000015_mu3e5_zmg_cb090_sam0075_combo_w1
a89974815	0.919200	858	--n_clients 8 --num_rounds 20 --aggregation_epochs 7 --local_train_steps 0 --batch_size 64 --eval_batch_size 1024 --alpha 0.5 --seed 0 --model_arch moderate_cnn --max_model_params 5000000 --aggregator fedavgm --server_lr 1.8 --server_momentum 0.46875 --lr 0.05 --momentum 0.925 --weight_decay 5e-4 --cosine_lr_eta_min_factor 0.00015 --sam_rho 0.05 --fedproxloss_mu 3e-5 --zero_mean_gradients --class_balanced_loss_beta 0.90 --final_eval_clients site-1 --name fedavgm_lr18_m046875_epochs7_clientlr005_cm0925_wd5e4_eta000015_mu3e5_zmg_cb090_sam005_combo_w1	discard	custom_aggregators.py	Lower server momentum with stronger client learning rate near-miss pairing under kept FedSAM stack [src: Reddi21 FedOpt; Qu22 FedSAM ICML]	/tmp/nvflare/simulation/fedavgm_lr18_m046875_epochs7_clientlr005_cm0925_wd5e4_eta000015_mu3e5_zmg_cb090_sam005_combo_w1
