commit	score	runtime_seconds	budget	status	target	description	artifacts
17cf764ab	0.920300	861	--n_clients 8 --num_rounds 20 --aggregation_epochs 7 --local_train_steps 0 --batch_size 64 --eval_batch_size 1024 --alpha 0.5 --seed 0 --model_arch moderate_cnn --max_model_params 5000000 --aggregator fedavgm --server_lr 1.8 --server_momentum 0.475 --lr 0.045 --momentum 0.9 --weight_decay 5e-4 --cosine_lr_eta_min_factor 0.0001625 --sam_rho 0.0725 --fedproxloss_mu 3e-5 --zero_mean_gradients --class_balanced_loss_beta 0.90 --final_eval_clients site-1 --name fedavgm_lr18_m0475_epochs7_clientlr0045_cm09_wd5e4_eta00001625_mu3e5_zmg_cb090_sam00725_w1	discard	client.py	Post-literature broad lower client momentum 0.9 probe under active FedSAM/FedAvgM high-water stack	/tmp/nvflare/simulation/fedavgm_lr18_m0475_epochs7_clientlr0045_cm09_wd5e4_eta00001625_mu3e5_zmg_cb090_sam00725_w1
20ca1b4fb	0.916300	867	--n_clients 8 --num_rounds 20 --aggregation_epochs 7 --local_train_steps 0 --batch_size 64 --eval_batch_size 1024 --alpha 0.5 --seed 0 --model_arch moderate_cnn --max_model_params 5000000 --aggregator fedavgm --server_lr 1.8 --server_momentum 0.475 --lr 0.045 --momentum 0.95 --weight_decay 5e-4 --cosine_lr_eta_min_factor 0.0001625 --sam_rho 0.0725 --fedproxloss_mu 3e-5 --zero_mean_gradients --class_balanced_loss_beta 0.90 --final_eval_clients site-1 --name fedavgm_lr18_m0475_epochs7_clientlr0045_cm095_wd5e4_eta00001625_mu3e5_zmg_cb090_sam00725_w1	discard	client.py	Post-literature broad upper client momentum 0.95 probe under active FedSAM/FedAvgM high-water stack	/tmp/nvflare/simulation/fedavgm_lr18_m0475_epochs7_clientlr0045_cm095_wd5e4_eta00001625_mu3e5_zmg_cb090_sam00725_w1
259d3a707	0.878000	868	--n_clients 8 --num_rounds 20 --aggregation_epochs 7 --local_train_steps 0 --batch_size 64 --eval_batch_size 1024 --alpha 0.5 --seed 0 --model_arch moderate_cnn --max_model_params 5000000 --aggregator median --lr 0.045 --momentum 0.925 --weight_decay 5e-4 --cosine_lr_eta_min_factor 0.0001625 --sam_rho 0.0725 --fedproxloss_mu 3e-5 --zero_mean_gradients --class_balanced_loss_beta 0.90 --final_eval_clients site-1 --name median_epochs7_clientlr0045_cm0925_wd5e4_eta00001625_mu3e5_zmg_cb090_sam00725_w1	discard	custom_aggregators.py	Post-literature median robust aggregator ablation under active FedSAM class-balanced high-water client stack	/tmp/nvflare/simulation/median_epochs7_clientlr0045_cm0925_wd5e4_eta00001625_mu3e5_zmg_cb090_sam00725_w1
36ef90a98	0.902600	868	--n_clients 8 --num_rounds 20 --aggregation_epochs 7 --local_train_steps 0 --batch_size 64 --eval_batch_size 1024 --alpha 0.5 --seed 0 --model_arch moderate_cnn --max_model_params 5000000 --aggregator default --lr 0.045 --momentum 0.925 --weight_decay 5e-4 --cosine_lr_eta_min_factor 0.0001625 --sam_rho 0.0725 --fedproxloss_mu 3e-5 --zero_mean_gradients --class_balanced_loss_beta 0.90 --final_eval_clients site-1 --name default_epochs7_clientlr0045_cm0925_wd5e4_eta00001625_mu3e5_zmg_cb090_sam00725_w1	discard	job.py	Post-literature default FedAvg recipe aggregator ablation under active FedSAM class-balanced high-water client stack	/tmp/nvflare/simulation/default_epochs7_clientlr0045_cm0925_wd5e4_eta00001625_mu3e5_zmg_cb090_sam00725_w1
3d7f8464f	0.910200	888	--n_clients 8 --num_rounds 20 --aggregation_epochs 7 --local_train_steps 0 --batch_size 64 --eval_batch_size 1024 --alpha 0.5 --seed 0 --model_arch moderate_cnn --max_model_params 5000000 --aggregator scaffold --lr 0.045 --momentum 0.925 --weight_decay 5e-4 --cosine_lr_eta_min_factor 0.0001625 --sam_rho 0.0725 --fedproxloss_mu 3e-5 --zero_mean_gradients --class_balanced_loss_beta 0.90 --final_eval_clients site-1 --name scaffold_epochs7_clientlr0045_cm0925_wd5e4_eta00001625_mu3e5_zmg_cb090_sam00725_w1	discard	custom_aggregators.py	Post-literature SCAFFOLD control-variate aggregator under active FedSAM class-balanced high-water client stack	/tmp/nvflare/simulation/scaffold_epochs7_clientlr0045_cm0925_wd5e4_eta00001625_mu3e5_zmg_cb090_sam00725_w1
42fe53899	0.798000	861	--n_clients 8 --num_rounds 20 --aggregation_epochs 7 --local_train_steps 0 --batch_size 64 --eval_batch_size 1024 --alpha 0.5 --seed 0 --model_arch moderate_cnn --max_model_params 5000000 --aggregator fedadam --server_lr 0.05 --fedopt_beta1 0.9 --fedopt_beta2 0.99 --fedopt_tau 0.1 --lr 0.045 --momentum 0.925 --weight_decay 5e-4 --cosine_lr_eta_min_factor 0.0001625 --sam_rho 0.0725 --fedproxloss_mu 3e-5 --zero_mean_gradients --class_balanced_loss_beta 0.90 --final_eval_clients site-1 --name fedadam_lr005_tau01_epochs7_clientlr0045_cm0925_wd5e4_eta00001625_mu3e5_zmg_cb090_sam00725_w1	discard	custom_aggregators.py	Post-literature conservative FedAdam server optimizer 0.05 tau 0.1 under active FedSAM high-water client stack	/tmp/nvflare/simulation/fedadam_lr005_tau01_epochs7_clientlr0045_cm0925_wd5e4_eta00001625_mu3e5_zmg_cb090_sam00725_w1
97aae7aba	0.329000	861	--n_clients 8 --num_rounds 20 --aggregation_epochs 7 --local_train_steps 0 --batch_size 64 --eval_batch_size 1024 --alpha 0.5 --seed 0 --model_arch moderate_cnn --max_model_params 5000000 --aggregator fedadam --server_lr 0.01 --fedopt_beta1 0.9 --fedopt_beta2 0.99 --fedopt_tau 0.1 --lr 0.045 --momentum 0.925 --weight_decay 5e-4 --cosine_lr_eta_min_factor 0.0001625 --sam_rho 0.0725 --fedproxloss_mu 3e-5 --zero_mean_gradients --class_balanced_loss_beta 0.90 --final_eval_clients site-1 --name fedadam_lr001_tau01_epochs7_clientlr0045_cm0925_wd5e4_eta00001625_mu3e5_zmg_cb090_sam00725_w1	discard	custom_aggregators.py	Post-literature lower FedAdam server optimizer 0.01 tau 0.1 under active FedSAM high-water client stack	/tmp/nvflare/simulation/fedadam_lr001_tau01_epochs7_clientlr0045_cm0925_wd5e4_eta00001625_mu3e5_zmg_cb090_sam00725_w1
51b9f9761		861	literature_loop	literature	templates/literature_loop.md	literature review: classifier variance/feature uniformity plateau; selected FedUV variance and uniformity regularizers	templates/literature_loop.md
e3ed725df	0.921700	916	--n_clients 8 --num_rounds 20 --aggregation_epochs 7 --local_train_steps 0 --batch_size 64 --eval_batch_size 1024 --alpha 0.5 --seed 0 --model_arch moderate_cnn --max_model_params 5000000 --aggregator fedavgm --server_lr 1.8 --server_momentum 0.475 --lr 0.045 --momentum 0.925 --weight_decay 5e-4 --cosine_lr_eta_min_factor 0.0001625 --sam_rho 0.0725 --fedproxloss_mu 3e-5 --zero_mean_gradients --class_balanced_loss_beta 0.90 --feduv_variance_coef 1.25 --final_eval_clients site-1 --name fedavgm_lr18_m0475_epochs7_clientlr0045_cm0925_wd5e4_eta00001625_mu3e5_zmg_cb090_sam00725_feduvvar125_w1	discard	client.py	FedUV classifier variance coef 1.25 on active FedSAM/FedAvgM stack [src: Son24 FedUV CVPR]	/tmp/nvflare/simulation/fedavgm_lr18_m0475_epochs7_clientlr0045_cm0925_wd5e4_eta00001625_mu3e5_zmg_cb090_sam00725_feduvvar125_w1
6205f2279	0.921100	1101	--n_clients 8 --num_rounds 20 --aggregation_epochs 7 --local_train_steps 0 --batch_size 64 --eval_batch_size 1024 --alpha 0.5 --seed 0 --model_arch moderate_cnn --max_model_params 5000000 --aggregator fedavgm --server_lr 1.8 --server_momentum 0.475 --lr 0.045 --momentum 0.925 --weight_decay 5e-4 --cosine_lr_eta_min_factor 0.0001625 --sam_rho 0.0725 --fedproxloss_mu 3e-5 --zero_mean_gradients --class_balanced_loss_beta 0.90 --feduv_uniformity_coef 0.1 --final_eval_clients site-1 --name fedavgm_lr18_m0475_epochs7_clientlr0045_cm0925_wd5e4_eta00001625_mu3e5_zmg_cb090_sam00725_feduvu01_w1	discard	client.py	FedUV uniformity coef 0.1 on active FedSAM/FedAvgM stack [src: Son24 FedUV CVPR]	/tmp/nvflare/simulation/fedavgm_lr18_m0475_epochs7_clientlr0045_cm0925_wd5e4_eta00001625_mu3e5_zmg_cb090_sam00725_feduvu01_w1
c62742cbb	0.921500	858	--n_clients 8 --num_rounds 20 --aggregation_epochs 7 --local_train_steps 0 --batch_size 64 --eval_batch_size 1024 --alpha 0.5 --seed 0 --model_arch moderate_cnn --max_model_params 5000000 --aggregator fedavgm --server_lr 1.8 --server_momentum 0.475 --lr 0.045 --momentum 0.925 --weight_decay 5e-4 --cosine_lr_eta_min_factor 0.0001625 --lr_warmup_units 7 --lr_warmup_start_factor 0.2 --sam_rho 0.0725 --fedproxloss_mu 3e-5 --zero_mean_gradients --class_balanced_loss_beta 0.90 --final_eval_clients site-1 --name fedavgm_lr18_m0475_epochs7_clientlr0045_cm0925_wd5e4_eta00001625_warm7f02_mu3e5_zmg_cb090_sam00725_w1	discard	client.py	One-round LR warmup units 7 start factor 0.2 on active FedSAM/FedAvgM stack	/tmp/nvflare/simulation/fedavgm_lr18_m0475_epochs7_clientlr0045_cm0925_wd5e4_eta00001625_warm7f02_mu3e5_zmg_cb090_sam00725_w1
58f79d24c	0.000000	469	--n_clients 8 --num_rounds 20 --aggregation_epochs 7 --local_train_steps 0 --batch_size 64 --eval_batch_size 1024 --alpha 0.5 --seed 0 --model_arch moderate_cnn --max_model_params 5000000 --aggregator fedavgm --server_lr 1.8 --server_momentum 0.475 --server_nesterov --lr 0.045 --momentum 0.925 --weight_decay 5e-4 --cosine_lr_eta_min_factor 0.0001625 --sam_rho 0.0725 --fedproxloss_mu 3e-5 --zero_mean_gradients --class_balanced_loss_beta 0.90 --final_eval_clients site-1 --name fedavgm_nesterov_lr18_m0475_epochs7_clientlr0045_cm0925_wd5e4_eta00001625_mu3e5_zmg_cb090_sam00725_w1	crash	custom_aggregators.py	Server Nesterov FedAvgM on active FedSAM/FedAvgM high-water stack	/tmp/nvflare/simulation/fedavgm_nesterov_lr18_m0475_epochs7_clientlr0045_cm0925_wd5e4_eta00001625_mu3e5_zmg_cb090_sam00725_w1
2a745f0f7	0.921800	864	--n_clients 8 --num_rounds 20 --aggregation_epochs 7 --local_train_steps 0 --batch_size 64 --eval_batch_size 1024 --alpha 0.5 --seed 0 --model_arch moderate_cnn --max_model_params 5000000 --aggregator fedavgm --server_lr 1.2 --server_momentum 0.475 --server_nesterov --lr 0.045 --momentum 0.925 --weight_decay 5e-4 --cosine_lr_eta_min_factor 0.0001625 --sam_rho 0.0725 --fedproxloss_mu 3e-5 --zero_mean_gradients --class_balanced_loss_beta 0.90 --final_eval_clients site-1 --name fedavgm_nesterov_lr12_m0475_epochs7_clientlr0045_cm0925_wd5e4_eta00001625_mu3e5_zmg_cb090_sam00725_w1	discard	custom_aggregators.py	Conservative server Nesterov FedAvgM server_lr 1.2 on active FedSAM/FedAvgM high-water stack	/tmp/nvflare/simulation/fedavgm_nesterov_lr12_m0475_epochs7_clientlr0045_cm0925_wd5e4_eta00001625_mu3e5_zmg_cb090_sam00725_w1
d83deaeed	0.921200	862	--n_clients 8 --num_rounds 20 --aggregation_epochs 7 --local_train_steps 0 --batch_size 64 --eval_batch_size 1024 --alpha 0.5 --seed 0 --model_arch moderate_cnn --max_model_params 5000000 --aggregator fedavgm --server_lr 1.8 --server_momentum 0.475 --lr 0.045 --momentum 0.925 --dampening 0.05 --weight_decay 5e-4 --cosine_lr_eta_min_factor 0.0001625 --sam_rho 0.0725 --fedproxloss_mu 3e-5 --zero_mean_gradients --class_balanced_loss_beta 0.90 --final_eval_clients site-1 --name fedavgm_lr18_m0475_epochs7_clientlr0045_cm0925_damp005_wd5e4_eta00001625_mu3e5_zmg_cb090_sam00725_w1	discard	client.py	Client SGD dampening 0.05 on active FedSAM/FedAvgM high-water stack	/tmp/nvflare/simulation/fedavgm_lr18_m0475_epochs7_clientlr0045_cm0925_damp005_wd5e4_eta00001625_mu3e5_zmg_cb090_sam00725_w1
2ccb3b370	0.923600	861	--n_clients 8 --num_rounds 20 --aggregation_epochs 7 --local_train_steps 0 --batch_size 64 --eval_batch_size 1024 --alpha 0.5 --seed 0 --model_arch moderate_cnn --max_model_params 5000000 --aggregator fedavgm --server_lr 1.8 --server_momentum 0.475 --client_weight_power 0.5 --lr 0.045 --momentum 0.925 --weight_decay 5e-4 --cosine_lr_eta_min_factor 0.0001625 --sam_rho 0.0725 --fedproxloss_mu 3e-5 --zero_mean_gradients --class_balanced_loss_beta 0.90 --final_eval_clients site-1 --name fedavgm_wpow05_lr18_m0475_epochs7_clientlr0045_cm0925_wd5e4_eta00001625_mu3e5_zmg_cb090_sam00725_w1	discard	custom_aggregators.py	Client weight power 0.5 FedAvgM on active FedSAM/FedAvgM high-water stack	/tmp/nvflare/simulation/fedavgm_wpow05_lr18_m0475_epochs7_clientlr0045_cm0925_wd5e4_eta00001625_mu3e5_zmg_cb090_sam00725_w1
78e3fcdb2	0.922700	868	--n_clients 8 --num_rounds 20 --aggregation_epochs 7 --local_train_steps 0 --batch_size 64 --eval_batch_size 1024 --alpha 0.5 --seed 0 --model_arch moderate_cnn --max_model_params 5000000 --aggregator fedavgm --server_lr 1.8 --server_momentum 0.475 --client_weight_power 0.75 --lr 0.045 --momentum 0.925 --weight_decay 5e-4 --cosine_lr_eta_min_factor 0.0001625 --sam_rho 0.0725 --fedproxloss_mu 3e-5 --zero_mean_gradients --class_balanced_loss_beta 0.90 --final_eval_clients site-1 --name fedavgm_wpow075_lr18_m0475_epochs7_clientlr0045_cm0925_wd5e4_eta00001625_mu3e5_zmg_cb090_sam00725_w1	discard	custom_aggregators.py	Client weight power 0.75 FedAvgM on active FedSAM/FedAvgM high-water stack	/tmp/nvflare/simulation/fedavgm_wpow075_lr18_m0475_epochs7_clientlr0045_cm0925_wd5e4_eta00001625_mu3e5_zmg_cb090_sam00725_w1
