commit	score	runtime_seconds	budget	status	target	description	artifacts
47eec3982	0.903700	738	--n_clients 8 --num_rounds 20 --aggregation_epochs 7 --local_train_steps 0 --batch_size 64 --eval_batch_size 1024 --alpha 0.5 --seed 0 --model_arch moderate_cnn --max_model_params 5000000 --aggregator fedavgm --server_lr 1.8 --server_momentum 0.475 --lr 0.04 --momentum 0.925 --weight_decay 5e-4 --cosine_lr_eta_min_factor 0.0001125 --fedproxloss_mu 3e-5 --final_eval_clients site-1 --name fedavgm_lr18_m0475_epochs7_clientlr004_cm0925_wd5e4_eta00001125_mu3e5	discard	client.py	Scheduler eta_min_factor 0.0001125 around 0.000125 near-miss FedAvgM FedProx stack [src: Li20 FedProx]	/tmp/nvflare/simulation/fedavgm_lr18_m0475_epochs7_clientlr004_cm0925_wd5e4_eta00001125_mu3e5
8237e606e	0.904700	732	--n_clients 8 --num_rounds 20 --aggregation_epochs 7 --local_train_steps 0 --batch_size 64 --eval_batch_size 1024 --alpha 0.5 --seed 0 --model_arch moderate_cnn --max_model_params 5000000 --aggregator fedavgm --server_lr 1.8 --server_momentum 0.4825 --lr 0.04 --momentum 0.925 --weight_decay 5e-4 --cosine_lr_eta_min_factor 0.000125 --fedproxloss_mu 3e-5 --final_eval_clients site-1 --name fedavgm_lr18_m04825_epochs7_clientlr004_cm0925_wd5e4_eta0000125_mu3e5	discard	client.py	Server momentum 0.4825 with eta_min_factor 0.000125 near-miss FedAvgM FedProx stack [src: Reddi21 FedOpt; Li20 FedProx]	/tmp/nvflare/simulation/fedavgm_lr18_m04825_epochs7_clientlr004_cm0925_wd5e4_eta0000125_mu3e5
8237e606e	0.902000	739	--n_clients 8 --num_rounds 20 --aggregation_epochs 7 --local_train_steps 0 --batch_size 64 --eval_batch_size 1024 --alpha 0.5 --seed 0 --model_arch moderate_cnn --max_model_params 5000000 --aggregator fedavgm --server_lr 1.8 --server_momentum 0.4675 --lr 0.04 --momentum 0.925 --weight_decay 5e-4 --cosine_lr_eta_min_factor 0.000125 --fedproxloss_mu 3e-5 --final_eval_clients site-1 --name fedavgm_lr18_m04675_epochs7_clientlr004_cm0925_wd5e4_eta0000125_mu3e5	discard	client.py	Server momentum 0.4675 with eta_min_factor 0.000125 near-miss FedAvgM FedProx stack [src: Reddi21 FedOpt; Li20 FedProx]	/tmp/nvflare/simulation/fedavgm_lr18_m04675_epochs7_clientlr004_cm0925_wd5e4_eta0000125_mu3e5
042548671	0.903000	738	--n_clients 8 --num_rounds 20 --aggregation_epochs 7 --local_train_steps 0 --batch_size 64 --eval_batch_size 1024 --alpha 0.5 --seed 0 --model_arch moderate_cnn --max_model_params 5000000 --aggregator fedavgm --server_lr 1.8 --server_momentum 0.475 --lr 0.04 --momentum 0.925 --weight_decay 5e-4 --cosine_lr_eta_min_factor 0.000125 --fedproxloss_mu 2.5e-5 --final_eval_clients site-1 --name fedavgm_lr18_m0475_epochs7_clientlr004_cm0925_wd5e4_eta0000125_mu25e6	discard	client.py	FedProx mu 2.5e-5 with eta_min_factor 0.000125 near-miss FedAvgM stack [src: Li20 FedProx]	/tmp/nvflare/simulation/fedavgm_lr18_m0475_epochs7_clientlr004_cm0925_wd5e4_eta0000125_mu25e6
042548671	0.899800	739	--n_clients 8 --num_rounds 20 --aggregation_epochs 7 --local_train_steps 0 --batch_size 64 --eval_batch_size 1024 --alpha 0.5 --seed 0 --model_arch moderate_cnn --max_model_params 5000000 --aggregator fedavgm --server_lr 1.8 --server_momentum 0.475 --lr 0.04 --momentum 0.925 --weight_decay 5e-4 --cosine_lr_eta_min_factor 0.000125 --fedproxloss_mu 3.5e-5 --final_eval_clients site-1 --name fedavgm_lr18_m0475_epochs7_clientlr004_cm0925_wd5e4_eta0000125_mu35e6	discard	client.py	FedProx mu 3.5e-5 with eta_min_factor 0.000125 near-miss FedAvgM stack [src: Li20 FedProx]	/tmp/nvflare/simulation/fedavgm_lr18_m0475_epochs7_clientlr004_cm0925_wd5e4_eta0000125_mu35e6
740247a03	0.902400	801	--n_clients 8 --num_rounds 20 --aggregation_epochs 7 --local_train_steps 760 --batch_size 64 --eval_batch_size 1024 --alpha 0.5 --seed 0 --model_arch moderate_cnn --max_model_params 5000000 --aggregator fedavgm --server_lr 1.8 --server_momentum 0.475 --lr 0.04 --momentum 0.925 --weight_decay 5e-4 --cosine_lr_eta_min_factor 0.0001 --fedproxloss_mu 3e-5 --final_eval_clients site-1 --name fedavgm_lr18_m0475_steps760_clientlr004_cm0925_wd5e4_eta00001_mu3e5	discard	client.py	Exact local_train_steps 760 around prior 768-step high-water FedAvgM FedProx stack	/tmp/nvflare/simulation/fedavgm_lr18_m0475_steps760_clientlr004_cm0925_wd5e4_eta00001_mu3e5
740247a03	0.902300	804	--n_clients 8 --num_rounds 20 --aggregation_epochs 7 --local_train_steps 776 --batch_size 64 --eval_batch_size 1024 --alpha 0.5 --seed 0 --model_arch moderate_cnn --max_model_params 5000000 --aggregator fedavgm --server_lr 1.8 --server_momentum 0.475 --lr 0.04 --momentum 0.925 --weight_decay 5e-4 --cosine_lr_eta_min_factor 0.0001 --fedproxloss_mu 3e-5 --final_eval_clients site-1 --name fedavgm_lr18_m0475_steps776_clientlr004_cm0925_wd5e4_eta00001_mu3e5	discard	client.py	Exact local_train_steps 776 around prior 768-step high-water FedAvgM FedProx stack	/tmp/nvflare/simulation/fedavgm_lr18_m0475_steps776_clientlr004_cm0925_wd5e4_eta00001_mu3e5
e1673626f		429	literature_loop	literature	templates/literature_loop.md	literature review: plateau after row 224; selected FedZMG zero-mean gradients and FedNova-style step-normalized FedAvgM	templates/literature_loop.md
366dcbf4d	0.899100	752	--n_clients 8 --num_rounds 20 --aggregation_epochs 7 --local_train_steps 0 --batch_size 64 --eval_batch_size 1024 --alpha 0.5 --seed 0 --model_arch moderate_cnn --max_model_params 5000000 --aggregator fednovam --server_lr 1.8 --server_momentum 0.475 --lr 0.04 --momentum 0.925 --weight_decay 5e-4 --cosine_lr_eta_min_factor 0.0001 --fedproxloss_mu 3e-5 --final_eval_clients site-1 --name fednovam_lr18_m0475_epochs7_clientlr004_cm0925_wd5e4_eta00001_mu3e5	discard	custom_aggregators.py	FedNova-style step-normalized FedAvgM on active FedProx stack [src: Wang20 FedNova arXiv:2007.07481; Reddi21 FedOpt arXiv:2003.00295]	/tmp/nvflare/simulation/fednovam_lr18_m0475_epochs7_clientlr004_cm0925_wd5e4_eta00001_mu3e5
366dcbf4d	0.913700	754	--n_clients 8 --num_rounds 20 --aggregation_epochs 7 --local_train_steps 0 --batch_size 64 --eval_batch_size 1024 --alpha 0.5 --seed 0 --model_arch moderate_cnn --max_model_params 5000000 --aggregator fedavgm --server_lr 1.8 --server_momentum 0.475 --lr 0.04 --momentum 0.925 --weight_decay 5e-4 --cosine_lr_eta_min_factor 0.0001 --fedproxloss_mu 3e-5 --zero_mean_gradients --final_eval_clients site-1 --name fedavgm_lr18_m0475_epochs7_clientlr004_cm0925_wd5e4_eta00001_mu3e5_zmg	keep	client.py	FedZMG zero-mean gradients on active FedAvgM FedProx stack [src: Zantalis26 FedZMG arXiv:2602.18384]	/tmp/nvflare/simulation/fedavgm_lr18_m0475_epochs7_clientlr004_cm0925_wd5e4_eta00001_mu3e5_zmg
6765b8fd7	0.910600	766	--n_clients 8 --num_rounds 20 --aggregation_epochs 7 --local_train_steps 0 --batch_size 64 --eval_batch_size 1024 --alpha 0.5 --seed 0 --model_arch moderate_cnn --max_model_params 5000000 --aggregator fedavgm --server_lr 1.8 --server_momentum 0.45 --lr 0.04 --momentum 0.925 --weight_decay 5e-4 --cosine_lr_eta_min_factor 0.0001 --fedproxloss_mu 3e-5 --zero_mean_gradients --final_eval_clients site-1 --name fedavgm_lr18_m045_epochs7_clientlr004_cm0925_wd5e4_eta00001_mu3e5_zmg	discard	custom_aggregators.py	Server momentum 0.45 around FedZMG new best stack [src: Zantalis26 FedZMG arXiv:2602.18384]	/tmp/nvflare/simulation/fedavgm_lr18_m045_epochs7_clientlr004_cm0925_wd5e4_eta00001_mu3e5_zmg
6765b8fd7	0.911100	765	--n_clients 8 --num_rounds 20 --aggregation_epochs 7 --local_train_steps 0 --batch_size 64 --eval_batch_size 1024 --alpha 0.5 --seed 0 --model_arch moderate_cnn --max_model_params 5000000 --aggregator fedavgm --server_lr 1.8 --server_momentum 0.50 --lr 0.04 --momentum 0.925 --weight_decay 5e-4 --cosine_lr_eta_min_factor 0.0001 --fedproxloss_mu 3e-5 --zero_mean_gradients --final_eval_clients site-1 --name fedavgm_lr18_m05_epochs7_clientlr004_cm0925_wd5e4_eta00001_mu3e5_zmg	discard	custom_aggregators.py	Server momentum 0.50 around FedZMG new best stack [src: Zantalis26 FedZMG arXiv:2602.18384]	/tmp/nvflare/simulation/fedavgm_lr18_m05_epochs7_clientlr004_cm0925_wd5e4_eta00001_mu3e5_zmg
5c2826c27	0.913600	759	--n_clients 8 --num_rounds 20 --aggregation_epochs 7 --local_train_steps 0 --batch_size 64 --eval_batch_size 1024 --alpha 0.5 --seed 0 --model_arch moderate_cnn --max_model_params 5000000 --aggregator fedavgm --server_lr 1.7 --server_momentum 0.475 --lr 0.04 --momentum 0.925 --weight_decay 5e-4 --cosine_lr_eta_min_factor 0.0001 --fedproxloss_mu 3e-5 --zero_mean_gradients --final_eval_clients site-1 --name fedavgm_lr17_m0475_epochs7_clientlr004_cm0925_wd5e4_eta00001_mu3e5_zmg	discard	custom_aggregators.py	Server lr 1.7 around FedZMG new best stack [src: Zantalis26 FedZMG arXiv:2602.18384]	/tmp/nvflare/simulation/fedavgm_lr17_m0475_epochs7_clientlr004_cm0925_wd5e4_eta00001_mu3e5_zmg
5c2826c27	0.912200	756	--n_clients 8 --num_rounds 20 --aggregation_epochs 7 --local_train_steps 0 --batch_size 64 --eval_batch_size 1024 --alpha 0.5 --seed 0 --model_arch moderate_cnn --max_model_params 5000000 --aggregator fedavgm --server_lr 1.9 --server_momentum 0.475 --lr 0.04 --momentum 0.925 --weight_decay 5e-4 --cosine_lr_eta_min_factor 0.0001 --fedproxloss_mu 3e-5 --zero_mean_gradients --final_eval_clients site-1 --name fedavgm_lr19_m0475_epochs7_clientlr004_cm0925_wd5e4_eta00001_mu3e5_zmg	discard	custom_aggregators.py	Server lr 1.9 around FedZMG new best stack [src: Zantalis26 FedZMG arXiv:2602.18384]	/tmp/nvflare/simulation/fedavgm_lr19_m0475_epochs7_clientlr004_cm0925_wd5e4_eta00001_mu3e5_zmg
9fa44d77e	0.913800	759	--n_clients 8 --num_rounds 20 --aggregation_epochs 7 --local_train_steps 0 --batch_size 64 --eval_batch_size 1024 --alpha 0.5 --seed 0 --model_arch moderate_cnn --max_model_params 5000000 --aggregator fedavgm --server_lr 1.75 --server_momentum 0.475 --lr 0.04 --momentum 0.925 --weight_decay 5e-4 --cosine_lr_eta_min_factor 0.0001 --fedproxloss_mu 3e-5 --zero_mean_gradients --final_eval_clients site-1 --name fedavgm_lr175_m0475_epochs7_clientlr004_cm0925_wd5e4_eta00001_mu3e5_zmg	discard	custom_aggregators.py	Server lr 1.75 tight bracket around FedZMG new best stack [src: Zantalis26 FedZMG arXiv:2602.18384]	/tmp/nvflare/simulation/fedavgm_lr175_m0475_epochs7_clientlr004_cm0925_wd5e4_eta00001_mu3e5_zmg
9fa44d77e	0.912100	762	--n_clients 8 --num_rounds 20 --aggregation_epochs 7 --local_train_steps 0 --batch_size 64 --eval_batch_size 1024 --alpha 0.5 --seed 0 --model_arch moderate_cnn --max_model_params 5000000 --aggregator fedavgm --server_lr 1.85 --server_momentum 0.475 --lr 0.04 --momentum 0.925 --weight_decay 5e-4 --cosine_lr_eta_min_factor 0.0001 --fedproxloss_mu 3e-5 --zero_mean_gradients --final_eval_clients site-1 --name fedavgm_lr185_m0475_epochs7_clientlr004_cm0925_wd5e4_eta00001_mu3e5_zmg	discard	custom_aggregators.py	Server lr 1.85 tight bracket around FedZMG new best stack [src: Zantalis26 FedZMG arXiv:2602.18384]	/tmp/nvflare/simulation/fedavgm_lr185_m0475_epochs7_clientlr004_cm0925_wd5e4_eta00001_mu3e5_zmg
b55a7e101	0.912100	756	--n_clients 8 --num_rounds 20 --aggregation_epochs 7 --local_train_steps 0 --batch_size 64 --eval_batch_size 1024 --alpha 0.5 --seed 0 --model_arch moderate_cnn --max_model_params 5000000 --aggregator fedavgm --server_lr 1.8 --server_momentum 0.475 --lr 0.035 --momentum 0.925 --weight_decay 5e-4 --cosine_lr_eta_min_factor 0.0001 --fedproxloss_mu 3e-5 --zero_mean_gradients --final_eval_clients site-1 --name fedavgm_lr18_m0475_epochs7_clientlr0035_cm0925_wd5e4_eta00001_mu3e5_zmg	discard	client.py	Client lr 0.035 around FedZMG new best stack [src: Zantalis26 FedZMG arXiv:2602.18384]	/tmp/nvflare/simulation/fedavgm_lr18_m0475_epochs7_clientlr0035_cm0925_wd5e4_eta00001_mu3e5_zmg
b55a7e101	0.916700	750	--n_clients 8 --num_rounds 20 --aggregation_epochs 7 --local_train_steps 0 --batch_size 64 --eval_batch_size 1024 --alpha 0.5 --seed 0 --model_arch moderate_cnn --max_model_params 5000000 --aggregator fedavgm --server_lr 1.8 --server_momentum 0.475 --lr 0.045 --momentum 0.925 --weight_decay 5e-4 --cosine_lr_eta_min_factor 0.0001 --fedproxloss_mu 3e-5 --zero_mean_gradients --final_eval_clients site-1 --name fedavgm_lr18_m0475_epochs7_clientlr0045_cm0925_wd5e4_eta00001_mu3e5_zmg	keep	client.py	Client lr 0.045 around FedZMG new best stack [src: Zantalis26 FedZMG arXiv:2602.18384]	/tmp/nvflare/simulation/fedavgm_lr18_m0475_epochs7_clientlr0045_cm0925_wd5e4_eta00001_mu3e5_zmg
c6af4e786	0.914000	759	--n_clients 8 --num_rounds 20 --aggregation_epochs 7 --local_train_steps 0 --batch_size 64 --eval_batch_size 1024 --alpha 0.5 --seed 0 --model_arch moderate_cnn --max_model_params 5000000 --aggregator fedavgm --server_lr 1.8 --server_momentum 0.475 --lr 0.0475 --momentum 0.925 --weight_decay 5e-4 --cosine_lr_eta_min_factor 0.0001 --fedproxloss_mu 3e-5 --zero_mean_gradients --final_eval_clients site-1 --name fedavgm_lr18_m0475_epochs7_clientlr00475_cm0925_wd5e4_eta00001_mu3e5_zmg	discard	client.py	Client lr 0.0475 above FedZMG client-lr improvement [src: Zantalis26 FedZMG arXiv:2602.18384]	/tmp/nvflare/simulation/fedavgm_lr18_m0475_epochs7_clientlr00475_cm0925_wd5e4_eta00001_mu3e5_zmg
c6af4e786	0.909400	756	--n_clients 8 --num_rounds 20 --aggregation_epochs 7 --local_train_steps 0 --batch_size 64 --eval_batch_size 1024 --alpha 0.5 --seed 0 --model_arch moderate_cnn --max_model_params 5000000 --aggregator fedavgm --server_lr 1.8 --server_momentum 0.475 --lr 0.05 --momentum 0.925 --weight_decay 5e-4 --cosine_lr_eta_min_factor 0.0001 --fedproxloss_mu 3e-5 --zero_mean_gradients --final_eval_clients site-1 --name fedavgm_lr18_m0475_epochs7_clientlr005_cm0925_wd5e4_eta00001_mu3e5_zmg	discard	client.py	Client lr 0.05 above FedZMG client-lr improvement [src: Zantalis26 FedZMG arXiv:2602.18384]	/tmp/nvflare/simulation/fedavgm_lr18_m0475_epochs7_clientlr005_cm0925_wd5e4_eta00001_mu3e5_zmg
9328f25c9	0.912500	766	--n_clients 8 --num_rounds 20 --aggregation_epochs 7 --local_train_steps 0 --batch_size 64 --eval_batch_size 1024 --alpha 0.5 --seed 0 --model_arch moderate_cnn --max_model_params 5000000 --aggregator fedavgm --server_lr 1.8 --server_momentum 0.475 --lr 0.04375 --momentum 0.925 --weight_decay 5e-4 --cosine_lr_eta_min_factor 0.0001 --fedproxloss_mu 3e-5 --zero_mean_gradients --final_eval_clients site-1 --name fedavgm_lr18_m0475_epochs7_clientlr004375_cm0925_wd5e4_eta00001_mu3e5_zmg	discard	client.py	Client lr 0.04375 tight bracket around FedZMG client-lr best [src: Zantalis26 FedZMG arXiv:2602.18384]	/tmp/nvflare/simulation/fedavgm_lr18_m0475_epochs7_clientlr004375_cm0925_wd5e4_eta00001_mu3e5_zmg
9328f25c9	0.915600	768	--n_clients 8 --num_rounds 20 --aggregation_epochs 7 --local_train_steps 0 --batch_size 64 --eval_batch_size 1024 --alpha 0.5 --seed 0 --model_arch moderate_cnn --max_model_params 5000000 --aggregator fedavgm --server_lr 1.8 --server_momentum 0.475 --lr 0.04625 --momentum 0.925 --weight_decay 5e-4 --cosine_lr_eta_min_factor 0.0001 --fedproxloss_mu 3e-5 --zero_mean_gradients --final_eval_clients site-1 --name fedavgm_lr18_m0475_epochs7_clientlr004625_cm0925_wd5e4_eta00001_mu3e5_zmg	discard	client.py	Client lr 0.04625 tight bracket around FedZMG client-lr best [src: Zantalis26 FedZMG arXiv:2602.18384]	/tmp/nvflare/simulation/fedavgm_lr18_m0475_epochs7_clientlr004625_cm0925_wd5e4_eta00001_mu3e5_zmg
0e6ef6b1c	0.912100	762	--n_clients 8 --num_rounds 20 --aggregation_epochs 7 --local_train_steps 0 --batch_size 64 --eval_batch_size 1024 --alpha 0.5 --seed 0 --model_arch moderate_cnn --max_model_params 5000000 --aggregator fedavgm --server_lr 1.8 --server_momentum 0.475 --lr 0.045 --momentum 0.925 --weight_decay 6e-4 --cosine_lr_eta_min_factor 0.0001 --fedproxloss_mu 3e-5 --zero_mean_gradients --final_eval_clients site-1 --name fedavgm_lr18_m0475_epochs7_clientlr0045_cm0925_wd6e4_eta00001_mu3e5_zmg	discard	client.py	Weight decay 6e-4 around FedZMG client-lr 0.045 stack [src: Zantalis26 FedZMG arXiv:2602.18384]	/tmp/nvflare/simulation/fedavgm_lr18_m0475_epochs7_clientlr0045_cm0925_wd6e4_eta00001_mu3e5_zmg
0e6ef6b1c	0.913900	765	--n_clients 8 --num_rounds 20 --aggregation_epochs 7 --local_train_steps 0 --batch_size 64 --eval_batch_size 1024 --alpha 0.5 --seed 0 --model_arch moderate_cnn --max_model_params 5000000 --aggregator fedavgm --server_lr 1.8 --server_momentum 0.475 --lr 0.045 --momentum 0.925 --weight_decay 4e-4 --cosine_lr_eta_min_factor 0.0001 --fedproxloss_mu 3e-5 --zero_mean_gradients --final_eval_clients site-1 --name fedavgm_lr18_m0475_epochs7_clientlr0045_cm0925_wd4e4_eta00001_mu3e5_zmg	discard	client.py	Weight decay 4e-4 around FedZMG client-lr 0.045 stack [src: Zantalis26 FedZMG arXiv:2602.18384]	/tmp/nvflare/simulation/fedavgm_lr18_m0475_epochs7_clientlr0045_cm0925_wd4e4_eta00001_mu3e5_zmg
979478cbb	0.914300	762	--n_clients 8 --num_rounds 20 --aggregation_epochs 7 --local_train_steps 0 --batch_size 64 --eval_batch_size 1024 --alpha 0.5 --seed 0 --model_arch moderate_cnn --max_model_params 5000000 --aggregator fedavgm --server_lr 1.8 --server_momentum 0.475 --lr 0.045 --momentum 0.925 --weight_decay 5e-4 --cosine_lr_eta_min_factor 0.0001 --fedproxloss_mu 5e-5 --zero_mean_gradients --final_eval_clients site-1 --name fedavgm_lr18_m0475_epochs7_clientlr0045_cm0925_wd5e4_eta00001_mu5e5_zmg	discard	client.py	FedProx mu 5e-5 around FedZMG client-lr 0.045 stack [src: Li20 FedProx arXiv:1812.06127; Zantalis26 FedZMG arXiv:2602.18384]	/tmp/nvflare/simulation/fedavgm_lr18_m0475_epochs7_clientlr0045_cm0925_wd5e4_eta00001_mu5e5_zmg
979478cbb	0.913000	762	--n_clients 8 --num_rounds 20 --aggregation_epochs 7 --local_train_steps 0 --batch_size 64 --eval_batch_size 1024 --alpha 0.5 --seed 0 --model_arch moderate_cnn --max_model_params 5000000 --aggregator fedavgm --server_lr 1.8 --server_momentum 0.475 --lr 0.045 --momentum 0.925 --weight_decay 5e-4 --cosine_lr_eta_min_factor 0.0001 --fedproxloss_mu 1e-5 --zero_mean_gradients --final_eval_clients site-1 --name fedavgm_lr18_m0475_epochs7_clientlr0045_cm0925_wd5e4_eta00001_mu1e5_zmg	discard	client.py	FedProx mu 1e-5 around FedZMG client-lr 0.045 stack [src: Li20 FedProx arXiv:1812.06127; Zantalis26 FedZMG arXiv:2602.18384]	/tmp/nvflare/simulation/fedavgm_lr18_m0475_epochs7_clientlr0045_cm0925_wd5e4_eta00001_mu1e5_zmg
62e3617a9	0.907000	753	--n_clients 8 --num_rounds 20 --aggregation_epochs 7 --local_train_steps 0 --batch_size 64 --eval_batch_size 1024 --alpha 0.5 --seed 0 --model_arch moderate_cnn --max_model_params 5000000 --aggregator fedavgm --server_lr 1.8 --server_momentum 0.475 --lr 0.045 --momentum 0.95 --weight_decay 5e-4 --cosine_lr_eta_min_factor 0.0001 --fedproxloss_mu 3e-5 --zero_mean_gradients --final_eval_clients site-1 --name fedavgm_lr18_m0475_epochs7_clientlr0045_cm095_wd5e4_eta00001_mu3e5_zmg	discard	client.py	Client momentum 0.95 around FedZMG client-lr 0.045 stack [src: Zantalis26 FedZMG arXiv:2602.18384]	/tmp/nvflare/simulation/fedavgm_lr18_m0475_epochs7_clientlr0045_cm095_wd5e4_eta00001_mu3e5_zmg
62e3617a9	0.911800	751	--n_clients 8 --num_rounds 20 --aggregation_epochs 7 --local_train_steps 0 --batch_size 64 --eval_batch_size 1024 --alpha 0.5 --seed 0 --model_arch moderate_cnn --max_model_params 5000000 --aggregator fedavgm --server_lr 1.8 --server_momentum 0.475 --lr 0.045 --momentum 0.90 --weight_decay 5e-4 --cosine_lr_eta_min_factor 0.0001 --fedproxloss_mu 3e-5 --zero_mean_gradients --final_eval_clients site-1 --name fedavgm_lr18_m0475_epochs7_clientlr0045_cm09_wd5e4_eta00001_mu3e5_zmg	discard	client.py	Client momentum 0.90 around FedZMG client-lr 0.045 stack [src: Zantalis26 FedZMG arXiv:2602.18384]	/tmp/nvflare/simulation/fedavgm_lr18_m0475_epochs7_clientlr0045_cm09_wd5e4_eta00001_mu3e5_zmg
58b5148a5	0.908800	643	--n_clients 8 --num_rounds 20 --aggregation_epochs 6 --local_train_steps 0 --batch_size 64 --eval_batch_size 1024 --alpha 0.5 --seed 0 --model_arch moderate_cnn --max_model_params 5000000 --aggregator fedavgm --server_lr 1.8 --server_momentum 0.475 --lr 0.045 --momentum 0.925 --weight_decay 5e-4 --cosine_lr_eta_min_factor 0.0001 --fedproxloss_mu 3e-5 --zero_mean_gradients --final_eval_clients site-1 --name fedavgm_lr18_m0475_epochs6_clientlr0045_cm0925_wd5e4_eta00001_mu3e5_zmg	discard	client.py	Aggregation epochs 6 around FedZMG client-lr 0.045 stack [src: Zantalis26 FedZMG arXiv:2602.18384]	/tmp/nvflare/simulation/fedavgm_lr18_m0475_epochs6_clientlr0045_cm0925_wd5e4_eta00001_mu3e5_zmg
58b5148a5	0.912100	751	--n_clients 8 --num_rounds 20 --aggregation_epochs 8 --local_train_steps 0 --batch_size 64 --eval_batch_size 1024 --alpha 0.5 --seed 0 --model_arch moderate_cnn --max_model_params 5000000 --aggregator fedavgm --server_lr 1.8 --server_momentum 0.475 --lr 0.045 --momentum 0.925 --weight_decay 5e-4 --cosine_lr_eta_min_factor 0.0001 --fedproxloss_mu 3e-5 --zero_mean_gradients --final_eval_clients site-1 --name fedavgm_lr18_m0475_epochs8_clientlr0045_cm0925_wd5e4_eta00001_mu3e5_zmg	discard	client.py	Aggregation epochs 8 around FedZMG client-lr 0.045 stack [src: Zantalis26 FedZMG arXiv:2602.18384]	/tmp/nvflare/simulation/fedavgm_lr18_m0475_epochs8_clientlr0045_cm0925_wd5e4_eta00001_mu3e5_zmg
0299c1c55	0.913600	762	--n_clients 8 --num_rounds 20 --aggregation_epochs 7 --local_train_steps 0 --batch_size 64 --eval_batch_size 1024 --alpha 0.5 --seed 0 --model_arch moderate_cnn --max_model_params 5000000 --aggregator fedavgm --server_lr 1.75 --server_momentum 0.475 --lr 0.045 --momentum 0.925 --weight_decay 5e-4 --cosine_lr_eta_min_factor 0.0001 --fedproxloss_mu 3e-5 --zero_mean_gradients --final_eval_clients site-1 --name fedavgm_lr175_m0475_epochs7_clientlr0045_cm0925_wd5e4_eta00001_mu3e5_zmg	discard	custom_aggregators.py	Server lr 1.75 around FedZMG client-lr 0.045 stack [src: Zantalis26 FedZMG arXiv:2602.18384]	/tmp/nvflare/simulation/fedavgm_lr175_m0475_epochs7_clientlr0045_cm0925_wd5e4_eta00001_mu3e5_zmg
