commit	score	runtime_seconds	budget	status	target	description	artifacts
5763278f0	0.914900	486	--n_clients 8 --num_rounds 20 --aggregation_epochs 7 --local_train_steps 0 --batch_size 64 --eval_batch_size 1024 --alpha 0.5 --seed 0 --model_arch moderate_cnn --max_model_params 5000000 --aggregator fedavgm --server_lr 1.8 --server_momentum 0.475 --lr 0.0475 --momentum 0.925 --weight_decay 5e-4 --cosine_lr_eta_min_factor 0.00015 --fedproxloss_mu 3e-5 --zero_mean_gradients --class_balanced_loss_beta 0.90 --final_eval_clients site-1 --name fedavgm_lr18_m0475_epochs7_clientlr00475_cm0925_wd5e4_eta000015_mu3e5_zmg_cb090_w1	discard	client.py	Client lr 0.0475 continuation under class-balanced beta 0.90 FedZMG stack [src: Cui19 CBLoss CVPR; Wang21 RatioLoss AAAI]	/tmp/nvflare/simulation/fedavgm_lr18_m0475_epochs7_clientlr00475_cm0925_wd5e4_eta000015_mu3e5_zmg_cb090_w1
299c698d2	0.914200	487	--n_clients 8 --num_rounds 20 --aggregation_epochs 7 --local_train_steps 0 --batch_size 64 --eval_batch_size 1024 --alpha 0.5 --seed 0 --model_arch moderate_cnn --max_model_params 5000000 --aggregator fedavgm --server_lr 1.8 --server_momentum 0.475 --lr 0.045 --momentum 0.925 --weight_decay 5e-4 --cosine_lr_eta_min_factor 0.00015 --fedproxloss_mu 3e-5 --zero_mean_gradients --class_balanced_loss_beta 0.8925 --final_eval_clients site-1 --name fedavgm_lr18_m0475_epochs7_clientlr0045_cm0925_wd5e4_eta000015_mu3e5_zmg_cb08925_w1	discard	client.py	Class-balanced beta 0.8925 lower midpoint under FedZMG stack [src: Cui19 CBLoss CVPR; Wang21 RatioLoss AAAI]	/tmp/nvflare/simulation/fedavgm_lr18_m0475_epochs7_clientlr0045_cm0925_wd5e4_eta000015_mu3e5_zmg_cb08925_w1
299c698d2	0.913500	484	--n_clients 8 --num_rounds 20 --aggregation_epochs 7 --local_train_steps 0 --batch_size 64 --eval_batch_size 1024 --alpha 0.5 --seed 0 --model_arch moderate_cnn --max_model_params 5000000 --aggregator fedavgm --server_lr 1.8 --server_momentum 0.475 --lr 0.045 --momentum 0.925 --weight_decay 5e-4 --cosine_lr_eta_min_factor 0.00015 --fedproxloss_mu 3e-5 --zero_mean_gradients --class_balanced_loss_beta 0.8875 --final_eval_clients site-1 --name fedavgm_lr18_m0475_epochs7_clientlr0045_cm0925_wd5e4_eta000015_mu3e5_zmg_cb08875_w1	discard	client.py	Class-balanced beta 0.8875 lower midpoint under FedZMG stack [src: Cui19 CBLoss CVPR; Wang21 RatioLoss AAAI]	/tmp/nvflare/simulation/fedavgm_lr18_m0475_epochs7_clientlr0045_cm0925_wd5e4_eta000015_mu3e5_zmg_cb08875_w1
76b48d097	0.911300	489	--n_clients 8 --num_rounds 20 --aggregation_epochs 7 --local_train_steps 0 --batch_size 64 --eval_batch_size 1024 --alpha 0.5 --seed 0 --model_arch moderate_cnn --max_model_params 5000000 --aggregator fedavgm --server_lr 1.8 --server_momentum 0.475 --lr 0.045 --momentum 0.921875 --weight_decay 5e-4 --cosine_lr_eta_min_factor 0.00015 --fedproxloss_mu 3e-5 --zero_mean_gradients --class_balanced_loss_beta 0.90 --final_eval_clients site-1 --name fedavgm_lr18_m0475_epochs7_clientlr0045_cm0921875_wd5e4_eta000015_mu3e5_zmg_cb090_w1	discard	client.py	Client momentum 0.921875 tight continuation under class-balanced beta 0.90 FedZMG stack [src: Cui19 CBLoss CVPR; Wang21 RatioLoss AAAI]	/tmp/nvflare/simulation/fedavgm_lr18_m0475_epochs7_clientlr0045_cm0921875_wd5e4_eta000015_mu3e5_zmg_cb090_w1
76b48d097	0.911500	490	--n_clients 8 --num_rounds 20 --aggregation_epochs 7 --local_train_steps 0 --batch_size 64 --eval_batch_size 1024 --alpha 0.5 --seed 0 --model_arch moderate_cnn --max_model_params 5000000 --aggregator fedavgm --server_lr 1.8 --server_momentum 0.475 --lr 0.045 --momentum 0.928125 --weight_decay 5e-4 --cosine_lr_eta_min_factor 0.00015 --fedproxloss_mu 3e-5 --zero_mean_gradients --class_balanced_loss_beta 0.90 --final_eval_clients site-1 --name fedavgm_lr18_m0475_epochs7_clientlr0045_cm0928125_wd5e4_eta000015_mu3e5_zmg_cb090_w1	discard	client.py	Client momentum 0.928125 tight continuation under class-balanced beta 0.90 FedZMG stack [src: Cui19 CBLoss CVPR; Wang21 RatioLoss AAAI]	/tmp/nvflare/simulation/fedavgm_lr18_m0475_epochs7_clientlr0045_cm0928125_wd5e4_eta000015_mu3e5_zmg_cb090_w1
e3c753487	0.901900	262	--n_clients 8 --num_rounds 20 --aggregation_epochs 3 --local_train_steps 0 --batch_size 64 --eval_batch_size 1024 --alpha 0.5 --seed 0 --model_arch moderate_cnn --max_model_params 5000000 --aggregator fedavgm --server_lr 1.8 --server_momentum 0.475 --lr 0.045 --momentum 0.925 --weight_decay 5e-4 --cosine_lr_eta_min_factor 0.00015 --fedproxloss_mu 3e-5 --zero_mean_gradients --class_balanced_loss_beta 0.90 --final_eval_clients site-1 --name fedavgm_lr18_m0475_epochs3_clientlr0045_cm0925_wd5e4_eta000015_mu3e5_zmg_cb090_w1	discard	client.py	Aggregation epochs 3 local-compute endpoint under class-balanced beta 0.90 FedZMG stack [src: Cui19 CBLoss CVPR; Wang21 RatioLoss AAAI]	/tmp/nvflare/simulation/fedavgm_lr18_m0475_epochs3_clientlr0045_cm0925_wd5e4_eta000015_mu3e5_zmg_cb090_w1
e3c753487	0.915500	716	--n_clients 8 --num_rounds 20 --aggregation_epochs 11 --local_train_steps 0 --batch_size 64 --eval_batch_size 1024 --alpha 0.5 --seed 0 --model_arch moderate_cnn --max_model_params 5000000 --aggregator fedavgm --server_lr 1.8 --server_momentum 0.475 --lr 0.045 --momentum 0.925 --weight_decay 5e-4 --cosine_lr_eta_min_factor 0.00015 --fedproxloss_mu 3e-5 --zero_mean_gradients --class_balanced_loss_beta 0.90 --final_eval_clients site-1 --name fedavgm_lr18_m0475_epochs11_clientlr0045_cm0925_wd5e4_eta000015_mu3e5_zmg_cb090_w1	discard	client.py	Aggregation epochs 11 local-compute endpoint under class-balanced beta 0.90 FedZMG stack [src: Cui19 CBLoss CVPR; Wang21 RatioLoss AAAI]	/tmp/nvflare/simulation/fedavgm_lr18_m0475_epochs11_clientlr0045_cm0925_wd5e4_eta000015_mu3e5_zmg_cb090_w1
17b75c127	0.895300	223	--n_clients 8 --num_rounds 20 --aggregation_epochs 7 --local_train_steps 256 --batch_size 64 --eval_batch_size 1024 --alpha 0.5 --seed 0 --model_arch moderate_cnn --max_model_params 5000000 --aggregator fedavgm --server_lr 1.8 --server_momentum 0.475 --lr 0.045 --momentum 0.925 --weight_decay 5e-4 --cosine_lr_eta_min_factor 0.00015 --fedproxloss_mu 3e-5 --zero_mean_gradients --class_balanced_loss_beta 0.90 --final_eval_clients site-1 --name fedavgm_lr18_m0475_steps256_clientlr0045_cm0925_wd5e4_eta000015_mu3e5_zmg_cb090_w1	discard	client.py	Exact local_train_steps 256 local-compute endpoint under class-balanced beta 0.90 FedZMG stack [src: Cui19 CBLoss CVPR; Wang21 RatioLoss AAAI]	/tmp/nvflare/simulation/fedavgm_lr18_m0475_steps256_clientlr0045_cm0925_wd5e4_eta000015_mu3e5_zmg_cb090_w1
17b75c127	0.912500	790	--n_clients 8 --num_rounds 20 --aggregation_epochs 7 --local_train_steps 1408 --batch_size 64 --eval_batch_size 1024 --alpha 0.5 --seed 0 --model_arch moderate_cnn --max_model_params 5000000 --aggregator fedavgm --server_lr 1.8 --server_momentum 0.475 --lr 0.045 --momentum 0.925 --weight_decay 5e-4 --cosine_lr_eta_min_factor 0.00015 --fedproxloss_mu 3e-5 --zero_mean_gradients --class_balanced_loss_beta 0.90 --final_eval_clients site-1 --name fedavgm_lr18_m0475_steps1408_clientlr0045_cm0925_wd5e4_eta000015_mu3e5_zmg_cb090_w1	discard	client.py	Exact local_train_steps 1408 local-compute endpoint under class-balanced beta 0.90 FedZMG stack [src: Cui19 CBLoss CVPR; Wang21 RatioLoss AAAI]	/tmp/nvflare/simulation/fedavgm_lr18_m0475_steps1408_clientlr0045_cm0925_wd5e4_eta000015_mu3e5_zmg_cb090_w1
7f5224658	0.914400	474	--n_clients 8 --num_rounds 20 --aggregation_epochs 7 --local_train_steps 0 --batch_size 64 --eval_batch_size 1024 --alpha 0.5 --seed 0 --model_arch moderate_cnn --max_model_params 5000000 --aggregator fedavgm --server_lr 1.8 --server_momentum 0.475 --lr 0.045 --momentum 0.925 --weight_decay 5e-4 --cosine_lr_eta_min_factor 0.000075 --fedproxloss_mu 3e-5 --zero_mean_gradients --class_balanced_loss_beta 0.90 --final_eval_clients site-1 --name fedavgm_lr18_m0475_epochs7_clientlr0045_cm0925_wd5e4_eta0000075_mu3e5_zmg_cb090_w1	discard	client.py	Scheduler eta_min_factor 0.000075 continuation under class-balanced beta 0.90 FedZMG stack [src: Cui19 CBLoss CVPR; Wang21 RatioLoss AAAI]	/tmp/nvflare/simulation/fedavgm_lr18_m0475_epochs7_clientlr0045_cm0925_wd5e4_eta0000075_mu3e5_zmg_cb090_w1
7f5224658	0.913700	474	--n_clients 8 --num_rounds 20 --aggregation_epochs 7 --local_train_steps 0 --batch_size 64 --eval_batch_size 1024 --alpha 0.5 --seed 0 --model_arch moderate_cnn --max_model_params 5000000 --aggregator fedavgm --server_lr 1.8 --server_momentum 0.475 --lr 0.045 --momentum 0.925 --weight_decay 5e-4 --cosine_lr_eta_min_factor 0.0001 --fedproxloss_mu 3e-5 --zero_mean_gradients --class_balanced_loss_beta 0.90 --final_eval_clients site-1 --name fedavgm_lr18_m0475_epochs7_clientlr0045_cm0925_wd5e4_eta00001_mu3e5_zmg_cb090_w1	discard	client.py	Scheduler eta_min_factor 0.0001 continuation under class-balanced beta 0.90 FedZMG stack [src: Cui19 CBLoss CVPR; Wang21 RatioLoss AAAI]	/tmp/nvflare/simulation/fedavgm_lr18_m0475_epochs7_clientlr0045_cm0925_wd5e4_eta00001_mu3e5_zmg_cb090_w1
616fe38e2	0.914100	474	--n_clients 8 --num_rounds 20 --aggregation_epochs 7 --local_train_steps 0 --batch_size 64 --eval_batch_size 1024 --alpha 0.5 --seed 0 --model_arch moderate_cnn --max_model_params 5000000 --aggregator fedavgm --server_lr 1.8 --server_momentum 0.475 --lr 0.045 --momentum 0.925 --weight_decay 5e-4 --cosine_lr_eta_min_factor 0.00015 --fedproxloss_mu 5e-5 --zero_mean_gradients --class_balanced_loss_beta 0.90 --final_eval_clients site-1 --name fedavgm_lr18_m0475_epochs7_clientlr0045_cm0925_wd5e4_eta000015_mu5e5_zmg_cb090_w1	discard	client.py	FedProx mu 5e-5 continuation under class-balanced beta 0.90 FedZMG stack [src: Li20 FedProx; Cui19 CBLoss CVPR; Wang21 RatioLoss AAAI]	/tmp/nvflare/simulation/fedavgm_lr18_m0475_epochs7_clientlr0045_cm0925_wd5e4_eta000015_mu5e5_zmg_cb090_w1
616fe38e2	0.912100	477	--n_clients 8 --num_rounds 20 --aggregation_epochs 7 --local_train_steps 0 --batch_size 64 --eval_batch_size 1024 --alpha 0.5 --seed 0 --model_arch moderate_cnn --max_model_params 5000000 --aggregator fedavgm --server_lr 1.8 --server_momentum 0.475 --lr 0.045 --momentum 0.925 --weight_decay 5e-4 --cosine_lr_eta_min_factor 0.00015 --fedproxloss_mu 7.5e-5 --zero_mean_gradients --class_balanced_loss_beta 0.90 --final_eval_clients site-1 --name fedavgm_lr18_m0475_epochs7_clientlr0045_cm0925_wd5e4_eta000015_mu75e6_zmg_cb090_w1	discard	client.py	FedProx mu 7.5e-5 continuation under class-balanced beta 0.90 FedZMG stack [src: Li20 FedProx; Cui19 CBLoss CVPR; Wang21 RatioLoss AAAI]	/tmp/nvflare/simulation/fedavgm_lr18_m0475_epochs7_clientlr0045_cm0925_wd5e4_eta000015_mu75e6_zmg_cb090_w1
397c33be9	0.915500	477	--n_clients 8 --num_rounds 20 --aggregation_epochs 7 --local_train_steps 0 --batch_size 64 --eval_batch_size 1024 --alpha 0.5 --seed 0 --model_arch moderate_cnn --max_model_params 5000000 --aggregator fedavgm --server_lr 1.7 --server_momentum 0.475 --lr 0.045 --momentum 0.925 --weight_decay 5e-4 --cosine_lr_eta_min_factor 0.00015 --fedproxloss_mu 3e-5 --zero_mean_gradients --class_balanced_loss_beta 0.90 --final_eval_clients site-1 --name fedavgm_lr17_m0475_epochs7_clientlr0045_cm0925_wd5e4_eta000015_mu3e5_zmg_cb090_w1	discard	custom_aggregators.py	Server lr 1.7 continuation under class-balanced beta 0.90 FedZMG stack [src: Cui19 CBLoss CVPR; Wang21 RatioLoss AAAI]	/tmp/nvflare/simulation/fedavgm_lr17_m0475_epochs7_clientlr0045_cm0925_wd5e4_eta000015_mu3e5_zmg_cb090_w1
397c33be9	0.914400	474	--n_clients 8 --num_rounds 20 --aggregation_epochs 7 --local_train_steps 0 --batch_size 64 --eval_batch_size 1024 --alpha 0.5 --seed 0 --model_arch moderate_cnn --max_model_params 5000000 --aggregator fedavgm --server_lr 1.9 --server_momentum 0.475 --lr 0.045 --momentum 0.925 --weight_decay 5e-4 --cosine_lr_eta_min_factor 0.00015 --fedproxloss_mu 3e-5 --zero_mean_gradients --class_balanced_loss_beta 0.90 --final_eval_clients site-1 --name fedavgm_lr19_m0475_epochs7_clientlr0045_cm0925_wd5e4_eta000015_mu3e5_zmg_cb090_w1	discard	custom_aggregators.py	Server lr 1.9 continuation under class-balanced beta 0.90 FedZMG stack [src: Cui19 CBLoss CVPR; Wang21 RatioLoss AAAI]	/tmp/nvflare/simulation/fedavgm_lr19_m0475_epochs7_clientlr0045_cm0925_wd5e4_eta000015_mu3e5_zmg_cb090_w1
125a5d1b2	0.910700	474	--n_clients 8 --num_rounds 20 --aggregation_epochs 7 --local_train_steps 0 --batch_size 64 --eval_batch_size 1024 --alpha 0.5 --seed 0 --model_arch moderate_cnn --max_model_params 5000000 --aggregator fedavgm --server_lr 1.8 --server_momentum 0.4625 --lr 0.045 --momentum 0.925 --weight_decay 5e-4 --cosine_lr_eta_min_factor 0.00015 --fedproxloss_mu 3e-5 --zero_mean_gradients --class_balanced_loss_beta 0.90 --final_eval_clients site-1 --name fedavgm_lr18_m04625_epochs7_clientlr0045_cm0925_wd5e4_eta000015_mu3e5_zmg_cb090_w1	discard	custom_aggregators.py	Server momentum 0.4625 continuation under class-balanced beta 0.90 FedZMG stack [src: Cui19 CBLoss CVPR; Wang21 RatioLoss AAAI]	/tmp/nvflare/simulation/fedavgm_lr18_m04625_epochs7_clientlr0045_cm0925_wd5e4_eta000015_mu3e5_zmg_cb090_w1
125a5d1b2	0.913900	477	--n_clients 8 --num_rounds 20 --aggregation_epochs 7 --local_train_steps 0 --batch_size 64 --eval_batch_size 1024 --alpha 0.5 --seed 0 --model_arch moderate_cnn --max_model_params 5000000 --aggregator fedavgm --server_lr 1.8 --server_momentum 0.4875 --lr 0.045 --momentum 0.925 --weight_decay 5e-4 --cosine_lr_eta_min_factor 0.00015 --fedproxloss_mu 3e-5 --zero_mean_gradients --class_balanced_loss_beta 0.90 --final_eval_clients site-1 --name fedavgm_lr18_m04875_epochs7_clientlr0045_cm0925_wd5e4_eta000015_mu3e5_zmg_cb090_w1	discard	custom_aggregators.py	Server momentum 0.4875 continuation under class-balanced beta 0.90 FedZMG stack [src: Cui19 CBLoss CVPR; Wang21 RatioLoss AAAI]	/tmp/nvflare/simulation/fedavgm_lr18_m04875_epochs7_clientlr0045_cm0925_wd5e4_eta000015_mu3e5_zmg_cb090_w1
cab982b81	0.914900	474	--n_clients 8 --num_rounds 20 --aggregation_epochs 7 --local_train_steps 0 --batch_size 64 --eval_batch_size 1024 --alpha 0.5 --seed 0 --model_arch moderate_cnn --max_model_params 5000000 --aggregator fedavgm --server_lr 1.8 --server_momentum 0.475 --lr 0.045 --momentum 0.925 --weight_decay 5e-4 --cosine_lr_eta_min_factor 0.00015 --fedproxloss_mu 3e-5 --zero_mean_gradients --class_balanced_loss_beta 0.9025 --final_eval_clients site-1 --name fedavgm_lr18_m0475_epochs7_clientlr0045_cm0925_wd5e4_eta000015_mu3e5_zmg_cb09025_w1	discard	client.py	Class-balanced beta 0.9025 upper midpoint under FedZMG stack [src: Cui19 CBLoss CVPR; Wang21 RatioLoss AAAI]	/tmp/nvflare/simulation/fedavgm_lr18_m0475_epochs7_clientlr0045_cm0925_wd5e4_eta000015_mu3e5_zmg_cb09025_w1
cab982b81	0.914900	475	--n_clients 8 --num_rounds 20 --aggregation_epochs 7 --local_train_steps 0 --batch_size 64 --eval_batch_size 1024 --alpha 0.5 --seed 0 --model_arch moderate_cnn --max_model_params 5000000 --aggregator fedavgm --server_lr 1.8 --server_momentum 0.475 --lr 0.045 --momentum 0.925 --weight_decay 5e-4 --cosine_lr_eta_min_factor 0.00015 --fedproxloss_mu 3e-5 --zero_mean_gradients --class_balanced_loss_beta 0.9075 --final_eval_clients site-1 --name fedavgm_lr18_m0475_epochs7_clientlr0045_cm0925_wd5e4_eta000015_mu3e5_zmg_cb09075_w1	discard	client.py	Class-balanced beta 0.9075 upper midpoint under FedZMG stack [src: Cui19 CBLoss CVPR; Wang21 RatioLoss AAAI]	/tmp/nvflare/simulation/fedavgm_lr18_m0475_epochs7_clientlr0045_cm0925_wd5e4_eta000015_mu3e5_zmg_cb09075_w1
b58f15bb2	0.916100	471	--n_clients 8 --num_rounds 20 --aggregation_epochs 7 --local_train_steps 0 --batch_size 64 --eval_batch_size 1024 --alpha 0.5 --seed 0 --model_arch moderate_cnn --max_model_params 5000000 --aggregator fedavgm --server_lr 1.8 --server_momentum 0.475 --lr 0.04375 --momentum 0.925 --weight_decay 5e-4 --cosine_lr_eta_min_factor 0.00015 --fedproxloss_mu 3e-5 --zero_mean_gradients --class_balanced_loss_beta 0.90 --final_eval_clients site-1 --name fedavgm_lr18_m0475_epochs7_clientlr004375_cm0925_wd5e4_eta000015_mu3e5_zmg_cb090_w1	discard	client.py	Client lr 0.04375 midpoint continuation under class-balanced beta 0.90 FedZMG stack [src: Cui19 CBLoss CVPR; Wang21 RatioLoss AAAI]	/tmp/nvflare/simulation/fedavgm_lr18_m0475_epochs7_clientlr004375_cm0925_wd5e4_eta000015_mu3e5_zmg_cb090_w1
b58f15bb2	0.911800	477	--n_clients 8 --num_rounds 20 --aggregation_epochs 7 --local_train_steps 0 --batch_size 64 --eval_batch_size 1024 --alpha 0.5 --seed 0 --model_arch moderate_cnn --max_model_params 5000000 --aggregator fedavgm --server_lr 1.8 --server_momentum 0.475 --lr 0.04625 --momentum 0.925 --weight_decay 5e-4 --cosine_lr_eta_min_factor 0.00015 --fedproxloss_mu 3e-5 --zero_mean_gradients --class_balanced_loss_beta 0.90 --final_eval_clients site-1 --name fedavgm_lr18_m0475_epochs7_clientlr004625_cm0925_wd5e4_eta000015_mu3e5_zmg_cb090_w1	discard	client.py	Client lr 0.04625 midpoint continuation under class-balanced beta 0.90 FedZMG stack [src: Cui19 CBLoss CVPR; Wang21 RatioLoss AAAI]	/tmp/nvflare/simulation/fedavgm_lr18_m0475_epochs7_clientlr004625_cm0925_wd5e4_eta000015_mu3e5_zmg_cb090_w1
dab282626	0.911400	481	--n_clients 8 --num_rounds 20 --aggregation_epochs 7 --local_train_steps 0 --batch_size 64 --eval_batch_size 1024 --alpha 0.5 --seed 0 --model_arch moderate_cnn --max_model_params 5000000 --aggregator fedavgm --server_lr 1.8 --server_momentum 0.475 --lr 0.045 --momentum 0.925 --weight_decay 5e-4 --cosine_lr_eta_min_factor 0.0002 --fedproxloss_mu 3e-5 --zero_mean_gradients --class_balanced_loss_beta 0.90 --final_eval_clients site-1 --name fedavgm_lr18_m0475_epochs7_clientlr0045_cm0925_wd5e4_eta00002_mu3e5_zmg_cb090_w1	discard	client.py	Scheduler eta_min_factor 0.0002 threshold probe under class-balanced beta 0.90 FedZMG stack [src: Cui19 CBLoss CVPR; Wang21 RatioLoss AAAI]	/tmp/nvflare/simulation/fedavgm_lr18_m0475_epochs7_clientlr0045_cm0925_wd5e4_eta00002_mu3e5_zmg_cb090_w1
3cb0f9a37		305	literature_loop	literature	templates/literature_loop.md	literature review: plateau after class-balanced FedZMG scalar jitter; selected local mixup alpha 0.2 and label smoothing 0.05	templates/literature_loop.md
79ada1006	0.912200	564	--n_clients 8 --num_rounds 20 --aggregation_epochs 7 --local_train_steps 0 --batch_size 64 --eval_batch_size 1024 --alpha 0.5 --seed 0 --model_arch moderate_cnn --max_model_params 5000000 --aggregator fedavgm --server_lr 1.8 --server_momentum 0.475 --lr 0.045 --momentum 0.925 --weight_decay 5e-4 --cosine_lr_eta_min_factor 0.00015 --fedproxloss_mu 3e-5 --zero_mean_gradients --class_balanced_loss_beta 0.90 --mixup_alpha 0.2 --final_eval_clients site-1 --name fedavgm_lr18_m0475_epochs7_clientlr0045_cm0925_wd5e4_eta000015_mu3e5_zmg_cb090_mixup02_w1	discard	client.py	Local mixup alpha 0.2 under class-balanced FedZMG stack [src: Zhang18 mixup arXiv:1710.09412; Yoon21 FedMix arXiv:2107.00233]	/tmp/nvflare/simulation/fedavgm_lr18_m0475_epochs7_clientlr0045_cm0925_wd5e4_eta000015_mu3e5_zmg_cb090_mixup02_w1
79ada1006	0.912600	495	--n_clients 8 --num_rounds 20 --aggregation_epochs 7 --local_train_steps 0 --batch_size 64 --eval_batch_size 1024 --alpha 0.5 --seed 0 --model_arch moderate_cnn --max_model_params 5000000 --aggregator fedavgm --server_lr 1.8 --server_momentum 0.475 --lr 0.045 --momentum 0.925 --weight_decay 5e-4 --cosine_lr_eta_min_factor 0.00015 --fedproxloss_mu 3e-5 --zero_mean_gradients --class_balanced_loss_beta 0.90 --label_smoothing 0.05 --final_eval_clients site-1 --name fedavgm_lr18_m0475_epochs7_clientlr0045_cm0925_wd5e4_eta000015_mu3e5_zmg_cb090_ls005_w1	discard	client.py	Label smoothing 0.05 under class-balanced FedZMG stack [src: Muller19 LabelSmoothing arXiv:1906.02629; Szegedy16 Inception arXiv:1512.00567]	/tmp/nvflare/simulation/fedavgm_lr18_m0475_epochs7_clientlr0045_cm0925_wd5e4_eta000015_mu3e5_zmg_cb090_ls005_w1
de16eaa9a	0.897200	486	--n_clients 8 --num_rounds 20 --aggregation_epochs 7 --local_train_steps 0 --batch_size 64 --eval_batch_size 1024 --alpha 0.5 --seed 0 --model_arch moderate_cnn --max_model_params 5000000 --aggregator fedavgm --server_lr 1.8 --server_momentum 0.475 --lr 0.045 --momentum 0.925 --weight_decay 5e-4 --cosine_lr_eta_min_factor 0.00015 --fedproxloss_mu 3e-5 --zero_mean_gradients --grad_clip_norm 1.0 --class_balanced_loss_beta 0.90 --final_eval_clients site-1 --name fedavgm_lr18_m0475_epochs7_clientlr0045_cm0925_wd5e4_eta000015_mu3e5_zmg_cb090_gclip1_w1	discard	client.py	Client grad clip norm 1.0 under class-balanced FedZMG stack [src: Zhang21 clipping arXiv:2106.13673]	/tmp/nvflare/simulation/fedavgm_lr18_m0475_epochs7_clientlr0045_cm0925_wd5e4_eta000015_mu3e5_zmg_cb090_gclip1_w1
de16eaa9a	0.915200	483	--n_clients 8 --num_rounds 20 --aggregation_epochs 7 --local_train_steps 0 --batch_size 64 --eval_batch_size 1024 --alpha 0.5 --seed 0 --model_arch moderate_cnn --max_model_params 5000000 --aggregator fedavgm --server_lr 1.8 --server_momentum 0.475 --lr 0.045 --momentum 0.925 --weight_decay 5e-4 --cosine_lr_eta_min_factor 0.00015 --fedproxloss_mu 3e-5 --zero_mean_gradients --grad_clip_norm 5.0 --class_balanced_loss_beta 0.90 --final_eval_clients site-1 --name fedavgm_lr18_m0475_epochs7_clientlr0045_cm0925_wd5e4_eta000015_mu3e5_zmg_cb090_gclip5_w1	discard	client.py	Client grad clip norm 5.0 under class-balanced FedZMG stack [src: Zhang21 clipping arXiv:2106.13673]	/tmp/nvflare/simulation/fedavgm_lr18_m0475_epochs7_clientlr0045_cm0925_wd5e4_eta000015_mu3e5_zmg_cb090_gclip5_w1
