commit	score	runtime_seconds	budget	status	target	description	artifacts
18f44cf4b	0.920900	957	--n_clients 8 --num_rounds 20 --aggregation_epochs 7 --local_train_steps 0 --batch_size 64 --eval_batch_size 1024 --alpha 0.5 --seed 0 --model_arch moderate_cnn --max_model_params 5000000 --aggregator fedavgm --server_lr 1.8 --server_momentum 0.475 --lr 0.045 --momentum 0.925 --weight_decay 5e-4 --cosine_lr_eta_min_factor 0.0001625 --sam_rho 0.0725 --fedproxloss_mu 3e-5 --zero_mean_gradients --class_balanced_loss_beta 0.90 --feddecorr_coef 0.1 --final_eval_clients site-1 --name fedavgm_lr18_m0475_epochs7_clientlr0045_cm0925_wd5e4_eta00001625_mu3e5_zmg_cb090_sam00725_feddecorr01_w1	discard	client.py	FedDecorr coef 0.1 on active FedSAM/FedAvgM high-water stack [src: Shi23 FedDecorr arXiv:2210.00226]	/tmp/nvflare/simulation/fedavgm_lr18_m0475_epochs7_clientlr0045_cm0925_wd5e4_eta00001625_mu3e5_zmg_cb090_sam00725_feddecorr01_w1
30489a19a	0.916700	867	--n_clients 8 --num_rounds 20 --aggregation_epochs 7 --local_train_steps 0 --batch_size 64 --eval_batch_size 1024 --alpha 0.5 --seed 0 --model_arch moderate_cnn --max_model_params 5000000 --aggregator fedavgm --server_lr 1.8 --server_momentum 0.475 --lr 0.045 --momentum 0.925 --weight_decay 5e-4 --cosine_lr_eta_min_factor 0.0001625 --sam_rho 0.0725 --fedproxloss_mu 3e-5 --zero_mean_gradients --class_balanced_loss_beta 0.90 --lookahead_k 5 --lookahead_alpha 0.5 --final_eval_clients site-1 --name fedavgm_lr18_m0475_epochs7_clientlr0045_cm0925_wd5e4_eta00001625_mu3e5_zmg_cb090_sam00725_lookaheadk5a05_w1	discard	client.py	Lookahead k=5 alpha=0.5 on active FedSAM/FedAvgM high-water stack [src: Zhang19 Lookahead arXiv:1907.08610]	/tmp/nvflare/simulation/fedavgm_lr18_m0475_epochs7_clientlr0045_cm0925_wd5e4_eta00001625_mu3e5_zmg_cb090_sam00725_lookaheadk5a05_w1
76cb9cedb	0.923200	1066	--n_clients 8 --num_rounds 20 --aggregation_epochs 7 --local_train_steps 992 --batch_size 64 --eval_batch_size 1024 --alpha 0.5 --seed 0 --model_arch moderate_cnn --max_model_params 5000000 --aggregator fedavgm --server_lr 1.8 --server_momentum 0.475 --lr 0.045 --momentum 0.925 --weight_decay 5e-4 --cosine_lr_eta_min_factor 0.0001625 --sam_rho 0.0725 --fedproxloss_mu 3e-5 --zero_mean_gradients --class_balanced_loss_beta 0.90 --final_eval_clients site-1 --name fedavgm_lr18_m0475_steps992_clientlr0045_cm0925_wd5e4_eta00001625_mu3e5_zmg_cb090_sam00725_w1	discard	client.py	Post-literature exact local_train_steps 992 high-end local-compute probe under active high-water stack	/tmp/nvflare/simulation/fedavgm_lr18_m0475_steps992_clientlr0045_cm0925_wd5e4_eta00001625_mu3e5_zmg_cb090_sam00725_w1
5136fee8f	0.922000	1073	--n_clients 8 --num_rounds 20 --aggregation_epochs 7 --local_train_steps 1000 --batch_size 64 --eval_batch_size 1024 --alpha 0.5 --seed 0 --model_arch moderate_cnn --max_model_params 5000000 --aggregator fedavgm --server_lr 1.800390625 --server_momentum 0.47421875 --lr 0.045 --momentum 0.925 --weight_decay 5e-4 --cosine_lr_eta_min_factor 0.0001625 --sam_rho 0.0725 --fedproxloss_mu 3e-5 --zero_mean_gradients --class_balanced_loss_beta 0.90 --final_eval_clients site-1 --name fedavgm_lr1800390625_m047421875_steps1000_clientlr0045_cm0925_wd5e4_eta00001625_mu3e5_zmg_cb090_sam00725_combo_w1	discard	client.py	Post-literature combo exact local_train_steps 1000 with server_lr 1.800390625 server_momentum 0.47421875 near-miss stack	/tmp/nvflare/simulation/fedavgm_lr1800390625_m047421875_steps1000_clientlr0045_cm0925_wd5e4_eta00001625_mu3e5_zmg_cb090_sam00725_combo_w1
97a7a7559	0.923100	1077	--n_clients 8 --num_rounds 20 --aggregation_epochs 7 --local_train_steps 1000 --batch_size 64 --eval_batch_size 1024 --alpha 0.5 --seed 0 --model_arch moderate_cnn --max_model_params 5000000 --aggregator fedavgm --server_lr 1.8 --server_momentum 0.475 --lr 0.045 --momentum 0.92578125 --weight_decay 5e-4 --cosine_lr_eta_min_factor 0.0001625 --sam_rho 0.0725 --fedproxloss_mu 3e-5 --zero_mean_gradients --class_balanced_loss_beta 0.90 --final_eval_clients site-1 --name fedavgm_lr18_m0475_steps1000_clientlr0045_cm092578125_wd5e4_eta00001625_mu3e5_zmg_cb090_sam00725_combo_w1	discard	client.py	Post-literature combo exact local_train_steps 1000 with client momentum 0.92578125 near-miss stack	/tmp/nvflare/simulation/fedavgm_lr18_m0475_steps1000_clientlr0045_cm092578125_wd5e4_eta00001625_mu3e5_zmg_cb090_sam00725_combo_w1
e8809bb71	0.904500	858	--n_clients 8 --num_rounds 20 --aggregation_epochs 7 --local_train_steps 0 --batch_size 64 --eval_batch_size 1024 --alpha 0.5 --seed 0 --model_arch moderate_cnn --max_model_params 5000000 --aggregator weighted --lr 0.045 --momentum 0.925 --weight_decay 5e-4 --cosine_lr_eta_min_factor 0.0001625 --sam_rho 0.0725 --fedproxloss_mu 3e-5 --zero_mean_gradients --class_balanced_loss_beta 0.90 --final_eval_clients site-1 --name weighted_epochs7_clientlr0045_cm0925_wd5e4_eta00001625_mu3e5_zmg_cb090_sam00725_w1	discard	custom_aggregators.py	Post-literature weighted aggregator ablation under active FedSAM class-balanced high-water client stack	/tmp/nvflare/simulation/weighted_epochs7_clientlr0045_cm0925_wd5e4_eta00001625_mu3e5_zmg_cb090_sam00725_w1
1f2905b85	0.922900	860	--n_clients 8 --num_rounds 20 --aggregation_epochs 7 --local_train_steps 0 --batch_size 64 --eval_batch_size 1024 --alpha 0.5 --seed 0 --model_arch moderate_cnn --max_model_params 5000000 --aggregator fedavgm --server_lr 1.8001953125 --server_momentum 0.475 --lr 0.045 --momentum 0.925 --weight_decay 5e-4 --cosine_lr_eta_min_factor 0.0001625 --sam_rho 0.0725 --fedproxloss_mu 3e-5 --zero_mean_gradients --class_balanced_loss_beta 0.90 --final_eval_clients site-1 --name fedavgm_lr18001953125_m0475_epochs7_clientlr0045_cm0925_wd5e4_eta00001625_mu3e5_zmg_cb090_sam00725_w1	discard	custom_aggregators.py	Post-literature isolated server_lr 1.8001953125 half-step under active high-water stack	/tmp/nvflare/simulation/fedavgm_lr18001953125_m0475_epochs7_clientlr0045_cm0925_wd5e4_eta00001625_mu3e5_zmg_cb090_sam00725_w1
8369afa9a	0.923500	861	--n_clients 8 --num_rounds 20 --aggregation_epochs 7 --local_train_steps 0 --batch_size 64 --eval_batch_size 1024 --alpha 0.5 --seed 0 --model_arch moderate_cnn --max_model_params 5000000 --aggregator fedavgm --server_lr 1.8 --server_momentum 0.474609375 --lr 0.045 --momentum 0.925 --weight_decay 5e-4 --cosine_lr_eta_min_factor 0.0001625 --sam_rho 0.0725 --fedproxloss_mu 3e-5 --zero_mean_gradients --class_balanced_loss_beta 0.90 --final_eval_clients site-1 --name fedavgm_lr18_m0474609375_epochs7_clientlr0045_cm0925_wd5e4_eta00001625_mu3e5_zmg_cb090_sam00725_w1	discard	custom_aggregators.py	Post-literature isolated server_momentum 0.474609375 half-step under active high-water stack	/tmp/nvflare/simulation/fedavgm_lr18_m0474609375_epochs7_clientlr0045_cm0925_wd5e4_eta00001625_mu3e5_zmg_cb090_sam00725_w1
faaaefca4	0.920300	864	--n_clients 8 --num_rounds 20 --aggregation_epochs 7 --local_train_steps 0 --batch_size 64 --eval_batch_size 1024 --alpha 0.5 --seed 0 --model_arch moderate_cnn --max_model_params 5000000 --aggregator fedavgm --server_lr 1.8 --server_momentum 0.475 --lr 0.045078125 --momentum 0.925 --weight_decay 5e-4 --cosine_lr_eta_min_factor 0.0001625 --sam_rho 0.0725 --fedproxloss_mu 3e-5 --zero_mean_gradients --class_balanced_loss_beta 0.90 --final_eval_clients site-1 --name fedavgm_lr18_m0475_epochs7_clientlr0045078125_cm0925_wd5e4_eta00001625_mu3e5_zmg_cb090_sam00725_w1	discard	client.py	Post-literature very tight upper client lr 0.045078125 interpolation under active high-water stack	/tmp/nvflare/simulation/fedavgm_lr18_m0475_epochs7_clientlr0045078125_cm0925_wd5e4_eta00001625_mu3e5_zmg_cb090_sam00725_w1
3ee56afa9	0.922200	864	--n_clients 8 --num_rounds 20 --aggregation_epochs 7 --local_train_steps 0 --batch_size 64 --eval_batch_size 1024 --alpha 0.5 --seed 0 --model_arch moderate_cnn --max_model_params 5000000 --aggregator fedavgm --server_lr 1.8 --server_momentum 0.475 --lr 0.044921875 --momentum 0.925 --weight_decay 5e-4 --cosine_lr_eta_min_factor 0.0001625 --sam_rho 0.0725 --fedproxloss_mu 3e-5 --zero_mean_gradients --class_balanced_loss_beta 0.90 --final_eval_clients site-1 --name fedavgm_lr18_m0475_epochs7_clientlr0044921875_cm0925_wd5e4_eta00001625_mu3e5_zmg_cb090_sam00725_w1	discard	client.py	Post-literature very tight lower client lr 0.044921875 interpolation under active high-water stack	/tmp/nvflare/simulation/fedavgm_lr18_m0475_epochs7_clientlr0044921875_cm0925_wd5e4_eta00001625_mu3e5_zmg_cb090_sam00725_w1
516a05c6c	0.923100	861	--n_clients 8 --num_rounds 20 --aggregation_epochs 7 --local_train_steps 0 --batch_size 64 --eval_batch_size 1024 --alpha 0.5 --seed 0 --model_arch moderate_cnn --max_model_params 5000000 --aggregator fedavgm --server_lr 1.8 --server_momentum 0.475 --lr 0.045 --momentum 0.925 --weight_decay 5e-4 --cosine_lr_eta_min_factor 0.0001625 --sam_rho 0.07265625 --fedproxloss_mu 3e-5 --zero_mean_gradients --class_balanced_loss_beta 0.90 --final_eval_clients site-1 --name fedavgm_lr18_m0475_epochs7_clientlr0045_cm0925_wd5e4_eta00001625_mu3e5_zmg_cb090_sam007265625_w1	discard	client.py	Post-literature tight upper SAM rho 0.07265625 interpolation under active high-water stack	/tmp/nvflare/simulation/fedavgm_lr18_m0475_epochs7_clientlr0045_cm0925_wd5e4_eta00001625_mu3e5_zmg_cb090_sam007265625_w1
8d0ec58d2	0.921300	864	--n_clients 8 --num_rounds 20 --aggregation_epochs 7 --local_train_steps 0 --batch_size 64 --eval_batch_size 1024 --alpha 0.5 --seed 0 --model_arch moderate_cnn --max_model_params 5000000 --aggregator fedavgm --server_lr 1.8 --server_momentum 0.475 --lr 0.045 --momentum 0.925 --weight_decay 5e-4 --cosine_lr_eta_min_factor 0.0001625 --sam_rho 0.072421875 --fedproxloss_mu 3e-5 --zero_mean_gradients --class_balanced_loss_beta 0.90 --final_eval_clients site-1 --name fedavgm_lr18_m0475_epochs7_clientlr0045_cm0925_wd5e4_eta00001625_mu3e5_zmg_cb090_sam0072421875_w1	discard	client.py	Post-literature tight lower SAM rho 0.072421875 interpolation under active high-water stack	/tmp/nvflare/simulation/fedavgm_lr18_m0475_epochs7_clientlr0045_cm0925_wd5e4_eta00001625_mu3e5_zmg_cb090_sam0072421875_w1
fdd501d7d	0.923800	816	--n_clients 8 --num_rounds 20 --aggregation_epochs 7 --local_train_steps 0 --batch_size 64 --eval_batch_size 1024 --alpha 0.5 --seed 0 --model_arch moderate_cnn --max_model_params 5000000 --aggregator fedavgm --server_lr 1.8 --server_momentum 0.475 --lr 0.045 --momentum 0.925 --weight_decay 5e-4 --cosine_lr_eta_min_factor 0.0001625 --sam_rho 0.0725 --fedproxloss_mu 3e-5 --zero_mean_gradients --class_balanced_loss_beta 0.90 --no_deterministic_training --final_eval_clients site-1 --name fedavgm_lr18_m0475_epochs7_clientlr0045_cm0925_wd5e4_eta00001625_mu3e5_zmg_cb090_sam00725_nondet_w1	discard	client.py	Noisy subcampaign deterministic-off training on active FedSAM/FedAvgM high-water stack	/tmp/nvflare/simulation/fedavgm_lr18_m0475_epochs7_clientlr0045_cm0925_wd5e4_eta00001625_mu3e5_zmg_cb090_sam00725_nondet_w1
61ceacd63	0.000000	280	--n_clients 8 --num_rounds 20 --aggregation_epochs 7 --local_train_steps 0 --batch_size 64 --eval_batch_size 1024 --alpha 0.5 --seed 0 --model_arch moderate_cnn --max_model_params 5000000 --aggregator fedavgm --server_lr 1.8 --server_momentum 0.475 --lr 0.045 --momentum 0.925 --weight_decay 5e-4 --cosine_lr_eta_min_factor 0.0001625 --sam_rho 0.0725 --fedproxloss_mu 3e-5 --zero_mean_gradients --class_balanced_loss_beta 0.90 --rdrop_alpha 0.1 --final_eval_clients site-1 --name fedavgm_lr18_m0475_epochs7_clientlr0045_cm0925_wd5e4_eta00001625_mu3e5_zmg_cb090_sam00725_rdrop01_w1	crash	client.py	R-Drop alpha 0.1 on active FedSAM/FedAvgM high-water stack [src: Liang21 R-Drop NeurIPS]	/tmp/nvflare/simulation/fedavgm_lr18_m0475_epochs7_clientlr0045_cm0925_wd5e4_eta00001625_mu3e5_zmg_cb090_sam00725_rdrop01_w1
b59b72128	0.906600	846	--n_clients 8 --num_rounds 20 --aggregation_epochs 7 --local_train_steps 0 --batch_size 64 --eval_batch_size 1024 --alpha 0.5 --seed 0 --model_arch moderate_cnn --max_model_params 5000000 --aggregator fedavgm --server_lr 1.8 --server_momentum 0.475 --lr 0.045 --momentum 0.925 --weight_decay 5e-4 --cosine_lr_eta_min_factor 0.0001625 --sam_rho 0.0725 --fedproxloss_mu 3e-5 --class_balanced_loss_beta 0.90 --final_eval_clients site-1 --name fedavgm_lr18_m0475_epochs7_clientlr0045_cm0925_wd5e4_eta00001625_mu3e5_cb090_sam00725_nozmg_w1	discard	client.py	Post-literature zero-mean-gradient off ablation under active FedSAM/FedAvgM high-water stack	/tmp/nvflare/simulation/fedavgm_lr18_m0475_epochs7_clientlr0045_cm0925_wd5e4_eta00001625_mu3e5_cb090_sam00725_nozmg_w1
eeb454097	0.912500	480	--n_clients 8 --num_rounds 20 --aggregation_epochs 7 --local_train_steps 0 --batch_size 64 --eval_batch_size 1024 --alpha 0.5 --seed 0 --model_arch moderate_cnn --max_model_params 5000000 --aggregator fedavgm --server_lr 1.8 --server_momentum 0.475 --lr 0.045 --momentum 0.925 --weight_decay 5e-4 --cosine_lr_eta_min_factor 0.0001625 --fedproxloss_mu 3e-5 --zero_mean_gradients --class_balanced_loss_beta 0.90 --final_eval_clients site-1 --name fedavgm_lr18_m0475_epochs7_clientlr0045_cm0925_wd5e4_eta00001625_mu3e5_zmg_cb090_nosam_w1	discard	client.py	Post-literature SAM off ablation under active FedAvgM cosine-floor high-water stack	/tmp/nvflare/simulation/fedavgm_lr18_m0475_epochs7_clientlr0045_cm0925_wd5e4_eta00001625_mu3e5_zmg_cb090_nosam_w1
2982c4f75	0.920000	858	--n_clients 8 --num_rounds 20 --aggregation_epochs 7 --local_train_steps 0 --batch_size 64 --eval_batch_size 1024 --alpha 0.5 --seed 0 --model_arch moderate_cnn --max_model_params 5000000 --aggregator fedavgm --server_lr 1.8 --server_momentum 0.475 --lr 0.045 --momentum 0.925 --weight_decay 5e-4 --cosine_lr_eta_min_factor 0.0001625 --sam_rho 0.0725 --fedproxloss_mu 3e-5 --zero_mean_gradients --final_eval_clients site-1 --name fedavgm_lr18_m0475_epochs7_clientlr0045_cm0925_wd5e4_eta00001625_mu3e5_zmg_sam00725_nocb_w1	discard	client.py	Post-literature class-balanced loss off ablation under active FedSAM/FedAvgM high-water stack	/tmp/nvflare/simulation/fedavgm_lr18_m0475_epochs7_clientlr0045_cm0925_wd5e4_eta00001625_mu3e5_zmg_sam00725_nocb_w1
9cf7e1cb6	0.802400	861	--n_clients 8 --num_rounds 20 --aggregation_epochs 7 --local_train_steps 0 --batch_size 64 --eval_batch_size 1024 --alpha 0.5 --seed 0 --model_arch moderate_cnn --max_model_params 5000000 --aggregator fedavgm --server_lr 1.8 --server_momentum 0.475 --lr 0.045 --momentum 0.925 --weight_decay 5e-4 --no_lr_scheduler --sam_rho 0.0725 --fedproxloss_mu 3e-5 --zero_mean_gradients --class_balanced_loss_beta 0.90 --final_eval_clients site-1 --name fedavgm_lr18_m0475_epochs7_clientlr0045_cm0925_wd5e4_nosched_mu3e5_zmg_cb090_sam00725_w1	discard	client.py	Post-literature scheduler off ablation under active FedSAM/FedAvgM cosine-floor high-water stack	/tmp/nvflare/simulation/fedavgm_lr18_m0475_epochs7_clientlr0045_cm0925_wd5e4_nosched_mu3e5_zmg_cb090_sam00725_w1
29a04989a	0.901600	858	--n_clients 8 --num_rounds 20 --aggregation_epochs 7 --local_train_steps 0 --batch_size 64 --eval_batch_size 1024 --alpha 0.5 --seed 0 --model_arch moderate_cnn --max_model_params 5000000 --aggregator fedavg --lr 0.045 --momentum 0.925 --weight_decay 5e-4 --cosine_lr_eta_min_factor 0.0001625 --sam_rho 0.0725 --fedproxloss_mu 3e-5 --zero_mean_gradients --class_balanced_loss_beta 0.90 --final_eval_clients site-1 --name fedavg_epochs7_clientlr0045_cm0925_wd5e4_eta00001625_mu3e5_zmg_cb090_sam00725_w1	discard	custom_aggregators.py	Post-literature FedAvg aggregator ablation under active FedSAM class-balanced high-water client stack	/tmp/nvflare/simulation/fedavg_epochs7_clientlr0045_cm0925_wd5e4_eta00001625_mu3e5_zmg_cb090_sam00725_w1
ced2612ec	0.917400	864	--n_clients 8 --num_rounds 20 --aggregation_epochs 7 --local_train_steps 0 --batch_size 64 --eval_batch_size 1024 --alpha 0.5 --seed 0 --model_arch moderate_cnn --max_model_params 5000000 --aggregator fedavgm --server_lr 1.8 --server_momentum 0.0 --lr 0.045 --momentum 0.925 --weight_decay 5e-4 --cosine_lr_eta_min_factor 0.0001625 --sam_rho 0.0725 --fedproxloss_mu 3e-5 --zero_mean_gradients --class_balanced_loss_beta 0.90 --final_eval_clients site-1 --name fedavgm_lr18_m0_epochs7_clientlr0045_cm0925_wd5e4_eta00001625_mu3e5_zmg_cb090_sam00725_w1	discard	custom_aggregators.py	Post-literature FedAvgM zero server momentum ablation under active FedSAM class-balanced high-water stack	/tmp/nvflare/simulation/fedavgm_lr18_m0_epochs7_clientlr0045_cm0925_wd5e4_eta00001625_mu3e5_zmg_cb090_sam00725_w1
ab2f97f9f	0.920900	864	--n_clients 8 --num_rounds 20 --aggregation_epochs 7 --local_train_steps 0 --batch_size 64 --eval_batch_size 1024 --alpha 0.5 --seed 0 --model_arch moderate_cnn --max_model_params 5000000 --aggregator fedavgm --server_lr 1.8 --server_momentum 0.55 --lr 0.045 --momentum 0.925 --weight_decay 5e-4 --cosine_lr_eta_min_factor 0.0001625 --sam_rho 0.0725 --fedproxloss_mu 3e-5 --zero_mean_gradients --class_balanced_loss_beta 0.90 --final_eval_clients site-1 --name fedavgm_lr18_m055_epochs7_clientlr0045_cm0925_wd5e4_eta00001625_mu3e5_zmg_cb090_sam00725_w1	discard	custom_aggregators.py	Post-literature broad upper FedAvgM server momentum 0.55 probe under active FedSAM high-water stack	/tmp/nvflare/simulation/fedavgm_lr18_m055_epochs7_clientlr0045_cm0925_wd5e4_eta00001625_mu3e5_zmg_cb090_sam00725_w1
088c0934e	0.922500	855	--n_clients 8 --num_rounds 20 --aggregation_epochs 7 --local_train_steps 0 --batch_size 64 --eval_batch_size 1024 --alpha 0.5 --seed 0 --model_arch moderate_cnn --max_model_params 5000000 --aggregator fedavgm --server_lr 1.8 --server_momentum 0.4 --lr 0.045 --momentum 0.925 --weight_decay 5e-4 --cosine_lr_eta_min_factor 0.0001625 --sam_rho 0.0725 --fedproxloss_mu 3e-5 --zero_mean_gradients --class_balanced_loss_beta 0.90 --final_eval_clients site-1 --name fedavgm_lr18_m04_epochs7_clientlr0045_cm0925_wd5e4_eta00001625_mu3e5_zmg_cb090_sam00725_w1	discard	custom_aggregators.py	Post-literature broad lower FedAvgM server momentum 0.4 probe under active FedSAM high-water stack	/tmp/nvflare/simulation/fedavgm_lr18_m04_epochs7_clientlr0045_cm0925_wd5e4_eta00001625_mu3e5_zmg_cb090_sam00725_w1
c80a12a35	0.920500	861	--n_clients 8 --num_rounds 20 --aggregation_epochs 7 --local_train_steps 0 --batch_size 64 --eval_batch_size 1024 --alpha 0.5 --seed 0 --model_arch moderate_cnn --max_model_params 5000000 --aggregator fedavgm --server_lr 2.0 --server_momentum 0.475 --lr 0.045 --momentum 0.925 --weight_decay 5e-4 --cosine_lr_eta_min_factor 0.0001625 --sam_rho 0.0725 --fedproxloss_mu 3e-5 --zero_mean_gradients --class_balanced_loss_beta 0.90 --final_eval_clients site-1 --name fedavgm_lr20_m0475_epochs7_clientlr0045_cm0925_wd5e4_eta00001625_mu3e5_zmg_cb090_sam00725_w1	discard	custom_aggregators.py	Post-literature broad upper FedAvgM server lr 2.0 probe under active FedSAM high-water stack	/tmp/nvflare/simulation/fedavgm_lr20_m0475_epochs7_clientlr0045_cm0925_wd5e4_eta00001625_mu3e5_zmg_cb090_sam00725_w1
c78d3ec14	0.921400	857	--n_clients 8 --num_rounds 20 --aggregation_epochs 7 --local_train_steps 0 --batch_size 64 --eval_batch_size 1024 --alpha 0.5 --seed 0 --model_arch moderate_cnn --max_model_params 5000000 --aggregator fedavgm --server_lr 1.6 --server_momentum 0.475 --lr 0.045 --momentum 0.925 --weight_decay 5e-4 --cosine_lr_eta_min_factor 0.0001625 --sam_rho 0.0725 --fedproxloss_mu 3e-5 --zero_mean_gradients --class_balanced_loss_beta 0.90 --final_eval_clients site-1 --name fedavgm_lr16_m0475_epochs7_clientlr0045_cm0925_wd5e4_eta00001625_mu3e5_zmg_cb090_sam00725_w1	discard	custom_aggregators.py	Post-literature broad lower FedAvgM server lr 1.6 probe under active FedSAM high-water stack	/tmp/nvflare/simulation/fedavgm_lr16_m0475_epochs7_clientlr0045_cm0925_wd5e4_eta00001625_mu3e5_zmg_cb090_sam00725_w1
a2c1a9266	0.922300	861	--n_clients 8 --num_rounds 20 --aggregation_epochs 7 --local_train_steps 0 --batch_size 64 --eval_batch_size 1024 --alpha 0.5 --seed 0 --model_arch moderate_cnn --max_model_params 5000000 --aggregator fedavgm --server_lr 1.8 --server_momentum 0.475 --lr 0.04 --momentum 0.925 --weight_decay 5e-4 --cosine_lr_eta_min_factor 0.0001625 --sam_rho 0.0725 --fedproxloss_mu 3e-5 --zero_mean_gradients --class_balanced_loss_beta 0.90 --final_eval_clients site-1 --name fedavgm_lr18_m0475_epochs7_clientlr004_cm0925_wd5e4_eta00001625_mu3e5_zmg_cb090_sam00725_w1	discard	client.py	Post-literature broad lower client lr 0.04 probe under active FedSAM/FedAvgM high-water stack	/tmp/nvflare/simulation/fedavgm_lr18_m0475_epochs7_clientlr004_cm0925_wd5e4_eta00001625_mu3e5_zmg_cb090_sam00725_w1
1984bc34b	0.922600	864	--n_clients 8 --num_rounds 20 --aggregation_epochs 7 --local_train_steps 0 --batch_size 64 --eval_batch_size 1024 --alpha 0.5 --seed 0 --model_arch moderate_cnn --max_model_params 5000000 --aggregator fedavgm --server_lr 1.8 --server_momentum 0.475 --lr 0.05 --momentum 0.925 --weight_decay 5e-4 --cosine_lr_eta_min_factor 0.0001625 --sam_rho 0.0725 --fedproxloss_mu 3e-5 --zero_mean_gradients --class_balanced_loss_beta 0.90 --final_eval_clients site-1 --name fedavgm_lr18_m0475_epochs7_clientlr005_cm0925_wd5e4_eta00001625_mu3e5_zmg_cb090_sam00725_w1	discard	client.py	Post-literature broad upper client lr 0.05 probe under active FedSAM/FedAvgM high-water stack	/tmp/nvflare/simulation/fedavgm_lr18_m0475_epochs7_clientlr005_cm0925_wd5e4_eta00001625_mu3e5_zmg_cb090_sam00725_w1
