commit	score	runtime_seconds	budget	status	target	description	artifacts
f7f8fbd87	0.898500	567	--n_clients 8 --num_rounds 20 --aggregation_epochs 7 --local_train_steps 0 --batch_size 64 --eval_batch_size 1024 --alpha 0.5 --seed 0 --model_arch moderate_cnn --max_model_params 5000000 --aggregator fedavgm --server_lr 1.8 --server_momentum 0.45 --lr 0.04 --momentum 0.925 --weight_decay 4e-4 --cosine_lr_eta_min_factor 0.005 --final_eval_clients site-1 --name fedavgm_lr18_m045_epochs7_clientlr004_cm0925_wd4e4_eta0005	discard	client.py	Weight decay retune 4e-4 with server momentum 0.45 eta_min_factor 0.005	/tmp/nvflare/simulation/fedavgm_lr18_m045_epochs7_clientlr004_cm0925_wd4e4_eta0005
a79187d21	0.897200	480	--n_clients 8 --num_rounds 20 --aggregation_epochs 6 --local_train_steps 0 --batch_size 64 --eval_batch_size 1024 --alpha 0.5 --seed 0 --model_arch moderate_cnn --max_model_params 5000000 --aggregator fedavgm --server_lr 1.8 --server_momentum 0.45 --lr 0.04 --momentum 0.925 --weight_decay 5e-4 --cosine_lr_eta_min_factor 0.005 --final_eval_clients site-1 --name fedavgm_lr18_m045_epochs6_clientlr004_cm0925_wd5e4_eta0005	discard	client.py	Aggregation epochs retune 6 with server momentum 0.45 eta_min_factor 0.005	/tmp/nvflare/simulation/fedavgm_lr18_m045_epochs6_clientlr004_cm0925_wd5e4_eta0005
a79187d21	0.886600	553	--n_clients 8 --num_rounds 20 --aggregation_epochs 8 --local_train_steps 0 --batch_size 64 --eval_batch_size 1024 --alpha 0.5 --seed 0 --model_arch moderate_cnn --max_model_params 5000000 --aggregator fedavgm --server_lr 1.8 --server_momentum 0.45 --lr 0.04 --momentum 0.925 --weight_decay 5e-4 --cosine_lr_eta_min_factor 0.005 --final_eval_clients site-1 --name fedavgm_lr18_m045_epochs8_clientlr004_cm0925_wd5e4_eta0005	discard	client.py	Aggregation epochs retune 8 with server momentum 0.45 eta_min_factor 0.005	/tmp/nvflare/simulation/fedavgm_lr18_m045_epochs8_clientlr004_cm0925_wd5e4_eta0005
cec743dae	0.897300	741	--n_clients 8 --num_rounds 20 --aggregation_epochs 7 --local_train_steps 0 --batch_size 64 --eval_batch_size 1024 --alpha 0.5 --seed 0 --model_arch moderate_cnn --max_model_params 5000000 --aggregator fedavgm --server_lr 1.8 --server_momentum 0.45 --lr 0.04 --momentum 0.925 --weight_decay 5e-4 --cosine_lr_eta_min_factor 0.005 --fedproxloss_mu 3e-6 --final_eval_clients site-1 --name fedavgm_lr18_m045_epochs7_clientlr004_cm0925_wd5e4_eta0005_mu3e6	discard	client.py	FedProx mu 3e-6 with server momentum 0.45 eta_min_factor 0.005 [src: Li20 FedProx]	/tmp/nvflare/simulation/fedavgm_lr18_m045_epochs7_clientlr004_cm0925_wd5e4_eta0005_mu3e6
cec743dae	0.901200	741	--n_clients 8 --num_rounds 20 --aggregation_epochs 7 --local_train_steps 0 --batch_size 64 --eval_batch_size 1024 --alpha 0.5 --seed 0 --model_arch moderate_cnn --max_model_params 5000000 --aggregator fedavgm --server_lr 1.8 --server_momentum 0.45 --lr 0.04 --momentum 0.925 --weight_decay 5e-4 --cosine_lr_eta_min_factor 0.005 --fedproxloss_mu 3e-5 --final_eval_clients site-1 --name fedavgm_lr18_m045_epochs7_clientlr004_cm0925_wd5e4_eta0005_mu3e5	discard	client.py	FedProx mu 3e-5 with server momentum 0.45 eta_min_factor 0.005 [src: Li20 FedProx]	/tmp/nvflare/simulation/fedavgm_lr18_m045_epochs7_clientlr004_cm0925_wd5e4_eta0005_mu3e5
33cf36250	0.895100	549	--n_clients 8 --num_rounds 20 --aggregation_epochs 7 --local_train_steps 0 --batch_size 64 --eval_batch_size 1024 --alpha 0.5 --seed 0 --model_arch moderate_cnn --max_model_params 5000000 --aggregator fedavgm --server_lr 1.75 --server_momentum 0.45 --lr 0.04 --momentum 0.925 --weight_decay 5e-4 --cosine_lr_eta_min_factor 0.005 --final_eval_clients site-1 --name fedavgm_lr175_m045_epochs7_clientlr004_cm0925_wd5e4_eta0005	discard	custom_aggregators.py	Server lr retune 1.75 with server momentum 0.45 eta_min_factor 0.005	/tmp/nvflare/simulation/fedavgm_lr175_m045_epochs7_clientlr004_cm0925_wd5e4_eta0005
33cf36250	0.899700	544	--n_clients 8 --num_rounds 20 --aggregation_epochs 7 --local_train_steps 0 --batch_size 64 --eval_batch_size 1024 --alpha 0.5 --seed 0 --model_arch moderate_cnn --max_model_params 5000000 --aggregator fedavgm --server_lr 1.85 --server_momentum 0.45 --lr 0.04 --momentum 0.925 --weight_decay 5e-4 --cosine_lr_eta_min_factor 0.005 --final_eval_clients site-1 --name fedavgm_lr185_m045_epochs7_clientlr004_cm0925_wd5e4_eta0005	discard	custom_aggregators.py	Server lr retune 1.85 with server momentum 0.45 eta_min_factor 0.005	/tmp/nvflare/simulation/fedavgm_lr185_m045_epochs7_clientlr004_cm0925_wd5e4_eta0005
9d0103edf	0.894100	417	--n_clients 8 --num_rounds 20 --aggregation_epochs 7 --local_train_steps 512 --batch_size 64 --eval_batch_size 1024 --alpha 0.5 --seed 0 --model_arch moderate_cnn --max_model_params 5000000 --aggregator fedavgm --server_lr 1.8 --server_momentum 0.45 --lr 0.04 --momentum 0.925 --weight_decay 5e-4 --cosine_lr_eta_min_factor 0.005 --final_eval_clients site-1 --name fedavgm_lr18_m045_steps512_clientlr004_cm0925_wd5e4_eta0005	discard	client.py	Exact local_train_steps 512 with server momentum 0.45 eta_min_factor 0.005	/tmp/nvflare/simulation/fedavgm_lr18_m045_steps512_clientlr004_cm0925_wd5e4_eta0005
9d0103edf	0.893500	463	--n_clients 8 --num_rounds 20 --aggregation_epochs 7 --local_train_steps 640 --batch_size 64 --eval_batch_size 1024 --alpha 0.5 --seed 0 --model_arch moderate_cnn --max_model_params 5000000 --aggregator fedavgm --server_lr 1.8 --server_momentum 0.45 --lr 0.04 --momentum 0.925 --weight_decay 5e-4 --cosine_lr_eta_min_factor 0.005 --final_eval_clients site-1 --name fedavgm_lr18_m045_steps640_clientlr004_cm0925_wd5e4_eta0005	discard	client.py	Exact local_train_steps 640 with server momentum 0.45 eta_min_factor 0.005	/tmp/nvflare/simulation/fedavgm_lr18_m045_steps640_clientlr004_cm0925_wd5e4_eta0005
3dfb41bc2	0.900200	567	--n_clients 8 --num_rounds 20 --aggregation_epochs 7 --local_train_steps 0 --batch_size 64 --eval_batch_size 1024 --alpha 0.5 --seed 0 --model_arch moderate_cnn --max_model_params 5000000 --aggregator fedavgm --server_lr 1.8 --server_momentum 0.45 --lr 0.04 --momentum 0.925 --weight_decay 5e-4 --cosine_lr_eta_min_factor 0.0075 --final_eval_clients site-1 --name fedavgm_lr18_m045_epochs7_clientlr004_cm0925_wd5e4_eta00075	discard	client.py	Scheduler eta_min_factor 0.0075 with server momentum 0.45 current best stack	/tmp/nvflare/simulation/fedavgm_lr18_m045_epochs7_clientlr004_cm0925_wd5e4_eta00075
3dfb41bc2	0.900000	568	--n_clients 8 --num_rounds 20 --aggregation_epochs 7 --local_train_steps 0 --batch_size 64 --eval_batch_size 1024 --alpha 0.5 --seed 0 --model_arch moderate_cnn --max_model_params 5000000 --aggregator fedavgm --server_lr 1.8 --server_momentum 0.45 --lr 0.04 --momentum 0.925 --weight_decay 5e-4 --cosine_lr_eta_min_factor 0.0025 --final_eval_clients site-1 --name fedavgm_lr18_m045_epochs7_clientlr004_cm0925_wd5e4_eta00025	discard	client.py	Scheduler eta_min_factor 0.0025 with server momentum 0.45 current best stack	/tmp/nvflare/simulation/fedavgm_lr18_m045_epochs7_clientlr004_cm0925_wd5e4_eta00025
77f29c8f7	0.897200	565	--n_clients 8 --num_rounds 20 --aggregation_epochs 7 --local_train_steps 0 --batch_size 64 --eval_batch_size 1024 --alpha 0.5 --seed 0 --model_arch moderate_cnn --max_model_params 5000000 --aggregator fedavgm --server_lr 1.8 --server_momentum 0.445 --lr 0.04 --momentum 0.925 --weight_decay 5e-4 --cosine_lr_eta_min_factor 0.005 --final_eval_clients site-1 --name fedavgm_lr18_m0445_epochs7_clientlr004_cm0925_wd5e4_eta0005	discard	custom_aggregators.py	Micro server momentum retune 0.445 around eta_min_factor 0.005 best	/tmp/nvflare/simulation/fedavgm_lr18_m0445_epochs7_clientlr004_cm0925_wd5e4_eta0005
77f29c8f7	0.897600	568	--n_clients 8 --num_rounds 20 --aggregation_epochs 7 --local_train_steps 0 --batch_size 64 --eval_batch_size 1024 --alpha 0.5 --seed 0 --model_arch moderate_cnn --max_model_params 5000000 --aggregator fedavgm --server_lr 1.8 --server_momentum 0.455 --lr 0.04 --momentum 0.925 --weight_decay 5e-4 --cosine_lr_eta_min_factor 0.005 --final_eval_clients site-1 --name fedavgm_lr18_m0455_epochs7_clientlr004_cm0925_wd5e4_eta0005	discard	custom_aggregators.py	Micro server momentum retune 0.455 around eta_min_factor 0.005 best	/tmp/nvflare/simulation/fedavgm_lr18_m0455_epochs7_clientlr004_cm0925_wd5e4_eta0005
9f18f36a5	0.764500	554	--n_clients 8 --num_rounds 20 --aggregation_epochs 7 --local_train_steps 0 --batch_size 64 --eval_batch_size 1024 --alpha 0.5 --seed 0 --model_arch moderate_cnn --max_model_params 5000000 --aggregator median --lr 0.04 --momentum 0.925 --weight_decay 5e-4 --cosine_lr_eta_min_factor 0.005 --final_eval_clients site-1 --name median_epochs7_clientlr004_cm0925_wd5e4_eta0005	discard	custom_aggregators.py	Aggregator axis robust median with current best client schedule	/tmp/nvflare/simulation/median_epochs7_clientlr004_cm0925_wd5e4_eta0005
9f18f36a5	0.876400	561	--n_clients 8 --num_rounds 20 --aggregation_epochs 7 --local_train_steps 0 --batch_size 64 --eval_batch_size 1024 --alpha 0.5 --seed 0 --model_arch moderate_cnn --max_model_params 5000000 --aggregator fedavg --lr 0.04 --momentum 0.925 --weight_decay 5e-4 --cosine_lr_eta_min_factor 0.005 --final_eval_clients site-1 --name fedavg_epochs7_clientlr004_cm0925_wd5e4_eta0005	discard	custom_aggregators.py	Aggregator axis explicit FedAvg with current best client schedule	/tmp/nvflare/simulation/fedavg_epochs7_clientlr004_cm0925_wd5e4_eta0005
81b21d750	0.893900	564	--n_clients 8 --num_rounds 20 --aggregation_epochs 7 --local_train_steps 0 --batch_size 64 --eval_batch_size 1024 --alpha 0.5 --seed 0 --model_arch moderate_cnn --max_model_params 5000000 --aggregator fedavgm --server_lr 1.8 --server_momentum 0.45 --lr 0.04 --momentum 0.93125 --weight_decay 5e-4 --cosine_lr_eta_min_factor 0.005 --final_eval_clients site-1 --name fedavgm_lr18_m045_epochs7_clientlr004_cm093125_wd5e4_eta0005	discard	client.py	Fine client momentum retune 0.93125 with server momentum 0.45 eta_min_factor 0.005	/tmp/nvflare/simulation/fedavgm_lr18_m045_epochs7_clientlr004_cm093125_wd5e4_eta0005
81b21d750	0.896400	567	--n_clients 8 --num_rounds 20 --aggregation_epochs 7 --local_train_steps 0 --batch_size 64 --eval_batch_size 1024 --alpha 0.5 --seed 0 --model_arch moderate_cnn --max_model_params 5000000 --aggregator fedavgm --server_lr 1.8 --server_momentum 0.45 --lr 0.04 --momentum 0.91875 --weight_decay 5e-4 --cosine_lr_eta_min_factor 0.005 --final_eval_clients site-1 --name fedavgm_lr18_m045_epochs7_clientlr004_cm091875_wd5e4_eta0005	discard	client.py	Fine client momentum retune 0.91875 with server momentum 0.45 eta_min_factor 0.005	/tmp/nvflare/simulation/fedavgm_lr18_m045_epochs7_clientlr004_cm091875_wd5e4_eta0005
e29c80a31	0.895900	567	--n_clients 8 --num_rounds 20 --aggregation_epochs 7 --local_train_steps 0 --batch_size 64 --eval_batch_size 1024 --alpha 0.5 --seed 0 --model_arch moderate_cnn --max_model_params 5000000 --aggregator fedavgm --server_lr 1.8 --server_momentum 0.45 --lr 0.04 --momentum 0.925 --weight_decay 5e-4 --cosine_lr_eta_min_factor 0.001 --final_eval_clients site-1 --name fedavgm_lr18_m045_epochs7_clientlr004_cm0925_wd5e4_eta0001	discard	client.py	Scheduler eta_min_factor 0.001 with server momentum 0.45 current best stack	/tmp/nvflare/simulation/fedavgm_lr18_m045_epochs7_clientlr004_cm0925_wd5e4_eta0001
e29c80a31	0.897400	567	--n_clients 8 --num_rounds 20 --aggregation_epochs 7 --local_train_steps 0 --batch_size 64 --eval_batch_size 1024 --alpha 0.5 --seed 0 --model_arch moderate_cnn --max_model_params 5000000 --aggregator fedavgm --server_lr 1.8 --server_momentum 0.45 --lr 0.04 --momentum 0.925 --weight_decay 5e-4 --cosine_lr_eta_min_factor 0.01 --final_eval_clients site-1 --name fedavgm_lr18_m045_epochs7_clientlr004_cm0925_wd5e4_eta001	discard	client.py	Scheduler eta_min_factor 0.01 with server momentum 0.45 current best stack	/tmp/nvflare/simulation/fedavgm_lr18_m045_epochs7_clientlr004_cm0925_wd5e4_eta001
b76e8776a	0.901900	677	--n_clients 8 --num_rounds 20 --aggregation_epochs 7 --local_train_steps 0 --batch_size 64 --eval_batch_size 1024 --alpha 0.5 --seed 0 --model_arch moderate_cnn --max_model_params 5000000 --aggregator fedavgm --server_lr 1.8 --server_momentum 0.45 --lr 0.04 --momentum 0.925 --weight_decay 5e-4 --cosine_lr_eta_min_factor 0.005 --fedproxloss_mu 1e-6 --final_eval_clients site-1 --name fedavgm_lr18_m045_epochs7_clientlr004_cm0925_wd5e4_eta0005_mu1e6	discard	client.py	FedProx mu 1e-6 with server momentum 0.45 eta_min_factor 0.005 [src: Li20 FedProx]	/tmp/nvflare/simulation/fedavgm_lr18_m045_epochs7_clientlr004_cm0925_wd5e4_eta0005_mu1e6
b76e8776a	0.899600	683	--n_clients 8 --num_rounds 20 --aggregation_epochs 7 --local_train_steps 0 --batch_size 64 --eval_batch_size 1024 --alpha 0.5 --seed 0 --model_arch moderate_cnn --max_model_params 5000000 --aggregator fedavgm --server_lr 1.8 --server_momentum 0.45 --lr 0.04 --momentum 0.925 --weight_decay 5e-4 --cosine_lr_eta_min_factor 0.005 --fedproxloss_mu 1e-4 --final_eval_clients site-1 --name fedavgm_lr18_m045_epochs7_clientlr004_cm0925_wd5e4_eta0005_mu1e4	discard	client.py	FedProx mu 1e-4 with server momentum 0.45 eta_min_factor 0.005 [src: Li20 FedProx]	/tmp/nvflare/simulation/fedavgm_lr18_m045_epochs7_clientlr004_cm0925_wd5e4_eta0005_mu1e4
89740ca8e	0.742500	558	--n_clients 8 --num_rounds 20 --aggregation_epochs 7 --local_train_steps 0 --batch_size 64 --eval_batch_size 1024 --alpha 0.5 --seed 0 --model_arch moderate_cnn --max_model_params 5000000 --aggregator fedavgm --server_lr 1.8 --server_momentum 0.45 --lr 0.04 --momentum 0.925 --weight_decay 5e-4 --no_lr_scheduler --final_eval_clients site-1 --name fedavgm_lr18_m045_epochs7_clientlr004_cm0925_wd5e4_nosched	discard	client.py	Scheduler off with server momentum 0.45 current best stack	/tmp/nvflare/simulation/fedavgm_lr18_m045_epochs7_clientlr004_cm0925_wd5e4_nosched
89740ca8e	0.902300	552	--n_clients 8 --num_rounds 20 --aggregation_epochs 7 --local_train_steps 0 --batch_size 64 --eval_batch_size 1024 --alpha 0.5 --seed 0 --model_arch moderate_cnn --max_model_params 5000000 --aggregator fedavgm --server_lr 1.8 --server_momentum 0.45 --lr 0.04 --momentum 0.925 --weight_decay 5e-4 --cosine_lr_eta_min_factor 0.0001 --final_eval_clients site-1 --name fedavgm_lr18_m045_epochs7_clientlr004_cm0925_wd5e4_eta00001	discard	client.py	Scheduler eta_min_factor 0.0001 with server momentum 0.45 current best stack	/tmp/nvflare/simulation/fedavgm_lr18_m045_epochs7_clientlr004_cm0925_wd5e4_eta00001
6237b3ee7		490	literature_loop	literature	templates/literature_loop.md	literature review: row 141 plateau after optimizer and scheduler nulls; selected update clipping and global self-distillation	templates/literature_loop.md
a835bc09d	0.903400	558	--n_clients 8 --num_rounds 20 --aggregation_epochs 7 --local_train_steps 0 --batch_size 64 --eval_batch_size 1024 --alpha 0.5 --seed 0 --model_arch moderate_cnn --max_model_params 5000000 --aggregator fedavgm --server_lr 1.8 --server_momentum 0.45 --lr 0.04 --momentum 0.925 --weight_decay 5e-4 --cosine_lr_eta_min_factor 0.005 --update_clip_norm 45 --final_eval_clients site-1 --name fedavgm_lr18_m045_epochs7_clientlr004_cm0925_wd5e4_eta0005_clip45	discard	custom_aggregators.py	Update clipping norm 45 with current FedAvgM best stack [src: Zhang21 clipping arXiv:2106.13673]	/tmp/nvflare/simulation/fedavgm_lr18_m045_epochs7_clientlr004_cm0925_wd5e4_eta0005_clip45
a835bc09d	0.901000	621	--n_clients 8 --num_rounds 20 --aggregation_epochs 7 --local_train_steps 0 --batch_size 64 --eval_batch_size 1024 --alpha 0.5 --seed 0 --model_arch moderate_cnn --max_model_params 5000000 --aggregator fedavgm --server_lr 1.8 --server_momentum 0.45 --lr 0.04 --momentum 0.925 --weight_decay 5e-4 --cosine_lr_eta_min_factor 0.005 --global_distill_alpha 0.05 --global_distill_temperature 2.0 --final_eval_clients site-1 --name fedavgm_lr18_m045_epochs7_clientlr004_cm0925_wd5e4_eta0005_gdistill005_t2	discard	client.py	Global self-distillation alpha 0.05 T2 with current FedAvgM best stack [src: Yashwanth24 ASD arXiv:2305.19600]	/tmp/nvflare/simulation/fedavgm_lr18_m045_epochs7_clientlr004_cm0925_wd5e4_eta0005_gdistill005_t2
69585a520	0.899400	567	--n_clients 8 --num_rounds 20 --aggregation_epochs 7 --local_train_steps 0 --batch_size 64 --eval_batch_size 1024 --alpha 0.5 --seed 0 --model_arch moderate_cnn --max_model_params 5000000 --aggregator fedavgm --server_lr 1.79 --server_momentum 0.45 --lr 0.04 --momentum 0.925 --weight_decay 5e-4 --cosine_lr_eta_min_factor 0.005 --final_eval_clients site-1 --name fedavgm_lr179_m045_epochs7_clientlr004_cm0925_wd5e4_eta0005	discard	custom_aggregators.py	Server lr micro 1.79 after literature reset with current best FedAvgM stack	/tmp/nvflare/simulation/fedavgm_lr179_m045_epochs7_clientlr004_cm0925_wd5e4_eta0005
69585a520	0.899500	567	--n_clients 8 --num_rounds 20 --aggregation_epochs 7 --local_train_steps 0 --batch_size 64 --eval_batch_size 1024 --alpha 0.5 --seed 0 --model_arch moderate_cnn --max_model_params 5000000 --aggregator fedavgm --server_lr 1.81 --server_momentum 0.45 --lr 0.04 --momentum 0.925 --weight_decay 5e-4 --cosine_lr_eta_min_factor 0.005 --final_eval_clients site-1 --name fedavgm_lr181_m045_epochs7_clientlr004_cm0925_wd5e4_eta0005	discard	custom_aggregators.py	Server lr micro 1.81 after literature reset with current best FedAvgM stack	/tmp/nvflare/simulation/fedavgm_lr181_m045_epochs7_clientlr004_cm0925_wd5e4_eta0005
b675cbeaf	0.903300	567	--n_clients 8 --num_rounds 20 --aggregation_epochs 7 --local_train_steps 0 --batch_size 64 --eval_batch_size 1024 --alpha 0.5 --seed 0 --model_arch moderate_cnn --max_model_params 5000000 --aggregator fedavgm --server_lr 1.8 --server_momentum 0.45 --lr 0.04 --momentum 0.9125 --weight_decay 5e-4 --cosine_lr_eta_min_factor 0.0001 --final_eval_clients site-1 --name fedavgm_lr18_m045_epochs7_clientlr004_cm09125_wd5e4_eta00001	discard	client.py	Client momentum 0.9125 under eta_min_factor 0.0001 near-miss scheduler base	/tmp/nvflare/simulation/fedavgm_lr18_m045_epochs7_clientlr004_cm09125_wd5e4_eta00001
b675cbeaf	0.901100	567	--n_clients 8 --num_rounds 20 --aggregation_epochs 7 --local_train_steps 0 --batch_size 64 --eval_batch_size 1024 --alpha 0.5 --seed 0 --model_arch moderate_cnn --max_model_params 5000000 --aggregator fedavgm --server_lr 1.8 --server_momentum 0.45 --lr 0.04 --momentum 0.90 --weight_decay 5e-4 --cosine_lr_eta_min_factor 0.0001 --final_eval_clients site-1 --name fedavgm_lr18_m045_epochs7_clientlr004_cm09_wd5e4_eta00001	discard	client.py	Client momentum 0.90 under eta_min_factor 0.0001 near-miss scheduler base	/tmp/nvflare/simulation/fedavgm_lr18_m045_epochs7_clientlr004_cm09_wd5e4_eta00001
aabbc4203	0.896300	567	--n_clients 8 --num_rounds 20 --aggregation_epochs 7 --local_train_steps 0 --batch_size 64 --eval_batch_size 1024 --alpha 0.5 --seed 0 --model_arch moderate_cnn --max_model_params 5000000 --aggregator fedavgm --server_lr 1.8 --server_momentum 0.45 --lr 0.04 --momentum 0.90625 --weight_decay 5e-4 --cosine_lr_eta_min_factor 0.0001 --final_eval_clients site-1 --name fedavgm_lr18_m045_epochs7_clientlr004_cm090625_wd5e4_eta00001	discard	client.py	Client momentum 0.90625 under eta_min_factor 0.0001 near 0.9125 near-miss	/tmp/nvflare/simulation/fedavgm_lr18_m045_epochs7_clientlr004_cm090625_wd5e4_eta00001
aabbc4203	0.900200	567	--n_clients 8 --num_rounds 20 --aggregation_epochs 7 --local_train_steps 0 --batch_size 64 --eval_batch_size 1024 --alpha 0.5 --seed 0 --model_arch moderate_cnn --max_model_params 5000000 --aggregator fedavgm --server_lr 1.8 --server_momentum 0.45 --lr 0.04 --momentum 0.91875 --weight_decay 5e-4 --cosine_lr_eta_min_factor 0.0001 --final_eval_clients site-1 --name fedavgm_lr18_m045_epochs7_clientlr004_cm091875_wd5e4_eta00001	discard	client.py	Client momentum 0.91875 under eta_min_factor 0.0001 near 0.9125 near-miss	/tmp/nvflare/simulation/fedavgm_lr18_m045_epochs7_clientlr004_cm091875_wd5e4_eta00001
9ac840607	0.901700	690	--n_clients 8 --num_rounds 20 --aggregation_epochs 7 --local_train_steps 896 --batch_size 64 --eval_batch_size 1024 --alpha 0.5 --seed 0 --model_arch moderate_cnn --max_model_params 5000000 --aggregator fedavgm --server_lr 1.8 --server_momentum 0.45 --lr 0.04 --momentum 0.925 --weight_decay 5e-4 --cosine_lr_eta_min_factor 0.005 --final_eval_clients site-1 --name fedavgm_lr18_m045_steps896_clientlr004_cm0925_wd5e4_eta0005	discard	client.py	Exact local_train_steps 896 with current FedAvgM best optimizer stack	/tmp/nvflare/simulation/fedavgm_lr18_m045_steps896_clientlr004_cm0925_wd5e4_eta0005
9ac840607	0.897300	726	--n_clients 8 --num_rounds 20 --aggregation_epochs 7 --local_train_steps 1000 --batch_size 64 --eval_batch_size 1024 --alpha 0.5 --seed 0 --model_arch moderate_cnn --max_model_params 5000000 --aggregator fedavgm --server_lr 1.8 --server_momentum 0.45 --lr 0.04 --momentum 0.925 --weight_decay 5e-4 --cosine_lr_eta_min_factor 0.005 --final_eval_clients site-1 --name fedavgm_lr18_m045_steps1000_clientlr004_cm0925_wd5e4_eta0005	discard	client.py	Exact local_train_steps 1000 with current FedAvgM best optimizer stack	/tmp/nvflare/simulation/fedavgm_lr18_m045_steps1000_clientlr004_cm0925_wd5e4_eta0005
e2e965168	0.904100	739	--n_clients 8 --num_rounds 20 --aggregation_epochs 7 --local_train_steps 0 --batch_size 64 --eval_batch_size 1024 --alpha 0.5 --seed 0 --model_arch moderate_cnn --max_model_params 5000000 --aggregator fedavgm --server_lr 1.8 --server_momentum 0.45 --lr 0.04 --momentum 0.925 --weight_decay 5e-4 --cosine_lr_eta_min_factor 0.0001 --fedproxloss_mu 3e-5 --final_eval_clients site-1 --name fedavgm_lr18_m045_epochs7_clientlr004_cm0925_wd5e4_eta00001_mu3e5	keep	client.py	FedProx mu 3e-5 under eta_min_factor 0.0001 near-miss scheduler base [src: Li20 FedProx]	/tmp/nvflare/simulation/fedavgm_lr18_m045_epochs7_clientlr004_cm0925_wd5e4_eta00001_mu3e5
