commit	score	runtime_seconds	budget	status	target	description	artifacts
7b42f2756	0.921200	867	--n_clients 8 --num_rounds 20 --aggregation_epochs 7 --local_train_steps 0 --batch_size 64 --eval_batch_size 1024 --alpha 0.5 --seed 0 --model_arch moderate_cnn --max_model_params 5000000 --aggregator fedavgm --server_lr 1.796875 --server_momentum 0.475 --lr 0.045 --momentum 0.925 --weight_decay 4.75e-4 --cosine_lr_eta_min_factor 0.00015 --sam_rho 0.0725 --fedproxloss_mu 2.75e-5 --zero_mean_gradients --class_balanced_loss_beta 0.90 --final_eval_clients site-1 --name fedavgm_lr1796875_m0475_epochs7_clientlr0045_cm0925_wd475e6_eta000015_mu275e7_zmg_cb090_sam00725_w1	discard	client.py	Lower FedProx mu 2.75e-5 on lower server lr 1.796875 and lower weight decay 4.75e-4 near-miss FedSAM/FedAvgM stack	/tmp/nvflare/simulation/fedavgm_lr1796875_m0475_epochs7_clientlr0045_cm0925_wd475e6_eta000015_mu275e7_zmg_cb090_sam00725_w1
965c1b1df		341	literature_loop	literature	templates/literature_loop.md	literature review: FedSAM/FedAvgM scalar plateau; selected gradient-norm SAM blend P1	templates/literature_loop.md
b6ed71508	0.922100	879	--n_clients 8 --num_rounds 20 --aggregation_epochs 7 --local_train_steps 0 --batch_size 64 --eval_batch_size 1024 --alpha 0.5 --seed 0 --model_arch moderate_cnn --max_model_params 5000000 --aggregator fedavgm --server_lr 1.8 --server_momentum 0.475 --lr 0.045 --momentum 0.925 --weight_decay 5e-4 --cosine_lr_eta_min_factor 0.00015 --sam_rho 0.0725 --sam_blend 0.5 --fedproxloss_mu 3e-5 --zero_mean_gradients --class_balanced_loss_beta 0.90 --final_eval_clients site-1 --name fedavgm_lr18_m0475_epochs7_clientlr0045_cm0925_wd5e4_eta000015_mu3e5_zmg_cb090_sam00725_blend050_w1	discard	client.py	Gradient-norm SAM blend 0.5 on active FedSAM/FedAvgM high-water stack [src: Zhao22 GNP; Sun23 FedSpeed]	/tmp/nvflare/simulation/fedavgm_lr18_m0475_epochs7_clientlr0045_cm0925_wd5e4_eta000015_mu3e5_zmg_cb090_sam00725_blend050_w1
1c18c3bf7	0.919200	879	--n_clients 8 --num_rounds 20 --aggregation_epochs 7 --local_train_steps 0 --batch_size 64 --eval_batch_size 1024 --alpha 0.5 --seed 0 --model_arch moderate_cnn --max_model_params 5000000 --aggregator fedavgm --server_lr 1.8 --server_momentum 0.475 --lr 0.045 --momentum 0.925 --weight_decay 5e-4 --cosine_lr_eta_min_factor 0.00015 --sam_rho 0.0725 --sam_blend 0.75 --fedproxloss_mu 3e-5 --zero_mean_gradients --class_balanced_loss_beta 0.90 --final_eval_clients site-1 --name fedavgm_lr18_m0475_epochs7_clientlr0045_cm0925_wd5e4_eta000015_mu3e5_zmg_cb090_sam00725_blend075_w1	discard	client.py	Gradient-norm SAM blend 0.75 on active FedSAM/FedAvgM high-water stack [src: Zhao22 GNP; Sun23 FedSpeed]	/tmp/nvflare/simulation/fedavgm_lr18_m0475_epochs7_clientlr0045_cm0925_wd5e4_eta000015_mu3e5_zmg_cb090_sam00725_blend075_w1
8a653e711	0.000000	167	--n_clients 8 --num_rounds 20 --aggregation_epochs 7 --local_train_steps 0 --batch_size 64 --eval_batch_size 1024 --alpha 0.5 --seed 0 --model_arch moderate_cnn --max_model_params 5000000 --aggregator fedexp --server_lr 3.0 --fedexp_epsilon 1e-12 --lr 0.045 --momentum 0.925 --weight_decay 5e-4 --cosine_lr_eta_min_factor 0.00015 --sam_rho 0.0725 --fedproxloss_mu 3e-5 --zero_mean_gradients --class_balanced_loss_beta 0.90 --final_eval_clients site-1 --name fedexp_cap3_epochs7_clientlr0045_cm0925_wd5e4_eta000015_mu3e5_zmg_cb090_sam00725_w1	crash	custom_aggregators.py	FedExP adaptive server step cap 3.0 on active FedSAM stack [src: Jhunjhunwala23 FedExP]	/tmp/nvflare/simulation/fedexp_cap3_epochs7_clientlr0045_cm0925_wd5e4_eta000015_mu3e5_zmg_cb090_sam00725_w1
6498a485e	0.917200	858	--n_clients 8 --num_rounds 20 --aggregation_epochs 7 --local_train_steps 0 --batch_size 64 --eval_batch_size 1024 --alpha 0.5 --seed 0 --model_arch moderate_cnn --max_model_params 5000000 --aggregator fedexp --server_lr 1.8 --fedexp_epsilon 1e-12 --lr 0.045 --momentum 0.925 --weight_decay 5e-4 --cosine_lr_eta_min_factor 0.00015 --sam_rho 0.0725 --fedproxloss_mu 3e-5 --zero_mean_gradients --class_balanced_loss_beta 0.90 --final_eval_clients site-1 --name fedexp_cap18_epochs7_clientlr0045_cm0925_wd5e4_eta000015_mu3e5_zmg_cb090_sam00725_w1	discard	custom_aggregators.py	FedExP adaptive server step cap 1.8 on active FedSAM stack after cap3 NaN [src: Jhunjhunwala23 FedExP]	/tmp/nvflare/simulation/fedexp_cap18_epochs7_clientlr0045_cm0925_wd5e4_eta000015_mu3e5_zmg_cb090_sam00725_w1
b7e5d258b	0.920000	1089	--n_clients 8 --num_rounds 20 --aggregation_epochs 9 --local_train_steps 0 --batch_size 64 --eval_batch_size 1024 --alpha 0.5 --seed 0 --model_arch moderate_cnn --max_model_params 5000000 --aggregator fedavgm --server_lr 1.8 --server_momentum 0.475 --lr 0.045 --momentum 0.925 --weight_decay 5e-4 --cosine_lr_eta_min_factor 0.00015 --sam_rho 0.0725 --fedproxloss_mu 3e-5 --zero_mean_gradients --class_balanced_loss_beta 0.90 --final_eval_clients site-1 --name fedavgm_lr18_m0475_epochs9_clientlr0045_cm0925_wd5e4_eta000015_mu3e5_zmg_cb090_sam00725_w1	discard	client.py	Aggregation epochs 9 higher local-compute extension on active FedSAM/FedAvgM high-water stack	/tmp/nvflare/simulation/fedavgm_lr18_m0475_epochs9_clientlr0045_cm0925_wd5e4_eta000015_mu3e5_zmg_cb090_sam00725_w1
0ad6bf589	0.921800	865	--n_clients 8 --num_rounds 20 --aggregation_epochs 7 --local_train_steps 0 --batch_size 64 --eval_batch_size 1024 --alpha 0.5 --seed 0 --model_arch moderate_cnn --max_model_params 5000000 --aggregator fedavgm --server_lr 1.8 --server_momentum 0.475 --lr 0.045 --momentum 0.925 --weight_decay 5e-4 --cosine_lr_eta_min_factor 0.00015 --sam_rho 0.0728125 --fedproxloss_mu 3e-5 --zero_mean_gradients --class_balanced_loss_beta 0.90 --final_eval_clients site-1 --name fedavgm_lr18_m0475_epochs7_clientlr0045_cm0925_wd5e4_eta000015_mu3e5_zmg_cb090_sam00728125_w1	discard	client.py	Tight upper SAM rho 0.0728125 interpolation on active FedSAM/FedAvgM high-water stack	/tmp/nvflare/simulation/fedavgm_lr18_m0475_epochs7_clientlr0045_cm0925_wd5e4_eta000015_mu3e5_zmg_cb090_sam00728125_w1
a0f2e4aba	0.923500	863	--n_clients 8 --num_rounds 20 --aggregation_epochs 7 --local_train_steps 0 --batch_size 64 --eval_batch_size 1024 --alpha 0.5 --seed 0 --model_arch moderate_cnn --max_model_params 5000000 --aggregator fedavgm --server_lr 1.8 --server_momentum 0.475 --lr 0.045 --momentum 0.925 --weight_decay 5e-4 --cosine_lr_eta_min_factor 0.00015 --sam_rho 0.0721875 --fedproxloss_mu 3e-5 --zero_mean_gradients --class_balanced_loss_beta 0.90 --final_eval_clients site-1 --name fedavgm_lr18_m0475_epochs7_clientlr0045_cm0925_wd5e4_eta000015_mu3e5_zmg_cb090_sam00721875_w1	discard	client.py	Tight lower SAM rho 0.0721875 interpolation on active FedSAM/FedAvgM high-water stack	/tmp/nvflare/simulation/fedavgm_lr18_m0475_epochs7_clientlr0045_cm0925_wd5e4_eta000015_mu3e5_zmg_cb090_sam00721875_w1
d34b3820c	0.919200	864	--n_clients 8 --num_rounds 20 --aggregation_epochs 7 --local_train_steps 0 --batch_size 64 --eval_batch_size 1024 --alpha 0.5 --seed 0 --model_arch moderate_cnn --max_model_params 5000000 --aggregator fedavgm --server_lr 1.8 --server_momentum 0.475 --lr 0.045 --momentum 0.925 --weight_decay 5e-4 --cosine_lr_eta_min_factor 0.00015 --sam_rho 0.07234375 --fedproxloss_mu 3e-5 --zero_mean_gradients --class_balanced_loss_beta 0.90 --final_eval_clients site-1 --name fedavgm_lr18_m0475_epochs7_clientlr0045_cm0925_wd5e4_eta000015_mu3e5_zmg_cb090_sam007234375_w1	discard	client.py	Lower-mid SAM rho 0.07234375 interpolation on active FedSAM/FedAvgM high-water stack	/tmp/nvflare/simulation/fedavgm_lr18_m0475_epochs7_clientlr0045_cm0925_wd5e4_eta000015_mu3e5_zmg_cb090_sam007234375_w1
a20df3159	0.921400	859	--n_clients 8 --num_rounds 20 --aggregation_epochs 7 --local_train_steps 0 --batch_size 64 --eval_batch_size 1024 --alpha 0.5 --seed 0 --model_arch moderate_cnn --max_model_params 5000000 --aggregator fedavgm --server_lr 1.7984375 --server_momentum 0.475 --lr 0.045 --momentum 0.925 --weight_decay 5e-4 --cosine_lr_eta_min_factor 0.00015 --sam_rho 0.0725 --fedproxloss_mu 3e-5 --zero_mean_gradients --class_balanced_loss_beta 0.90 --final_eval_clients site-1 --name fedavgm_lr17984375_m0475_epochs7_clientlr0045_cm0925_wd5e4_eta000015_mu3e5_zmg_cb090_sam00725_w1	discard	custom_aggregators.py	Lower-mid server_lr 1.7984375 interpolation on active FedSAM/FedAvgM high-water stack	/tmp/nvflare/simulation/fedavgm_lr17984375_m0475_epochs7_clientlr0045_cm0925_wd5e4_eta000015_mu3e5_zmg_cb090_sam00725_w1
66ac948e5	0.922900	855	--n_clients 8 --num_rounds 20 --aggregation_epochs 7 --local_train_steps 0 --batch_size 64 --eval_batch_size 1024 --alpha 0.5 --seed 0 --model_arch moderate_cnn --max_model_params 5000000 --aggregator fedavgm --server_lr 1.8 --server_momentum 0.475 --lr 0.045 --momentum 0.925 --weight_decay 5e-4 --cosine_lr_eta_min_factor 0.00015 --sam_rho 0.0725 --fedproxloss_mu 2.875e-5 --zero_mean_gradients --class_balanced_loss_beta 0.90 --final_eval_clients site-1 --name fedavgm_lr18_m0475_epochs7_clientlr0045_cm0925_wd5e4_eta000015_mu2875e8_zmg_cb090_sam00725_w1	discard	client.py	Tight lower FedProx mu 2.875e-5 interpolation on active FedSAM/FedAvgM high-water stack	/tmp/nvflare/simulation/fedavgm_lr18_m0475_epochs7_clientlr0045_cm0925_wd5e4_eta000015_mu2875e8_zmg_cb090_sam00725_w1
69db19ef3	0.919000	863	--n_clients 8 --num_rounds 20 --aggregation_epochs 7 --local_train_steps 0 --batch_size 64 --eval_batch_size 1024 --alpha 0.5 --seed 0 --model_arch moderate_cnn --max_model_params 5000000 --aggregator fedavgm --server_lr 1.8 --server_momentum 0.475 --lr 0.045 --momentum 0.925 --weight_decay 5e-4 --cosine_lr_eta_min_factor 0.00015 --sam_rho 0.0725 --fedproxloss_mu 3.125e-5 --zero_mean_gradients --class_balanced_loss_beta 0.90 --final_eval_clients site-1 --name fedavgm_lr18_m0475_epochs7_clientlr0045_cm0925_wd5e4_eta000015_mu3125e8_zmg_cb090_sam00725_w1	discard	client.py	Tight upper FedProx mu 3.125e-5 interpolation on active FedSAM/FedAvgM high-water stack	/tmp/nvflare/simulation/fedavgm_lr18_m0475_epochs7_clientlr0045_cm0925_wd5e4_eta000015_mu3125e8_zmg_cb090_sam00725_w1
369b6a6c7	0.920100	858	--n_clients 8 --num_rounds 20 --aggregation_epochs 7 --local_train_steps 0 --batch_size 64 --eval_batch_size 1024 --alpha 0.5 --seed 0 --model_arch moderate_cnn --max_model_params 5000000 --aggregator fedavgm --server_lr 1.8 --server_momentum 0.475 --lr 0.045 --momentum 0.925 --weight_decay 5e-4 --cosine_lr_eta_min_factor 0.00015 --sam_rho 0.0725 --fedproxloss_mu 3e-5 --zero_mean_gradients --class_balanced_loss_beta 0.9015625 --final_eval_clients site-1 --name fedavgm_lr18_m0475_epochs7_clientlr0045_cm0925_wd5e4_eta000015_mu3e5_zmg_cb09015625_sam00725_w1	discard	client.py	Tight upper class-balanced beta 0.9015625 interpolation on active FedSAM/FedAvgM high-water stack	/tmp/nvflare/simulation/fedavgm_lr18_m0475_epochs7_clientlr0045_cm0925_wd5e4_eta000015_mu3e5_zmg_cb09015625_sam00725_w1
3faa0c779	0.921900	864	--n_clients 8 --num_rounds 20 --aggregation_epochs 7 --local_train_steps 0 --batch_size 64 --eval_batch_size 1024 --alpha 0.5 --seed 0 --model_arch moderate_cnn --max_model_params 5000000 --aggregator fedavgm --server_lr 1.80078125 --server_momentum 0.475 --lr 0.045 --momentum 0.925 --weight_decay 5e-4 --cosine_lr_eta_min_factor 0.00015 --sam_rho 0.0725 --fedproxloss_mu 3e-5 --zero_mean_gradients --class_balanced_loss_beta 0.90 --final_eval_clients site-1 --name fedavgm_lr180078125_m0475_epochs7_clientlr0045_cm0925_wd5e4_eta000015_mu3e5_zmg_cb090_sam00725_w1	discard	custom_aggregators.py	Tight upper server_lr 1.80078125 interpolation on active FedSAM/FedAvgM high-water stack	/tmp/nvflare/simulation/fedavgm_lr180078125_m0475_epochs7_clientlr0045_cm0925_wd5e4_eta000015_mu3e5_zmg_cb090_sam00725_w1
ab031ef6f	0.918500	862	--n_clients 8 --num_rounds 20 --aggregation_epochs 7 --local_train_steps 0 --batch_size 64 --eval_batch_size 1024 --alpha 0.5 --seed 0 --model_arch moderate_cnn --max_model_params 5000000 --aggregator fedavgm --server_lr 1.8 --server_momentum 0.475 --lr 0.045 --momentum 0.925 --weight_decay 5e-4 --cosine_lr_eta_min_factor 0.00015 --sam_rho 0.0725 --fedproxloss_mu 3e-5 --zero_mean_gradients --class_balanced_loss_beta 0.896875 --final_eval_clients site-1 --name fedavgm_lr18_m0475_epochs7_clientlr0045_cm0925_wd5e4_eta000015_mu3e5_zmg_cb0896875_sam00725_w1	discard	client.py	Tight lower class-balanced beta 0.896875 interpolation on active FedSAM/FedAvgM high-water stack	/tmp/nvflare/simulation/fedavgm_lr18_m0475_epochs7_clientlr0045_cm0925_wd5e4_eta000015_mu3e5_zmg_cb0896875_sam00725_w1
efa4e67bf	0.922300	857	--n_clients 8 --num_rounds 20 --aggregation_epochs 7 --local_train_steps 0 --batch_size 64 --eval_batch_size 1024 --alpha 0.5 --seed 0 --model_arch moderate_cnn --max_model_params 5000000 --aggregator fedavgm --server_lr 1.8 --server_momentum 0.475 --lr 0.045 --momentum 0.925 --weight_decay 4.875e-4 --cosine_lr_eta_min_factor 0.00015 --sam_rho 0.0725 --fedproxloss_mu 3e-5 --zero_mean_gradients --class_balanced_loss_beta 0.90 --final_eval_clients site-1 --name fedavgm_lr18_m0475_epochs7_clientlr0045_cm0925_wd4875e7_eta000015_mu3e5_zmg_cb090_sam00725_w1	discard	client.py	Tight lower weight decay 4.875e-4 interpolation on active FedSAM/FedAvgM high-water stack	/tmp/nvflare/simulation/fedavgm_lr18_m0475_epochs7_clientlr0045_cm0925_wd4875e7_eta000015_mu3e5_zmg_cb090_sam00725_w1
cacdff691	0.921000	858	--n_clients 8 --num_rounds 20 --aggregation_epochs 7 --local_train_steps 0 --batch_size 64 --eval_batch_size 1024 --alpha 0.5 --seed 0 --model_arch moderate_cnn --max_model_params 5000000 --aggregator fedavgm --server_lr 1.8 --server_momentum 0.475 --lr 0.045 --momentum 0.925 --weight_decay 5e-4 --cosine_lr_eta_min_factor 0.000125 --sam_rho 0.0725 --fedproxloss_mu 3e-5 --zero_mean_gradients --class_balanced_loss_beta 0.90 --final_eval_clients site-1 --name fedavgm_lr18_m0475_epochs7_clientlr0045_cm0925_wd5e4_eta0000125_mu3e5_zmg_cb090_sam00725_w1	discard	client.py	Tight lower cosine floor 0.000125 interpolation on active FedSAM/FedAvgM high-water stack	/tmp/nvflare/simulation/fedavgm_lr18_m0475_epochs7_clientlr0045_cm0925_wd5e4_eta0000125_mu3e5_zmg_cb090_sam00725_w1
7e3434df7	0.918300	860	--n_clients 8 --num_rounds 20 --aggregation_epochs 7 --local_train_steps 0 --batch_size 64 --eval_batch_size 1024 --alpha 0.5 --seed 0 --model_arch moderate_cnn --max_model_params 5000000 --aggregator fedavgm --server_lr 1.8 --server_momentum 0.475 --lr 0.045 --momentum 0.925 --weight_decay 5.125e-4 --cosine_lr_eta_min_factor 0.00015 --sam_rho 0.0725 --fedproxloss_mu 3e-5 --zero_mean_gradients --class_balanced_loss_beta 0.90 --final_eval_clients site-1 --name fedavgm_lr18_m0475_epochs7_clientlr0045_cm0925_wd5125e7_eta000015_mu3e5_zmg_cb090_sam00725_w1	discard	client.py	Tight upper weight decay 5.125e-4 interpolation on active FedSAM/FedAvgM high-water stack	/tmp/nvflare/simulation/fedavgm_lr18_m0475_epochs7_clientlr0045_cm0925_wd5125e7_eta000015_mu3e5_zmg_cb090_sam00725_w1
eaaac2107	0.924300	864	--n_clients 8 --num_rounds 20 --aggregation_epochs 7 --local_train_steps 0 --batch_size 64 --eval_batch_size 1024 --alpha 0.5 --seed 0 --model_arch moderate_cnn --max_model_params 5000000 --aggregator fedavgm --server_lr 1.8 --server_momentum 0.475 --lr 0.045 --momentum 0.925 --weight_decay 5e-4 --cosine_lr_eta_min_factor 0.000175 --sam_rho 0.0725 --fedproxloss_mu 3e-5 --zero_mean_gradients --class_balanced_loss_beta 0.90 --final_eval_clients site-1 --name fedavgm_lr18_m0475_epochs7_clientlr0045_cm0925_wd5e4_eta0000175_mu3e5_zmg_cb090_sam00725_w1	discard	client.py	Tight upper cosine floor 0.000175 interpolation on active FedSAM/FedAvgM high-water stack	/tmp/nvflare/simulation/fedavgm_lr18_m0475_epochs7_clientlr0045_cm0925_wd5e4_eta0000175_mu3e5_zmg_cb090_sam00725_w1
b1db3dd29	0.925800	858	--n_clients 8 --num_rounds 20 --aggregation_epochs 7 --local_train_steps 0 --batch_size 64 --eval_batch_size 1024 --alpha 0.5 --seed 0 --model_arch moderate_cnn --max_model_params 5000000 --aggregator fedavgm --server_lr 1.8 --server_momentum 0.475 --lr 0.045 --momentum 0.925 --weight_decay 5e-4 --cosine_lr_eta_min_factor 0.0001625 --sam_rho 0.0725 --fedproxloss_mu 3e-5 --zero_mean_gradients --class_balanced_loss_beta 0.90 --final_eval_clients site-1 --name fedavgm_lr18_m0475_epochs7_clientlr0045_cm0925_wd5e4_eta00001625_mu3e5_zmg_cb090_sam00725_w1	keep	client.py	Very tight upper cosine floor 0.0001625 interpolation on active FedSAM/FedAvgM high-water stack	/tmp/nvflare/simulation/fedavgm_lr18_m0475_epochs7_clientlr0045_cm0925_wd5e4_eta00001625_mu3e5_zmg_cb090_sam00725_w1
3e364ed1d	0.920400	865	--n_clients 8 --num_rounds 20 --aggregation_epochs 7 --local_train_steps 0 --batch_size 64 --eval_batch_size 1024 --alpha 0.5 --seed 0 --model_arch moderate_cnn --max_model_params 5000000 --aggregator fedavgm --server_lr 1.8 --server_momentum 0.475 --lr 0.045 --momentum 0.925 --weight_decay 5e-4 --cosine_lr_eta_min_factor 0.00015625 --sam_rho 0.0725 --fedproxloss_mu 3e-5 --zero_mean_gradients --class_balanced_loss_beta 0.90 --final_eval_clients site-1 --name fedavgm_lr18_m0475_epochs7_clientlr0045_cm0925_wd5e4_eta000015625_mu3e5_zmg_cb090_sam00725_w1	discard	client.py	Post-improvement lower cosine floor 0.00015625 interpolation on active FedSAM/FedAvgM high-water stack	/tmp/nvflare/simulation/fedavgm_lr18_m0475_epochs7_clientlr0045_cm0925_wd5e4_eta000015625_mu3e5_zmg_cb090_sam00725_w1
27598a6c2	0.918400	864	--n_clients 8 --num_rounds 20 --aggregation_epochs 7 --local_train_steps 0 --batch_size 64 --eval_batch_size 1024 --alpha 0.5 --seed 0 --model_arch moderate_cnn --max_model_params 5000000 --aggregator fedavgm --server_lr 1.8 --server_momentum 0.475 --lr 0.045 --momentum 0.925 --weight_decay 5e-4 --cosine_lr_eta_min_factor 0.00016875 --sam_rho 0.0725 --fedproxloss_mu 3e-5 --zero_mean_gradients --class_balanced_loss_beta 0.90 --final_eval_clients site-1 --name fedavgm_lr18_m0475_epochs7_clientlr0045_cm0925_wd5e4_eta000016875_mu3e5_zmg_cb090_sam00725_w1	discard	client.py	Post-improvement upper cosine floor 0.00016875 interpolation on active FedSAM/FedAvgM high-water stack	/tmp/nvflare/simulation/fedavgm_lr18_m0475_epochs7_clientlr0045_cm0925_wd5e4_eta000016875_mu3e5_zmg_cb090_sam00725_w1
6057ea2ef	0.923800	861	--n_clients 8 --num_rounds 20 --aggregation_epochs 7 --local_train_steps 0 --batch_size 64 --eval_batch_size 1024 --alpha 0.5 --seed 0 --model_arch moderate_cnn --max_model_params 5000000 --aggregator fedavgm --server_lr 1.8 --server_momentum 0.47421875 --lr 0.045 --momentum 0.925 --weight_decay 5e-4 --cosine_lr_eta_min_factor 0.0001625 --sam_rho 0.0725 --fedproxloss_mu 3e-5 --zero_mean_gradients --class_balanced_loss_beta 0.90 --final_eval_clients site-1 --name fedavgm_lr18_m047421875_epochs7_clientlr0045_cm0925_wd5e4_eta00001625_mu3e5_zmg_cb090_sam00725_w1	discard	client.py	Post-improvement lower FedAvgM server momentum 0.47421875 interpolation on active cosine-floor high-water stack	/tmp/nvflare/simulation/fedavgm_lr18_m047421875_epochs7_clientlr0045_cm0925_wd5e4_eta00001625_mu3e5_zmg_cb090_sam00725_w1
ef7533c21	0.923100	863	--n_clients 8 --num_rounds 20 --aggregation_epochs 7 --local_train_steps 0 --batch_size 64 --eval_batch_size 1024 --alpha 0.5 --seed 0 --model_arch moderate_cnn --max_model_params 5000000 --aggregator fedavgm --server_lr 1.8 --server_momentum 0.47578125 --lr 0.045 --momentum 0.925 --weight_decay 5e-4 --cosine_lr_eta_min_factor 0.0001625 --sam_rho 0.0725 --fedproxloss_mu 3e-5 --zero_mean_gradients --class_balanced_loss_beta 0.90 --final_eval_clients site-1 --name fedavgm_lr18_m047578125_epochs7_clientlr0045_cm0925_wd5e4_eta00001625_mu3e5_zmg_cb090_sam00725_w1	discard	client.py	Post-improvement upper FedAvgM server momentum 0.47578125 interpolation on active cosine-floor high-water stack	/tmp/nvflare/simulation/fedavgm_lr18_m047578125_epochs7_clientlr0045_cm0925_wd5e4_eta00001625_mu3e5_zmg_cb090_sam00725_w1
e14fc2d6c	0.921300	862	--n_clients 8 --num_rounds 20 --aggregation_epochs 7 --local_train_steps 0 --batch_size 64 --eval_batch_size 1024 --alpha 0.5 --seed 0 --model_arch moderate_cnn --max_model_params 5000000 --aggregator fedavgm --server_lr 1.8 --server_momentum 0.475 --lr 0.045 --momentum 0.92421875 --weight_decay 5e-4 --cosine_lr_eta_min_factor 0.0001625 --sam_rho 0.0725 --fedproxloss_mu 3e-5 --zero_mean_gradients --class_balanced_loss_beta 0.90 --final_eval_clients site-1 --name fedavgm_lr18_m0475_epochs7_clientlr0045_cm092421875_wd5e4_eta00001625_mu3e5_zmg_cb090_sam00725_w1	discard	client.py	Post-improvement lower client momentum 0.92421875 interpolation on active cosine-floor high-water stack	/tmp/nvflare/simulation/fedavgm_lr18_m0475_epochs7_clientlr0045_cm092421875_wd5e4_eta00001625_mu3e5_zmg_cb090_sam00725_w1
38d43256a	0.925700	861	--n_clients 8 --num_rounds 20 --aggregation_epochs 7 --local_train_steps 0 --batch_size 64 --eval_batch_size 1024 --alpha 0.5 --seed 0 --model_arch moderate_cnn --max_model_params 5000000 --aggregator fedavgm --server_lr 1.8 --server_momentum 0.475 --lr 0.045 --momentum 0.92578125 --weight_decay 5e-4 --cosine_lr_eta_min_factor 0.0001625 --sam_rho 0.0725 --fedproxloss_mu 3e-5 --zero_mean_gradients --class_balanced_loss_beta 0.90 --final_eval_clients site-1 --name fedavgm_lr18_m0475_epochs7_clientlr0045_cm092578125_wd5e4_eta00001625_mu3e5_zmg_cb090_sam00725_w1	discard	client.py	Post-improvement upper client momentum 0.92578125 interpolation on active cosine-floor high-water stack	/tmp/nvflare/simulation/fedavgm_lr18_m0475_epochs7_clientlr0045_cm092578125_wd5e4_eta00001625_mu3e5_zmg_cb090_sam00725_w1
