commit	score	runtime_seconds	budget	status	target	description	artifacts
326e4ba37	0.911600	612	--n_clients 8 --num_rounds 20 --aggregation_epochs 7 --local_train_steps 0 --batch_size 64 --eval_batch_size 1024 --alpha 0.5 --seed 0 --model_arch moderate_cnn_norm --max_model_params 5000000 --aggregator fedavgm --server_lr 1.8 --server_momentum 0.475 --lr 0.045 --momentum 0.925 --weight_decay 5e-4 --cosine_lr_eta_min_factor 0.00015 --fedproxloss_mu 3e-5 --zero_mean_gradients --class_balanced_loss_beta 0.90 --final_eval_clients site-1 --name archsub_moderate_cnn_norm_fedavgm_lr18_m0475_epochs7_cb090_w1	discard	model.py	Architecture subcampaign: moderate_cnn_norm under active class-balanced FedZMG stack	/tmp/nvflare/simulation/archsub_moderate_cnn_norm_fedavgm_lr18_m0475_epochs7_cb090_w1
326e4ba37	0.911800	470	--n_clients 8 --num_rounds 20 --aggregation_epochs 7 --local_train_steps 0 --batch_size 64 --eval_batch_size 1024 --alpha 0.5 --seed 0 --model_arch moderate_cnn_small_head --max_model_params 5000000 --aggregator fedavgm --server_lr 1.8 --server_momentum 0.475 --lr 0.045 --momentum 0.925 --weight_decay 5e-4 --cosine_lr_eta_min_factor 0.00015 --fedproxloss_mu 3e-5 --zero_mean_gradients --class_balanced_loss_beta 0.90 --final_eval_clients site-1 --name archsub_moderate_cnn_small_head_fedavgm_lr18_m0475_epochs7_cb090_w1	discard	model.py	Architecture subcampaign: moderate_cnn_small_head under active class-balanced FedZMG stack	/tmp/nvflare/simulation/archsub_moderate_cnn_small_head_fedavgm_lr18_m0475_epochs7_cb090_w1
57f956d03	0.908600	474	--n_clients 8 --num_rounds 20 --aggregation_epochs 7 --local_train_steps 0 --batch_size 64 --eval_batch_size 1024 --alpha 0.5 --seed 0 --model_arch moderate_cnn --max_model_params 5000000 --aggregator fedavgm --server_lr 1.8 --server_momentum 0.475 --lr 0.045 --momentum 0.925 --nesterov --weight_decay 5e-4 --cosine_lr_eta_min_factor 0.00015 --fedproxloss_mu 3e-5 --zero_mean_gradients --class_balanced_loss_beta 0.90 --final_eval_clients site-1 --name fedavgm_lr18_m0475_epochs7_clientlr0045_nesterov_cm0925_wd5e4_eta000015_mu3e5_zmg_cb090_w1	discard	client.py	Client Nesterov momentum under class-balanced FedZMG stack	/tmp/nvflare/simulation/fedavgm_lr18_m0475_epochs7_clientlr0045_nesterov_cm0925_wd5e4_eta000015_mu3e5_zmg_cb090_w1
2519ea0c1		151	literature_loop	literature	templates/literature_loop.md	literature review: no non-duplicate safe local axis remained; selected local Cutout sizes 8 and 12	templates/literature_loop.md
7c7dd7b0d	0.915600	507	--n_clients 8 --num_rounds 20 --aggregation_epochs 7 --local_train_steps 0 --batch_size 64 --eval_batch_size 1024 --alpha 0.5 --seed 0 --model_arch moderate_cnn --max_model_params 5000000 --aggregator fedavgm --server_lr 1.8 --server_momentum 0.475 --lr 0.045 --momentum 0.925 --weight_decay 5e-4 --cosine_lr_eta_min_factor 0.00015 --cutout_size 8 --fedproxloss_mu 3e-5 --zero_mean_gradients --class_balanced_loss_beta 0.90 --final_eval_clients site-1 --name fedavgm_lr18_m0475_epochs7_clientlr0045_cm0925_wd5e4_eta000015_mu3e5_zmg_cb090_cutout8_w1	discard	client.py	Local Cutout size 8 under class-balanced FedZMG stack [src: DeVries17 Cutout arXiv:1708.04552; Zhong17 RandomErasing arXiv:1708.04896]	/tmp/nvflare/simulation/fedavgm_lr18_m0475_epochs7_clientlr0045_cm0925_wd5e4_eta000015_mu3e5_zmg_cb090_cutout8_w1
7c7dd7b0d	0.917500	508	--n_clients 8 --num_rounds 20 --aggregation_epochs 7 --local_train_steps 0 --batch_size 64 --eval_batch_size 1024 --alpha 0.5 --seed 0 --model_arch moderate_cnn --max_model_params 5000000 --aggregator fedavgm --server_lr 1.8 --server_momentum 0.475 --lr 0.045 --momentum 0.925 --weight_decay 5e-4 --cosine_lr_eta_min_factor 0.00015 --cutout_size 12 --fedproxloss_mu 3e-5 --zero_mean_gradients --class_balanced_loss_beta 0.90 --final_eval_clients site-1 --name fedavgm_lr18_m0475_epochs7_clientlr0045_cm0925_wd5e4_eta000015_mu3e5_zmg_cb090_cutout12_w1	discard	client.py	Local Cutout size 12 under class-balanced FedZMG stack [src: DeVries17 Cutout arXiv:1708.04552]	/tmp/nvflare/simulation/fedavgm_lr18_m0475_epochs7_clientlr0045_cm0925_wd5e4_eta000015_mu3e5_zmg_cb090_cutout12_w1
34ef1450f	0.918400	504	--n_clients 8 --num_rounds 20 --aggregation_epochs 7 --local_train_steps 0 --batch_size 64 --eval_batch_size 1024 --alpha 0.5 --seed 0 --model_arch moderate_cnn --max_model_params 5000000 --aggregator fedavgm --server_lr 1.8 --server_momentum 0.475 --lr 0.045 --momentum 0.925 --weight_decay 5e-4 --cosine_lr_eta_min_factor 0.00015 --cutout_size 10 --fedproxloss_mu 3e-5 --zero_mean_gradients --class_balanced_loss_beta 0.90 --final_eval_clients site-1	discard	client.py	active class-balanced FedZMG stack plus Cutout size 10 [src: DeVries17 Cutout arXiv:1708.04552]	/tmp/nvflare/simulation/autofl_cifar10_fedavgm_alpha0.5_seed0
34ef1450f	0.917000	514	--n_clients 8 --num_rounds 20 --aggregation_epochs 7 --local_train_steps 0 --batch_size 64 --eval_batch_size 1024 --alpha 0.5 --seed 0 --model_arch moderate_cnn --max_model_params 5000000 --aggregator fedavgm --server_lr 1.8 --server_momentum 0.475 --lr 0.045 --momentum 0.925 --weight_decay 5e-4 --cosine_lr_eta_min_factor 0.00015 --cutout_size 14 --fedproxloss_mu 3e-5 --zero_mean_gradients --class_balanced_loss_beta 0.90 --final_eval_clients site-1	discard	client.py	active class-balanced FedZMG stack plus Cutout size 14 [src: DeVries17 Cutout arXiv:1708.04552]	/tmp/nvflare/simulation/autofl_cifar10_fedavgm_alpha0.5_seed0
8775b4ad3		398	literature_loop	literature	templates/literature_loop.md	literature review: no non-duplicate safe local axis remained after Cutout; selected FedSAM local optimizer radii 0.02 and 0.05	templates/literature_loop.md
9bf486096	0.914800	864	--n_clients 8 --num_rounds 20 --aggregation_epochs 7 --local_train_steps 0 --batch_size 64 --eval_batch_size 1024 --alpha 0.5 --seed 0 --model_arch moderate_cnn --max_model_params 5000000 --aggregator fedavgm --server_lr 1.8 --server_momentum 0.475 --lr 0.045 --momentum 0.925 --weight_decay 5e-4 --cosine_lr_eta_min_factor 0.00015 --sam_rho 0.02 --fedproxloss_mu 3e-5 --zero_mean_gradients --class_balanced_loss_beta 0.90 --final_eval_clients site-1 --name fedavgm_lr18_m0475_epochs7_clientlr0045_cm0925_wd5e4_eta000015_mu3e5_zmg_cb090_sam002_w1	discard	client.py	active class-balanced FedZMG stack plus FedSAM rho 0.02 [src: Qu22 FedSAM ICML; Foret21 SAM ICLR]	/tmp/nvflare/simulation/fedavgm_lr18_m0475_epochs7_clientlr0045_cm0925_wd5e4_eta000015_mu3e5_zmg_cb090_sam002_w1
9bf486096	0.923900	861	--n_clients 8 --num_rounds 20 --aggregation_epochs 7 --local_train_steps 0 --batch_size 64 --eval_batch_size 1024 --alpha 0.5 --seed 0 --model_arch moderate_cnn --max_model_params 5000000 --aggregator fedavgm --server_lr 1.8 --server_momentum 0.475 --lr 0.045 --momentum 0.925 --weight_decay 5e-4 --cosine_lr_eta_min_factor 0.00015 --sam_rho 0.05 --fedproxloss_mu 3e-5 --zero_mean_gradients --class_balanced_loss_beta 0.90 --final_eval_clients site-1 --name fedavgm_lr18_m0475_epochs7_clientlr0045_cm0925_wd5e4_eta000015_mu3e5_zmg_cb090_sam005_w1	keep	client.py	active class-balanced FedZMG stack plus FedSAM rho 0.05 [src: Qu22 FedSAM ICML; Foret21 SAM ICLR]	/tmp/nvflare/simulation/fedavgm_lr18_m0475_epochs7_clientlr0045_cm0925_wd5e4_eta000015_mu3e5_zmg_cb090_sam005_w1
cde87e95d	0.917800	861	--n_clients 8 --num_rounds 20 --aggregation_epochs 7 --local_train_steps 0 --batch_size 64 --eval_batch_size 1024 --alpha 0.5 --seed 0 --model_arch moderate_cnn --max_model_params 5000000 --aggregator fedavgm --server_lr 1.8 --server_momentum 0.475 --lr 0.045 --momentum 0.925 --weight_decay 5e-4 --cosine_lr_eta_min_factor 0.00015 --sam_rho 0.04 --fedproxloss_mu 3e-5 --zero_mean_gradients --class_balanced_loss_beta 0.90 --final_eval_clients site-1 --name fedavgm_lr18_m0475_epochs7_clientlr0045_cm0925_wd5e4_eta000015_mu3e5_zmg_cb090_sam004_w1	discard	client.py	SAM radius 0.04 lower bracket around kept FedSAM 0.05 stack [src: Qu22 FedSAM ICML; Foret21 SAM ICLR]	/tmp/nvflare/simulation/fedavgm_lr18_m0475_epochs7_clientlr0045_cm0925_wd5e4_eta000015_mu3e5_zmg_cb090_sam004_w1
cde87e95d	0.920700	861	--n_clients 8 --num_rounds 20 --aggregation_epochs 7 --local_train_steps 0 --batch_size 64 --eval_batch_size 1024 --alpha 0.5 --seed 0 --model_arch moderate_cnn --max_model_params 5000000 --aggregator fedavgm --server_lr 1.8 --server_momentum 0.475 --lr 0.045 --momentum 0.925 --weight_decay 5e-4 --cosine_lr_eta_min_factor 0.00015 --sam_rho 0.06 --fedproxloss_mu 3e-5 --zero_mean_gradients --class_balanced_loss_beta 0.90 --final_eval_clients site-1 --name fedavgm_lr18_m0475_epochs7_clientlr0045_cm0925_wd5e4_eta000015_mu3e5_zmg_cb090_sam006_w1	discard	client.py	SAM radius 0.06 upper bracket around kept FedSAM 0.05 stack [src: Qu22 FedSAM ICML; Foret21 SAM ICLR]	/tmp/nvflare/simulation/fedavgm_lr18_m0475_epochs7_clientlr0045_cm0925_wd5e4_eta000015_mu3e5_zmg_cb090_sam006_w1
565ea695b	0.917900	752	--n_clients 8 --num_rounds 20 --aggregation_epochs 6 --local_train_steps 0 --batch_size 64 --eval_batch_size 1024 --alpha 0.5 --seed 0 --model_arch moderate_cnn --max_model_params 5000000 --aggregator fedavgm --server_lr 1.8 --server_momentum 0.475 --lr 0.045 --momentum 0.925 --weight_decay 5e-4 --cosine_lr_eta_min_factor 0.00015 --sam_rho 0.05 --fedproxloss_mu 3e-5 --zero_mean_gradients --class_balanced_loss_beta 0.90 --final_eval_clients site-1 --name fedavgm_lr18_m0475_epochs6_clientlr0045_cm0925_wd5e4_eta000015_mu3e5_zmg_cb090_sam005_w1	discard	client.py	Aggregation epochs 6 under kept FedSAM rho 0.05 stack [src: Qu22 FedSAM ICML; Foret21 SAM ICLR]	/tmp/nvflare/simulation/fedavgm_lr18_m0475_epochs6_clientlr0045_cm0925_wd5e4_eta000015_mu3e5_zmg_cb090_sam005_w1
565ea695b	0.918900	975	--n_clients 8 --num_rounds 20 --aggregation_epochs 8 --local_train_steps 0 --batch_size 64 --eval_batch_size 1024 --alpha 0.5 --seed 0 --model_arch moderate_cnn --max_model_params 5000000 --aggregator fedavgm --server_lr 1.8 --server_momentum 0.475 --lr 0.045 --momentum 0.925 --weight_decay 5e-4 --cosine_lr_eta_min_factor 0.00015 --sam_rho 0.05 --fedproxloss_mu 3e-5 --zero_mean_gradients --class_balanced_loss_beta 0.90 --final_eval_clients site-1 --name fedavgm_lr18_m0475_epochs8_clientlr0045_cm0925_wd5e4_eta000015_mu3e5_zmg_cb090_sam005_w1	discard	client.py	Aggregation epochs 8 under kept FedSAM rho 0.05 stack [src: Qu22 FedSAM ICML; Foret21 SAM ICLR]	/tmp/nvflare/simulation/fedavgm_lr18_m0475_epochs8_clientlr0045_cm0925_wd5e4_eta000015_mu3e5_zmg_cb090_sam005_w1
d98ffe709	0.918800	861	--n_clients 8 --num_rounds 20 --aggregation_epochs 7 --local_train_steps 0 --batch_size 64 --eval_batch_size 1024 --alpha 0.5 --seed 0 --model_arch moderate_cnn --max_model_params 5000000 --aggregator fedavgm --server_lr 1.8 --server_momentum 0.475 --lr 0.04 --momentum 0.925 --weight_decay 5e-4 --cosine_lr_eta_min_factor 0.00015 --sam_rho 0.05 --fedproxloss_mu 3e-5 --zero_mean_gradients --class_balanced_loss_beta 0.90 --final_eval_clients site-1 --name fedavgm_lr18_m0475_epochs7_clientlr004_cm0925_wd5e4_eta000015_mu3e5_zmg_cb090_sam005_w1	discard	client.py	Client lr 0.04 under kept FedSAM rho 0.05 stack [src: Qu22 FedSAM ICML; Foret21 SAM ICLR]	/tmp/nvflare/simulation/fedavgm_lr18_m0475_epochs7_clientlr004_cm0925_wd5e4_eta000015_mu3e5_zmg_cb090_sam005_w1
d98ffe709	0.922200	861	--n_clients 8 --num_rounds 20 --aggregation_epochs 7 --local_train_steps 0 --batch_size 64 --eval_batch_size 1024 --alpha 0.5 --seed 0 --model_arch moderate_cnn --max_model_params 5000000 --aggregator fedavgm --server_lr 1.8 --server_momentum 0.475 --lr 0.05 --momentum 0.925 --weight_decay 5e-4 --cosine_lr_eta_min_factor 0.00015 --sam_rho 0.05 --fedproxloss_mu 3e-5 --zero_mean_gradients --class_balanced_loss_beta 0.90 --final_eval_clients site-1 --name fedavgm_lr18_m0475_epochs7_clientlr005_cm0925_wd5e4_eta000015_mu3e5_zmg_cb090_sam005_w1	discard	client.py	Client lr 0.05 under kept FedSAM rho 0.05 stack [src: Qu22 FedSAM ICML; Foret21 SAM ICLR]	/tmp/nvflare/simulation/fedavgm_lr18_m0475_epochs7_clientlr005_cm0925_wd5e4_eta000015_mu3e5_zmg_cb090_sam005_w1
4adb61a38	0.920200	865	--n_clients 8 --num_rounds 20 --aggregation_epochs 7 --local_train_steps 0 --batch_size 64 --eval_batch_size 1024 --alpha 0.5 --seed 0 --model_arch moderate_cnn --max_model_params 5000000 --aggregator fedavgm --server_lr 1.7 --server_momentum 0.475 --lr 0.045 --momentum 0.925 --weight_decay 5e-4 --cosine_lr_eta_min_factor 0.00015 --sam_rho 0.05 --fedproxloss_mu 3e-5 --zero_mean_gradients --class_balanced_loss_beta 0.90 --final_eval_clients site-1 --name fedavgm_lr17_m0475_epochs7_clientlr0045_cm0925_wd5e4_eta000015_mu3e5_zmg_cb090_sam005_w1	discard	custom_aggregators.py	Server lr 1.7 under kept FedSAM rho 0.05 stack [src: Qu22 FedSAM ICML; Foret21 SAM ICLR]	/tmp/nvflare/simulation/fedavgm_lr17_m0475_epochs7_clientlr0045_cm0925_wd5e4_eta000015_mu3e5_zmg_cb090_sam005_w1
4adb61a38	0.919700	867	--n_clients 8 --num_rounds 20 --aggregation_epochs 7 --local_train_steps 0 --batch_size 64 --eval_batch_size 1024 --alpha 0.5 --seed 0 --model_arch moderate_cnn --max_model_params 5000000 --aggregator fedavgm --server_lr 1.9 --server_momentum 0.475 --lr 0.045 --momentum 0.925 --weight_decay 5e-4 --cosine_lr_eta_min_factor 0.00015 --sam_rho 0.05 --fedproxloss_mu 3e-5 --zero_mean_gradients --class_balanced_loss_beta 0.90 --final_eval_clients site-1 --name fedavgm_lr19_m0475_epochs7_clientlr0045_cm0925_wd5e4_eta000015_mu3e5_zmg_cb090_sam005_w1	discard	custom_aggregators.py	Server lr 1.9 under kept FedSAM rho 0.05 stack [src: Qu22 FedSAM ICML; Foret21 SAM ICLR]	/tmp/nvflare/simulation/fedavgm_lr19_m0475_epochs7_clientlr0045_cm0925_wd5e4_eta000015_mu3e5_zmg_cb090_sam005_w1
1058b82e8	0.918200	864	--n_clients 8 --num_rounds 20 --aggregation_epochs 7 --local_train_steps 0 --batch_size 64 --eval_batch_size 1024 --alpha 0.5 --seed 0 --model_arch moderate_cnn --max_model_params 5000000 --aggregator fedavgm --server_lr 1.8 --server_momentum 0.45 --lr 0.045 --momentum 0.925 --weight_decay 5e-4 --cosine_lr_eta_min_factor 0.00015 --sam_rho 0.05 --fedproxloss_mu 3e-5 --zero_mean_gradients --class_balanced_loss_beta 0.90 --final_eval_clients site-1 --name fedavgm_lr18_m045_epochs7_clientlr0045_cm0925_wd5e4_eta000015_mu3e5_zmg_cb090_sam005_w1	discard	custom_aggregators.py	Server momentum 0.45 under kept FedSAM rho 0.05 stack [src: Qu22 FedSAM ICML; Foret21 SAM ICLR]	/tmp/nvflare/simulation/fedavgm_lr18_m045_epochs7_clientlr0045_cm0925_wd5e4_eta000015_mu3e5_zmg_cb090_sam005_w1
1058b82e8	0.919700	864	--n_clients 8 --num_rounds 20 --aggregation_epochs 7 --local_train_steps 0 --batch_size 64 --eval_batch_size 1024 --alpha 0.5 --seed 0 --model_arch moderate_cnn --max_model_params 5000000 --aggregator fedavgm --server_lr 1.8 --server_momentum 0.5 --lr 0.045 --momentum 0.925 --weight_decay 5e-4 --cosine_lr_eta_min_factor 0.00015 --sam_rho 0.05 --fedproxloss_mu 3e-5 --zero_mean_gradients --class_balanced_loss_beta 0.90 --final_eval_clients site-1 --name fedavgm_lr18_m05_epochs7_clientlr0045_cm0925_wd5e4_eta000015_mu3e5_zmg_cb090_sam005_w1	discard	custom_aggregators.py	Server momentum 0.5 under kept FedSAM rho 0.05 stack [src: Qu22 FedSAM ICML; Foret21 SAM ICLR]	/tmp/nvflare/simulation/fedavgm_lr18_m05_epochs7_clientlr0045_cm0925_wd5e4_eta000015_mu3e5_zmg_cb090_sam005_w1
a64946ed2	0.921700	864	--n_clients 8 --num_rounds 20 --aggregation_epochs 7 --local_train_steps 0 --batch_size 64 --eval_batch_size 1024 --alpha 0.5 --seed 0 --model_arch moderate_cnn --max_model_params 5000000 --aggregator fedavgm --server_lr 1.8 --server_momentum 0.475 --lr 0.045 --momentum 0.925 --weight_decay 5e-4 --cosine_lr_eta_min_factor 0.00015 --sam_rho 0.05 --fedproxloss_mu 1e-5 --zero_mean_gradients --class_balanced_loss_beta 0.90 --final_eval_clients site-1 --name fedavgm_lr18_m0475_epochs7_clientlr0045_cm0925_wd5e4_eta000015_mu1e5_zmg_cb090_sam005_w1	discard	client.py	FedProx mu 1e-5 under kept FedSAM rho 0.05 stack [src: Li20 FedProx; Qu22 FedSAM ICML]	/tmp/nvflare/simulation/fedavgm_lr18_m0475_epochs7_clientlr0045_cm0925_wd5e4_eta000015_mu1e5_zmg_cb090_sam005_w1
a64946ed2	0.919300	864	--n_clients 8 --num_rounds 20 --aggregation_epochs 7 --local_train_steps 0 --batch_size 64 --eval_batch_size 1024 --alpha 0.5 --seed 0 --model_arch moderate_cnn --max_model_params 5000000 --aggregator fedavgm --server_lr 1.8 --server_momentum 0.475 --lr 0.045 --momentum 0.925 --weight_decay 5e-4 --cosine_lr_eta_min_factor 0.00015 --sam_rho 0.05 --fedproxloss_mu 5e-5 --zero_mean_gradients --class_balanced_loss_beta 0.90 --final_eval_clients site-1 --name fedavgm_lr18_m0475_epochs7_clientlr0045_cm0925_wd5e4_eta000015_mu5e5_zmg_cb090_sam005_w1	discard	client.py	FedProx mu 5e-5 under kept FedSAM rho 0.05 stack [src: Li20 FedProx; Qu22 FedSAM ICML]	/tmp/nvflare/simulation/fedavgm_lr18_m0475_epochs7_clientlr0045_cm0925_wd5e4_eta000015_mu5e5_zmg_cb090_sam005_w1
0ae1a85c3	0.923000	861	--n_clients 8 --num_rounds 20 --aggregation_epochs 7 --local_train_steps 0 --batch_size 64 --eval_batch_size 1024 --alpha 0.5 --seed 0 --model_arch moderate_cnn --max_model_params 5000000 --aggregator fedavgm --server_lr 1.8 --server_momentum 0.475 --lr 0.045 --momentum 0.925 --weight_decay 5e-4 --cosine_lr_eta_min_factor 0.00015 --sam_rho 0.05 --fedproxloss_mu 3e-5 --zero_mean_gradients --class_balanced_loss_beta 0.875 --final_eval_clients site-1 --name fedavgm_lr18_m0475_epochs7_clientlr0045_cm0925_wd5e4_eta000015_mu3e5_zmg_cb0875_sam005_w1	discard	client.py	Class-balanced beta 0.875 under kept FedSAM rho 0.05 stack [src: Cui19 CBLoss; Qu22 FedSAM ICML]	/tmp/nvflare/simulation/fedavgm_lr18_m0475_epochs7_clientlr0045_cm0925_wd5e4_eta000015_mu3e5_zmg_cb0875_sam005_w1
0ae1a85c3	0.918500	858	--n_clients 8 --num_rounds 20 --aggregation_epochs 7 --local_train_steps 0 --batch_size 64 --eval_batch_size 1024 --alpha 0.5 --seed 0 --model_arch moderate_cnn --max_model_params 5000000 --aggregator fedavgm --server_lr 1.8 --server_momentum 0.475 --lr 0.045 --momentum 0.925 --weight_decay 5e-4 --cosine_lr_eta_min_factor 0.00015 --sam_rho 0.05 --fedproxloss_mu 3e-5 --zero_mean_gradients --class_balanced_loss_beta 0.925 --final_eval_clients site-1 --name fedavgm_lr18_m0475_epochs7_clientlr0045_cm0925_wd5e4_eta000015_mu3e5_zmg_cb0925_sam005_w1	discard	client.py	Class-balanced beta 0.925 under kept FedSAM rho 0.05 stack [src: Cui19 CBLoss; Qu22 FedSAM ICML]	/tmp/nvflare/simulation/fedavgm_lr18_m0475_epochs7_clientlr0045_cm0925_wd5e4_eta000015_mu3e5_zmg_cb0925_sam005_w1
282ee4844	0.922200	858	--n_clients 8 --num_rounds 20 --aggregation_epochs 7 --local_train_steps 0 --batch_size 64 --eval_batch_size 1024 --alpha 0.5 --seed 0 --model_arch moderate_cnn --max_model_params 5000000 --aggregator fedavgm --server_lr 1.8 --server_momentum 0.475 --lr 0.045 --momentum 0.925 --weight_decay 5e-4 --cosine_lr_eta_min_factor 0.0001 --sam_rho 0.05 --fedproxloss_mu 3e-5 --zero_mean_gradients --class_balanced_loss_beta 0.90 --final_eval_clients site-1 --name fedavgm_lr18_m0475_epochs7_clientlr0045_cm0925_wd5e4_eta00001_mu3e5_zmg_cb090_sam005_w1	discard	client.py	Scheduler eta_min_factor 0.0001 under kept FedSAM rho 0.05 stack [src: Qu22 FedSAM ICML]	/tmp/nvflare/simulation/fedavgm_lr18_m0475_epochs7_clientlr0045_cm0925_wd5e4_eta00001_mu3e5_zmg_cb090_sam005_w1
282ee4844	0.920400	864	--n_clients 8 --num_rounds 20 --aggregation_epochs 7 --local_train_steps 0 --batch_size 64 --eval_batch_size 1024 --alpha 0.5 --seed 0 --model_arch moderate_cnn --max_model_params 5000000 --aggregator fedavgm --server_lr 1.8 --server_momentum 0.475 --lr 0.045 --momentum 0.925 --weight_decay 5e-4 --cosine_lr_eta_min_factor 0.0002 --sam_rho 0.05 --fedproxloss_mu 3e-5 --zero_mean_gradients --class_balanced_loss_beta 0.90 --final_eval_clients site-1 --name fedavgm_lr18_m0475_epochs7_clientlr0045_cm0925_wd5e4_eta00002_mu3e5_zmg_cb090_sam005_w1	discard	client.py	Scheduler eta_min_factor 0.0002 under kept FedSAM rho 0.05 stack [src: Qu22 FedSAM ICML]	/tmp/nvflare/simulation/fedavgm_lr18_m0475_epochs7_clientlr0045_cm0925_wd5e4_eta00002_mu3e5_zmg_cb090_sam005_w1
12e00f715	0.920100	864	--n_clients 8 --num_rounds 20 --aggregation_epochs 7 --local_train_steps 0 --batch_size 64 --eval_batch_size 1024 --alpha 0.5 --seed 0 --model_arch moderate_cnn --max_model_params 5000000 --aggregator fedavgm --server_lr 1.8 --server_momentum 0.475 --lr 0.045 --momentum 0.925 --weight_decay 4e-4 --cosine_lr_eta_min_factor 0.00015 --sam_rho 0.05 --fedproxloss_mu 3e-5 --zero_mean_gradients --class_balanced_loss_beta 0.90 --final_eval_clients site-1 --name fedavgm_lr18_m0475_epochs7_clientlr0045_cm0925_wd4e4_eta000015_mu3e5_zmg_cb090_sam005_w1	discard	client.py	Weight decay 4e-4 under kept FedSAM rho 0.05 stack [src: Qu22 FedSAM ICML]	/tmp/nvflare/simulation/fedavgm_lr18_m0475_epochs7_clientlr0045_cm0925_wd4e4_eta000015_mu3e5_zmg_cb090_sam005_w1
12e00f715	0.918300	861	--n_clients 8 --num_rounds 20 --aggregation_epochs 7 --local_train_steps 0 --batch_size 64 --eval_batch_size 1024 --alpha 0.5 --seed 0 --model_arch moderate_cnn --max_model_params 5000000 --aggregator fedavgm --server_lr 1.8 --server_momentum 0.475 --lr 0.045 --momentum 0.925 --weight_decay 6e-4 --cosine_lr_eta_min_factor 0.00015 --sam_rho 0.05 --fedproxloss_mu 3e-5 --zero_mean_gradients --class_balanced_loss_beta 0.90 --final_eval_clients site-1 --name fedavgm_lr18_m0475_epochs7_clientlr0045_cm0925_wd6e4_eta000015_mu3e5_zmg_cb090_sam005_w1	discard	client.py	Weight decay 6e-4 under kept FedSAM rho 0.05 stack [src: Qu22 FedSAM ICML]	/tmp/nvflare/simulation/fedavgm_lr18_m0475_epochs7_clientlr0045_cm0925_wd6e4_eta000015_mu3e5_zmg_cb090_sam005_w1
