commit	score	runtime_seconds	budget	status	target	description	artifacts
e2e965168	0.900200	741	--n_clients 8 --num_rounds 20 --aggregation_epochs 7 --local_train_steps 0 --batch_size 64 --eval_batch_size 1024 --alpha 0.5 --seed 0 --model_arch moderate_cnn --max_model_params 5000000 --aggregator fedavgm --server_lr 1.8 --server_momentum 0.45 --lr 0.04 --momentum 0.925 --weight_decay 5e-4 --cosine_lr_eta_min_factor 0.0001 --fedproxloss_mu 1e-6 --final_eval_clients site-1 --name fedavgm_lr18_m045_epochs7_clientlr004_cm0925_wd5e4_eta00001_mu1e6	discard	client.py	FedProx mu 1e-6 under eta_min_factor 0.0001 near-miss scheduler base [src: Li20 FedProx]	/tmp/nvflare/simulation/fedavgm_lr18_m045_epochs7_clientlr004_cm0925_wd5e4_eta00001_mu1e6
199eff3bb	0.903300	740	--n_clients 8 --num_rounds 20 --aggregation_epochs 7 --local_train_steps 0 --batch_size 64 --eval_batch_size 1024 --alpha 0.5 --seed 0 --model_arch moderate_cnn --max_model_params 5000000 --aggregator fedavgm --server_lr 1.8 --server_momentum 0.45 --lr 0.04 --momentum 0.925 --weight_decay 5e-4 --cosine_lr_eta_min_factor 0.0001 --fedproxloss_mu 1e-5 --final_eval_clients site-1 --name fedavgm_lr18_m045_epochs7_clientlr004_cm0925_wd5e4_eta00001_mu1e5	discard	client.py	FedProx mu 1e-5 around lower-floor new best [src: Li20 FedProx]	/tmp/nvflare/simulation/fedavgm_lr18_m045_epochs7_clientlr004_cm0925_wd5e4_eta00001_mu1e5
199eff3bb	0.901200	740	--n_clients 8 --num_rounds 20 --aggregation_epochs 7 --local_train_steps 0 --batch_size 64 --eval_batch_size 1024 --alpha 0.5 --seed 0 --model_arch moderate_cnn --max_model_params 5000000 --aggregator fedavgm --server_lr 1.8 --server_momentum 0.45 --lr 0.04 --momentum 0.925 --weight_decay 5e-4 --cosine_lr_eta_min_factor 0.0001 --fedproxloss_mu 1e-4 --final_eval_clients site-1 --name fedavgm_lr18_m045_epochs7_clientlr004_cm0925_wd5e4_eta00001_mu1e4	discard	client.py	FedProx mu 1e-4 around lower-floor new best [src: Li20 FedProx]	/tmp/nvflare/simulation/fedavgm_lr18_m045_epochs7_clientlr004_cm0925_wd5e4_eta00001_mu1e4
3e5256cc5	0.902300	735	--n_clients 8 --num_rounds 20 --aggregation_epochs 7 --local_train_steps 0 --batch_size 64 --eval_batch_size 1024 --alpha 0.5 --seed 0 --model_arch moderate_cnn --max_model_params 5000000 --aggregator fedavgm --server_lr 1.8 --server_momentum 0.45 --lr 0.04 --momentum 0.9125 --weight_decay 5e-4 --cosine_lr_eta_min_factor 0.0001 --fedproxloss_mu 3e-5 --final_eval_clients site-1 --name fedavgm_lr18_m045_epochs7_clientlr004_cm09125_wd5e4_eta00001_mu3e5	discard	client.py	Client momentum 0.9125 around FedProx lower-floor new best [src: Li20 FedProx]	/tmp/nvflare/simulation/fedavgm_lr18_m045_epochs7_clientlr004_cm09125_wd5e4_eta00001_mu3e5
3e5256cc5	0.898700	735	--n_clients 8 --num_rounds 20 --aggregation_epochs 7 --local_train_steps 0 --batch_size 64 --eval_batch_size 1024 --alpha 0.5 --seed 0 --model_arch moderate_cnn --max_model_params 5000000 --aggregator fedavgm --server_lr 1.8 --server_momentum 0.45 --lr 0.04 --momentum 0.9375 --weight_decay 5e-4 --cosine_lr_eta_min_factor 0.0001 --fedproxloss_mu 3e-5 --final_eval_clients site-1 --name fedavgm_lr18_m045_epochs7_clientlr004_cm09375_wd5e4_eta00001_mu3e5	discard	client.py	Client momentum 0.9375 around FedProx lower-floor new best [src: Li20 FedProx]	/tmp/nvflare/simulation/fedavgm_lr18_m045_epochs7_clientlr004_cm09375_wd5e4_eta00001_mu3e5
6c0a70899	0.906100	735	--n_clients 8 --num_rounds 20 --aggregation_epochs 7 --local_train_steps 0 --batch_size 64 --eval_batch_size 1024 --alpha 0.5 --seed 0 --model_arch moderate_cnn --max_model_params 5000000 --aggregator fedavgm --server_lr 1.8 --server_momentum 0.475 --lr 0.04 --momentum 0.925 --weight_decay 5e-4 --cosine_lr_eta_min_factor 0.0001 --fedproxloss_mu 3e-5 --final_eval_clients site-1 --name fedavgm_lr18_m0475_epochs7_clientlr004_cm0925_wd5e4_eta00001_mu3e5	keep	custom_aggregators.py	Server momentum 0.475 around FedProx lower-floor new best [src: Li20 FedProx]	/tmp/nvflare/simulation/fedavgm_lr18_m0475_epochs7_clientlr004_cm0925_wd5e4_eta00001_mu3e5
6c0a70899	0.904900	738	--n_clients 8 --num_rounds 20 --aggregation_epochs 7 --local_train_steps 0 --batch_size 64 --eval_batch_size 1024 --alpha 0.5 --seed 0 --model_arch moderate_cnn --max_model_params 5000000 --aggregator fedavgm --server_lr 1.8 --server_momentum 0.425 --lr 0.04 --momentum 0.925 --weight_decay 5e-4 --cosine_lr_eta_min_factor 0.0001 --fedproxloss_mu 3e-5 --final_eval_clients site-1 --name fedavgm_lr18_m0425_epochs7_clientlr004_cm0925_wd5e4_eta00001_mu3e5	discard	custom_aggregators.py	Server momentum 0.425 around FedProx lower-floor new best [src: Li20 FedProx]	/tmp/nvflare/simulation/fedavgm_lr18_m0425_epochs7_clientlr004_cm0925_wd5e4_eta00001_mu3e5
f7e154099	0.904800	732	--n_clients 8 --num_rounds 20 --aggregation_epochs 7 --local_train_steps 0 --batch_size 64 --eval_batch_size 1024 --alpha 0.5 --seed 0 --model_arch moderate_cnn --max_model_params 5000000 --aggregator fedavgm --server_lr 1.8 --server_momentum 0.4625 --lr 0.04 --momentum 0.925 --weight_decay 5e-4 --cosine_lr_eta_min_factor 0.0001 --fedproxloss_mu 3e-5 --final_eval_clients site-1 --name fedavgm_lr18_m04625_epochs7_clientlr004_cm0925_wd5e4_eta00001_mu3e5	discard	custom_aggregators.py	Server momentum 0.4625 around FedProx lower-floor best [src: Li20 FedProx]	/tmp/nvflare/simulation/fedavgm_lr18_m04625_epochs7_clientlr004_cm0925_wd5e4_eta00001_mu3e5
f7e154099	0.898900	729	--n_clients 8 --num_rounds 20 --aggregation_epochs 7 --local_train_steps 0 --batch_size 64 --eval_batch_size 1024 --alpha 0.5 --seed 0 --model_arch moderate_cnn --max_model_params 5000000 --aggregator fedavgm --server_lr 1.8 --server_momentum 0.4875 --lr 0.04 --momentum 0.925 --weight_decay 5e-4 --cosine_lr_eta_min_factor 0.0001 --fedproxloss_mu 3e-5 --final_eval_clients site-1 --name fedavgm_lr18_m04875_epochs7_clientlr004_cm0925_wd5e4_eta00001_mu3e5	discard	custom_aggregators.py	Server momentum 0.4875 around FedProx lower-floor best [src: Li20 FedProx]	/tmp/nvflare/simulation/fedavgm_lr18_m04875_epochs7_clientlr004_cm0925_wd5e4_eta00001_mu3e5
87d434132	0.901600	735	--n_clients 8 --num_rounds 20 --aggregation_epochs 7 --local_train_steps 0 --batch_size 64 --eval_batch_size 1024 --alpha 0.5 --seed 0 --model_arch moderate_cnn --max_model_params 5000000 --aggregator fedavgm --server_lr 1.85 --server_momentum 0.475 --lr 0.04 --momentum 0.925 --weight_decay 5e-4 --cosine_lr_eta_min_factor 0.0001 --fedproxloss_mu 3e-5 --final_eval_clients site-1 --name fedavgm_lr185_m0475_epochs7_clientlr004_cm0925_wd5e4_eta00001_mu3e5	discard	custom_aggregators.py	Server lr 1.85 around FedProx lower-floor server_momentum 0.475 best [src: Li20 FedProx]	/tmp/nvflare/simulation/fedavgm_lr185_m0475_epochs7_clientlr004_cm0925_wd5e4_eta00001_mu3e5
87d434132	0.902300	738	--n_clients 8 --num_rounds 20 --aggregation_epochs 7 --local_train_steps 0 --batch_size 64 --eval_batch_size 1024 --alpha 0.5 --seed 0 --model_arch moderate_cnn --max_model_params 5000000 --aggregator fedavgm --server_lr 1.75 --server_momentum 0.475 --lr 0.04 --momentum 0.925 --weight_decay 5e-4 --cosine_lr_eta_min_factor 0.0001 --fedproxloss_mu 3e-5 --final_eval_clients site-1 --name fedavgm_lr175_m0475_epochs7_clientlr004_cm0925_wd5e4_eta00001_mu3e5	discard	custom_aggregators.py	Server lr 1.75 around FedProx lower-floor server_momentum 0.475 best [src: Li20 FedProx]	/tmp/nvflare/simulation/fedavgm_lr175_m0475_epochs7_clientlr004_cm0925_wd5e4_eta00001_mu3e5
6d8ee0d1f	0.899500	690	--n_clients 8 --num_rounds 20 --aggregation_epochs 7 --local_train_steps 0 --batch_size 64 --eval_batch_size 1024 --alpha 0.5 --seed 0 --model_arch moderate_cnn --max_model_params 5000000 --aggregator fedavgm --server_lr 1.8 --server_momentum 0.475 --lr 0.04 --momentum 0.925 --weight_decay 4e-4 --cosine_lr_eta_min_factor 0.0001 --fedproxloss_mu 3e-5 --final_eval_clients site-1 --name fedavgm_lr18_m0475_epochs7_clientlr004_cm0925_wd4e4_eta00001_mu3e5	discard	client.py	Weight decay 4e-4 around FedProx lower-floor server_momentum 0.475 best [src: Li20 FedProx]	/tmp/nvflare/simulation/fedavgm_lr18_m0475_epochs7_clientlr004_cm0925_wd4e4_eta00001_mu3e5
6d8ee0d1f	0.902000	701	--n_clients 8 --num_rounds 20 --aggregation_epochs 7 --local_train_steps 0 --batch_size 64 --eval_batch_size 1024 --alpha 0.5 --seed 0 --model_arch moderate_cnn --max_model_params 5000000 --aggregator fedavgm --server_lr 1.8 --server_momentum 0.475 --lr 0.04 --momentum 0.925 --weight_decay 6e-4 --cosine_lr_eta_min_factor 0.0001 --fedproxloss_mu 3e-5 --final_eval_clients site-1 --name fedavgm_lr18_m0475_epochs7_clientlr004_cm0925_wd6e4_eta00001_mu3e5	discard	client.py	Weight decay 6e-4 around FedProx lower-floor server_momentum 0.475 best [src: Li20 FedProx]	/tmp/nvflare/simulation/fedavgm_lr18_m0475_epochs7_clientlr004_cm0925_wd6e4_eta00001_mu3e5
02c53759f	0.899100	735	--n_clients 8 --num_rounds 20 --aggregation_epochs 7 --local_train_steps 0 --batch_size 64 --eval_batch_size 1024 --alpha 0.5 --seed 0 --model_arch moderate_cnn --max_model_params 5000000 --aggregator fedavgm --server_lr 1.8 --server_momentum 0.475 --lr 0.04 --momentum 0.925 --weight_decay 5e-4 --cosine_lr_eta_min_factor 0.0005 --fedproxloss_mu 3e-5 --final_eval_clients site-1 --name fedavgm_lr18_m0475_epochs7_clientlr004_cm0925_wd5e4_eta00005_mu3e5	discard	client.py	Scheduler eta_min_factor 0.0005 around FedProx server_momentum 0.475 best [src: Li20 FedProx]	/tmp/nvflare/simulation/fedavgm_lr18_m0475_epochs7_clientlr004_cm0925_wd5e4_eta00005_mu3e5
02c53759f	0.903400	739	--n_clients 8 --num_rounds 20 --aggregation_epochs 7 --local_train_steps 0 --batch_size 64 --eval_batch_size 1024 --alpha 0.5 --seed 0 --model_arch moderate_cnn --max_model_params 5000000 --aggregator fedavgm --server_lr 1.8 --server_momentum 0.475 --lr 0.04 --momentum 0.925 --weight_decay 5e-4 --cosine_lr_eta_min_factor 0.00025 --fedproxloss_mu 3e-5 --final_eval_clients site-1 --name fedavgm_lr18_m0475_epochs7_clientlr004_cm0925_wd5e4_eta000025_mu3e5	discard	client.py	Scheduler eta_min_factor 0.00025 around FedProx server_momentum 0.475 best [src: Li20 FedProx]	/tmp/nvflare/simulation/fedavgm_lr18_m0475_epochs7_clientlr004_cm0925_wd5e4_eta000025_mu3e5
074ee78bb	0.895100	618	--n_clients 8 --num_rounds 20 --aggregation_epochs 6 --local_train_steps 0 --batch_size 64 --eval_batch_size 1024 --alpha 0.5 --seed 0 --model_arch moderate_cnn --max_model_params 5000000 --aggregator fedavgm --server_lr 1.8 --server_momentum 0.475 --lr 0.04 --momentum 0.925 --weight_decay 5e-4 --cosine_lr_eta_min_factor 0.0001 --fedproxloss_mu 3e-5 --final_eval_clients site-1 --name fedavgm_lr18_m0475_epochs6_clientlr004_cm0925_wd5e4_eta00001_mu3e5	discard	client.py	Aggregation epochs 6 around FedProx lower-floor server_momentum 0.475 best [src: Li20 FedProx]	/tmp/nvflare/simulation/fedavgm_lr18_m0475_epochs6_clientlr004_cm0925_wd5e4_eta00001_mu3e5
074ee78bb	0.900100	729	--n_clients 8 --num_rounds 20 --aggregation_epochs 8 --local_train_steps 0 --batch_size 64 --eval_batch_size 1024 --alpha 0.5 --seed 0 --model_arch moderate_cnn --max_model_params 5000000 --aggregator fedavgm --server_lr 1.8 --server_momentum 0.475 --lr 0.04 --momentum 0.925 --weight_decay 5e-4 --cosine_lr_eta_min_factor 0.0001 --fedproxloss_mu 3e-5 --final_eval_clients site-1 --name fedavgm_lr18_m0475_epochs8_clientlr004_cm0925_wd5e4_eta00001_mu3e5	discard	client.py	Aggregation epochs 8 around FedProx lower-floor server_momentum 0.475 best [src: Li20 FedProx]	/tmp/nvflare/simulation/fedavgm_lr18_m0475_epochs8_clientlr004_cm0925_wd5e4_eta00001_mu3e5
95ac07f1c	0.902900	735	--n_clients 8 --num_rounds 20 --aggregation_epochs 7 --local_train_steps 0 --batch_size 64 --eval_batch_size 1024 --alpha 0.5 --seed 0 --model_arch moderate_cnn --max_model_params 5000000 --aggregator fedavgm --server_lr 1.8 --server_momentum 0.475 --lr 0.038 --momentum 0.925 --weight_decay 5e-4 --cosine_lr_eta_min_factor 0.0001 --fedproxloss_mu 3e-5 --final_eval_clients site-1 --name fedavgm_lr18_m0475_epochs7_clientlr0038_cm0925_wd5e4_eta00001_mu3e5	discard	client.py	Client lr 0.038 around FedProx lower-floor server_momentum 0.475 best [src: Li20 FedProx]	/tmp/nvflare/simulation/fedavgm_lr18_m0475_epochs7_clientlr0038_cm0925_wd5e4_eta00001_mu3e5
95ac07f1c	0.900000	735	--n_clients 8 --num_rounds 20 --aggregation_epochs 7 --local_train_steps 0 --batch_size 64 --eval_batch_size 1024 --alpha 0.5 --seed 0 --model_arch moderate_cnn --max_model_params 5000000 --aggregator fedavgm --server_lr 1.8 --server_momentum 0.475 --lr 0.042 --momentum 0.925 --weight_decay 5e-4 --cosine_lr_eta_min_factor 0.0001 --fedproxloss_mu 3e-5 --final_eval_clients site-1 --name fedavgm_lr18_m0475_epochs7_clientlr0042_cm0925_wd5e4_eta00001_mu3e5	discard	client.py	Client lr 0.042 around FedProx lower-floor server_momentum 0.475 best [src: Li20 FedProx]	/tmp/nvflare/simulation/fedavgm_lr18_m0475_epochs7_clientlr0042_cm0925_wd5e4_eta00001_mu3e5
6c7906593	0.903500	735	--n_clients 8 --num_rounds 20 --aggregation_epochs 7 --local_train_steps 0 --batch_size 64 --eval_batch_size 1024 --alpha 0.5 --seed 0 --model_arch moderate_cnn --max_model_params 5000000 --aggregator fedavgm --server_lr 1.8 --server_momentum 0.480 --lr 0.04 --momentum 0.925 --weight_decay 5e-4 --cosine_lr_eta_min_factor 0.0001 --fedproxloss_mu 3e-5 --final_eval_clients site-1 --name fedavgm_lr18_m048_epochs7_clientlr004_cm0925_wd5e4_eta00001_mu3e5	discard	custom_aggregators.py	Server momentum 0.480 fine bracket around FedProx lower-floor best [src: Li20 FedProx]	/tmp/nvflare/simulation/fedavgm_lr18_m048_epochs7_clientlr004_cm0925_wd5e4_eta00001_mu3e5
6c7906593	0.902900	738	--n_clients 8 --num_rounds 20 --aggregation_epochs 7 --local_train_steps 0 --batch_size 64 --eval_batch_size 1024 --alpha 0.5 --seed 0 --model_arch moderate_cnn --max_model_params 5000000 --aggregator fedavgm --server_lr 1.8 --server_momentum 0.470 --lr 0.04 --momentum 0.925 --weight_decay 5e-4 --cosine_lr_eta_min_factor 0.0001 --fedproxloss_mu 3e-5 --final_eval_clients site-1 --name fedavgm_lr18_m047_epochs7_clientlr004_cm0925_wd5e4_eta00001_mu3e5	discard	custom_aggregators.py	Server momentum 0.470 fine bracket around FedProx lower-floor best [src: Li20 FedProx]	/tmp/nvflare/simulation/fedavgm_lr18_m047_epochs7_clientlr004_cm0925_wd5e4_eta00001_mu3e5
4299927bb	0.898300	732	--n_clients 8 --num_rounds 20 --aggregation_epochs 7 --local_train_steps 0 --batch_size 64 --eval_batch_size 1024 --alpha 0.5 --seed 0 --model_arch moderate_cnn --max_model_params 5000000 --aggregator fedavgm --server_lr 1.8 --server_momentum 0.475 --lr 0.04 --momentum 0.925 --weight_decay 5e-4 --cosine_lr_eta_min_factor 0.0001 --fedproxloss_mu 5e-5 --final_eval_clients site-1 --name fedavgm_lr18_m0475_epochs7_clientlr004_cm0925_wd5e4_eta00001_mu5e5	discard	client.py	FedProx mu 5e-5 around server_momentum 0.475 lower-floor best [src: Li20 FedProx]	/tmp/nvflare/simulation/fedavgm_lr18_m0475_epochs7_clientlr004_cm0925_wd5e4_eta00001_mu5e5
4299927bb	0.896800	734	--n_clients 8 --num_rounds 20 --aggregation_epochs 7 --local_train_steps 0 --batch_size 64 --eval_batch_size 1024 --alpha 0.5 --seed 0 --model_arch moderate_cnn --max_model_params 5000000 --aggregator fedavgm --server_lr 1.8 --server_momentum 0.475 --lr 0.04 --momentum 0.925 --weight_decay 5e-4 --cosine_lr_eta_min_factor 0.0001 --fedproxloss_mu 2e-5 --final_eval_clients site-1 --name fedavgm_lr18_m0475_epochs7_clientlr004_cm0925_wd5e4_eta00001_mu2e5	discard	client.py	FedProx mu 2e-5 around server_momentum 0.475 lower-floor best [src: Li20 FedProx]	/tmp/nvflare/simulation/fedavgm_lr18_m0475_epochs7_clientlr004_cm0925_wd5e4_eta00001_mu2e5
11c68e329	0.896300	661	--n_clients 8 --num_rounds 20 --aggregation_epochs 7 --local_train_steps 640 --batch_size 64 --eval_batch_size 1024 --alpha 0.5 --seed 0 --model_arch moderate_cnn --max_model_params 5000000 --aggregator fedavgm --server_lr 1.8 --server_momentum 0.475 --lr 0.04 --momentum 0.925 --weight_decay 5e-4 --cosine_lr_eta_min_factor 0.0001 --fedproxloss_mu 3e-5 --final_eval_clients site-1 --name fedavgm_lr18_m0475_steps640_clientlr004_cm0925_wd5e4_eta00001_mu3e5	discard	client.py	Exact local_train_steps 640 around FedProx lower-floor server_momentum 0.475 best [src: Li20 FedProx]	/tmp/nvflare/simulation/fedavgm_lr18_m0475_steps640_clientlr004_cm0925_wd5e4_eta00001_mu3e5
11c68e329	0.906400	716	--n_clients 8 --num_rounds 20 --aggregation_epochs 7 --local_train_steps 768 --batch_size 64 --eval_batch_size 1024 --alpha 0.5 --seed 0 --model_arch moderate_cnn --max_model_params 5000000 --aggregator fedavgm --server_lr 1.8 --server_momentum 0.475 --lr 0.04 --momentum 0.925 --weight_decay 5e-4 --cosine_lr_eta_min_factor 0.0001 --fedproxloss_mu 3e-5 --final_eval_clients site-1 --name fedavgm_lr18_m0475_steps768_clientlr004_cm0925_wd5e4_eta00001_mu3e5	discard	client.py	Exact local_train_steps 768 around FedProx lower-floor server_momentum 0.475 best [src: Li20 FedProx]	/tmp/nvflare/simulation/fedavgm_lr18_m0475_steps768_clientlr004_cm0925_wd5e4_eta00001_mu3e5
30db18315	0.900000	738	--n_clients 8 --num_rounds 20 --aggregation_epochs 7 --local_train_steps 720 --batch_size 64 --eval_batch_size 1024 --alpha 0.5 --seed 0 --model_arch moderate_cnn --max_model_params 5000000 --aggregator fedavgm --server_lr 1.8 --server_momentum 0.475 --lr 0.04 --momentum 0.925 --weight_decay 5e-4 --cosine_lr_eta_min_factor 0.0001 --fedproxloss_mu 3e-5 --final_eval_clients site-1 --name fedavgm_lr18_m0475_steps720_clientlr004_cm0925_wd5e4_eta00001_mu3e5	discard	client.py	Exact local_train_steps 720 near 768 FedProx lower-floor near-best [src: Li20 FedProx]	/tmp/nvflare/simulation/fedavgm_lr18_m0475_steps720_clientlr004_cm0925_wd5e4_eta00001_mu3e5
30db18315	0.903700	789	--n_clients 8 --num_rounds 20 --aggregation_epochs 7 --local_train_steps 832 --batch_size 64 --eval_batch_size 1024 --alpha 0.5 --seed 0 --model_arch moderate_cnn --max_model_params 5000000 --aggregator fedavgm --server_lr 1.8 --server_momentum 0.475 --lr 0.04 --momentum 0.925 --weight_decay 5e-4 --cosine_lr_eta_min_factor 0.0001 --fedproxloss_mu 3e-5 --final_eval_clients site-1 --name fedavgm_lr18_m0475_steps832_clientlr004_cm0925_wd5e4_eta00001_mu3e5	discard	client.py	Exact local_train_steps 832 near 768 FedProx lower-floor near-best [src: Li20 FedProx]	/tmp/nvflare/simulation/fedavgm_lr18_m0475_steps832_clientlr004_cm0925_wd5e4_eta00001_mu3e5
9026b3adc	0.774800	741	--n_clients 8 --num_rounds 20 --aggregation_epochs 7 --local_train_steps 0 --batch_size 64 --eval_batch_size 1024 --alpha 0.5 --seed 0 --model_arch moderate_cnn --max_model_params 5000000 --aggregator median --lr 0.04 --momentum 0.925 --weight_decay 5e-4 --cosine_lr_eta_min_factor 0.0001 --fedproxloss_mu 3e-5 --final_eval_clients site-1 --name median_epochs7_clientlr004_cm0925_wd5e4_eta00001_mu3e5	discard	custom_aggregators.py	Robust median with FedProx lower-floor active client stack [src: Li20 FedProx]	/tmp/nvflare/simulation/median_epochs7_clientlr004_cm0925_wd5e4_eta00001_mu3e5
9026b3adc	0.880700	744	--n_clients 8 --num_rounds 20 --aggregation_epochs 7 --local_train_steps 0 --batch_size 64 --eval_batch_size 1024 --alpha 0.5 --seed 0 --model_arch moderate_cnn --max_model_params 5000000 --aggregator weighted --lr 0.04 --momentum 0.925 --weight_decay 5e-4 --cosine_lr_eta_min_factor 0.0001 --fedproxloss_mu 3e-5 --final_eval_clients site-1 --name weighted_epochs7_clientlr004_cm0925_wd5e4_eta00001_mu3e5	discard	custom_aggregators.py	Weighted FedAvg with FedProx lower-floor active client stack [src: Li20 FedProx]	/tmp/nvflare/simulation/weighted_epochs7_clientlr004_cm0925_wd5e4_eta00001_mu3e5
202bc9bea	0.905500	732	--n_clients 8 --num_rounds 20 --aggregation_epochs 7 --local_train_steps 0 --batch_size 64 --eval_batch_size 1024 --alpha 0.5 --seed 0 --model_arch moderate_cnn --max_model_params 5000000 --aggregator fedavgm --server_lr 1.79 --server_momentum 0.475 --lr 0.04 --momentum 0.925 --weight_decay 5e-4 --cosine_lr_eta_min_factor 0.0001 --fedproxloss_mu 3e-5 --final_eval_clients site-1 --name fedavgm_lr179_m0475_epochs7_clientlr004_cm0925_wd5e4_eta00001_mu3e5	discard	custom_aggregators.py	Server lr 1.79 micro around FedProx lower-floor server_momentum 0.475 best [src: Li20 FedProx]	/tmp/nvflare/simulation/fedavgm_lr179_m0475_epochs7_clientlr004_cm0925_wd5e4_eta00001_mu3e5
202bc9bea	0.902500	735	--n_clients 8 --num_rounds 20 --aggregation_epochs 7 --local_train_steps 0 --batch_size 64 --eval_batch_size 1024 --alpha 0.5 --seed 0 --model_arch moderate_cnn --max_model_params 5000000 --aggregator fedavgm --server_lr 1.81 --server_momentum 0.475 --lr 0.04 --momentum 0.925 --weight_decay 5e-4 --cosine_lr_eta_min_factor 0.0001 --fedproxloss_mu 3e-5 --final_eval_clients site-1 --name fedavgm_lr181_m0475_epochs7_clientlr004_cm0925_wd5e4_eta00001_mu3e5	discard	custom_aggregators.py	Server lr 1.81 micro around FedProx lower-floor server_momentum 0.475 best [src: Li20 FedProx]	/tmp/nvflare/simulation/fedavgm_lr181_m0475_epochs7_clientlr004_cm0925_wd5e4_eta00001_mu3e5
f52df3e9a	0.710600	735	--n_clients 8 --num_rounds 20 --aggregation_epochs 7 --local_train_steps 0 --batch_size 64 --eval_batch_size 1024 --alpha 0.5 --seed 0 --model_arch moderate_cnn --max_model_params 5000000 --aggregator fedadam --server_lr 0.05 --fedopt_beta1 0.9 --fedopt_beta2 0.99 --fedopt_tau 0.1 --lr 0.04 --momentum 0.925 --weight_decay 5e-4 --cosine_lr_eta_min_factor 0.0001 --fedproxloss_mu 3e-5 --final_eval_clients site-1 --name fedadam_lr005_tau01_epochs7_clientlr004_cm0925_wd5e4_eta00001_mu3e5	discard	custom_aggregators.py	Conservative FedAdam server_lr 0.05 tau 0.1 with active FedProx client stack [src: Reddi21 FedOpt]	/tmp/nvflare/simulation/fedadam_lr005_tau01_epochs7_clientlr004_cm0925_wd5e4_eta00001_mu3e5
