commit	score	runtime_seconds	budget	status	target	description	artifacts
c205a6617	0.913400	488	--n_clients 8 --num_rounds 20 --aggregation_epochs 7 --local_train_steps 0 --batch_size 64 --eval_batch_size 1024 --alpha 0.5 --seed 0 --model_arch moderate_cnn --max_model_params 5000000 --aggregator fedavgm --server_lr 1.8 --server_momentum 0.475 --lr 0.045 --momentum 0.925 --weight_decay 5e-4 --cosine_lr_eta_min_factor 0.00015 --fedproxloss_mu 3e-5 --zero_mean_gradients --final_eval_clients site-1 --class_balanced_loss_beta 0.85 --name fedavgm_lr18_m0475_epochs7_clientlr0045_cm0925_wd5e4_eta000015_mu3e5_zmg_cb085_w1	discard	client.py	Class-balanced effective-number beta 0.85 lower bracket under FedZMG stack [src: Cui19 CBLoss CVPR; Wang21 RatioLoss AAAI]	/tmp/nvflare/simulation/fedavgm_lr18_m0475_epochs7_clientlr0045_cm0925_wd5e4_eta000015_mu3e5_zmg_cb085_w1
c205a6617	0.909600	488	--n_clients 8 --num_rounds 20 --aggregation_epochs 7 --local_train_steps 0 --batch_size 64 --eval_batch_size 1024 --alpha 0.5 --seed 0 --model_arch moderate_cnn --max_model_params 5000000 --aggregator fedavgm --server_lr 1.8 --server_momentum 0.475 --lr 0.045 --momentum 0.925 --weight_decay 5e-4 --cosine_lr_eta_min_factor 0.00015 --fedproxloss_mu 3e-5 --zero_mean_gradients --final_eval_clients site-1 --class_balanced_loss_beta 0.80 --name fedavgm_lr18_m0475_epochs7_clientlr0045_cm0925_wd5e4_eta000015_mu3e5_zmg_cb080_w1	discard	client.py	Class-balanced effective-number beta 0.80 lower bracket under FedZMG stack [src: Cui19 CBLoss CVPR; Wang21 RatioLoss AAAI]	/tmp/nvflare/simulation/fedavgm_lr18_m0475_epochs7_clientlr0045_cm0925_wd5e4_eta000015_mu3e5_zmg_cb080_w1
1b56d8a87	0.913200	667	--n_clients 8 --num_rounds 20 --aggregation_epochs 7 --batch_size 64 --eval_batch_size 1024 --alpha 0.5 --seed 0 --model_arch moderate_cnn --max_model_params 5000000 --aggregator fedavgm --server_lr 1.8 --server_momentum 0.475 --lr 0.045 --momentum 0.925 --weight_decay 5e-4 --cosine_lr_eta_min_factor 0.00015 --fedproxloss_mu 3e-5 --zero_mean_gradients --class_balanced_loss_beta 0.90 --final_eval_clients site-1 --local_train_steps 1152 --name fedavgm_lr18_m0475_steps1152_clientlr0045_cm0925_wd5e4_eta000015_mu3e5_zmg_cb090_w1	discard	client.py	Exact local_train_steps 1152 upper continuation under class-balanced beta 0.90 FedZMG stack [src: Cui19 CBLoss CVPR; Wang21 RatioLoss AAAI]	/tmp/nvflare/simulation/fedavgm_lr18_m0475_steps1152_clientlr0045_cm0925_wd5e4_eta000015_mu3e5_zmg_cb090_w1
1b56d8a87	0.914900	728	--n_clients 8 --num_rounds 20 --aggregation_epochs 7 --batch_size 64 --eval_batch_size 1024 --alpha 0.5 --seed 0 --model_arch moderate_cnn --max_model_params 5000000 --aggregator fedavgm --server_lr 1.8 --server_momentum 0.475 --lr 0.045 --momentum 0.925 --weight_decay 5e-4 --cosine_lr_eta_min_factor 0.00015 --fedproxloss_mu 3e-5 --zero_mean_gradients --class_balanced_loss_beta 0.90 --final_eval_clients site-1 --local_train_steps 1280 --name fedavgm_lr18_m0475_steps1280_clientlr0045_cm0925_wd5e4_eta000015_mu3e5_zmg_cb090_w1	discard	client.py	Exact local_train_steps 1280 upper continuation under class-balanced beta 0.90 FedZMG stack [src: Cui19 CBLoss CVPR; Wang21 RatioLoss AAAI]	/tmp/nvflare/simulation/fedavgm_lr18_m0475_steps1280_clientlr0045_cm0925_wd5e4_eta000015_mu3e5_zmg_cb090_w1
5bd49652d	0.913600	349	--n_clients 8 --num_rounds 20 --aggregation_epochs 7 --batch_size 64 --eval_batch_size 1024 --alpha 0.5 --seed 0 --model_arch moderate_cnn --max_model_params 5000000 --aggregator fedavgm --server_lr 1.8 --server_momentum 0.475 --lr 0.045 --momentum 0.925 --weight_decay 5e-4 --cosine_lr_eta_min_factor 0.00015 --fedproxloss_mu 3e-5 --zero_mean_gradients --class_balanced_loss_beta 0.90 --final_eval_clients site-1 --local_train_steps 512 --name fedavgm_lr18_m0475_steps512_clientlr0045_cm0925_wd5e4_eta000015_mu3e5_zmg_cb090_w1	discard	client.py	Exact local_train_steps 512 lower continuation under class-balanced beta 0.90 FedZMG stack [src: Cui19 CBLoss CVPR; Wang21 RatioLoss AAAI]	/tmp/nvflare/simulation/fedavgm_lr18_m0475_steps512_clientlr0045_cm0925_wd5e4_eta000015_mu3e5_zmg_cb090_w1
5bd49652d	0.908100	285	--n_clients 8 --num_rounds 20 --aggregation_epochs 7 --batch_size 64 --eval_batch_size 1024 --alpha 0.5 --seed 0 --model_arch moderate_cnn --max_model_params 5000000 --aggregator fedavgm --server_lr 1.8 --server_momentum 0.475 --lr 0.045 --momentum 0.925 --weight_decay 5e-4 --cosine_lr_eta_min_factor 0.00015 --fedproxloss_mu 3e-5 --zero_mean_gradients --class_balanced_loss_beta 0.90 --final_eval_clients site-1 --local_train_steps 384 --name fedavgm_lr18_m0475_steps384_clientlr0045_cm0925_wd5e4_eta000015_mu3e5_zmg_cb090_w1	discard	client.py	Exact local_train_steps 384 lower continuation under class-balanced beta 0.90 FedZMG stack [src: Cui19 CBLoss CVPR; Wang21 RatioLoss AAAI]	/tmp/nvflare/simulation/fedavgm_lr18_m0475_steps384_clientlr0045_cm0925_wd5e4_eta000015_mu3e5_zmg_cb090_w1
fa73af7a7	0.911700	599	--n_clients 8 --num_rounds 20 --local_train_steps 0 --batch_size 64 --eval_batch_size 1024 --alpha 0.5 --seed 0 --model_arch moderate_cnn --max_model_params 5000000 --aggregator fedavgm --server_lr 1.8 --server_momentum 0.475 --lr 0.045 --momentum 0.925 --weight_decay 5e-4 --cosine_lr_eta_min_factor 0.00015 --fedproxloss_mu 3e-5 --zero_mean_gradients --class_balanced_loss_beta 0.90 --final_eval_clients site-1 --aggregation_epochs 9 --name fedavgm_lr18_m0475_epochs9_clientlr0045_cm0925_wd5e4_eta000015_mu3e5_zmg_cb090_w1	discard	client.py	Aggregation epochs 9 upper local-compute continuation under class-balanced beta 0.90 FedZMG stack [src: Cui19 CBLoss CVPR; Wang21 RatioLoss AAAI]	/tmp/nvflare/simulation/fedavgm_lr18_m0475_epochs9_clientlr0045_cm0925_wd5e4_eta000015_mu3e5_zmg_cb090_w1
fa73af7a7	0.911400	655	--n_clients 8 --num_rounds 20 --local_train_steps 0 --batch_size 64 --eval_batch_size 1024 --alpha 0.5 --seed 0 --model_arch moderate_cnn --max_model_params 5000000 --aggregator fedavgm --server_lr 1.8 --server_momentum 0.475 --lr 0.045 --momentum 0.925 --weight_decay 5e-4 --cosine_lr_eta_min_factor 0.00015 --fedproxloss_mu 3e-5 --zero_mean_gradients --class_balanced_loss_beta 0.90 --final_eval_clients site-1 --aggregation_epochs 10 --name fedavgm_lr18_m0475_epochs10_clientlr0045_cm0925_wd5e4_eta000015_mu3e5_zmg_cb090_w1	discard	client.py	Aggregation epochs 10 upper local-compute continuation under class-balanced beta 0.90 FedZMG stack [src: Cui19 CBLoss CVPR; Wang21 RatioLoss AAAI]	/tmp/nvflare/simulation/fedavgm_lr18_m0475_epochs10_clientlr0045_cm0925_wd5e4_eta000015_mu3e5_zmg_cb090_w1
2aa9c0237	0.911700	487	--n_clients 8 --num_rounds 20 --aggregation_epochs 7 --local_train_steps 0 --batch_size 64 --eval_batch_size 1024 --alpha 0.5 --seed 0 --model_arch moderate_cnn --max_model_params 5000000 --aggregator fedavgm --server_lr 1.8 --server_momentum 0.475 --lr 0.045 --momentum 0.925 --weight_decay 5e-4 --fedproxloss_mu 3e-5 --zero_mean_gradients --class_balanced_loss_beta 0.90 --final_eval_clients site-1 --cosine_lr_eta_min_factor 0.002 --name fedavgm_lr18_m0475_epochs7_clientlr0045_cm0925_wd5e4_eta0002_mu3e5_zmg_cb090_w1	discard	client.py	Cosine eta_min_factor 0.002 upper scheduler floor under class-balanced beta 0.90 FedZMG stack [src: Cui19 CBLoss CVPR; Wang21 RatioLoss AAAI]	/tmp/nvflare/simulation/fedavgm_lr18_m0475_epochs7_clientlr0045_cm0925_wd5e4_eta0002_mu3e5_zmg_cb090_w1
2aa9c0237	0.912100	484	--n_clients 8 --num_rounds 20 --aggregation_epochs 7 --local_train_steps 0 --batch_size 64 --eval_batch_size 1024 --alpha 0.5 --seed 0 --model_arch moderate_cnn --max_model_params 5000000 --aggregator fedavgm --server_lr 1.8 --server_momentum 0.475 --lr 0.045 --momentum 0.925 --weight_decay 5e-4 --fedproxloss_mu 3e-5 --zero_mean_gradients --class_balanced_loss_beta 0.90 --final_eval_clients site-1 --cosine_lr_eta_min_factor 0.005 --name fedavgm_lr18_m0475_epochs7_clientlr0045_cm0925_wd5e4_eta0005_mu3e5_zmg_cb090_w1	discard	client.py	Cosine eta_min_factor 0.005 upper scheduler floor under class-balanced beta 0.90 FedZMG stack [src: Cui19 CBLoss CVPR; Wang21 RatioLoss AAAI]	/tmp/nvflare/simulation/fedavgm_lr18_m0475_epochs7_clientlr0045_cm0925_wd5e4_eta0005_mu3e5_zmg_cb090_w1
f493eaf5d	0.911500	490	--n_clients 8 --num_rounds 20 --aggregation_epochs 7 --local_train_steps 0 --batch_size 64 --eval_batch_size 1024 --alpha 0.5 --seed 0 --model_arch moderate_cnn --max_model_params 5000000 --aggregator fedavgm --server_momentum 0.475 --lr 0.045 --momentum 0.925 --weight_decay 5e-4 --cosine_lr_eta_min_factor 0.00015 --fedproxloss_mu 3e-5 --zero_mean_gradients --class_balanced_loss_beta 0.90 --final_eval_clients site-1 --server_lr 1.4 --name fedavgm_lr14_m0475_epochs7_clientlr0045_cm0925_wd5e4_eta000015_mu3e5_zmg_cb090_w1	discard	custom_aggregators.py	Server lr 1.4 edge lower under class-balanced beta 0.90 FedZMG stack [src: Cui19 CBLoss CVPR; Wang21 RatioLoss AAAI]	/tmp/nvflare/simulation/fedavgm_lr14_m0475_epochs7_clientlr0045_cm0925_wd5e4_eta000015_mu3e5_zmg_cb090_w1
f493eaf5d	0.915700	487	--n_clients 8 --num_rounds 20 --aggregation_epochs 7 --local_train_steps 0 --batch_size 64 --eval_batch_size 1024 --alpha 0.5 --seed 0 --model_arch moderate_cnn --max_model_params 5000000 --aggregator fedavgm --server_momentum 0.475 --lr 0.045 --momentum 0.925 --weight_decay 5e-4 --cosine_lr_eta_min_factor 0.00015 --fedproxloss_mu 3e-5 --zero_mean_gradients --class_balanced_loss_beta 0.90 --final_eval_clients site-1 --server_lr 2.2 --name fedavgm_lr22_m0475_epochs7_clientlr0045_cm0925_wd5e4_eta000015_mu3e5_zmg_cb090_w1	discard	custom_aggregators.py	Server lr 2.2 edge upper under class-balanced beta 0.90 FedZMG stack [src: Cui19 CBLoss CVPR; Wang21 RatioLoss AAAI]	/tmp/nvflare/simulation/fedavgm_lr22_m0475_epochs7_clientlr0045_cm0925_wd5e4_eta000015_mu3e5_zmg_cb090_w1
987722d11	0.909700	487	--n_clients 8 --num_rounds 20 --aggregation_epochs 7 --local_train_steps 0 --batch_size 64 --eval_batch_size 1024 --alpha 0.5 --seed 0 --model_arch moderate_cnn --max_model_params 5000000 --aggregator fedavgm --server_momentum 0.475 --lr 0.045 --momentum 0.925 --weight_decay 5e-4 --cosine_lr_eta_min_factor 0.00015 --fedproxloss_mu 3e-5 --zero_mean_gradients --class_balanced_loss_beta 0.90 --final_eval_clients site-1 --server_lr 2.4 --name fedavgm_lr24_m0475_epochs7_clientlr0045_cm0925_wd5e4_eta000015_mu3e5_zmg_cb090_w1	discard	custom_aggregators.py	Server lr 2.4 upper extension under class-balanced beta 0.90 FedZMG stack [src: Cui19 CBLoss CVPR; Wang21 RatioLoss AAAI]	/tmp/nvflare/simulation/fedavgm_lr24_m0475_epochs7_clientlr0045_cm0925_wd5e4_eta000015_mu3e5_zmg_cb090_w1
987722d11	0.000000	189	--n_clients 8 --num_rounds 20 --aggregation_epochs 7 --local_train_steps 0 --batch_size 64 --eval_batch_size 1024 --alpha 0.5 --seed 0 --model_arch moderate_cnn --max_model_params 5000000 --aggregator fedavgm --server_momentum 0.475 --lr 0.045 --momentum 0.925 --weight_decay 5e-4 --cosine_lr_eta_min_factor 0.00015 --fedproxloss_mu 3e-5 --zero_mean_gradients --class_balanced_loss_beta 0.90 --final_eval_clients site-1 --server_lr 2.6 --name fedavgm_lr26_m0475_epochs7_clientlr0045_cm0925_wd5e4_eta000015_mu3e5_zmg_cb090_w1	crash	custom_aggregators.py	Server lr 2.6 upper extension under class-balanced beta 0.90 FedZMG stack [src: Cui19 CBLoss CVPR; Wang21 RatioLoss AAAI]	/tmp/nvflare/simulation/fedavgm_lr26_m0475_epochs7_clientlr0045_cm0925_wd5e4_eta000015_mu3e5_zmg_cb090_w1
1050d78d1	0.910400	487	--n_clients 8 --num_rounds 20 --aggregation_epochs 7 --local_train_steps 0 --batch_size 64 --eval_batch_size 1024 --alpha 0.5 --seed 0 --model_arch moderate_cnn --max_model_params 5000000 --aggregator fedavgm --server_lr 1.8 --server_momentum 0.475 --lr 0.045 --momentum 0.925 --weight_decay 5e-4 --cosine_lr_eta_min_factor 0.00015 --fedproxloss_mu 3e-5 --zero_mean_gradients --class_balanced_loss_beta 0.9125 --final_eval_clients site-1 --name fedavgm_lr18_m0475_epochs7_clientlr0045_cm0925_wd5e4_eta000015_mu3e5_zmg_cb09125_w1	discard	client.py	Class-balanced beta 0.9125 tight midpoint around kept beta 0.90 FedZMG stack [src: Cui19 CBLoss CVPR; Wang21 RatioLoss AAAI]	/tmp/nvflare/simulation/fedavgm_lr18_m0475_epochs7_clientlr0045_cm0925_wd5e4_eta000015_mu3e5_zmg_cb09125_w1
6b566eaeb		394	literature_loop	literature	templates/literature_loop.md	literature review: plateau after 32 scored class-balanced FedZMG follow-ups; selected FedNova normalized aggregation variants	templates/literature_loop.md
1f5fb49a8	0.900900	488	--n_clients 8 --num_rounds 20 --aggregation_epochs 7 --local_train_steps 0 --batch_size 64 --eval_batch_size 1024 --alpha 0.5 --seed 0 --model_arch moderate_cnn --max_model_params 5000000 --aggregator fednova --server_lr 1.0 --server_momentum 0.0 --lr 0.045 --momentum 0.925 --weight_decay 5e-4 --cosine_lr_eta_min_factor 0.00015 --fedproxloss_mu 3e-5 --zero_mean_gradients --class_balanced_loss_beta 0.90 --final_eval_clients site-1 --name fednova_lr10_m0_epochs7_clientlr0045_cm0925_wd5e4_eta000015_mu3e5_zmg_cb090_w1	discard	custom_aggregators.py	FedNova normalized aggregation on class-balanced FedZMG stack [src: Wang20 FedNova NeurIPS]	/tmp/nvflare/simulation/fednova_lr10_m0_epochs7_clientlr0045_cm0925_wd5e4_eta000015_mu3e5_zmg_cb090_w1
1f5fb49a8	0.899000	487	--n_clients 8 --num_rounds 20 --aggregation_epochs 7 --local_train_steps 0 --batch_size 64 --eval_batch_size 1024 --alpha 0.5 --seed 0 --model_arch moderate_cnn --max_model_params 5000000 --aggregator fednova --server_lr 1.8 --server_momentum 0.0 --lr 0.045 --momentum 0.925 --weight_decay 5e-4 --cosine_lr_eta_min_factor 0.00015 --fedproxloss_mu 3e-5 --zero_mean_gradients --class_balanced_loss_beta 0.90 --final_eval_clients site-1 --name fednova_lr18_m0_epochs7_clientlr0045_cm0925_wd5e4_eta000015_mu3e5_zmg_cb090_w1	discard	custom_aggregators.py	FedNova normalized aggregation server_lr 1.8 on class-balanced FedZMG stack [src: Wang20 FedNova NeurIPS]	/tmp/nvflare/simulation/fednova_lr18_m0_epochs7_clientlr0045_cm0925_wd5e4_eta000015_mu3e5_zmg_cb090_w1
bbd06585d	0.913300	489	--n_clients 8 --num_rounds 20 --aggregation_epochs 7 --local_train_steps 0 --batch_size 64 --eval_batch_size 1024 --alpha 0.5 --seed 0 --model_arch moderate_cnn --max_model_params 5000000 --aggregator fedavgm --server_momentum 0.475 --lr 0.045 --momentum 0.925 --weight_decay 5e-4 --cosine_lr_eta_min_factor 0.00015 --fedproxloss_mu 3e-5 --zero_mean_gradients --class_balanced_loss_beta 0.90 --final_eval_clients site-1 --server_lr 2.1 --name fedavgm_lr21_m0475_epochs7_clientlr0045_cm0925_wd5e4_eta000015_mu3e5_zmg_cb090_w1	discard	custom_aggregators.py	Server lr 2.1 narrow continuation under class-balanced beta 0.90 FedZMG stack [src: Cui19 CBLoss CVPR; Wang21 RatioLoss AAAI]	/tmp/nvflare/simulation/fedavgm_lr21_m0475_epochs7_clientlr0045_cm0925_wd5e4_eta000015_mu3e5_zmg_cb090_w1
bbd06585d	0.000000	325	--n_clients 8 --num_rounds 20 --aggregation_epochs 7 --local_train_steps 0 --batch_size 64 --eval_batch_size 1024 --alpha 0.5 --seed 0 --model_arch moderate_cnn --max_model_params 5000000 --aggregator fedavgm --server_momentum 0.475 --lr 0.045 --momentum 0.925 --weight_decay 5e-4 --cosine_lr_eta_min_factor 0.00015 --fedproxloss_mu 3e-5 --zero_mean_gradients --class_balanced_loss_beta 0.90 --final_eval_clients site-1 --server_lr 2.3 --name fedavgm_lr23_m0475_epochs7_clientlr0045_cm0925_wd5e4_eta000015_mu3e5_zmg_cb090_w1	crash	custom_aggregators.py	Server lr 2.3 narrow continuation under class-balanced beta 0.90 FedZMG stack [src: Cui19 CBLoss CVPR; Wang21 RatioLoss AAAI]	/tmp/nvflare/simulation/fedavgm_lr23_m0475_epochs7_clientlr0045_cm0925_wd5e4_eta000015_mu3e5_zmg_cb090_w1
d5d6376bb	0.912300	552	--n_clients 8 --num_rounds 20 --aggregation_epochs 7 --local_train_steps 928 --batch_size 64 --eval_batch_size 1024 --alpha 0.5 --seed 0 --model_arch moderate_cnn --max_model_params 5000000 --aggregator fedavgm --server_lr 1.8 --server_momentum 0.475 --lr 0.045 --momentum 0.925 --weight_decay 5e-4 --cosine_lr_eta_min_factor 0.00015 --fedproxloss_mu 3e-5 --zero_mean_gradients --class_balanced_loss_beta 0.90 --final_eval_clients site-1 --name fedavgm_lr18_m0475_steps928_clientlr0045_cm0925_wd5e4_eta000015_mu3e5_zmg_cb090_w1	discard	client.py	Exact local_train_steps 928 continuation under class-balanced beta 0.90 FedZMG stack [src: Cui19 CBLoss CVPR; Wang21 RatioLoss AAAI]	/tmp/nvflare/simulation/fedavgm_lr18_m0475_steps928_clientlr0045_cm0925_wd5e4_eta000015_mu3e5_zmg_cb090_w1
d5d6376bb	0.911700	565	--n_clients 8 --num_rounds 20 --aggregation_epochs 7 --local_train_steps 960 --batch_size 64 --eval_batch_size 1024 --alpha 0.5 --seed 0 --model_arch moderate_cnn --max_model_params 5000000 --aggregator fedavgm --server_lr 1.8 --server_momentum 0.475 --lr 0.045 --momentum 0.925 --weight_decay 5e-4 --cosine_lr_eta_min_factor 0.00015 --fedproxloss_mu 3e-5 --zero_mean_gradients --class_balanced_loss_beta 0.90 --final_eval_clients site-1 --name fedavgm_lr18_m0475_steps960_clientlr0045_cm0925_wd5e4_eta000015_mu3e5_zmg_cb090_w1	discard	client.py	Exact local_train_steps 960 continuation under class-balanced beta 0.90 FedZMG stack [src: Cui19 CBLoss CVPR; Wang21 RatioLoss AAAI]	/tmp/nvflare/simulation/fedavgm_lr18_m0475_steps960_clientlr0045_cm0925_wd5e4_eta000015_mu3e5_zmg_cb090_w1
dc011b3da	0.913600	486	--n_clients 8 --num_rounds 20 --aggregation_epochs 7 --local_train_steps 0 --batch_size 64 --eval_batch_size 1024 --alpha 0.5 --seed 0 --model_arch moderate_cnn --max_model_params 5000000 --aggregator fedavgm --server_lr 1.8 --server_momentum 0.425 --lr 0.045 --momentum 0.925 --weight_decay 5e-4 --cosine_lr_eta_min_factor 0.00015 --fedproxloss_mu 3e-5 --zero_mean_gradients --class_balanced_loss_beta 0.90 --final_eval_clients site-1 --name fedavgm_lr18_m0425_epochs7_clientlr0045_cm0925_wd5e4_eta000015_mu3e5_zmg_cb090_w1	discard	custom_aggregators.py	Server momentum 0.425 continuation under class-balanced beta 0.90 FedZMG stack [src: Cui19 CBLoss CVPR; Wang21 RatioLoss AAAI]	/tmp/nvflare/simulation/fedavgm_lr18_m0425_epochs7_clientlr0045_cm0925_wd5e4_eta000015_mu3e5_zmg_cb090_w1
dc011b3da	0.907800	487	--n_clients 8 --num_rounds 20 --aggregation_epochs 7 --local_train_steps 0 --batch_size 64 --eval_batch_size 1024 --alpha 0.5 --seed 0 --model_arch moderate_cnn --max_model_params 5000000 --aggregator fedavgm --server_lr 1.8 --server_momentum 0.525 --lr 0.045 --momentum 0.925 --weight_decay 5e-4 --cosine_lr_eta_min_factor 0.00015 --fedproxloss_mu 3e-5 --zero_mean_gradients --class_balanced_loss_beta 0.90 --final_eval_clients site-1 --name fedavgm_lr18_m0525_epochs7_clientlr0045_cm0925_wd5e4_eta000015_mu3e5_zmg_cb090_w1	discard	custom_aggregators.py	Server momentum 0.525 continuation under class-balanced beta 0.90 FedZMG stack [src: Cui19 CBLoss CVPR; Wang21 RatioLoss AAAI]	/tmp/nvflare/simulation/fedavgm_lr18_m0525_epochs7_clientlr0045_cm0925_wd5e4_eta000015_mu3e5_zmg_cb090_w1
be65fd011	0.914000	492	--n_clients 8 --num_rounds 20 --aggregation_epochs 7 --local_train_steps 0 --batch_size 64 --eval_batch_size 1024 --alpha 0.5 --seed 0 --model_arch moderate_cnn --max_model_params 5000000 --aggregator fedavgm --server_lr 1.8 --server_momentum 0.475 --lr 0.045 --momentum 0.925 --weight_decay 4e-4 --cosine_lr_eta_min_factor 0.00015 --fedproxloss_mu 3e-5 --zero_mean_gradients --class_balanced_loss_beta 0.90 --final_eval_clients site-1 --name fedavgm_lr18_m0475_epochs7_clientlr0045_cm0925_wd4e4_eta000015_mu3e5_zmg_cb090_w1	discard	client.py	Weight decay 4e-4 continuation under class-balanced beta 0.90 FedZMG stack [src: Cui19 CBLoss CVPR; Wang21 RatioLoss AAAI]	/tmp/nvflare/simulation/fedavgm_lr18_m0475_epochs7_clientlr0045_cm0925_wd4e4_eta000015_mu3e5_zmg_cb090_w1
be65fd011	0.911000	489	--n_clients 8 --num_rounds 20 --aggregation_epochs 7 --local_train_steps 0 --batch_size 64 --eval_batch_size 1024 --alpha 0.5 --seed 0 --model_arch moderate_cnn --max_model_params 5000000 --aggregator fedavgm --server_lr 1.8 --server_momentum 0.475 --lr 0.045 --momentum 0.925 --weight_decay 6e-4 --cosine_lr_eta_min_factor 0.00015 --fedproxloss_mu 3e-5 --zero_mean_gradients --class_balanced_loss_beta 0.90 --final_eval_clients site-1 --name fedavgm_lr18_m0475_epochs7_clientlr0045_cm0925_wd6e4_eta000015_mu3e5_zmg_cb090_w1	discard	client.py	Weight decay 6e-4 continuation under class-balanced beta 0.90 FedZMG stack [src: Cui19 CBLoss CVPR; Wang21 RatioLoss AAAI]	/tmp/nvflare/simulation/fedavgm_lr18_m0475_epochs7_clientlr0045_cm0925_wd6e4_eta000015_mu3e5_zmg_cb090_w1
5763278f0	0.911700	487	--n_clients 8 --num_rounds 20 --aggregation_epochs 7 --local_train_steps 0 --batch_size 64 --eval_batch_size 1024 --alpha 0.5 --seed 0 --model_arch moderate_cnn --max_model_params 5000000 --aggregator fedavgm --server_lr 1.8 --server_momentum 0.475 --lr 0.0425 --momentum 0.925 --weight_decay 5e-4 --cosine_lr_eta_min_factor 0.00015 --fedproxloss_mu 3e-5 --zero_mean_gradients --class_balanced_loss_beta 0.90 --final_eval_clients site-1 --name fedavgm_lr18_m0475_epochs7_clientlr00425_cm0925_wd5e4_eta000015_mu3e5_zmg_cb090_w1	discard	client.py	Client lr 0.0425 continuation under class-balanced beta 0.90 FedZMG stack [src: Cui19 CBLoss CVPR; Wang21 RatioLoss AAAI]	/tmp/nvflare/simulation/fedavgm_lr18_m0475_epochs7_clientlr00425_cm0925_wd5e4_eta000015_mu3e5_zmg_cb090_w1
